Sent,Tm,Lex,Luhn,Lsa,Tr,LDA
"Martinez sees off Vinci challenge

Veteran Spaniard Conchita Martinez came from a set down to beat Italian Roberta Vinci at the Qatar Open in Doha.

",8.280000000000001,0.12185428037926022,95,-0.029166298179854257,0.11596250328792808,0.7657137391679775
The 1994 Wimbledon champion won 5-7 6-0 6-2 to earn a second round meeting with French Open champion Anastasia Myskina.,8.280000000000001,0.12209125696828543,83,0.16431972012236373,0.12518770414315933,0.7585575451105182
Fifth seed Patty Schnyder also had a battle as she needed three sets to beat China's Na Li 7-5 3-6 7-5.,5.5200000000000005,0.11999155666974698,53,0.22409833088294365,0.12338287489791011,0.7506195936509781
Slovakian Daniela Hantuchova beat Bulgarian Magdaleena Maleeva 4-6 6-4 6-3 to set up a second round clash with Russian Elena Bovina.,10.120000000000001,0.12228261936614751,96,0.28186478180556396,0.12230867885529378,0.7604497043986228
The veteran Martinez found herself in trouble early on against Vinci with the Italian clinching the set thanks to breaks in the third and 11th games.,9.200000000000001,0.16449030529087746,68,-0.09529325143193386,0.11735717062557223,0.7543405678001348
But Vinci's game fell to pieces after that and Martinez swept her aside with some crisp cross-court returns and deft volleys.,3.68,0.10567793609063146,64,-0.1525903090030481,0.11204619359759674,0.7580377551627036
"In the day's other matches, Japan's Ai Sugiyama defeated Australian Samantha Stosur 6-2 6-3 while Australian Nicole Pratt beat Tunisian Selima Sfar 7-5 6-2 and will next face compatriot Alicia Molik.
",6.44,0.12361204523505093,133,0.1432188625029607,0.12375487459253964,0.7742541253761469
