Sent,Tm,Lex,Luhn,Lsa,Tr,LDA
"Serena becomes world number two

Serena Williams has moved up five places to second in the world rankings after her Australian Open win.

",13.8,0.15129953093243473,69,-0.1581380811918259,0.110940053258316,0.7544067645664901
"Williams won her first Grand Slam title since 2003 with victory over Lindsay Davenport, the world number one.",10.120000000000001,0.10289843700679917,63,-0.14554648972051037,0.10768949879693408,0.7543714297866035
Men's champion Marat Safin remains fourth in the ATP rankings while beaten,2.7600000000000002,0.12432805150167679,47,0.18727585488962223,0.10571022966648655,0.7442799806883067
finalist Lleyton Hewitt replaces Andy Roddick as world number two.,8.280000000000001,0.10417513256904001,50,-0.1024405287140069,0.09958225183174096,0.737298601381642
"Roger Federer retains top spot, but Safin has overtaken Hewitt to become the new leader of the Champions Race.",5.5200000000000005,0.09337599304710774,63,0.16598064912383267,0.10450324440525302,0.7491163584129894
"Alicia Molik, who lost a three-set thriller against Davenport in the quarter-finals, is in the women's top 10 for the first time in her career.",10.120000000000001,0.09195316872611964,74,0.22451375405706953,0.10568254398051062,0.7577907219507637
Her rise means Australia have a player in the top 10 of the men's and women's rankings for the first time in 21 years.,12.88,0.1284338565589223,53,0.27523471180604614,0.1029611235541468,0.7533784555661417
"And Britain's Elena Baltacha, who qualified and then reached the third round, has risen to 120 in the world - a leap of 65 places and her highest ranking yet.
",15.64,0.0835358296578996,74,-0.060168942123837624,0.10293105450661201,0.76376322381836
