Sent,Tm,Lex,Luhn,Lsa,Tr,LDA
"Vodafone appoints new Japan boss

Vodafone has drafted in its UK chief executive William Morrow to take charge of its troubled Japanese operation.

",4.6000000000000005,0.07939329040923128,96,-0.032470938188349716,0.10557571629057706,0.765391531484183
"Mr Morrow will succeed Shiro Tsuda as president of Vodafone KK, Japan's number three mobile operator, in April.",6.44,0.10331557567474658,75,0.19203056684135636,0.09743642774451414,0.7607332522063635
"Mr Tsuda, who will become chairman, was appointed president only two months ago but the business has struggled since then, losing customers in January.",5.5200000000000005,0.10705132887192316,74,0.2579112736992861,0.10676478028284346,0.7565067913704746
"Vodafone had pinned its hopes on the launch of its 3G phones in November but demand for them has been slow.

",3.68,0.06570841994401681,46,-0.07122555011937749,0.10584086826647661,0.7389588417541373
"While it has more than 15 million customers in Japan, Vodafone has found it difficult to satisfy Japan's technologically demanding mobile users.",6.44,0.18218756941960246,86,-0.0970334858463545,0.10716354257640637,0.7572315489447569
"It suffered a net loss of more than 58,000 customers in January, its second monthly reverse in the last year.",4.6000000000000005,0.07924578975138288,51,0.16724658862031855,0.09908492924441845,0.750340334753086
"""Vodafone is going to need to put a lot of money into Japan if it wants to rebuild the business,"" Tetsuro Tsusaka, a telecoms analyst with Deutsche Bank, told Reuters.",8.280000000000001,0.08513948616072493,90,-0.16524810366310014,0.10408383638642736,0.7622688134418834
"""I do not know if it will be worth it for them to spend that kind of money just for Japan.",4.6000000000000005,0.08018076199059411,24,-0.22937228970410622,0.0985897212444076,0.7075699936334364
"""
",0.0,0.09777777777777777,0,0.0,0.015460177963928892,0.26666666666666666
