Sent,Tm,Lex,Luhn,Lsa,Tr,LDA
"Bargain calls widen Softbank loss

Japanese communications firm Softbank has widened losses after heavy spending on a new cut-rate phone service.

",12.88,0.12668548103683544,103,-0.15491357537519015,0.1066767027188491,0.7681898982343909
"The service, launched in December and dubbed ""Otoku"" or ""bargain"", has had almost 900,000 orders, Softbank said.",3.68,0.09470911289257412,55,-0.10294211836313061,0.09925137187754356,0.7505661086816714
"The firm, a market leader in high-speed internet, had an operating loss for the three months to December of 7.5bn yen ($71.5m; £38.4m).",12.88,0.13406282765529517,76,-0.15456385863011848,0.10562258816147699,0.7635417838824278
But without the Otoku marketing spend it would have made a profit - and expects to move into the black in 2006.,11.040000000000001,0.10889493446463128,48,0.2853596969475049,0.10577498820085247,0.740080918659945
The firm did not give a figure for the extent of profits it expected to make next year.,9.200000000000001,0.11128314123695549,40,0.27708095908166414,0.10510831116140852,0.7325672676338103
"It was born in the 1990s tech boom, investing widely and becoming a fast-rising star, till the end of the tech bubble hit it hard.",12.88,0.10726585777310851,66,-0.03156602778835705,0.10263508053890452,0.7664633582717355
"Its recent return to a high profile came with the purchase of Japan Telecom, the country's third-biggest fixed-line telecoms firm.",9.200000000000001,0.10169565171218306,79,-0.020548502049382043,0.10735583977957305,0.7614052756509548
"The acquisition spurred its broadband internet division to pole position in the Japanese market, with more than 5.1 million subscribers at the end of December.
",11.040000000000001,0.09540299322841694,96,-0.1580111689594964,0.1075751175613918,0.7611028983037008
