Sent,Tm,Lex,Luhn,Lsa,Tr,LDA
"Berlin honours S Korean director

South Korean film director Im Kwon-Taek has received an honorary Golden Bear at the Berlin Film Festival.

",19.32,0.10488703826003953,101,-0.15959722585422273,0.09394890611171097,0.7689440838978475
"Im, who has made more than 100 films in a 40-year career, was hailed for his ""remarkable visual beauty, technical innovation, and intellectual depth"".",8.280000000000001,0.08928847267458423,86,-0.0578898416060376,0.09297757242266595,0.763746149037612
"Twenty of his films are screening in a special retrospective during the festival, which runs until 20 February.",6.44,0.07451404216895528,57,-0.08782451181488413,0.09416407392259105,0.7398134192616524
"The veteran film-maker, 68, won the best director prize at the Cannes Film Festival in 2002 for Chihwaseon.",9.200000000000001,0.12306122411006923,66,-0.18213915223263333,0.09454289170578896,0.7579319714850161
"""Although his films vary in style, they all bear his unmistakable stamp: they are forceful and charged cinematographically, as well as reticent, stylised and musical,"" organisers said in a statement.",11.96,0.08445834589239645,107,-0.08944735940048766,0.08879223744670858,0.7625714979295783
"Meanwhile, a film version of Bizet's opera Carmen - translated into the South African language Xhosa - has received a warm reception at the festival.",29.44,0.16074578790734842,89,0.2106747995048666,0.09444189415680965,0.7602782300036659
"U-Carmen eKhayelitsha (Carmen in Khayelitsha), which is one of 21 films up for Berlin's top prize, the Golden Bear, is British director Mark Dornford-May's first feature film.",18.400000000000002,0.09956752448036273,109,-0.21150075653046385,0.09753037787420277,0.7655959113232162
"""It's the first time any opera has been translated into a black South African language.",6.44,0.0693513439571021,43,0.2886001658184356,0.09374237861772085,0.7295020951882227
"Xhosa works brilliantly, it's such a musical language,"" said music director Charles Hazlewood.
",11.040000000000001,0.07412622054914209,64,0.06151967722126209,0.08985966774180124,0.7441828639735448
