Sent,Tm,Lex,Luhn,Lsa,Tr,LDA
"Apple Mac mini gets warm welcome

The Mac mini has been welcomed by Apple fans, industry experts and PC users.

",34.04,0.03747640042932446,58,-0.14396944818250887,0.0196322313706023,0.7590143077305282
"The release of the tiny, low-cost machine is seen as a good move for Apple which currently has a small share of the desktop computer market.",31.28,0.030695655726017474,70,0.030390357157924184,0.02098550169230994,0.6233176960950471
Mac watchers and some analysts say the Mac mini will go a long way to help Apple appeal to the mass of consumers.,23.92,0.0391909538638141,52,-0.048853605863316975,0.01967724412791923,0.7469922130113551
"They speculate that the Mac mini will be bought by iPod owners and those wanting an easy-to-use and administer second home computer.

",27.6,0.0223936332609286,65,0.2288545314034146,0.020502161669429024,0.7565133388235978
"""It's the bravest move they have made yet,"" said Jonny Evans, news editor at Macworld magazine.",5.5200000000000005,0.017208814388695405,49,-0.0007654013488699048,0.01695986931113873,0.7392968165229238
"Mr Evans said the combination of low cost, small size and huge numbers of iPod users could make it a big success.

",16.560000000000002,0.016005050366214642,66,0.07664516835032194,0.020266740698694868,0.7618018632607533
He thought that the machine would appeal to those that like Apple technology but who before now have balked at paying high prices for its hardware.,11.96,0.015425258395612504,57,-0.03649527257584531,0.02042547977461195,0.7497819816685162
"""It's deeply affordable,"" he said.",1.84,0.019555555555555555,16,0.0042594802337859025,0.01336960985793811,0.6210279761611873
"""Plus you know that you do not get viruses or all of the associated problems.""",0.0,0.019555555555555555,13,-0.0013964239484311445,0.015262709766594528,0.6202830321980165
"Already, he said, PC owning friends had declared that they would be buying one.",0.0,0.013462643605278865,21,0.022401141243058646,0.019418944931271734,0.6875113764516007
Interest in the new products launched at Macworld expo was so strong that websites for Apple's store and the show struggled to cope with demand.,9.200000000000001,0.016101780256444282,78,-0.044823940231753755,0.0199675806049983,0.7548725705274684
According to response statistics gathered by Netcraft many visiting the Apple store in the wake of Mr Jobs' speech suffered lengthy response times.,10.120000000000001,0.013365627642077273,86,-0.02555533683419753,0.019049124889634256,0.7659925114392189
"The Macworld Expo site was completely overwhelmed and went offline.

",3.68,0.017725166194603646,44,-0.00921587339011864,0.015344560589403974,0.723427114138194
"""I think fundamentally it's a good idea because it's cheap even for a PC,"" said Nick Ross, deputy labs editor at PC Pro.",11.96,0.014740307673448706,57,-0.0684109928823342,0.019520447325137753,0.7578606736129511
"Apple's work on making things easy to use would also help the Mac mini win fans, he said.",24.84,0.02767959303197386,35,-0.05746029845867984,0.02039003869473772,0.7392177608094896
"""I think people expect it just to work now and really it should,"" hesaid.",10.120000000000001,0.01287931413208834,22,-0.05944198189286206,0.018150512996070196,0.6860593662061768
"The Mac mini could find a role in homes that need a second computer that is easy to install and administer, he said.",33.120000000000005,0.018823980351259564,48,0.18781713589092605,0.02001771171516952,0.7370368480661444
"""For browsing the web, e-mail and all kinds of basic duties it's going to be absolutely adequate,"" said Mr Ross.",5.5200000000000005,0.01149424466142198,52,0.018450127862285132,0.01900675373170333,0.7500189058655566
"Ian Fogg, broadband and personal technology analyst at Jupiter Research, agreed that the Mac mini could be very popular.",23.92,0.018365083141585765,75,-0.04111552569348937,0.019191729879202705,0.7564037995927926
"""Apple has been hoping that sales of the iPod will have a halo effect on the sales of the Mac,"" he said.

",3.68,0.02116570060425127,35,-0.013563303926868438,0.0196083383472778,0.7366579937654403
"Before now, he said, Apple has been seen as a premium brand.",1.84,0.010452266463412855,17,-0.0802335378954004,0.01678372613082749,0.6513970539389402
"But, he said, the Mac mini changed that perception.",16.560000000000002,0.02140430779931776,23,-0.06270231843348333,0.019034772421417833,0.6804515353353198
"""It's a particularly good price when you see that it's Apple that is doing it,"" he said.",5.5200000000000005,0.027119705276942144,14,-0.11057203651284465,0.019547899878749726,0.6478863357157955
Apple expects the Mac mini to sell for £339 in the UK and $499 in the US.,19.32,0.020195304436117712,31,-0.12419347272946892,0.019231954569941184,0.7332621782292894
"Adding extras such as a larger hard drive, more memory and networking options will increase the basic price.",11.040000000000001,0.012060812926200653,63,-0.02177990922266471,0.019937926074642984,0.7545620031296267
It will go on sale from 22 January.,2.7600000000000002,0.012201534046991104,13,-0.002047036089746517,0.014978964947817463,0.6660699276978038
"""For consumers interested in style, design and small size - which is what the majority of iPod customers are interested in - it's a natural next step,"" said Mr Fogg.",30.360000000000003,0.012510935585354233,85,0.12278191278217308,0.019945065086846417,0.7627237370023779
"Apple has traditionally done well in the market that the Mac mini is aimed at, said Mr Fogg, who also expected many PC makers to release copycat devices in reaction.

",27.6,0.028290094313641358,81,-0.07628096192548106,0.020438941560503524,0.7647412518668608
"His only misgivings were over how easy other consumers, other than iPod owners, would find using the machine.",10.120000000000001,0.02212339898445821,41,0.21559855215629445,0.01950449226396657,0.7228445734269415
He said anyone wanting to use the Mac mini with the peripherals from an old computer may find it odd to have something so small and sleek next to a hulking monitor.,36.800000000000004,0.022696674202407723,57,0.12203648356019547,0.019937507322334798,0.7469034618928485
"""They'd be much more likely to pair a Mac mini with a LCD or flat panel monitor which increases the upgrade cost,"" he said.",26.68,0.013023193913583765,49,0.013880983304793922,0.0192572092812975,0.749459787420559
"Those with flat screens and LCD monitors are likely to have bought them recently and not be in the market for a new machine.

",12.88,0.022080441301350378,44,0.09069117533641645,0.01955380614354591,0.7393347911568686
"There are also questions over whether the Mac mini will work with very old peripherals, such as display, keyboard and mouse.",21.16,0.01382130069928847,49,-0.04975439327267063,0.018600766973633918,0.7341433532412549
"The Mac mini also fell short of being a media server that can be a video recorder as well as a store for all the digital music, movies and images people accumulate, said Mr Fogg.",26.68,0.01361220390039832,90,-0.004857073674570383,0.020142541293513064,0.7686312614806532
"""The Mac mini is not quite ready for that yet,"" he said.",16.560000000000002,0.025568604016875357,12,-0.07463553025105986,0.017643062555825963,0.6408625385039101
"""It does not have the right connectors that fit a TV screen or enough storage.""",4.6000000000000005,0.010397488428863328,27,0.004771203525057509,0.017260915553670528,0.7103956534888481
"Said Mr Fogg: ""It's very much a computer.""",6.44,0.03639024045273781,14,0.1336279176845629,0.014643817208120235,0.6522311619221561
"One dissenting opinion came from Brian Gammage, vice-president of research at analysts Gartner.",2.7600000000000002,0.010919807569987543,62,-0.018691660079136984,0.0154634541807803,0.7448499400722325
"He said: ""I don't think it changes the world.""",3.68,0.012478013476225826,5,-0.048349175360467775,0.015043310578954253,0.532387766885667
"Although the Mac mini was very cheap for an Apple computer, it was still expensive compared to many PCs.",26.68,0.03447195906483846,43,-0.06172434420813512,0.01921060778308227,0.737137660183764
"Also, he said, it appealed in categories that few consumers care about when buying a home computer.",10.120000000000001,0.017670426880057988,41,0.1934992053902039,0.020024078878557658,0.7318608859613678
"""The PC world is a pile-em-high, sell-em-cheap market,"" he said, ""and all of them are pretty interchangeable.""",10.120000000000001,0.019196465759015135,59,-0.07569362706521672,0.018559131198400608,0.6173669950715134
"""Since the days when Apple ruled the personal computing world its market share has been on a long, slow decline,"" he said.",16.560000000000002,0.019666088084713762,58,-0.07464574729873082,0.01998768877055196,0.7537283562118455
"""Every few years it does something to give its market share a kick then it starts to go back down again,"" said Mr Gammage.",12.88,0.01659878046534332,41,0.013423826342012274,0.01917614821828312,0.7293329497602543
"The release of the Mac mini fit perfectly with this trend, he said.
",22.080000000000002,0.02173963311572493,31,-0.0608925850065153,0.019344919150888783,0.7180725787169424
