Sent,Tm,Lex,Luhn,Lsa,Tr,LDA
"Profits jump at China's top bank

Industrial and Commercial Bank (ICBC), China's biggest lender, has seen an 18% jump in profits during 2004.

",11.96,0.10502304505867589,81,0.009652173948144577,0.10975643168259441,0.7653866985672148
The increase in earnings has allowed the firm to write off bad loans and pave the way for a state bailout and eventual stock-market listing.,8.280000000000001,0.1074424265075224,79,0.14072036322692358,0.10890010007743078,0.7639276409167954
"China is trying to clean up its banking system, which is weighed down by billions of dollars of unpaid loans.",4.6000000000000005,0.11770251584474027,51,0.32088707732008365,0.10703385532558848,0.7387182745383507
"It has already pumped $45bn (£24bn) into two of its largest banks, and has identified ICBC as a recipient of aid.",2.7600000000000002,0.10149443860201314,46,-0.04564968853907165,0.0991799390575162,0.7453054674445627
"ICBC's profits were 74.7bn yuan ($9bn; £4.8bn) in 2004, the bank said in a statement.",9.200000000000001,0.1516319238450042,44,-0.05566587840729931,0.10479083268066014,0.7536691341625412
"The percentage of non-performing loans dropped to 19.1%, down about 2 percentage points.",4.6000000000000005,0.10709583916859046,48,0.15543754471584187,0.1012016069762473,0.7399576151744398
ICBC was founded in 1984 and had total assets of 5.3 trillion yuan at the end of 2003.,6.44,0.08328504127671366,44,-0.0546556183790523,0.10654447189794997,0.7401363768848978
"China committed to gradually opening up its banking sector when it joined the World Trade Organisation in 2002.
",4.6000000000000005,0.10632476969673996,67,0.2661153608844811,0.10259276230201277,0.7545644064184772
