Sent,Tm,Lex,Luhn,Lsa,Tr,LDA
"Labour's Cunningham to stand down

Veteran Labour MP and former Cabinet minister Jack Cunningham has said he will stand down at the next election.

",7.36,0.09536562055919495,79,-0.03429994619538015,0.11321093874092489,0.7575303105520182
"One of the few Blair-era ministers to serve under Jim Callaghan, he was given the agriculture portfolio when Labour regained power in 1997.",6.44,0.1263217235831443,75,0.2624918135848917,0.11450826644941844,0.7577830307610927
"Mr Cunningham went on to become Tony Blair's ""cabinet enforcer"".",2.7600000000000002,0.11882236072950038,36,-0.10391993705963529,0.09846974923695392,0.7187496828547356
He has represented the constituency now known as Copeland since 1970.,1.84,0.11,33,1.5772431104232875e-17,0.07929848101561417,0.6926880913599547
"Mr Blair said he was a ""huge figure"" in Labour and a ""valued, personal friend"".

",3.68,0.116808968578586,42,-0.03519961800130954,0.10978952883060895,0.7389750807908376
"During Labour's long period in opposition, Mr Cunningham held a number of shadow roles including foreign affairs, the environment and as trade spokesman.",8.280000000000001,0.117234296835547,103,-0.12205634341443232,0.11524927812359138,0.7662058143884585
As agriculture minister he caused controversy when he decided to ban beef on the bone in the wake of fears over BSE.,9.200000000000001,0.08920177793955963,63,0.30919458495010316,0.09467972943533182,0.7537073925297187
"He quit the government in 1999 and in recent years has served as the chairman of the all-party committee on Lords reform and has been a loyal supporter of the government from the backbenches.
",11.040000000000001,0.10624525177446777,102,0.14164853112766826,0.11479402816755627,0.766113484157664
