Sent,Tm,Lex,Luhn,Lsa,Tr,LDA
"Almagro continues Spanish surge

Unseeded Nicolas Almagro became the fifth Spaniard to reach the last eight at the Buenos Aires Open, ousting eighth seed Mariano Zabaleta.

",5.5200000000000005,0.1047184633387604,103,-0.21772836201956386,0.11560510513265865,0.7693580639190717
He showed admirable resolve to win a rain-affected match 6-7 6-4 6-4.,6.44,0.15673227897455408,48,0.22153005064144987,0.11934445070641116,0.7224238014819506
"Compatriot and seventh seed Rafael Nadal also reached the last eight, beating Italian Potito Starace 6-1 6-3.",2.7600000000000002,0.1296797151486298,67,-0.2044508094857863,0.12550833315423582,0.7501670353845508
"Nadal, playing in the outdoor clay event for the first time, hit some powerful forehands to oust Starace in a match delayed over an hour by rain.",14.72,0.19756098585167822,77,0.026404622259319173,0.12588224074378043,0.7654984336845349
"""It's always a problem to have to stop for rain but one gets used to it,"" said Spanish teenager Nadal.",5.5200000000000005,0.1030395895429595,35,-0.07444669630864012,0.11767707122971102,0.7140684646344183
"""Luckily, I was able to keep my pace going throughout the match.""",4.6000000000000005,0.09567214231715274,16,0.25907815260416384,0.10886202179721279,0.6592420871697227
"He will now play Gaston Gaudio, who beat unseeded Brazilian Flavio Saretta 6-3 6-2 in the day's late match.
",11.040000000000001,0.09259682482626523,68,0.06180891640991456,0.12712077723599002,0.7535643270207791
