Sent,Tm,Lex,Luhn,Lsa,Tr,LDA
"Israeli club look to Africa

Four African players, including Zimbabwe goalkeeper Energy Murambadoro, are all ready to play for Israeli club Hapoel Bnei Sakhnin in the Uefa Cup.

",16.560000000000002,0.17195911166264294,116,-0.06851829414950841,0.12951829757179345,0.7721688870462219
Bnei Sakhnin are the first Arab side ever to play in European competition and will play English Premiership side Newcastle United in the first round.,13.8,0.10203577394653415,88,-0.08944177932897952,0.12629475239968638,0.7562529097078823
"Warriors' goalkeeper Murambadoro, who made a name for himself at the African Nations Cup finals in Tunisia, helped Bnei Sakhnin overcome Albania's Partizani Tirana 6-1 in the previous round.",5.5200000000000005,0.13937742004892908,122,-0.11765923331554043,0.126477014103113,0.7711899464329152
Murambadoro moved to Israel recently after a brief stint with South African club Hellenic.,8.280000000000001,0.17546368519738495,58,0.26846255542154657,0.12326489836678216,0.7366034283493583
"The club won the Israeli Cup final last season and are based in Sakhnin, which is near Haifa.",8.280000000000001,0.10184633194814487,44,-0.12283887981212491,0.121371489084158,0.7376769711705913
The club have a strong ethic and are high profile promoters of peace and co-operation within Israel.,10.120000000000001,0.0940310842242639,57,0.25752474118460805,0.11322430647512018,0.7456157167422789
"The three other Africans at the club are former Cameroon defender Ernest Etchi, DR Congo's Alain Masudi and Nigerian midfielder Edith Agoye, who had a stint with Tunisian side Esperance.
",11.96,0.0952865929721001,111,0.1919074219676885,0.09984924199934697,0.7696749468602236
