Sent,Tm,Lex,Luhn,Lsa,Tr,LDA
"Coach Ranieri sacked by Valencia

Claudio Ranieri has been sacked as Valencia coach just eight months after taking charge at the Primera Liga club for the second time in his career.

",8.280000000000001,0.14012818487494771,95,-0.11939820316375907,0.09759014549728863,0.7679692823491265
The decision was taken at a board meeting following the side's surprise elimination from the Uefa Cup.,5.5200000000000005,0.09653799966063685,50,0.3124162000062084,0.09468336621308591,0.7324953701087447
"""We understand, and he understands, that the results in the last few weeks have not been the most appropriate,"" said club president Juan Bautista.",4.6000000000000005,0.09421824958439075,55,-0.03157396015177651,0.09380796641782106,0.7397440653333711
Former assistant Antonio Lopez will take over as the new coach.,4.6000000000000005,0.07302136772856878,26,-0.10213149458092859,0.08166050831226554,0.6869346171420789
"Italian Ranieri took over the Valencia job in June 2004 having been replaced at Chelsea by Jose Mourinho.

",1.84,0.09285390605056958,59,-0.0846665927216989,0.09682467814133723,0.7472456169443762
Things began well but the Spanish champions extended their winless streak to six after losing to Racing Santander last weekend.,2.7600000000000002,0.09337756316113065,68,0.015956336269211915,0.093584420986197,0.7551294859207581
That defeat was then followed by a Uefa Cup exit at the hands of Steaua Bucharest.,1.84,0.09669413903868852,36,0.3129947335253054,0.08672703772133497,0.7324953701133644
"Ranieri first took charge of Valencia in 1997, guiding them to the King's Cup and helping them to qualify for the Champions League.",3.68,0.09957412175752793,62,0.04305336771293121,0.1002976055939475,0.7543456688610289
"The 54-year-old then moved to Atletico Madrid in 1999, before joining Chelsea the following year.
",3.68,0.09359446814353926,49,-0.030437775346884664,0.09482427111672209,0.7511819444085073
