Sent,Tm,Lex,Luhn,Lsa,Tr,LDA
"Talks held on Gibraltar's future

Two days of talks on the future of Gibraltar begin at Jack Straw's country residence later on Wednesday.

",10.120000000000001,0.09575322133785086,85,-0.2187986159077069,0.10982614677988264,0.7637152299997774
"Officials at the two-day summit at the foreign secretary's official Kent house, Chevening, will plan a new forum on the Rock's future.",11.040000000000001,0.09230620567556357,83,-0.1606136916960997,0.10598888962737038,0.7600700201184443
"In October, Mr Straw and his Spanish counterpart Miguel Moratinos agreed to establish a body that would give Gibraltarians a voice in their future.",8.280000000000001,0.09165778987262604,93,-0.11287606297963969,0.10830830231621107,0.7612330203122424
"Most Gibraltarians said in a referendum they wanted to remain British.

",2.7600000000000002,0.1089837085823381,40,-0.006138187102273539,0.10117008512370627,0.7091182689775908
"Gibraltar's Chief Minister Peter Caruana will represent the British citizens living on the Rock, while Britain's Europe Director Dominick Chilcott will represent the UK.",5.5200000000000005,0.10950433030730626,114,0.2466599186773247,0.10286928781535248,0.7696585778439874
"Madrid is being represented by Spain's director general for Europe, Jose Maria Pons.",2.7600000000000002,0.09135764109434742,53,0.25662278931133375,0.09508317542164542,0.7451865121706608
The initiative follows Spain's socialist government's decision to put its long-standing sovereignty ambitions on hold.,9.200000000000001,0.07523642548239429,78,-0.08946019521984212,0.11023552629077556,0.7488875361224389
"Gibraltarians rejected plans for the Rock's sovereignty to be shared between Britain and Spain in a referendum organised by Gibraltar government.
",5.5200000000000005,0.21520067764757347,91,-0.10299381681479262,0.10651858662505594,0.7570926564787749
