Sent,Tm,Lex,Luhn,Lsa,Tr,LDA
"Hillbillies singer Scoggins dies

Country and Western musician Jerry Scoggins has died in Los Angeles at the age of 93, his family has said.

",5.5200000000000005,0.07607225501775455,83,-0.014872760049851679,0.09493669668182447,0.7660420542209073
Scoggins was best remembered for singing the theme tune to popular US TV show The Beverly Hillbillies.,9.200000000000001,0.15793697879489496,58,0.01704910385115325,0.09606407149929075,0.7415302132170282
The Texan-born singer approached the producers of the programme with theme tune The Ballad of Jed Clampett for the pilot which was screened in 1962.,10.120000000000001,0.07183080348022554,82,-0.07105396796757991,0.09932090423558484,0.7639600841558223
"The show, which told the story of a poor man striking oil and moving to Beverly Hills, ran until 1971.

",7.36,0.07141679670756985,51,0.11533404979971136,0.09458067391765762,0.7507614774739231
Scoggins' daugher Jane Kelly Misel said that her father never tired of the song and would sing it at least once a day.,7.36,0.09631617565955987,51,0.22539086589880464,0.09423726866327299,0.7507707002762569
"""He'd sing it at birthdays and anniversaries and variety shows.",3.68,0.09179479706242098,37,0.28682267593797633,0.09950592280506773,0.6884933307621505
"He never stopped performing it,"" she said.",0.0,0.0680593763995745,11,-0.14330088562456203,0.08331223062050497,0.6209137235721598
"When a film version of The Beverly Hillbillies was made in 1993, Scoggins came out of retirement to perform the theme tune.",11.040000000000001,0.15651077903834662,68,-0.10878717358278932,0.10217551872697514,0.7516402914848253
"Scoggins sang the lyrics while bluegrass stars Lester Flatt and Earl Scruggs played guitar and banjo.
",2.7600000000000002,0.0900620378396532,66,0.1926558305290981,0.07586671284982158,0.7578965414560044
