Sent,Tm,Lex,Luhn,Lsa,Tr,LDA
"Parmalat bank barred from suing

Bank of America has been banned from suing Parmalat, the food group which went bust in 2003 after an accounting scandal.

",13.8,0.22091427661683796,77,0.1962326979014243,0.1260624311768957,0.7651837832994232
"The bank - along with investors, auditors and the group's managers - wants damages for being a victim of fraud at the hands of the Italian firm.",11.040000000000001,0.1270100514990678,63,-0.1549833484427981,0.1259705297819594,0.7541234957142349
But a judge has barred Bank of America and two auditors from the case.,5.5200000000000005,0.10601427273375141,34,0.17313456712463052,0.12449145131866199,0.7217890468990767
"The bank, and Italaudit - formerly the Italian arm of auditor Grant Thornton - face lawsuits and possible prosecution.",11.040000000000001,0.1077340685201051,65,-0.2038822673840687,0.1250179431816583,0.7500825897202397
"A second auditor, Deloitte & Touche, has also been banned from the case.",5.5200000000000005,0.10723114620223587,28,-0.003725162862632361,0.09899843473532721,0.7036195939058588
"Grant Thornton - now rid of the Italian unit at the centre of the case - is still being permitted to sue, as are Consob, Italy's stock market regulator, hundreds of small investors and Parmalat's new managers.",11.96,0.12688681748877711,113,-0.11371786716050329,0.1229218119401126,0.7702263618558564
"Parmalat collapsed in December 2003 after it emerged that the 4bn euros ($5.2bn; £2.8bn) it supposedly held in a Bank of American offshore account did not in fact exist.
",7.36,0.08420936693922472,100,0.25326814434065803,0.11653739786538465,0.771053568233873
