Sent,Tm,Lex,Luhn,Lsa,Tr,LDA
"Madagascar completes currency switch

Madagascar has completed the replacement of its Malagasy franc with a new currency, the ariary.

",15.64,0.1709864706360646,88,-0.01389029300670689,0.10067803882376532,0.7541025258634376
"From Monday, all prices and contracts will have to be quoted in the ariary, which was trading at 1,893 to the US dollar.",4.6000000000000005,0.10846689784398766,47,0.2188855920246341,0.09602313936984755,0.7393525058216837
"The Malagasy franc, which lost almost half its value in 2004, is no longer legal tender but will remain exchangeable at banks until 2009.",10.120000000000001,0.08826086865895541,66,0.18042472151233774,0.11261332408343358,0.7580549912340536
"The phasing out of the franc, begun in July 2003, was intended to distance the country from its past under French colonial rule and address the problem of the large amount of counterfeit francs in circulation.",16.560000000000002,0.09734697334598594,118,-0.05522732681860203,0.11411085294039122,0.7713457754777578
"""It's above all a question of sovereignty,"" Reuters quoted a central bank official as saying.",5.5200000000000005,0.10875045122381093,49,0.31923192850698595,0.10160343304598148,0.731593973240487
"""It is symbolic of our independence from the old colonial ways.",4.6000000000000005,0.09291166963297787,31,-0.1073382518809212,0.09762526194968375,0.6915597720053182
"Since we left the French monetary zone in 1973 we should have our own currency with its own name.""",6.44,0.08663297041364836,35,-0.1111475813890092,0.11057564365425672,0.721364192695761
"The ariary was the name of a pre-colonial currency in the Indian Ocean island state.
",8.280000000000001,0.12664369824456925,48,-0.08367156046585415,0.10677030613264041,0.7384360770597859
