Sent,Tm,Lex,Luhn,Lsa,Tr,LDA
"US Airways staff agree to pay cut

A union representing 5,200 flight attendants at bankrupt US Airways have agreed to a new contract that cuts pay by nearly 10%.

",18.400000000000002,0.18649983819609217,92,0.24904165455892005,0.12281393477809753,0.7694177568289539
"The deal will help the carrier, trying to survive by cutting costs by nearly $1bn (£530m) a year, save about $94m. More than two thirds of its 28,000 staff have now accepted wage cuts.",12.88,0.1416925642179149,72,-0.02022144027967581,0.12015556709864443,0.767508677250119
"But talks are still continuing with a union representing mechanics, baggage handlers and cleaners, which has so far failed to negotiate a new contract.",5.5200000000000005,0.09428571428571428,76,0.1882843128291707,0.10995873157893017,0.755218533635432
The seventh largest carrier in the US sought bankruptcy protection for a second time in two years last September.,7.36,0.10397512197078973,60,-0.15137249001994826,0.1228969288819143,0.7436093735877639
It had been one of the quickest to deal with difficulties faced by the aviation industry after the 9/11 attacks in 2001.,4.6000000000000005,0.09429443544929243,52,-0.16633984801813914,0.1209133404290107,0.7453616832142069
But it emerged from Chapter 11 bankruptcy in March 2003 to face competition from low-cost carriers and higher fuel costs.,8.280000000000001,0.16497263700287707,76,-0.22560458501659744,0.12307356962065859,0.7635321663550737
"US Airways management has said it may need to start liquidating assets if it does not receive concessions from all staff by the middle of this month.
",7.36,0.0942796888773194,69,0.17484937702930586,0.12018792761274427,0.7502447736639004
