Sent,Tm,Lex,Luhn,Lsa,Tr,LDA
"Dawson joins England injury list

Scrum-half Matt Dawson is an injury doubt for England's Six Nations opener against Wales next weekend.

",9.200000000000001,0.15064429696996656,88,-0.19798680986667672,0.1288541430963038,0.7673552692686998
The World Cup winner missed Wasps' 12-9 loss to Bath on Saturday after injuring his right calf.,2.7600000000000002,0.1252699232601855,52,0.12143723608558103,0.11920657247855193,0.7551021815571646
"Wasps coach Warren Gatland said: ""He's got a fitness test in the week but he's got a good chance of playing.""",6.44,0.12293870199304505,51,0.19966856814772377,0.12208628813460325,0.7502548609725502
"Gloucester's Andy Hazell and Leicester star Lewis Moody also received knocks during their respective league matches, but should be fit for Wales next week.",7.36,0.11063678514136904,89,0.22931548931634888,0.12491391913010114,0.7662051307920081
"If Dawson is not fit to face Wales, Robinson will have to choose from Gloucester's Andy Gomarsall or Leicester youngster Harry Ellis.

",4.6000000000000005,0.14377545819049192,82,0.12611598700302495,0.107857358711246,0.7611119352289683
Jamie Noon is another player on the sidelines after he limped off in the first half against Saracens on Friday with a dead leg.,4.6000000000000005,0.12164063457501531,51,-0.09061421530557213,0.11731625413126419,0.7511256939970403
"The centre, who is in line for a first Six Nations start against Wales, will have to wait 48 hours before knowing the state of his injury.
",8.280000000000001,0.10509419986992667,50,-0.2121129502840204,0.11976546431792968,0.7537848614087643
