Sent,Tm,Lex,Luhn,Lsa,Tr,LDA
"Housewives lift Channel 4 ratings

The debut of US television hit Desperate Housewives has helped lift Channel 4's January audience share by 12% compared to last year.

",23.0,0.13106049763145974,113,-0.09579336307794167,0.10767138985917242,0.7726964668921972
Other successes such as Celebrity Big Brother and The Simpsons have enabled the broadcaster to surpass BBC Two for the first month since last July.,3.68,0.09305028228197369,69,0.31155068066126446,0.10459813312757012,0.7549244399271544
BBC Two's share of the audience fell from 11.2% to 9.6% last month in comparison with January 2004.,13.8,0.18100519433679654,55,0.020809139725678858,0.10509550659134248,0.7484173104920838
"Celebrity Big Brother attracted fewer viewers than its 2002 series.

",1.84,0.1069926183102789,45,0.3267209917149942,0.1016425861734707,0.7321224375029174
"Comedy drama Desperate Housewives managed to pull in five million viewers at one point during its run to date, attracting a quarter of the television audience.",16.560000000000002,0.10034380869618553,96,0.08711171144949022,0.10499375199448838,0.7646535023291255
"The two main television channels, BBC1 and ITV1, have both seen their monthly audience share decline in a year on year comparison for January, while Five's proportion remained the same at a slender 6.3%.",24.84,0.09791225243389784,110,-0.11854322056622,0.10800847067300749,0.7682140151321538
"Digital multi-channel TV is continuing to be the strongest area of growth, with the BBC reporting Freeview box ownership of five million, including one million sales in the last portion of 2004.",12.88,0.07445158487183284,111,0.04500368488615868,0.10327633554411532,0.7726364788853805
"Its share of the audience soared by 20% in January 2005 compared with last year, and currently stands at an average of 28.6%.
",14.72,0.0951837614375749,56,-0.12041176992628852,0.10471382603683303,0.7551375824276897
