Sent,Tm,Lex,Luhn,Lsa,Tr,LDA
"Cage film's third week at US top

Nicolas Cage movie National Treasure has topped the US and Canada box office for the third week in a row.

",13.8,0.13275609938564267,72,-0.05004192996771954,0.10882682200017428,0.7608023504771648
"National Treasure made $17.1m (£8.8m) in ticket sales from Friday to Sunday, according to studio estimates, taking its total to $110.2m (£56.7m).",4.6000000000000005,0.09522416790917797,83,-0.13545021243564925,0.10129155470247168,0.7626302742388276
"Comedy Christmas with the Kranks, starring Tim Allen and Jamie Lee Curtis, was in second place.",3.68,0.107704198193244,51,0.2735557620520423,0.09513490442635739,0.7502542490260266
"The Polar Express entered in third place while Jude Law film Closer made its debut at number six.

",8.280000000000001,0.09991993408307466,53,0.15070521148593644,0.10782345667279371,0.7538295377249273
"Oliver Stone's big-budget epic Alexander, starring Colin Farrell, followed last week's disappointing sixth-place opening with a slump to seventh place and takings of $4.7m (£2.4m).",11.040000000000001,0.11753454602544178,112,0.2833635402047989,0.11075438669183367,0.7725462539973518
"Critics have savaged the three-hour epic, which reportedly cost $150m (£77m) to make.",7.36,0.1031300104472294,52,0.0637388535186078,0.10559593968861584,0.7455923844223898
"National Treasure, which sees Cage's character Ben Gates chase a hidden fortune, has been made by Disney Studios.",3.68,0.13069025100084977,74,-0.15058844512696798,0.10621979208229308,0.7551277995203398
"It is Cage's fourth collaboration with Jerry Bruckheimer, who is usually noted for his male-orientated action films.
",2.7600000000000002,0.09304079295533978,67,-0.034705753384135465,0.1043531437354604,0.751115689860298
