Sent,Tm,Lex,Luhn,Lsa,Tr,LDA
"Rusedski forced out in Marseille

Greg Rusedski was forced to withdraw from the Open 13 in Marseille on Thursday with a rib injury.

",4.6000000000000005,0.14666666666666667,79,-2.3257843629056448e-17,0.14010285062340957,0.7613058537055827
"The British number two had been scheduled to play qualifier Sebastien de Chaunac, who beat world number five Guillermo Coria 6-4 7-5 in round one.",10.120000000000001,0.14385178585957106,92,0.11462718114342013,0.15000780192446772,0.7613842654491934
But Rusedski was unable to take to the court because of a problem with the left-hand side of his rib-cage.,3.68,0.14666666666666667,47,-4.932350274688215e-16,0.13330576122300747,0.738276959916776
American Taylor Dent caused a shock with a 7-6 6-2 victory over second seed David Nalbandian.,4.6000000000000005,0.14520185380602227,60,0.3081878046664102,0.14984445532985735,0.744945412728938
"But third seed Joachim Johansson made it through after beating Frenchman Gilles Simon 7-6 6-3 while in the first match of the day, sixth seed Feliciano Lopez defeated Ivo Karlovic.",8.280000000000001,0.1509463603344067,101,0.3288147101362548,0.15286541056212322,0.7700459241252938
"There were also wins for Slovakia's Karol Beck and Croatian duo Ivan Ljubicic and Mario Ancic.
",0.92,0.14666666666666667,54,8.303121153183896e-17,0.1138737203371345,0.7511334455386702
