Sent,Tm,Lex,Luhn,Lsa,Tr,LDA
"Celebrities get to stay in jungle

All four contestants still remain in I'm A Celebrity ...",5.5200000000000005,0.15498520864395784,44,0.16661600631178344,0.0862832378955441,0.7143122225840056
"Get Me Out Of Here as no evictions were made on the television show on Saturday.

",4.6000000000000005,0.08840034424811485,34,-0.06387555906814031,0.09535443267574616,0.6928350695554791
"Contestants Paul Burrell, Joe Pasquale, Janet Street-Porter and Fran Cosgrave were told by hosts Ant and Dec. Natalie Appleton's decision to quit the show last Monday had given them all a stay of execution, the group were told.",10.120000000000001,0.12305957548154228,135,-0.17254682900320986,0.0957035230179176,0.7775167522275641
"Model Sophie Anderton was the last person to be voted off the ITV1 show, set in the Australian jungle.",7.36,0.10334040974689268,56,-0.0875964479442126,0.09416445222165999,0.7459202272186638
"The four remaining stars will do a joint Bushtucker Trial on Sunday.

",0.92,0.08445456019045962,36,0.20612262136737097,0.08982019984060265,0.722461370977947
"Former All Saints singer Natalie Appleton,31, walked out of the show after learning she would face a fifth so-called Bushtucker Trial.",6.44,0.09980223862338143,67,0.0020210300487810994,0.0995434000628144,0.7472069103659007
The celebrities are chosen by the viewers to pass trials in order to win food for the rest of the camp.,5.5200000000000005,0.06923938418140368,50,0.24232635155690888,0.0959890413162446,0.7508873148015196
"Appleton had endured a torrid time during the programme, including a well-publicised row with Sophie Anderton.",4.6000000000000005,0.08200073600942287,71,-0.1643795077277319,0.09108254291777267,0.7486880202354707
"And on 26 November singer Brian Harvey quit as a contestant after he had a blazing row with Janet Street-Porter.
",9.200000000000001,0.07471754287482471,67,-0.18924305930510477,0.09205917005169782,0.7585410068861224
