Sent,Tm,Lex,Luhn,Lsa,Tr,LDA
"Share boost for feud-hit Reliance

The board of Indian conglomerate Reliance has agreed a share buy-back, to counter the effects of a power struggle in the controlling family.

",11.040000000000001,0.13224207470212476,114,0.18684325200766402,0.12838735768476855,0.7703091696494362
"The buy-back is a victory for chairman Mukesh Ambani, whose idea it was.",3.68,0.17478277592796584,39,-0.25338578377321896,0.124316816036031,0.7183379101761577
"His brother Anil, the vice-chairman, said had not been consulted and that the buy-back was ""completely inappropriate and unnecessary"".",3.68,0.10271824575265327,73,-0.21407812646721794,0.12117488294312967,0.7450673235507663
The board hopes the move will reverse a 13% fall in Reliance's shares since the feud became public last month.,10.120000000000001,0.12039129709921906,54,0.25964231925483056,0.12428162939454396,0.749885180368075
"The company has been fractious since founder Dhirubhai Ambani died in 2002, leaving no will.",4.6000000000000005,0.10202636959753228,50,-0.1363812810665864,0.10749078737227728,0.7400565266051046
"""Today's round has gone to [Mukesh], there is no doubt about it,"" said Nanik Rupani, president of the Indian Merchants Chamber, a Bombay-based traders' body.",3.68,0.11626790904925387,83,-0.06255370726933063,0.12125832089490145,0.7639851850505638
"The company plans to buy back 52 million shares at 570 rupees (£6.80; $13) apiece, a premium of more than 10% to its current market price.
",19.32,0.13157132787125095,79,0.00280619493228899,0.11309020567434791,0.7695851305629685
