Sent,Tm,Lex,Luhn,Lsa,Tr,LDA
"Hollywood ready for Oscars night

Hollywood is preparing for the biggest night in the film world's calendar, the 77th Academy Awards, on Sunday.

",17.48,0.02893562597394358,87,0.018252704620604757,0.03600719306556946,0.7659388487692751
"A host of stars are expected to grace the red carpet outside Los Angeles' Kodak Theatre, including Johnny Depp, Cate Blanchett and Leonardo DiCaprio.",6.44,0.036842429343303736,96,0.062034825885063885,0.0321329553483444,0.769626977341302
"British actors in attendance include nominees Clive Owen, Imelda Staunton, Kate Winslet and director Mike Leigh.",9.200000000000001,0.03972983946392812,87,-0.014957306426482785,0.028688313311928507,0.7618030213510537
"The Aviator leads the shortlist, but critics believe the night may belong to Clint Eastwood's Million Dollar Baby.",6.44,0.033657031936283534,67,-0.11620582464200252,0.03466519869979074,0.7529701841265585
"A recent poll of US pundits found Eastwood's boxing drama had become the new favourite to win best film over the Howard Hughes biopic.

",12.88,0.02473677693372922,70,-0.1181701595940908,0.034592724383555734,0.758383722742235
"If the 74-year-old does win, he will become the oldest person ever to be named best director at the ceremony.",11.040000000000001,0.030977240870197868,43,0.05229387785083158,0.03479441190377931,0.7365873276111774
"UK critics still favour The Aviator for best film, but believe the best director title will generate a close fought battle between Eastwood and Martin Scorsese.

",13.8,0.041388385646299444,84,-0.1584663806708098,0.03477213064089867,0.7631426973878476
"Scorsese has never won the best director prize, despite four previous nominations for films including Raging Bull, Goodfellas and Gangs of New York.",6.44,0.031204728527426707,80,-0.0989564075556068,0.034162572280374635,0.7611036239891003
"Eastwood has won best director once before, for Unforgiven in 1993.",5.5200000000000005,0.04712346257835447,33,-0.16178651388999601,0.029149187338507253,0.7084424044459822
"Most experts predict the twice-nominated Jamie Foxx will win best actor for his portrayal of singer Ray Charles, while Vera Drake star Imelda Staunton looks likely to lose out in the best actress field to Hilary Swank in Million Dollar Baby.",15.64,0.030302754174540446,140,-0.059583024170023056,0.03398826890391548,0.7789813646081535
"The UK's highest hopes remain with Clive Owen, who has scooped both the Golden Globe and the Bafta for his supporting role in Closer.",1.84,0.027117076119732336,63,-0.010575495469562594,0.03450032882159582,0.760715045526965
"Actor and comedian Chris Rock will host the event, which will be broadcast with a seven-second time delay to allow censors to cut out any unsuitable content.

",12.88,0.04679666408574511,87,0.1257002241180955,0.03646512857811844,0.7645567876395719
"""We have the bleep machine ready, but bleeps will be used as needed,"" producer Gil Cates told reporters.",5.5200000000000005,0.0317195082959634,53,0.02175754733311873,0.029193570634950795,0.751030768968759
"However, he added that he strongly disapproved of the growing tendency to censor live broadcasts on US TV.

",5.5200000000000005,0.03792664083858758,54,0.12523028277389683,0.03037585599599393,0.7449711199183735
"He also played down fears that Rock, who is known for using strong language in his stand-up routines, might cause controversy on the night.",7.36,0.028086176281838314,57,0.1369462852899638,0.03591148567693013,0.7455056913176223
The 40-year-old comic has already promised not to swear live on air during the show.,8.280000000000001,0.045623692239783284,39,0.21175071435606685,0.036076027159030306,0.7404454871185512
"""Chris has a sense of humour and everything he says is really said humorously,"" Cates said.",2.7600000000000002,0.03607123511651129,29,0.01946148924234568,0.025569199617361826,0.708392923894595
"""You need a movie star and someone who is a stand-up comic so they can deal with the vicissitudes of the show.""",11.040000000000001,0.03543381922131313,41,0.18415336676818622,0.03640930632356553,0.7203858316023657
"Security will also be tight, with police employing a system to detect sarin nerve gas.",8.280000000000001,0.03207114190558397,53,-0.0037672928017461775,0.025398250796109356,0.740008146892889
"""We are pulling out all the stops,"" said John Miller, chief of counterterrorism at the Los Angeles Police Department.",1.84,0.03510768791075311,65,0.022559175904876674,0.031926585615044786,0.7507524624646928
"The show is ""a symbol of American culture and has the potential to be a high-visibility target,"" he added.",6.44,0.02620399143298432,58,0.08803805356984268,0.03468656644363683,0.739096643749507
"Meanwhile, organisers have erected a canopy over the red carpet following an outbreak of torrential rain in Los Angeles over the past week.",9.200000000000001,0.03236697137951876,69,0.027556483435067867,0.029686937094878466,0.7587187817023224
Cates said the covers would be removed if the threat of wet weather receded.,2.7600000000000002,0.028205128205128202,36,4.665568898932328e-06,0.02741062484276107,0.7319273716999136
"Details have also emerged of the contents of this year's gift bags, which are given to nominees and presenters on the night.",11.040000000000001,0.03875909144031167,51,0.14467867996867076,0.03437976290891547,0.7380709394431009
"This year's bags will include a gift certificate for a luxury beach resort, a pair of mink eyelashes and a kitchen set with a year's supply of tea and coffee.",24.84,0.028722126912590358,91,0.1285642818101185,0.03109366719336289,0.7697956765813159
"The event will be televised by the ABC network from 1700 local time (0100 GMT), and on Sky Movies in the UK from 0130 GMT.
",8.280000000000001,0.024890773165648052,60,0.04632116242336892,0.02796374642108018,0.7637008662319889
