Sent,Tm,Lex,Luhn,Lsa,Tr,LDA
"Oil prices fall back from highs

Oil prices retreated from four-month highs in early trading on Tuesday after producers' cartel Opec said it was now unlikely to cut production.

",10.120000000000001,0.1452904128972203,99,-0.04958744075021899,0.11114955653191319,0.7679642078407761
"Following the comments by acting Opec secretary general Adnan Shihab-Eldin, US light crude fell 32 cents to $51.43 a barrel.",9.200000000000001,0.10953818319935286,77,0.3355477625620542,0.10225227538648117,0.7671468171488778
He said that high oil prices meant Opec was unlikely to stick to its plan to cut output in the second quarter.,14.72,0.09226098110193776,45,-0.06344453328815722,0.10705307049338579,0.7486333568422912
"In London, Brent crude fell 32 cents to $49.74 a barrel.

",6.44,0.10672570508087711,36,0.3429508917999129,0.09630114938067612,0.7432569449160965
Opec members are next meeting to discuss production levels on 16 March.,4.6000000000000005,0.08456830920731558,46,-0.0050316081673063414,0.10095723139274627,0.7396476628774031
"On Monday, oil prices rose for a sixth straight session, reaching a four-month high as cold weather in the US threatened stocks of heating oil.",23.0,0.1805828436579138,91,-0.09489407162494669,0.10978098053695746,0.7672611325058907
"US demand for heating oil was predicted to be about 14% above normal this week, while stocks were currently about 7.5% below the levels of a year ago.",12.88,0.07971338303512965,54,-0.07821269630504882,0.10937055773835855,0.7533481616234606
"Cold weather across Europe has also put upward pressure on crude prices.
",7.36,0.08132018182025295,44,0.06106523540111929,0.10313517853948152,0.7279728038987827
