Sent,Tm,Lex,Luhn,Lsa,Tr,LDA
"Musical treatment for Capra film

The classic film It's A Wonderful Life is to be turned into a musical by the producer of the controversial hit show Jerry Springer - The Opera.

",20.240000000000002,0.1187163396941372,106,-0.23243255227980106,0.09402523403605267,0.7679586570740172
"Frank Capra's 1946 movie starring James Stewart, is being turned into a £7m musical by producer Jon Thoday.",9.200000000000001,0.08294733838862388,67,-0.12686334348544798,0.09159028725098788,0.7613484608049066
"He is working with Steve Brown, who wrote the award-winning musical Spend Spend Spend.",5.5200000000000005,0.07459168663404461,50,0.27734603447968476,0.09553924190273708,0.7494466518886944
"A spokeswoman said the plans were in the ""very early stages"", with no cast, opening date or theatre announced.

",6.44,0.09702467180607169,55,-0.009976488211403362,0.0900928453139686,0.7460007003332393
"A series of workshops have been held in London, and on Wednesday a cast of singers unveiled the musical to a select group of potential investors.",11.040000000000001,0.09116137225524407,84,-0.042955872477502995,0.09282382727810484,0.7611278647047779
Mr Thoday said the idea of turning the film into a musical had been an ambition of his for almost 20 years.,11.96,0.10955971567625462,41,-0.1163287752024315,0.0981722474225295,0.7439558259926984
"It's a Wonderful Life was based on a short story, The Greatest Gift, by Philip van Doren Stern.",4.6000000000000005,0.08868913551278504,55,-0.009092227495946554,0.09245234592612979,0.7533459001409785
"Mr Thoday managed to buy the rights to the story from Van Doren Stern's family in 1999, following Mr Brown's success with Spend Spend Spend.",5.5200000000000005,0.12781205736202858,81,0.2551615890721914,0.09218143371773362,0.7692458301028102
"He later secured the film rights from Paramount, enabling them to use the title It's A Wonderful Life.
",4.6000000000000005,0.08949768267081036,48,-0.15469341655101704,0.0931225371517557,0.7352215224107029
