Sent,Tm,Lex,Luhn,Lsa,Tr,LDA
"Holmes feted with further honour

Double Olympic champion Kelly Holmes has been voted European Athletics (EAA) woman athlete of 2004 in the governing body's annual poll.

",10.120000000000001,0.09826822481632627,107,0.06377774227017516,0.09798888126297585,0.7721584693121525
"The Briton, made a dame in the New Year Honours List for taking 800m and 1,500m gold, won vital votes from the public, press and EAA member federations.",6.44,0.1770033187304185,88,-0.19102489070605597,0.09911070787632044,0.7689848079433621
She is only the second British woman to land the title after-,4.6000000000000005,0.08134044248132545,27,0.20775436408840342,0.08881856665607957,0.6923711568950126
Sally Gunnell won for her world 400m hurdles win in 1993.,5.5200000000000005,0.0679382054912759,37,-0.09023709727075571,0.0891652068997029,0.7393736551071248
Swedish triple jumper Christian Olsson was voted male athlete of the year.,7.36,0.08399978645187772,53,-0.14307951216146242,0.0896406409455145,0.745534208586931
The accolade is the latest in a long list of awards that Holmes has received since her success in Athens.,5.5200000000000005,0.09004863767262015,51,-0.046111755070580324,0.0916376055181277,0.7460833736356811
"In addition to becoming a dame, she was also named the BBC Sports Personality of the Year in December.",2.7600000000000002,0.06849758744974029,48,-0.18695478186981696,0.09206183445410718,0.7322575557581814
Her gutsy victory in the 800m also earned her the International Association of Athletics Federations' award for the best women's performance in the world for 2004.,9.200000000000001,0.10817859086507609,92,0.10696037279983915,0.0981844572230782,0.7608677438594296
"And she scooped two awards at the British Athletics Writers' Association annual dinner in October.
",3.68,0.10472520604133963,62,0.25856191577364107,0.09339209916409379,0.7461813242926761
