Sent,Tm,Lex,Luhn,Lsa,Tr,LDA
"Comic Morris returns with sitcom

Comedian Chris Morris, who created controversial TV show Brass Eye, is to return to screens with a new sitcom about a spoof London media worker.

",11.040000000000001,0.12811503222250806,116,0.16849915810392582,0.09654168253923222,0.772424988273939
Morris will direct and co-write Nathan Barley - a character from cult website TV Go Home - for Channel 4.,18.400000000000002,0.10329542688304935,66,-0.18745657628628343,0.09728722371085016,0.754083463003777
"It is a send-up of the stereotypical ""cool"" metropolitan media scene, with Nicholas Burns in the title role.",7.36,0.08275782944771187,68,0.08145801911531993,0.09564446069437663,0.7506049919056079
"A Brass Eye satire of the media handling of paedophilia sparked 2,500 complaints in 2001.

",4.6000000000000005,0.08943788973587356,61,0.2566979836277132,0.0886413773583893,0.7497095199297394
"Nathan Barley will be ""a character-driven comedy"", according to Charlie Brooker, who created TV Go Home in 1999 and has co-written the series.",3.68,0.08204985496320863,77,-0.1913736946773997,0.09813852543965484,0.7611240978074714
"Barley is described as a ""webmaster, guerrilla film-maker, screenwriter, DJ and in his own words, a 'self-facilitating media node"".",3.68,0.08460716019273358,77,0.018644990475231726,0.08929131491694395,0.7569283790388643
"The story will also feature Dan Ashcroft, a style magazine columnist, and his sister Claire, a film-maker who hates the ""cool"" scene.",9.200000000000001,0.12279643248020572,80,0.04420159129868863,0.09517242400864188,0.7633241508472959
"As well as Brass Eye, Morris was behind another news show satire, The Day Today, and dark sketch comedy Jam.",9.200000000000001,0.09799396301570851,55,0.24586573088511848,0.09502002953127282,0.7538577561399987
"The new show is expected to begin in February.
",3.68,0.08894641105900077,23,0.11615602076527749,0.0842629618006382,0.6653830516736763
