Sent,Tm,Lex,Luhn,Lsa,Tr,LDA
"Moya fights back for Indian title

Carlos Moya became the first man to successfully defend the Chennai Open title by beating four-times finalist Paradorn Srichaphan 3-6 6-4 7-6 (7/5).

",9.200000000000001,0.09830770540066983,122,-0.19366651404498922,0.09130895107243327,0.7697843958340342
"The Spaniard then donated his £28,000 prize money to relief efforts for the victims of the Asian tsunami.",10.120000000000001,0.15568753854167505,60,-0.02754692929856912,0.0958250522776586,0.749908567309743
"The final was close throughout, with Thai second seed Srichaphan - the 2003 winner - closing out the first set.",18.400000000000002,0.09211464146618253,48,-0.12047772879431748,0.09202880625920101,0.745520123279676
"But Moya took the second set, before bouncing back from 5-2 down in the decider to force and win a tie-break.",6.44,0.10065143585767478,44,-0.19888450728097692,0.09048507279728864,0.7393706432998141
"Moya confirmed afterwards: ""I'm donating my prize money from this tournament for the tsunami victims, hoping it makes some difference to their lives.",11.040000000000001,0.09067227723989596,72,-0.12843976717268304,0.0974347608524221,0.755531451475237
"His contribution follows pledges by four other players to donate their prize money from the tournament, which went ahead after the 26 December disaster which has so far claimed at least 150,000 lives.",16.560000000000002,0.0872294696730284,88,-0.03244000688077135,0.1009358235398661,0.7648598268126077
"Scrichapan said he would donate an unspecified amount for relief work in Thailand, where more than 5,000 people were killed.",10.120000000000001,0.07110642145184368,65,0.07941123445490218,0.09349142916895681,0.7445226433801473
"The ATP has announced that it would contribute the US$25,000 tournament fee to Unicef's emergency relief fund in Tamil Nadu.",10.120000000000001,0.10418405290127668,75,0.24083348735941723,0.09181066111699743,0.759449350927912
"The ATP Tour's sponsor, Mercedes, said it would also contribute, increasing the ATP donation to US$40,000.
",3.68,0.08004645746775316,57,0.2531646924085067,0.08667944291517604,0.749889472306891
