Sent,Tm,Lex,Luhn,Lsa,Tr,LDA
in a cocoon of loyal and wealthy supporters president clinton said friday that he must live with the consequences of his mistakes although he contended that democrats should take pride in the achievements of his presidency and take heart from its possibilities.,143,0.0028201308302858302,129,-0.003561350421979505,0.002652845891882459,0.9592470525860415
clinton has stopped apologizing for his conduct with monica lewinsky but he has taken to making glancing at times humble references to it before moving on to attack the republican congress as indifferent to americans needs.,143,0.001923184157171034,118,0.04766286751319841,0.002626628388680673,0.9528431074769389
he did so friday at a series of fund raisers.,31,0.0017695601746453603,22,0.023109698309860323,0.0022083531146740065,0.8624060727760837
in one deft sentence he acknowledged his personal pain while claiming credit for the country s economic strength making a compact appeal for both sympathy and support in an appearance earlier in the day in cleveland.,70,0.0012066604501417841,128,0.01496490759629161,0.002586694535385936,0.9636024826677073
after thanking the gathered donors for the very kind personal things they had said to him the president declared if i had to do it all over again every day i would do it in a heartbeat to see america where it is today as compared to six years ago.,64,0.00232672526801988,87,0.04537822171813659,0.00258551473776385,0.9520764716197857
as the applause died away clinton continued i want you to understand too that we all have to live with the consequences of our mistakes in life.,64,0.001692788549686353,62,0.004782033065893169,0.0024447376052697204,0.9269726838955239
he added with a chuckle most of us don t have to live with it in quite such a public way.,23,0.0031054143534575856,23,0.017239350210678267,0.0022571489732528217,0.8788523307856917
but nobody gets out of life for free.,9,0.0012011891072363356,8,-0.01604532172268171,0.00223185161676003,0.5309054704611451
to the music of a saxophone and a hammered dulcimer clinton raised about over lunch in a private home in cleveland for the democratic senate candidate in ohio mary boyle.,237,0.0023371976900569314,103,0.26734593916628324,0.002525094501878123,0.9450641409401855
then he flew to philadelphia to raise half a million dollars for the democratic party.,113,0.0025273367541816115,52,0.10845150434864997,0.0025018704909977453,0.9149207997551064
by midsummer the president s aides were delighted to have persuaded him to condense his fund raising remarks to just minutes of policy points and partisan jabbing.,68,0.0018144069894232213,95,0.026681538625396285,0.002442095761672398,0.9524274380273349
but as his troubles have grown and the mid term elections have approached his free form remarks have become longer.,16,0.0018980830291808533,52,0.016094782990380807,0.002592797146192041,0.935554831164203
in cleveland on friday he spoke for minutes and here on friday evening he spoke for almost minutes.,34,0.0021441362736684105,50,-0.010350446572104736,0.0022072753385152383,0.9198742939162713
these fund raising visits have fallen into a pattern since clinton s videotaped grand jury testimony on aug. .,84,0.0020555424690304916,64,0.03569876209260774,0.002404004986962725,0.94263954417719
he is lauded applauded and embraced by his hosts and the donors.,0,0.0009582127656022423,27,-7.423436869394878e-05,0.0017611750763808205,0.8870186950684452
mr. president these are your friends here today said tony george the host of the cleveland event offering the refrain of those who have played a similar role.,74,0.002241211210303019,77,0.05162455574669053,0.002532478701738376,0.9523627121197402
but in cleveland as elsewhere protesters who were scattered along the president s motorcade route were reminders of calls for his resignation and impeachment and of the mockery some are heaping upon his presidency.,76,0.0018049384181575482,103,0.04244261378872042,0.0022652476883721646,0.9445315810473184
at a rally for the president outside city hall here friday night a group of teamsters chanted two more years.,96,0.002398677645318837,55,0.016423901546354206,0.002416111599844532,0.9355447372476101
clinton s motorcade route was lined downtown with hundreds of people some of them carrying supportive or condemnatory signs.,87,0.0014855301966939505,77,-0.0009039015182723427,0.002352248020761097,0.5324783196038121
after an impromptu shopping trip during which he was greeted with shouts of we love you clinton told some donors at the beginning of an impassioned reprise of his cleveland speech i didn t even mind the protesters that s the american way.,79,0.0011353166513064987,114,0.041327532905133996,0.0023519184714751937,0.9628767473699283
but he added he preferred it when they were in the minority and that seemed to be the case.,6,0.001107513091776246,24,0.008719117341693037,0.002349186929152288,0.8570817240150402
as he rode into cleveland clinton passed a billboard for a local radio station wncx.,74,0.0010958571803724433,54,0.033299209793265665,0.0021458351414583533,0.9300785595764886
lovin touchin squeezin it read the words superimposed on a cartoon of the president with his arm over ms. lewinsky s shoulders the washington monument beside them.,59,0.0010476546394725846,94,0.07902202741543649,0.0022303649519869557,0.948821392976917
the president left it to his aides on friday to respond directly to the latest gusher of grand jury disclosures in washington.,70,0.002488049556625146,78,0.013998825608965842,0.0025277919637158104,0.94527289375056
instead in his remarks clinton spoke with pride of his record and with urgency about addressing the international economic crisis and the needs of struggling farmers and schoolchildren.,77,0.0009694964600495243,98,0.0021046983403177977,0.0025273626559226326,0.9507500718020248
as he typically does now before such partisan audiences he also walked through his political calculation for the mid term elections.,48,0.001304576988314441,64,0.020780053919861055,0.0025273498736258513,0.5390659171663994
clinton said in cleveland that republicans had bragged privately to him about their prospects.,92,0.0024577031724871165,48,0.04056667646379801,0.002337616512887207,0.8852505300321666
they tell me,4,0.0024154589371980675,0,0.0,0.0003630642801374533,0.3333333333333333
oh we re going to do very well mr. president in these mid terms because we have so much more money than you do and because democrats who turned out to re elect clinton would not return to the polls in an off year.,169,0.004356404360416646,62,0.08180539009808485,0.0026755843937041348,0.5984491253070428
that argument of course would also insulate clinton from any blame for depressing the democratic vote.,132,0.0013008239528019448,49,0.036556657427911476,0.0023890175033617787,0.9076025671929198
but he often goes further than that saying that his predicament could actually help the democrats.,33,0.0012974419221637907,19,0.004397712840331347,0.0018577450296946804,0.7639182633973131
lower income democratic voters he said might not bother to vote in a typical election.,97,0.0016024711858857001,49,0.03078333320196361,0.0024735926117602047,0.9150575891668343
the people that were good enough to serve you here at this event today they ve got a lot of hassles in their life he said.,51,0.001720426268511316,40,-0.014095512009506773,0.0023506685522324882,0.9295526010392489
but he said adversity is our friend because it can overcome apathy and focus us on what is at issue here.,28,0.0009128006314075914,39,0.009079433748640432,0.0022392715432609117,0.9010746056425445
what should be at issue clinton said are his achievements and agenda and the republicans record which he described harshly.,114,0.003104280132028289,53,0.030472705113679575,0.0025127390906932437,0.8948224636800038
what have they done he asked in cleveland.,15,0.003335503992171519,12,0.07117556644390846,0.0019655441690160456,0.751220441642612
they killed the minimum wage increase for million americans.,23,0.0017849117906127633,39,0.04999068424321996,0.00217101468056937,0.8958395434419668
they killed campaign finance reform.,67,0.0016964839051806528,25,0.028234966547785196,0.0024039589268691655,0.8589890028514329
they killed the tobacco reform legislation.,19,0.001794793026041007,28,-0.0021128132576072748,0.0022249267060198276,0.631502897929613
in other election years reps. david price and julia carson would have had little in common other than that they were democrats with relatively safe seats.,84,0.0031919502612271903,59,0.0822998223606087,0.002582725012693983,0.9406562302664375
price is a centrist who has represented this high tech district in north carolina for all but of the last years a political scientist who has taught at duke and yale.,78,0.0015382420764262293,87,0.008765969735526047,0.002465089898719505,0.9483853554676165
mrs. carson fairly liberal is a house freshman who worked her way up in politics from the grass roots having been reared in poverty.,53,0.0018790630773096075,67,0.02286590472649924,0.0024718371631233258,0.9460432077792563
but party officials who opened this election year with high hopes of recapturing the house are beginning to worry that democratic incumbents like price and mrs. carson share something else greater than expected peril on election day.,225,0.0035561114586892327,126,0.05920627074724138,0.002686720038029696,0.9672072190686528
as in many congressional races the biggest variable is the white house scandal which has injected fear and uncertainty into campaigns around the country.,82,0.002468950308757586,81,0.010939374847980184,0.002590687032980306,0.9446832000824575
other democratic incumbents who republican officials cite as locked in contests that are more competitive than expected include reps. corrine brown of florida vic snyder of arkansas lois capps and ellen tauscher of california martin frost of texas melvin watt of north carolina john lafalce of new york and sander levin of michigan.,196,0.0012341017615030067,222,0.010480595116697635,0.0023338180321080307,0.9792416060769212
here in north carolina s th congressional district price acknowledging that his own polls showed him in a tight race said this is a swing district that is sensitive to any tide or trend.,100,0.0033902585765424186,100,0.028758219198083215,0.0025316385155262034,0.686622037808886
it s something you think about a lot in connection with the president s troubles.,40,0.001403274621385068,29,0.012735435133299288,0.0024940150324005727,0.8576401948212734
the efforts of price and mrs. carson to contain the lewinsky debacle and their opponents attempts to capitalize on it offer important clues suggesting how clinton s problems are influencing the conduct of races around the country.,103,0.0031460609889040992,126,0.06063131883211311,0.002617868349766345,0.9637170250067462
many democrats are straddling a line that seems to shift a bit with every new scandal related disclosure they do not want to appear close to a president whose conduct embarrasses them and yet sensing the possibility of a public backlash against republicans they are weighing their words carefully and are wary of hopping on any impeachment bandwagon.,162,0.0016060122496375452,168,0.022207372208738817,0.002620289443548387,0.9639183418426576
and while publicly these democrats express confidence that the scandal will have little impact on them their campaigns are preparing for the worst by placing greater emphasis than ever on behind the efforts to prod their core constituencies to vote.,94,0.0014360939194659975,115,0.024784882496083113,0.0026486864786626372,0.9585883875876454
in a reflection of the uncertainty that the clinton scandal has cast even among republicans the challengers in the price and carson districts both are political novices seeking office for the first time have differing strategies tom roberg a computer executive in raleigh who is taking on price has broadcast a television commercial exploiting the scandal.,233,0.0036845816438830937,207,0.0911624387021213,0.002671323122504757,0.9748067382888004
tom roberg has called for bill clinton s resignation the narrator says.,65,0.0023257093247161615,43,0.047829211665437105,0.0024071956445538903,0.8791702469148964
this is not the time to be silent price.,33,0.0020952914537139267,15,0.0627650527312272,0.002261917518507819,0.8265924111391697
where do you stand but in indianapolis gary hofmeister a conservative jeweler challenging mrs. carson in indiana,40,0.0018080104954599067,75,0.011215828125737006,0.0021130921239489045,0.5311406883565035
s th congressional district is taking a more subtle approach rather than mention the scandal directly he notes as often as he can that julia votes with clinton almost percent of the time.,120,0.0016221371093444387,93,0.06321897723856258,0.0026842850261296286,0.9503733820962225
asked why he was not much raising the scandal directly hofmeister said don t murder somebody when they re in the process of committing suicide.,36,0.002453705875381486,62,0.050972543104282814,0.0023316507911562935,0.9368125016369775
there would be a danger if we went overboard.,3,0.0013001975660928864,15,0.0024838760201844378,0.0013311705477348993,0.7669163237404708
the best evidence of the discomfort of both price and mrs. carson is that when asked in separate interviews whether they would want clinton to campaign in their districts both said it would be impossible at this late date for the white house to schedule a visit.,195,0.0028838331548584986,116,0.02853574615386109,0.002637293717006255,0.9632861346350663
what if there was a sudden schedule change both paused squirmed a bit and mustered answers that were hardly affirmative.,11,0.002184194934743544,59,0.013785796919783712,0.0022026383400355573,0.9294579654468634
given the president s popularity i doubt it will hurt me mrs. carson said.,51,0.002004850229821172,37,0.020313013138235386,0.0023330985331815727,0.8944331988664104
and price i don t think that would be such a good idea he said.,31,0.0017940136666125645,16,0.016848040441340556,0.0023339929270847644,0.8558690131682627
i ve never had a president campaign here,94,0.002754827330465555,19,0.04516363055150232,0.002168592888910446,0.7893661515416673
and i wouldn t want to start this time although he is eagerly welcoming erskine bowles the president s chief of staff and a popular native son in north carolina to stump with him here this sunday.,81,0.0015421073429531852,101,0.029072631380929158,0.0025105180719683846,0.9616499336122738
making strategy for the stump is further complicated by anecdotal evidence that runs counter to democratic fears and republican hopes.,111,0.0019253803011348534,83,0.05543873553049912,0.0026121181116901047,0.9359746446604803
in three days of campaign stops here in north carolina and in indianapolis the scandal was rarely raised by any voter being courted by the candidates of either party.,146,0.0029763894943686,82,0.0894013811579095,0.002665499406481152,0.946663577753946
when a reporter asked about it many voters said that as appalled as they were at clinton s behavior they had a hard time relating it to their decision on which way to vote in the congressional elections in five weeks.,129,0.0023612283385081286,87,0.07353512905108413,0.0026874117890138285,0.9475898000587589
as hofmeister walked through the parking lot outside a gun and knife show at the indiana national guard armory in indianapolis last sunday billy derringer a year old machinist who is retired on disability called him over to express outrage about the millions of dollars that had been spent to investigate clinton.,141,0.0017950727279109691,177,0.06638702276469854,0.002520308190418131,0.9731075169629505
it s pathetic to spend all of our money said derringer who identified himself as an independent.,14,0.0013129719259965852,46,0.005346921627666127,0.002294044423691346,0.8774801328454204
it shouldn t have gotten this far.,1,0.0024154589371980675,7,-2.9473495561088903e-05,-0.00020166544767488557,0.6639076139443345
hofmeister tried his best to make the republicans case.,59,0.002749357803442721,29,0.000743631615834333,0.0024751558072577283,0.8133029273317133
there has to be rule of law he said.,10,0.0014924086381504036,7,0.027000545057047444,0.0021168860874637326,0.7523668980191701
mrs. carson said she hoped that democrats and swing voters alike would become so fed up with the lewinsky inquiry that the issue might even help her.,81,0.002259628591859741,60,0.020689008304171287,0.0025618016202389763,0.9404034426871171
to that end she proudly informs audiences that she voted against making public the report delivered to the house by kenneth starr the whitewater independent counsel.,51,0.0019771385549535313,96,0.010875826345726123,0.0026076363745659932,0.953848265731091
i was one of members of congress who voted against putting all that filth on the internet she said adding that starr s inquiry had been a cruel hoax in terms of fiscal responsibility and accountability.,29,0.0014924967889077705,96,0.03042105850238783,0.0025512838720525527,0.9523444964834077
the carson campaign is counting on voters like timothy daly a year old real estate executive who voted for a republican two years ago but now favors mrs. carson.,190,0.003022901024774736,93,0.08781399842485169,0.002606646026071172,0.9602381536178973
i m pulling the democratic ticket because i m tired of it the right side of the republican party is playing politics daly said.,168,0.0013515326775774665,59,0.05243731306333739,0.002508401515709034,0.928311603926518
we d like to see them go on with the people s business.,31,0.0023753700730179787,14,-0.03025662843198381,0.002348858086253184,0.770191429588433
back here in the th district price has some reasons to be worried.,34,0.003184483380337578,28,0.007855682012598522,0.0024431214669448074,0.8588102584900187
he was first elected to the house in but as a four term incumbent was ousted in the republican sweep of only to win his seat back two years later .,134,0.0019883194639568657,57,0.06444685228086433,0.002534333224113679,0.9310233857234952
in addition the district was redrawn last year to include a large durham section where voters do not know him well. determined not to be a midterm casualty of clinton once again price says he is waging the most vigorous get out the vote ground campaign of his career.,244,0.002161027734480962,129,0.06649980339711829,0.002593316532987492,0.9539776458323678
rather than engage roberg over the clinton scandal price has begun broadcasting a television commercial that emphasizes his central issue education.,133,0.0027094996141997785,95,0.139893631124653,0.002558815555131896,0.9506196379134269
the congressman s advisers say they intentionally produced an advertisement that appears decidedly nonpolitical it features school children in a play in an effort to break through the television clutter about the scandal.,54,0.0011281094941259747,135,0.03572841749954356,0.0025373815738879532,0.9592035162265492
but the price campaign also has a weapon it is holding in reserve in the event roberg appears to be riding the clinton scandal to advantage the incumbent s advisers say they would not be timid about running commercials underscoring that he earned a divinity degree before getting his doctorate in political science.,196,0.0018056693171367242,165,0.05534868386589493,0.0026182139723379557,0.9697051599934057
at a coffee with voters in a wealthy enclave of raleigh the other night roberg opened his remarks by asserting that clinton had lost the moral authority to lead.,66,0.0010628432065625689,88,0.009451093857172707,0.002634849992617422,0.9558947484403575
yet none of those assembled asked him about the scandal they were more concerned about the state s plans to build a highway near their neighborhood.,60,0.001155180715861041,60,0.041425420190215376,0.002503889003840034,0.9195939839598224
it was a surprising scene three months ago when dennis rivera one of new york city s most left leaning labor leaders was singing the praises of sen. alfonse m. d amato.,142,0.0021454851230732126,91,-0.01985141491643483,0.002521610266485659,0.9580500696844096
rivera president of the largest union in new york city praised d amato for persuading trent lott the senate majority leader to support legislation that financed health coverage for hundreds of thousands of uninsured children.,294,0.003384295428166045,149,-0.00389382180864898,0.0026853407277075995,0.9633508858634773
it looked as if rivera s politically potent union might endorse d amato or at the very minimum stay neutral in this year s u.s. senate race in new york.,275,0.003328477978501139,80,0.017783624898457,0.0026366037934462488,0.9484709817880019
but on monday rivera s member union the national health and human service employees union endorsed rep. charles e. schumer d n.y. and thereby risked d amato s wrath.,227,0.0033925944862675176,100,-0.042327653819735134,0.002548600471252904,0.9556632560957332
the endorsement is risky labor leaders acknowledge because angering this powerful senator could make him far less responsive to labor s needs when unions turn to him for help in the future if he is re elected.,125,0.0026062267345342205,97,-0.015525324595098249,0.0026420999604062794,0.9456513571968939
although it may seem illogical two words go far to explain why rivera s union backed schumer monica lewinsky.,73,0.002430423621222061,56,0.0023102787190101893,0.0023220134015191256,0.9162865139493327
largely as a result of the lewinsky scandal democrats say they suddenly fear that the republicans will gain a filibuster proof seat majority in the senate where the republicans have seats to the democrats .,227,0.0031753238980558353,120,0.06981699961988472,0.002512345411514932,0.9594576004463953
for labor leaders like rivera the notion of a strong republican majority is a nightmare.,115,0.002353480590145463,56,0.011707592096504947,0.0025301870403176938,0.923449672606141
that fear has helped push other new york unions into schumer s column even though d amato had long courted them.,140,0.002166089824961932,49,-0.042439889479761926,0.0026259401082394528,0.5445737986275265
those unions include the teamsters joint council in new york city and district council an umbrella group representing municipal employees.,115,0.001952913474471569,94,-0.019568516179753262,0.002353604476409844,0.9510242747899931
labor leaders say they fear that with a filibuster proof republican majority the senate would push through anti union legislation like recently defeated republican proposals to curb labor s political spending and cut financing for the national labor relations board.,333,0.00312553874281485,172,0.04744209748619859,0.0026490768219294275,0.9711639868200317
we are worried about legislation that will not allow the labor movement to survive into the next century rivera said.,52,0.0021984836281751163,49,0.005999732965847202,0.0023909974366365474,0.9048882803573352
alarmed that the democrats will lose senate seats in california illinois wisconsin nevada and south carolina rivera s union concluded that it was worth backing schumer.,158,0.0016633020963741346,112,0.01426688156549469,0.002499670360533588,0.9564700712005698
the decision rivera emphasized repeatedly was not personal but was based on national considerations.,45,0.0013292709777771477,66,0.02442391189070879,0.0025451555353767077,0.9122107060903953
unfortunately the leadership of the republican party at the national level in the person of newt gingrich and trent lott are not necessarily from the same culture as the republicans of the northeast he said.,166,0.0021193138783071547,103,0.062407213772804344,0.002545375295261237,0.9509645836877504
they re far more conservative far more anti labor far more anti worker far more pro business.,43,0.0014099675520102466,42,-0.00888384732086825,0.0023753042898557192,0.5097223455149881
we fear that the democratic party faces irrelevance in the united states senate if we go below seats.,132,0.0023095325672272404,56,0.08420531687396907,0.002590413397160033,0.4957623561402019
trying to avoid a rupture with d amato rivera praised him as an effective senator.,95,0.0016292802879775685,45,-0.03928051257398812,0.0022980999447333498,0.900984084245023
the endorsement could be a boon for schumer.,67,0.0019950450117165465,22,-0.09035805321669499,0.0015966982934199046,0.8271654908313457
rivera s union and the teachers union have labor s strongest political operations in new york.,122,0.002487381323132619,57,-0.006622103324938098,0.0024908183514382293,0.9263207783952875
in addition schumer will get thousands of dollars from the local as well as use of its renowned phone banks which can make political calls a day.,101,0.0023158895704506006,71,-0.001077121193220185,0.002569312173181423,0.5499290106414266
a spokesman for d amato said al d amato s proud that he s been endorsed by over union federations and locals representing more that working men and women and he ll continue his efforts on behalf of working middle class families.,170,0.0023781390731778544,117,-0.03066750158205414,0.0025975122017629737,0.5463206467002524
his labor endorsements include the new york city patrolmen s benevolent association and the new york state building and construction trades council.,147,0.0030719829074424532,102,0.0026997426477446355,0.0023695164975787815,0.9484404061589645
besides the backing of schumer also received the endorsement of s parent union the service employees international union which has members in new york state.,188,0.0032809383140753566,89,-0.01907727166782943,0.0025537743519933862,0.9410578927677904
rivera who did not support d amato the last time he ran either announced the endorsements during the founding convention of the new york state council of the service employees union.,218,0.0030908207170716995,95,0.01513668855510528,0.0026421929150549023,0.9483207131963113
