Sent,Tm,Lex,Luhn,Lsa,Tr,LDA
in kinshasa the private congolese airlines which owned the aircraft said the victims were civilians fleeing fighting in kindu.,88,0.004833046973032852,71,-0.16144529787634904,0.0061480194572401375,0.9331623851728946
it was not possible to confirm independently either claim.,17,0.004475909683977617,25,-0.15871948655614823,0.0043868631467990195,0.8323315482481468
kalunga said the airport although still under government control was in effect unoperational because of the rebel surface to air missiles deployed nearby.,177,0.005350188907447399,84,-0.17574538864517103,0.0059330412867277405,0.9454129373494773
war weary physically exhausted and sweaty hundreds of rebel troops and rwandan soldiers marched through dense tropical forest went to reinforce their comrades at kindu.,177,0.005256121856515568,109,-0.0994183864941323,0.00580079821734975,0.9562787296438876
after a week of battling for kindu rebel fighters had made little progress and failed to capture the town outright.,181,0.006863306107043239,62,-0.15159193268445056,0.006273751029931185,0.9351262505536864
the rebels see kindu as a major prize in their two month revolt against president laurent kabila whom they accuse of mismanagement corruption and warmongering among congo s tribes.,180,0.006120490953100138,102,0.3119638904860499,0.005917588913457818,0.9547710434186114
kabila has turned kindu into a launching pad for a counteroffensive against rebel positions in eastern congo.,244,0.007251819621756927,65,0.0008407639224793359,0.00602812894610308,0.9304791190834195
the conflict has drawn in many of congo s neighbors.,41,0.0034561579083504925,25,0.04436803790453728,0.005571572124930274,0.865970752003273
there are unconfirmed reports that troops from chad and the sudan are involved in defending kindu.,54,0.005206675870307817,49,-0.16046522698701668,0.0057128593687221455,0.9229109433923398
kabila accuses rwanda and uganda former allies who installed him in power in may after an eight month rebellion of sponsoring the new fighting.,96,0.005924410238192028,66,0.3086988650507897,0.0057420873452349525,0.9406843728464578
both countries say they have legitimate security interests in eastern congo and accuse kabila of failing to rid the common border area of rwandan and ugandan rebels.,147,0.009467884776633795,99,0.15736489904553816,0.006385001669128833,0.9566102183056588
tanks aircraft and troops from angola zimbabwe and namibia are supporting kabila.,65,0.004371035569303441,51,-0.003909488725484314,0.005563037046276591,0.9158241793693983
the assistance was essential in routing an early rebel offensive in the west that had reached the outskirts of kinshasa in mid august.,146,0.004573087075411661,77,-0.08964589798706878,0.006223402210786901,0.4984038814243983
the rebels say they now control one third of kindu and are poised to overrun the rest of the town.,82,0.00921316306057541,37,-0.19328910598984372,0.005788436390499507,0.9036737500590933
under a scorching sun the column of rebel reinforcements heading to kindu sneaked through abandoned roadside hamlets.,148,0.002531097395155967,68,-0.04839279357832258,0.005657874236890163,0.9417228275755524
the silence of their march was interrupted only by the singing of crickets and the clanging of the bullet belts hanging around the soldiers necks.,7,0.0030686002981925448,65,-0.009549047938417342,0.004676379917274895,0.9435434612081602
soldiers walked by empty huts made of mud and palm leaves.,7,0.0068573515814939374,35,-0.02331439695480525,0.00508655297982929,0.793482941958416
some rested in the shade of the umbrella shaped acacia trees.,3,0.0033305937442310585,32,-0.011700396789570466,0.003722578976238914,0.8995129200452768
the soldiers stopped for the night at the bridge over the chocolate colored elila river which guards the path to kindu.,54,0.002505642372833086,60,-0.07131708191877364,0.005457442534134158,0.9415441369379112
there was no immediate comment on the latest developments from the government in kinshasa which claimed earlier in the week it was in control of the tarmac bridge.,73,0.00785828039759049,73,-0.1619057915639274,0.006230487769885458,0.9372213293013477
a day after shooting down a jetliner carrying people rebels clashed with government troops near a strategic airstrip in eastern congo on sunday.,118,0.010091172751248857,87,-0.15996144904179607,0.006487082819920946,0.5828427057358234
fighting for the town of kindu in this vast west african nation subsided after rebels launched an artillery barrage into government held buildings and the airfield two miles three kilometers away.,128,0.00667555929231722,112,-0.22056121045249172,0.0062403524486469,0.548395844129328
on saturday the rebels shot down a congolese boeing over the kindu airport.,79,0.007512268070123092,45,-0.18997400607590037,0.00576639388244019,0.9133490624741131
rescue workers said there were no survivors from the downed plane the british broadcasting corp. reported sunday.,14,0.002898264375766633,64,-0.052607990632128,0.005583771054680903,0.924153114686702
rebels said the airplane was carrying troops and ammunition.,8,0.004084926288139293,36,-0.10216033942470734,0.005256693045882751,0.5757191551901685
in the capital kinshasa the private congolese airlines which owned the aircraft said the victims were civilians fleeing fighting in kindu.,97,0.005728388771777319,78,-0.16835790071858342,0.006206351943530491,0.9378927531791578
it was not possible to confirm either claim independently.,17,0.004475909683977617,25,-0.15871948655614823,0.004386863116970492,0.8323315482481468
rebel commander fino kabangu kalunga said surface to air missiles in the arsenal of his congolese democratic coalition had prevented the government from landing aircraft at the airport.,209,0.005056710183687229,123,-0.13680164714096807,0.006002822021005799,0.5009117719439462
kabangu kalunga said rebel troops and their rwandan allies had closed in on government forces from three directions after a week of fighting.,163,0.006509582010062155,73,-0.16556647310742073,0.006372746422609063,0.9392390504483648
he said government troops did not launch a counterattack to sunday s barrage and some reportedly retreated on the one road leading out of town.,72,0.00551761545883594,76,-0.17665634201224711,0.006061259460845485,0.7978437363324166
the rebels say they now control one third of kindu which the government has used as a staging area for a counteroffensive against rebel positions in the east.,201,0.007802522329914149,71,-0.1658187848247944,0.006307669764237833,0.9271906416994531
rebels who began their insurgency more than two months ago accuse president laurent kabila of corruption failing to carry out promised democratic reforms and stirring up hatred among congo s tribes.,129,0.006211857093449395,118,0.2565559560332911,0.006160388943460375,0.9647385761026793
early in the conflict rebels pushed far into the west to the outskirts of congo s capital.,69,0.009282848784291767,46,-0.0641267095197798,0.006282125419770572,0.9178611329373231
then angola zimbabwe and namibia intervened to help kabila and drove the rebels back to their bases in eastern congo.,124,0.005690161950517859,67,0.04118028276965931,0.005949169335914924,0.9369391961206429
the conflict has drawn in many of congo s neighbors.,41,0.003456157908350492,25,0.04436803790453728,0.005571572124930275,0.865970752003273
there are unconfirmed reports that troops from chad and the sudan are involved in defending kindu.,54,0.005206675870307817,49,-0.16046522698701668,0.005712859368722145,0.9229109433923398
kabila accuses rwanda and uganda former allies who installed him in power in may after an eight month rebellion of sponsoring the rebels.,96,0.00674520837923833,66,0.32630154239352643,0.005762025724546073,0.9388994055101662
both countries say they have legitimate security interests in eastern congo and accuse kabila of failing to rid the common border area of rwandan and ugandan rebels.,147,0.009467884776633795,99,0.15736489904553816,0.006385001669128833,0.9566102183056588
back in the golden years kasuku wa ngeyo had a farm and was the head of a strong farmers organization in the northeastern breadbasket of this central african nation.,43,0.006693963181188264,102,-0.006402856906749811,0.005723769467346245,0.9568975082882807
a quarter of a century later the year old businessman who also ran hotels and a tourist camp is broke the farmers group is a memory.,20,0.003165745584257437,71,-0.0038869610419800076,0.00555689337605816,0.9469302894448007
inter tribal rivalry looting soldiers rwandan refugees and two rebellions in as many years have wiped out half a million head of cattle here slashed coffee and tea exports in half and turned congo s bucolic eastern region of green pastures sparkling volcanic lakes and snow capped mountains into a war zone.,110,0.00575048588921008,187,0.02324099613983927,0.006008430171739306,0.9794281464155451
nobody is making money any more.,1,0.0034704483941257,9,-0.017229400650281067,0.005010300410787929,0.7763526729917513
people are surviving on a sack of beans.,10,0.0024152248135489484,21,-0.009482774825996534,0.004787979985583802,0.8652261990695518
they are tired of insecurity and have little hope things will get better said kasuku the son of an italian settler and a rwandan tutsi refugee mother.,32,0.00422434378516267,72,-0.00577460531439755,0.005495448198353351,0.9432293933017267
on aug. tutsis political opponents and disenchanted members of president laurent kabila s army took up arms accusing kabila of corruption nepotism and fostering tribal strife.,146,0.006230410131867318,119,0.44465370367535684,0.005759503532508247,0.9630602909661721
the war has split africa s third largest nation between the government held west and south and rebel controlled east and no political settlement is in sight.,178,0.004835680718360281,88,-0.12780958876508577,0.006345433467185562,0.9519098387043348
goma a small trading post at the head of lake kivu in eastern congo is no longer the starting point for tourists trekking to see mountain gorillas.,85,0.0036828455712856075,84,-0.013769024338015717,0.005805825797461476,0.9559040849987613
today its decaying buildings empty shops and crumbling guest houses are home to rebel leaders soldiers and people displaced by violence.,120,0.0031666659267257993,88,-0.0329992809480113,0.005941794597096426,0.9537640428308224
the rebels have promised to revitalize the economy by reducing taxes to boost investment.,8,0.002327070645182858,55,-0.0017384554384948477,0.0051874590223477055,0.9241410672668823
they also say they will pay civil servants who haven t seen a paycheck in months or years and invite investors to buy tea and coffee farms and gold and diamond mining concessions.,15,0.003216636913698914,94,0.0360944943683463,0.005176864283582028,0.9609488930101528
but the war has also increased tribal animosity especially toward ethnic tutsis a tiny but highly successful minority in the eastern region.,58,0.003260116811689074,79,0.07660464797924002,0.0058070567901967,0.9418636456325474
in the liberating effect of early political freedoms revived unresolved land disputes and led to clashes between the rwandan tutsis and hutus who had settled in eastern congo since the s. mai mai warriors armed youths from the hunde and nande tribes who accuse tutsis of stealing their land also joined the fighting.,143,0.004012210262080091,173,0.10935464072226789,0.00611440140350512,0.6341228483215897
in nearly million rwandan refugees engulfed goma a town of .,42,0.004693335100503429,35,-0.08420256461661044,0.0051205013002320245,0.8577580132263655
among them were former hutu soldiers and militiamen who took part in a genocide in neighboring rwanda in which more than half a million tutsis were killed.,45,0.005730976405691387,72,0.12007346343050634,0.005713751047441001,0.9359354362325657
they brought anti tutsi ideology with them and sold weapons to congolese tribes who then joined in the persecution of tutsi landowners and ranchers.,35,0.0031837462324690374,82,0.03079308008706074,0.005433188550171545,0.9506472939550229
people misunderstood political freedoms for anarchy said safari ngezayo a farmer and hotel owner.,26,0.0028133448055342944,71,0.018234173504547056,0.005343004392809407,0.937148946069432
we tried to mediate between tutsis and hutus and other tribes but how can you talk to people who have blood on their hands and genocide in their heads in late congolese tutsis backed by rwanda attacked the refugee camps dislodged the hutu fighters and forced most of the refugees back home across the border.,104,0.006521526076661417,145,0.08302000509927636,0.006192389217278624,0.7260204944920441
after an eight month rebellion backed by rwanda and uganda dictator mobutu sese seko fled in may and kabila took power.,98,0.006399018541722546,67,0.2644545528215473,0.005231528906362302,0.9412473115227655
he quickly changed the name of the country to congo from zaire.,44,0.0029444144703135644,30,0.03088650963579141,0.005988436037599494,0.8878899388778513
few people in northeastern congo expected another rebellion so soon.,61,0.007859680065798614,38,0.07082724128565383,0.006018580981379916,0.875232534257274
i blame our politicians.,2,0.0028732468149690452,15,0.06044852540116813,0.004242683150559207,0.7575477170990619
then i blame the foreign powers who kept meddling in our affairs.,3,0.0031463914421404012,29,0.06858069552005172,0.005018739938894166,0.8714157662157015
it is they who supported mobutu and kabila and we are paying the interest kasuku said.,48,0.004967181615909578,36,0.1259869737856953,0.005537663264451104,0.8518704974187683
