Sent,Tm,Lex,Luhn,Lsa,Tr,LDA
rebels attacked a village in western uganda and killed six civilians before soldiers drove them off a military spokesman said thursday.,30,0.006825869021339251,80,-0.02819469125230201,0.006353899484039277,0.9437161864114962
the attack occurred overnight wednesday in the village of chiondo near kasese kilometers miles west of the capital kampala said the spokesman who identified himself only as lt. majera. majera said the attackers were believed to be rebels of the allied democratic forces who operate from bases in the foothills of the rwenzori mountains that straddle the uganda congolese border.,108,0.004157826056496658,216,-0.04868571389232294,0.006310897302237659,0.975474184307862
he said the rebels likely fled back to their bases after the attack.,20,0.006536784785501145,24,-0.040558565358218945,0.0062887652532042405,0.5562982380101675
majera said the attackers avoided a nearby army post when they shot up the village.,22,0.003232840413628862,45,0.007620490080049334,0.005716971452173704,0.9105894573481079
it was the gunfire that alerted the soldiers he said adding that they killed two of the assailants.,2,0.0031660589761694545,35,-0.0114424321147333,0.004824155009440858,0.8955206380235982
the various rebel groups operating in the region often attack with knives or machetes either to save on ammunition or because they don t have guns.,124,0.0032248123019580147,61,-0.038238481955587086,0.0058904117674085064,0.9381744646062726
he had no further details.,0,0.0033727609139173665,6,-0.01765635449461921,0.0033280275707670342,0.3333333333333333
under an agreement earlier this year with congo uganda sent troops into the neighboring country to flush out the adf fighters.,68,0.0045531443414412245,67,0.029504706614371892,0.006240069871616793,0.40439856858595263
president yoweri museveni insists they will remain there until ugandan security is guaranteed despite congolese president laurent kabila s protests that uganda is backing congolese rebels attempting to topple him.,146,0.005464341280541953,134,0.14662327783729837,0.005917086010072909,0.9599136978905027
the anti kabila rebels claim the ugandan rebel lord s resistance army which operates in northern uganda and enjoys support from sudan is fighting alongside kabila s forces together with sudanese soldiers.,248,0.012357968804233307,131,0.10082760641790278,0.006310107362165681,0.8811447028536394
the government owned daily new vision reported thursday that lra leader joseph kony was badly wounded last week and is in hospital in juba the largest town still under government control in southern sudan.,139,0.006566541111247412,122,-0.18255074628593682,0.006411886886140825,0.9642405944021571
the sudan people s liberation army which is fighting the government in khartoum for autonomy for southern sudan has waged pitched battles with government troops in the past week as it moves on juba spokesmen for both sides say.,116,0.006996957155699903,128,-0.12005036236973779,0.006465043388162561,0.9633836045806435
new vision quoted ugandan minister of state for security muruli mukasa as saying kony s largest camp at al gabelain kilometers miles south of juba was destroyed last week when the spla took control.,68,0.004266085456882396,118,-0.08003592195313552,0.0062468102546621215,0.9662867485818614
muruli said the lra had been planning to bomb several sites in the ugandan capital including the parliament building state run radio uganda unidentified embassies and other public sites the newspaper said.,48,0.0053216928113550424,114,0.011542460603620734,0.006146728143700188,0.96292722243263
congolese rebels have taken their two month campaign to oust president laurent kabila to the internet.,109,0.007702762261506177,61,0.2720469835830279,0.005849243041535631,0.9207336119783429
we have to explain to the world audience who we are and what we re fighting for rebel leader ernest wamba dia wamba said on friday.,152,0.006073175726084885,61,-0.08469219144475185,0.005470489803643804,0.939724492349215
besides the kabila government has been using the internet to tell their side of the story.,80,0.0036165869249871977,33,0.11203931900826593,0.006092084249996822,0.8443133909595819
the year old history professor at the university of dar es salaam in tanzania said supporters of the congolese rally for democracy in the united states have created a web site for the rebellion.,81,0.003490503615490956,116,0.0695387252873605,0.005782212293150406,0.9638106438655702
the site www.prairienet.org panafrican cdm has been set up on the donor supported prairenet community network in eastern illinois.,44,0.004022353145413715,90,0.0024452831287714977,0.005196820881402145,0.9539888743459611
the rebels are a coalition of ethnic tutsis disenchanted members of kabila s army and political opponents who accuse kabila of power grabbing mismanagement corruption and sowing dissent among congo s tribes.,193,0.007561561553911332,133,0.5252643109685355,0.0058925493622750125,0.9674290690162477
after an initial lightning advance in the far west of africa s third largest nation the rebels were stopped at the outskirts of the capital kinshasa by troops from angola zimbabwe and namibia who are backing kabila.,115,0.007781748598821863,112,-0.10761509307906297,0.006297912962469573,0.9611171291101317
since then the rebels have been confined to a chunk of territory in the extreme eastern part of the country where their rebellion was declared aug. .,55,0.005188959228528458,70,0.08752284759997991,0.006108335347102332,0.9377801141228144
wamba said the rebels control percent of congo an area of million people.,83,0.008353705198732544,46,-0.07218086229435929,0.006140384061757767,0.920588493204885
so far kabila has refused to negotiate with the rebels accusing them of being the puppets of neighboring rwanda and uganda.,67,0.0055558494142282045,61,0.3622982955373283,0.005513764622242121,0.9274931152708887
posting the rebel mission statement on the internet is just part of the media campaign.,123,0.0054267689669259545,51,0.08066041345800945,0.006121933847160812,0.9135996726214828
last week wamba dispatched two of his top aides to the united states and europe to lobby for political support and raise public awareness about the conflict in congo.,101,0.007728680869641344,96,0.029857191024556147,0.006124340244757281,0.9561183625509272
world leaders diplomats and are not familiar enough with our cause.,6,0.0033610958513456022,27,-0.03611103048460938,0.005263839890694552,0.8647256102064672
they still talk about tutsis leading the rebellion.,32,0.005740677780972951,23,0.18177928931955561,0.005469585576417898,0.8639271781582678
well i m not a tutsi wamba said.,17,0.006169772232414478,10,-0.036098314022264266,0.0028161114310761006,0.7725772820464407
jacques depelchin the movement s vice president and a former lecturer at the university of california at berkeley met in washington earlier this week with the u.s. special envoy in the great lakes region of central africa howard wolpe and with congressmen wamba said.,85,0.004032674537283605,163,-0.022323088776701847,0.005524496139006981,0.9723781506581073
congolese rebels have taken their two month campaign to oust president laurent kabila to the internet.,109,0.007702762261506177,61,0.2720469835830279,0.005849243041535631,0.9207336119783429
we have to explain to the world audience who we are and what we re fighting for rebel leader ernest wamba dia wamba said on friday.,152,0.006073175726084885,61,-0.08469219144475185,0.005470489803643804,0.939724492349215
besides the kabila government has been using the internet to tell their side of the story.,80,0.0036165869249871977,33,0.11203931900826593,0.006092084249996822,0.8443133909595819
the year old history professor at the university of dar es salaam in tanzania said supporters of the congolese rally for democracy in the united states have created a web site for the rebellion.,81,0.003490503615490956,116,0.0695387252873605,0.005782212293150406,0.9638106438655702
the site www.prairienet.org panafrican cdm has been set up on the donor supported prairenet community network in eastern illinois.,44,0.004022353145413715,90,0.0024452831287714977,0.005196820881402145,0.9539888743459611
the rebels are a coalition of ethnic tutsis disenchanted members of kabila s army and political opponents who accuse kabila of power grabbing mismanagement corruption and sowing dissent among congo s tribes.,193,0.007561561553911332,133,0.5252643109685355,0.0058925493622750125,0.9674290690162477
after an initial lightning advance in the far west of africa s third largest nation the rebels were stopped at the outskirts of the capital kinshasa by troops from angola zimbabwe and namibia who are backing kabila.,115,0.007781748598821863,112,-0.10761509307906297,0.006297912962469573,0.9611171291101317
since then the rebels have been confined to a chunk of territory in the extreme eastern part of the country where their rebellion was declared aug. .,55,0.005188959228528458,70,0.08752284759997991,0.006108335347102332,0.9377801141228144
wamba said the rebels control percent of congo an area of million people.,83,0.008353705198732544,46,-0.07218086229435929,0.006140384061757767,0.920588493204885
so far kabila has refused to negotiate with the rebels accusing them of being the puppets of neighboring rwanda and uganda.,67,0.0055558494142282045,61,0.3622982955373283,0.00551376462224212,0.9274931152708887
posting the rebel mission statement on the internet is just part of the media campaign.,123,0.0054267689669259545,51,0.08066041345800945,0.006121933847160812,0.9135996726214828
last week wamba dispatched two of his top aides to the united states and europe to lobby for political support and raise public awareness about the conflict in congo.,101,0.007728680869641344,96,0.029857191024556147,0.006124340244757281,0.9561183625509272
world leaders diplomats and are not familiar enough with our cause.,6,0.0033610958513456022,27,-0.03611103048460938,0.005263839890694552,0.8647256102064672
they still talk about tutsis leading the rebellion.,32,0.005740677780972951,23,0.18177928931955561,0.005469585576417898,0.8639271781582678
well i m not a tutsi wamba said.,17,0.006169772232414478,10,-0.036098314022264266,0.0028161114310761006,0.7725772820464407
jacques depelchin the movement s vice president and a former lecturer at the university of california at berkeley met in washington earlier this week with the u.s. special envoy in the great lakes region of central africa howard wolpe and with congressmen wamba said.,85,0.004032674537283605,163,-0.022323088776701847,0.0055244961390069815,0.9723781506581073
after a day of fighting congolese rebels said sunday they had entered kindu the strategic town and airbase in eastern congo used by the government to halt their advances.,189,0.010441734447598994,91,-0.2082833957802947,0.0064723495057780545,0.8879382013135921
etienne ngangura a rebel spokesman said the rebel fighters were inside kindu and had taken the adjacent large airbase kilometers miles west of goma the rebel stronghold.,407,0.009362451765744365,108,-0.1914793427820735,0.005801377872344878,0.9582753507126328
we re in the town and the airport ngangura said.,29,0.006211535560306607,19,-0.14191198671701633,0.00469734695477162,0.8268072312567096
he offered no details and the report could not be confirmed independently.,11,0.008345519823259047,37,-0.1269943506209678,0.004767606025279829,0.8655450209732338
rebel military sources said the fighting continued inside kindu where the rebels were apparently meeting stiff resistance.,163,0.0053645230844097825,77,-0.1006653660230879,0.0064085162548318695,0.9426687371028732
the rebels ethnic tutsis disenchanted members of president laurent kabila s army and opposition politicians took up arms aug. accusing kabila of mismanagement corruption and creating division among congo s tribes.,185,0.008971431197278648,144,0.5266017238858671,0.006020483088387461,0.9685711777312278
the rebels have targeted kindu since late august when they were forced to retreat from the outskirts of the capital kinshasa after troops from angola and zimbabwe came to kabila s aid.,134,0.007333256447453294,89,-0.1410660912512774,0.006172075291298391,0.9559257762342449
troops moving south from kisangani the largest city under rebel control and moving west had made steady gains against kindu which the government apparently used to build up force for a planned counter offensive.,231,0.008547756010380152,121,-0.18283637350870954,0.006424265085143596,0.9610818310368403
apart from kindu ngangura said rebel fighters took buta kilometers miles north of kisangani and on the main road in northern congo that links sudan and the central african republic.,224,0.006812625248923181,108,-0.1203567800387709,0.006016541846599639,0.9594111438388759
also on sunday ngangura said the rebels took bumba kilometers miles northwest of kisangani.,28,0.004852239872552266,55,-0.12179173588021164,0.005104196128633111,0.9229050838378399
these reports could not be confirmed independently either.,5,0.005536923821030061,26,-0.15259537751336102,0.004337089956889806,0.8316006360174723
rebel leaders said a victory at kindu would confirm rebel strength boost fighters morale and perhaps persuade others to join them.,267,0.009645328605429358,73,-0.11745751210090276,0.005980697899539331,0.9434691072440329
the rebels want direct negotiations with kabila.,42,0.0030780328636196355,28,0.11048402551790734,0.005674908516715466,0.8601099396877059
but the president has so far refused accusing the rebels of being puppets of rwanda and uganda which kabila has accused of orchestrating the rebellion.,90,0.006350699217009906,76,0.4179650957339317,0.005368611465440946,0.9360294036842016
the conflict in central africa has drawn in most of congo s nine neighbors and regional diplomatic initiatives have so far failed to stop it.,59,0.005069467612984256,74,0.016042352044596534,0.006032783158637847,0.9408395209236567
rebel commanders said tuesday they were poised to overrun an important government held air base in eastern congo a battle that could determine the future of the two month congolese war.,262,0.006962308676874854,113,-0.12477679164528743,0.006546523500000768,0.6380293452857281
after trekking several hundred kilometers miles through dense tropical forest thousands of rebel fighters have gathered kilometers miles outside kindu where troops loyal to president laurent kabila have used an air base as a launching pad for offensives.,262,0.008486321458365819,144,-0.09378746915381217,0.005875284470717765,0.9703533120216571
if the rebels succeed in capturing kindu kilometers miles west of goma the rebel headquarters this will remove the last government stronghold in eastern congo and pave the way for rebel advance into the mineral rich southwest.,378,0.007732722094740682,137,-0.15129069431615008,0.006282355896027115,0.9631454353189041
a rebel defeat on the other hand would put the coalition of ethnic tutsis disenchanted members of the congolese army and opposition politicians on the defensive and give a boost to kabila s efforts to fend off the rebellion launched aug. .,230,0.006640241400825428,140,0.2669212637832038,0.006304101121977144,0.966961806202741
rebel commander richard mondo said troops had fired artillery rounds into kindu monday and early tuesday sending the population fleeing out of town.,197,0.007401093821060022,94,-0.17903076555015082,0.006333262658159752,0.9539638107312313
advance units had crossed the lualaba river from the north and were meeting stiff resistance in the town he said.,40,0.002620902666097669,56,-0.06042906047992695,0.005891800114504553,0.9355316697265198
since the assault on the town began at a.m. gmt at least enemy soldiers were killed and taken prisoner mondo said adding the number was expected to rise.,35,0.0059295029934225505,67,-0.06127814274566625,0.00591175937991561,0.9496873165967317
the rebels took casualties too but the number was not known.,3,0.0025800582131597196,19,-0.02191978032383598,0.005349259746424814,0.8148667131296776
one rebel soldier was wounded in the stomach he said.,119,0.005280768805947999,24,-0.041153650814149595,0.004956147040226171,0.8453192285981501
he said the large kindu air base kilometers miles outside town was deserted and no one appeared to be in control.,118,0.006246234448814855,55,-0.2415741882800003,0.0056634485278349795,0.9344813789990931
our soldiers are in the town and the fighting is continuing rebel battalion commander arthur mulunda said in kalima kilometers miles northeast of kindu.,198,0.00624978008321118,95,-0.18855394210990312,0.0057523492662254596,0.9518790589682339
there was no independent confirmation of the rebel claims.,105,0.003797563586810523,33,-0.05816742959263669,0.005697604996312245,0.8615137494262898
on sunday a spokesman in goma boasted that kindu was already under rebel control.,180,0.007661356577657089,41,-0.18573179695606856,0.005903189426605858,0.829249358921578
in kinshasa government spokesman didier mumengi said monday the congolese army was firmly in control of kindu.,141,0.00574452487804544,77,-0.1344968307133649,0.005831569250475494,0.9385224303757937
mulunda s strong battalion walked kilometers miles bukavu at the southern end of lake kivu to kalima which fell to the rebels saturday with little resistance.,43,0.004599447679500699,98,-0.07841556080926006,0.006013479814443785,0.9566841062829753
the rebel fighters clad in brand new rwandan made dark green uniforms rubber rain boots and toting kalashnikov assault rifles and rocket propelled grenade launchers said they were advancing slowly through the lush forest of palm trees and razor sharp tall grass.,139,0.0037104546487814753,168,-0.038088805501639025,0.005155267453736526,0.9776624345091912
we ve been resting a lot.,2,0.0032473574411272608,9,-0.015252965206087474,0.004214217633322624,0.8296991577523124
it took us two weeks to get here mondo said.,5,0.006250927183545816,9,-0.06883608163475424,0.003869050308006167,0.7728931767179307
the rebels are now using kalima a town with one main street scattered houses and mud and brick huts to supply troops with rice cooking oil drinking water and ammunition.,42,0.003228500219398981,94,-0.083262813321725,0.005388380686021319,0.9640472702247613
a small grass airstrip kilometers miles away from kalima is just barely long enough for the rebels russian built antonov an transport aircraft.,36,0.0042890250059688375,88,-0.0836680469688196,0.0054798551152467284,0.6865964037655841
the rebels have targeted kindu since late august when they were forced to retreat from the outskirts of kinshasa after angola and zimbabwe sent troops to bail out kabila.,126,0.0064015902552508564,83,-0.1367306546702015,0.006085721969576994,0.9529126491808949
rebels still control a string of towns in eastern congo including kisangani the country s third largest city.,84,0.008472638769908551,66,-0.10521433879934128,0.006294549430632504,0.5259141224426988
the bloody bandages of injured rebels trucked back to this rear base wednesday offered evidence that the three day battle for the strategic air base at kindu was not going well for those fighting to oust congolese president laurent kabila.,201,0.006891972394473798,133,-0.0556325743369816,0.006447244772279281,0.9693985896103212
it was impossible to say who had the upper hand in the battle for kindu and its air base which government forces have been using to launch airstrikes on eastern towns and to assemble ground troops.,137,0.007870239084676873,97,-0.22868308811803578,0.006204482146090169,0.5288463753262821
rebel commander richard mondo said shelling and ground attacks which began monday continued on wednesday.,127,0.004528890413562448,71,-0.08887776023251134,0.006159288278825601,0.9388031463612084
mondo said he was expecting air shipments of munitions to bolster the rebel offensive.,127,0.003873570074617881,51,-0.0747134978900645,0.005659170682684306,0.9165285639925447
on wednesday a truck unloaded a dozen wounded rebel fighters at kalima a small town kilometers miles northeast of kindu serving as a rear base for the attack.,216,0.007326007820211725,103,-0.18963582452664163,0.0058803123284570545,0.9629623498443877
sweaty and weary some limping and others bandaged they waited to be airlifted to a hospital in goma the rebel stronghold kilometers miles east on the rwandan border.,151,0.004578043848758758,96,-0.07885567311042793,0.00544200616203876,0.9486133442061676
the rebels a coalition of ethnic tutsis disenchanted soldiers in kabila s army and opposition politicians faced stiff resistance.,88,0.007604954436125965,92,0.2625904138751413,0.005964027326487726,0.9481146830306343
in kinshasa the ministry of defense said tuesday that the congolese armed forces known as the fac had killed rebels in warding off the attacks.,46,0.007083554807916646,71,-0.08631621330590605,0.006196674790244139,0.9422622721674667
kindu is effectively in the hands of the fac which has now launched an offensive after defending its positions said a ministry statement broadcast on state run television.,64,0.005019256313455559,96,-0.06662283036740207,0.0059759333466223455,0.9531960925420945
the civilians there are cooperating fully with the fac as their counterparts did previously in kinshasa the capital.,27,0.003030131419705408,61,-0.06329070070889437,0.005809205138189291,0.9212956362587502
rebel leaders hope the capture of kindu will boost morale and demonstrate can carry their two month rebellion into the rest of congo africa s third largest nation.,239,0.012477560665446063,94,-0.02330173819930845,0.006415821654109675,0.9569657074556569
the rebel victory would also open routes to katanga and eastern kasai provinces rich in copper and diamonds.,132,0.002714636545518404,66,-0.022979831290293802,0.005355405081834291,0.9425631709434119
the rebels targeted kindu since late august when they were forced to retreat their march from extreme western congo to the outskirts of kinshasa after angola and zimbabwe sent troops to bail out kabila.,169,0.008630648191303625,107,-0.11192805904991847,0.006243096855768291,0.9630398470977639
rebel commanders say their fighters face an estimated government troops apparently reinforced by sudanese soldiers.,141,0.0068785115408062005,82,-0.13824287172552382,0.006132324933780682,0.9383662399090984
sudan denies involvement in congo.,44,0.002966590042709492,25,0.0022672608160005103,0.005302212032942204,0.8467076817559578
the rebels accuse kabila of betraying the eight month rebellion that brought him to power in may through mismanagement and creating divisions among congo s tribes.,129,0.010096302776875477,87,0.3782916454371457,0.0061230930041743575,0.9503517543718164
rebels in eastern congo on saturday said they shot down a passenger jet ferrying government soldiers into a strategic airport facing a rebel assault.,212,0.007800009194954946,96,-0.1284300936289858,0.0063335973781752436,0.9494385576876061
a congo airlines executive said the victims were civilians being evacuated from kindu about kilometers miles east of the capital kinshasa.,115,0.005461079966624098,82,-0.1315625689704654,0.00589440572091953,0.9351410543736867
neither claim could be confirmed independently.,11,0.004475909683977617,25,-0.15871948655614823,0.004386863116970492,0.8323315482481468
stavros papaioannou the president of the airline s management committee said a missile hit the rear engine of the boeing jet after the aircraft took off from kindu airport.,91,0.0035148119939184762,102,-0.08064341483256014,0.0048372822660331626,0.9574644354497469
a rebel military commander who requested anonymity said the plane was carrying troops although he did not explain how he knew this.,122,0.005333161140219453,64,-0.09604121332458784,0.0059130361159482146,0.9334075241125394
he said the plane was shot down while approaching kindu air base where the rebels had deployed at least two surface to air missiles and more than troops in preparation for a final assault on the government held town.,141,0.0076513695755566925,104,-0.264627540639104,0.006054359735547103,0.9633867251102646
alexis tambwe mwamba one of rebel leaders said from the rebel stronghold at goma kilometers miles northeast of kalima that fighters had intercepted government radio messages in kindu and knew in advance of the arrival of the aircraft.,327,0.006577662455504839,145,-0.180989943035875,0.006023321220969944,0.9689752412989875
he said the government had been using the boeing to fly in troops and ammunition in kindu for several days.,81,0.008258435704947607,42,-0.22834515616484835,0.005769328470898316,0.9131528116852049
papaioannou citing th graf pvs a day after shooting down a jetliner congolese rebels and their rwandan allies pushed sunday through government defense lines showing the confidence of a victor in a week old battle for a strategic air base.,133,0.00523498210840318,140,-0.1610169959820658,0.00638325866598226,0.9700212368680645
fighting in kindu kilometers miles northeast of the elila river bridge died down after the rebels fired a barrage of artillery into the government held quarters and the air base four kilometers two miles away.,134,0.008361268223045943,117,-0.23612728192450988,0.0057810878258318975,0.9652827985750365
rebel commander fino kabangu kalunga said the government forces surrounded by rebel troops from three directions failed to respond to sunday s attacks.,261,0.007195621868952928,97,-0.17672956052539027,0.006182777247255253,0.9525254848412398
some troops reportedly retreated through a single road corridor leading out of the town.,26,0.0034244029493959113,48,-0.11147371027983122,0.005757051992963419,0.9168773510433029
on saturday the rebels said they shot down a congolese boeing which was attempting to land at kindu air base with troops and ammunition.,105,0.007512844458966832,71,-0.2347497260260313,0.006153558160504313,0.9470946361165169
