Sent,Tm,Lex,Luhn,Lsa,Tr,LDA
the convention packed town hall and the new group aims to make the service employees a power to be reckoned with by bringing together a dozen union locals to forge a common political and legislative strategy.,140,0.001670113952609362,119,-0.011916622637728656,0.002616730133561676,0.966425823035165
earlier this year merged with the service employees and as part of that agreement rivera became head of the service employees in new york state.,141,0.0020844388014763684,77,0.037488652028863395,0.0024881909514731584,0.9425908043304673
it was not a voice mail message that dr. marilyn rymer a neurologist in kansas city mo. would routinely delete even as a registered democrat.,42,0.002110992101635484,84,0.00020366100610776585,0.0022346027422616467,0.9521205046963708
speaker newt gingrich s office it said was calling to discuss a national leadership award.,82,0.0026794511924872473,62,0.09914719634504028,0.002525616490880354,0.9291078476147995
dr. rymer has won acclaim as the director of a prominent stroke treatment center but this proposition seemed particularly grand.,20,0.001482372241777102,71,0.009062926232496438,0.0023131821111165296,0.9398009891105878
when she returned the call she said she was told she would also be named honorary chairman of an elite committee to advise gingrich on legislation.,81,0.002617165415556226,73,0.06328258210981812,0.002573378817133349,0.6737112436283832
too good to be true well dr. rymer would have to pay her own way if the committee should actually meet and as an honorary committee chairman she discovered she would be a member of a committee composed entirely of honorary chairmen.,98,0.0033473099448152483,102,0.07446215782130906,0.0023484553174109527,0.9588356363325545
and oh the speaker wanted a donation of to to help our efforts according to a transcript of a similar chat with another doctor to elect a bigger republican majority in the house of representatives.,143,0.003563799219618767,97,0.022692935911923916,0.002670593377159964,0.8250722892801706
with the approach of the midterm elections next month it turns out that the national republican congressional committee which supports candidates for the house has been sponsoring similar calls to tens of thousands of small business owners including doctors.,154,0.0030933247397557134,153,0.07998080957435191,0.0027320067930176935,0.963931051342059
with this and other fund raising programs the committee says it has amassed million for the elections.,51,0.0028895314477501207,46,0.1383558263968439,0.0024310333695264134,0.9031333071679111
but campaign finance watchdogs say the solicitations mark a new departure in political fund raising one they call akin to the practices of marketing companies like the publishers clearing house that hook consumers with visions of million dollar windfalls to induce them to subscribe to magazines.,191,0.0025970387695333783,179,0.07005893542306377,0.002562553598130253,0.9730016860052455
by citing the speaker and promising celebrity and influence they say the calls are a bait and switch scheme to seize the attention of people who might otherwise hang up.,52,0.001860368556075637,80,0.053299752618883596,0.0025209261812702013,0.8314029534372374
dr. rymer says she was incensed.,5,0.0014476062860487894,14,0.004929982995640994,0.0005212758884099366,0.824505083780585
so was dr. stanley turecki a child and family psychiatrist in new york who votes as an independent and was also called.,45,0.0031482269996788875,62,0.008567067772221004,0.002472359107083974,0.9292513642494055
i was absolutely outraged he said.,2,0.0024154589371980675,18,4.0290636036975856e-05,0.0016590893941423454,0.7759591596664519
anybody else who would do that would fall into the category of consumer fraud.,6,0.0012173280174390176,25,0.002624767613795216,0.002157308199103772,0.8627654133792216
kenneth gross a washington lawyer who specializes in election law and represents both democratic and republican clients said i have never heard of that particular device.,136,0.0025660199883475255,94,0.04899003356780403,0.002629512989376815,0.9471864202251621
but it doesn t appear illegal he said adding it s a fund raising gimmick to get attention.,33,0.0026979184952159252,40,0.07674117592114883,0.002249669815917594,0.9002000124772372
fred wertheimer president of democracy a nonprofit nonpartisan advocate of campaign finance reform said this is a new version of caveat emptor buyer be damned instead of buyer beware.,120,0.0012388357066686097,120,0.011365243862237914,0.002272450544277437,0.9612258342958253
when businesses do it he added congress orders investigations.,13,0.0029329719107974526,37,0.01696211994754611,0.002502883847600801,0.872415040494796
but this isn t going to be investigated because it s members of congress who are doing it.,17,0.002208139445215847,28,0.026851438718405878,0.0022303120827297488,0.8647075376394561
todd harris a spokesman for the national republican congressional committee said that he had not heard of any complaints and that there was no intent to deceive.,108,0.0020187901423531483,85,0.05900648292769442,0.002515526440388408,0.941353537673859
the national leadership award is a part of what we call donor and member fulfillment harris said.,94,0.0032077274044291443,59,0.07125644905274477,0.002501513103177096,0.9094214915992448
it s part of bringing them into the process.,8,0.001604386670445403,16,0.004584418909140816,0.0024304787781269043,0.7743682698317241
it s important that they be recognized for the support they give the party.,60,0.0013568396909008555,34,-0.016650910982053728,0.002555648577272005,0.5709767263081945
there s no quid pro quo that people solicited could receive awards for past contributions he added.,39,0.0015976212955546524,54,0.0037068660547766087,0.0023386502272162582,0.9364391217498773
what most peeves drs.,1,0.0024154589371980675,8,-1.345303454540976e-05,-0.0002856901306981956,0.7759591595545248
rymer and turecki is the message left with secretaries and answering machines invoking gingrich s office and proposing the award.,45,0.003004574051336487,78,0.03123498241141496,0.0025517990110328313,0.9474672688103066
they say they envisioned a senior aide at a telephone in the speaker s chambers under the capitol dome.,28,0.0012026523172760154,53,0.0055091809137728055,0.0021925962146714956,0.9120382719904497
the calls however are not placed by aides to gingrich by any of his offices or by anyone in washington.,20,0.004547634167593369,32,0.06430551283884159,0.002431689780853505,0.5853623588911795
they are made by people with headsets and computers at the home of infocision management corp. a telemarketing firm and congressional committee client in akron ohio.,88,0.0016561899249668234,107,0.06606947166911588,0.0024201625798330106,0.7022054974861389
on its web page infocision says its employees operate telephone lines and phone centers.,15,0.001937296308198813,56,-0.002994099233569109,0.002169113674267807,0.4994670347913188
every word in the script is approved by our clients the company says on its web site.,12,0.0019574269571118537,37,0.006400958222210628,0.002205540505852568,0.9134273637086949
every conceivable objection is scripted with a powerful rebuttal.,5,0.0013003236519598979,42,-5.978204757104959e-05,0.0017312457073433564,0.8866126550797216
besides telemarketing for businesses said jamie blair a supervisor at the center we specialize in helping the republican party and conservative political groups.,133,0.001845866369520169,102,-0.013701919763327373,0.002589752301021111,0.9467386850616851
however far they are from gingrich the telemarketers are instructed to answer return calls with republican congressional committee newt gingrich s office.,128,0.0027871678459093488,94,0.0879677254616441,0.002448687406724429,0.9398330138156024
may i help you a doctor in kansas city mo.,23,0.0019537550529829533,18,0.011591689118675157,0.001919628090534374,0.8505497043278586
who is a registered republican and who declined to be named dialed the gingrich number left on answering machines and secretly recorded the ensuing discussion which is legal in missouri.,76,0.0012133851789842913,107,0.03549378523401234,0.0026355175572314775,0.9567965710904373
we were asked to contact you on behalf of the speaker says a woman who picked up the call and identified herself as nancy.,56,0.002755418981848785,49,0.028416864577081157,0.002437481375471895,0.9184088858336803
he is right now aggressively pushing legislation to cut taxes by as much as half and he s also interested in legislation to cut capital gains to a single rate of percent.,97,0.0023644739617807013,91,0.031068149394921626,0.0024470345249468376,0.9529318427138559
to assure passage of the legislation the speaker wants to increase his republican majority she says adding to help us do that the speaker is pulling together a group of individuals such as yourself and is inviting you to be an honorary chairman on his advisory council.,186,0.002769099497344867,123,0.04259242517305041,0.00257794931346811,0.9529570048502702
nancy continues there will be correspondence with the speaker such as conference calls.,23,0.0026730916969136755,48,0.03846544001909084,0.0024517168644148726,0.880616579778041
it s a great way that he can get your input and thoughts on legislation that does concern you.,24,0.001309305524746371,35,-0.007328431879615672,0.002461123522024749,0.8776951989230631
or maybe surveys or questionnaires.,0,0.0024154589371980675,19,1.565096977167201e-05,0.001346348885036105,0.7760748433608775
later nancy says as a member of his committee you would be receiving from the speaker our national leadership award which is really quite an honor.,90,0.0041728217680657995,62,0.1007441357835495,0.0023901577046496546,0.9266104729275502
and to be honest he will be asking each of our chairmen if they could help our efforts to increase our majority with a one time contribution of or .,47,0.002563714795720054,52,0.06361822159639743,0.0025785759243550418,0.5059216699533093
now that would be used on the nationwide media campaign that newt has undertaken to target those seats we really need.,68,0.0011019305729264195,48,0.04013552836480974,0.002482617998634713,0.9089563104087381
and as someone who i m sure would also benefit from this could i tell the speaker he could count on your help the doctor demurs.,30,0.0019217663139010294,30,0.025213187353951977,0.0021901740219933347,0.8830577278743709
i am a registered you know republican in kansas she tells nancy.,67,0.0026285063017120456,33,0.03796269588511612,0.002345620887272816,0.8708223861171083
probably if i were to do something it would be to go through my own representative.,2,0.0013209497013078279,14,0.0013456696180613938,0.0017272335344805663,0.66528815318456
then the doctor tries to ascertain where nancy is located.,15,0.001867715367005501,26,0.016960409042739235,0.0016044937676345631,0.8571278262636666
is this congressman gingrich s office that i m talking to the doctor asks.,35,0.0034730409447532124,38,0.06312191527186302,0.0024504703628291653,0.7400502948483018
the speaker s office says nancy.,38,0.003002592075573591,18,0.07807811541574554,0.0021304127340810793,0.7879053355120358
this is the speaker s office.,31,0.002556450850960457,13,0.08264611282455192,0.002166694212405956,0.7518387450542343
that i m talking to says the doctor double checking.,9,0.0013078936529745742,21,0.014583101672322364,0.0022399206330618896,0.86432569440398
uh huh nancy replies.,9,0.001062792256578762,15,0.010562162317738292,0.0010697262084222552,0.8612587946263546
the law prohibits political fund raising calls from federal offices.,55,0.0038428762634976224,46,0.10792228930411399,0.002572943868401433,0.9013101000614379
vice president al gore is under a justice department investigation for fund raising calls he allegedly made from his office in the presidential campaign.,154,0.0026712424440440783,101,0.08650201981079922,0.002628273007528429,0.9497466683664008
but the calls can be made from just about anywhere else including campaign offices.,59,0.005249094210992227,29,0.0657251191166374,0.0026657147799887667,0.854769753174978
harris said the calls are in no way related to the speaker s official office.,70,0.0029268393015679534,38,0.028839097763421508,0.002527697080800991,0.8825956704897533
he added what is more important is not where the calls get routed.,8,0.003551300430240275,21,0.026065644863995385,0.0023176294491705175,0.7834384679087516
people are more interested in an award with the speaker s good name on it than whether the call gets routed to washington or ohio.,109,0.004059794074793423,55,0.07829143850408922,0.0026037298899299686,0.9222611058271556
turecki disagrees.,3,0.001109370883320513,15,0.0017011318256552313,0.0013612122108958428,0.7766049546234752
i see it as basic sleaze he said.,2,0.0024154589371980675,11,-3.167816579133585e-05,0.0015507547621390002,0.7763804671945876
the last time george voinovich ran for office he won re election as ohio s governor with percent of the vote stunning even his most optimistic supporters and setting a th century record for victory margins in ohio politics.,201,0.0026167666512903597,125,0.25299203925770986,0.00260615445481318,0.9670115430413285
this year voinovich a republican who is barred from seeking a third term is running again this time for the senate seat held by john glenn a democrat who is retiring.,233,0.0038697935776716673,80,0.22460244079295796,0.00261208880917717,0.9541248550181668
and while there are few who expect voinovich to repeat his electoral benchmark of four years ago politicians of both parties generally acknowledge that he is well positioned to increase the republican majority in the senate.,183,0.002903806041019987,121,0.1674501770631023,0.0026626906122835625,0.9586092383803243
that has not prevented voinovich s democratic opponent mary boyle from undertaking a vigorous campaign.,172,0.0027326752813457253,68,0.3405348465658468,0.0024413009183386265,0.924719050072859
ms. boyle a former commissioner in cuyahoga county which encompasses cleveland is crisscrossing the nation s seventh most populous state in what she describes as a grass roots campaign that while operating on a comparative shoestring has nonetheless attracted to her side nationally known democrats president clinton foremost among them on the campaign trail.,352,0.0020906199798157543,218,0.19385879488900534,0.002612231495504149,0.9745845459904112
glenn the former astronaut who is preparing to return to space this month at the age of has not made an endorsement in the senate race.,134,0.0019611486272952646,65,0.0017055629788115224,0.002547445354239565,0.9406538026370516
like many candidates this year ms. boyle is campaigning hard on the issue of education seeking to portray voinovich as a lackluster steward who allowed the state s schools to decline.,183,0.0039359638856181255,106,0.4444755232253658,0.002694395217306748,0.9546876389841856
he promised to be the education governor said ms. boyle.,50,0.0030455756465830887,31,0.49116354541353535,0.0022586470766917982,0.8819893534583483
but after seven and a half years he has failed the students of this state.,46,0.002237356028588635,24,0.13033743969644462,0.002511040733403234,0.8819040222075254
her role in the campaign she said is to remind the people of the state of ohio that george voinovich made a promise and that he didn t deliver on it.,198,0.0034638863144183444,70,0.2259945455083059,0.0026163523179234278,0.945711414089372
specifically she discusses a decision last year by the ohio supreme court that cited wide disparities in the quality of the state s schools and ruled unconstitutional the formula for funding them.,117,0.00284185736278911,113,0.1793788679147129,0.0025588379335906393,0.9602331061292116
she has also attacked her republican opponent for supporting a proposal to raise the state s sales tax by one percent.,138,0.002441691586390665,63,0.14680304232882907,0.002626962351426776,0.9332142775261375
under that plan half the additional funds would have been used for school improvement with the remainder earmarked for reducing property taxes.,30,0.0015647867028390113,74,0.08231228260034204,0.0023065985106859215,0.9422291481281324
that statewide ballot initiative last may proved to be wildly unpopular with about percent of the voters opposing it.,25,0.0015835796153071944,63,0.048438759441711034,0.0023390366819741036,0.9255778655979277
while the topics of taxes and education are hot ones this political season in ohio it is not clear that ms. boyle s emphasis on them has helped her campaign.,156,0.0021589948524679695,75,0.3357776428240395,0.002572377431282605,0.9485573193219493
despite some narrowing in the opinion polls she is still trailing voinovich by percentage points in some polls and as much as points in others.,39,0.0017466687244965184,55,0.08938240473182027,0.0022520618741876572,0.93021735843849
there is also a sharp fund raising disparity.,29,0.0023832876119026067,23,0.11543337378139641,0.0021163623571905064,0.8573348572573513
ms. boyle who is running her first statewide race and has widespread union support has raised nearly million so far far less than the nearly million voinovich has taken in.,161,0.004100087094888736,73,0.379324157039571,0.0025020380683522326,0.9379600060005491
also voinovich a former lieutenant governor has been on statewide ballots five times over the last years and thus is the better known candidate.,75,0.0028957449810246335,59,0.3288432845754812,0.0023973398407100698,0.8428174402266967
the electoral dynamics of ohio are also aiding voinovich.,55,0.0015853775732149718,32,0.22118085188007308,0.0021700132517547058,0.8777720180396242
the northern half of the state with its history of industrial unionized cities has a tradition of voting largely for democratic candidates while the southern tier of the state is considered more conservative and typically leans republican.,214,0.0019297790985425354,146,0.09863768936987885,0.002582364827755753,0.9667899290681332
but voinovich and ms. boyle share the same home terrain depriving ms. boyle of the geographic advantage that often accompanies democratic candidates.,152,0.003046192830675541,93,0.4591635542858658,0.0024182243185525707,0.951431346732246
indeed as a boy voinovich once delivered newspapers to the boyle home in the working class collinwood section of cleveland.,95,0.0018133309598619115,72,0.2681301331116788,0.0023156786820417046,0.9409421273760942
and voinovich a former mayor of cleveland has developed a reputation as a moderate republican who works well with democrats.,148,0.002461288998203396,71,0.16110314223615066,0.0025130589336087037,0.9294226666576982
voinovich while campaigning vigorously himself is keeping a full schedule of official duties assuming the role of the experienced elected official.,113,0.0015420578118188408,88,0.04601786067592883,0.002634523129361813,0.9412676574105645
if i get into the senate i will probably know more about domestic policy than any member of the senate he said in an interview on wednesday in canton sandwiched between a ribbon cutting ceremony and a fund raising reception at a vacuum cleaner museum.,155,0.0015778615529402017,116,0.09501350080389298,0.0026066222095598893,0.963257232881977
as mayor i had my nose rubbed into the problems of urban america and was fairly successful in dealing with them.,21,0.001976913791604883,54,0.028693409435578614,0.0024040208721702308,0.9318285848801244
and as governor i have dealt with the problems of medicaid welfare and education.,27,0.001780267843470965,43,0.18770897998679165,0.0023745571585163053,0.9013570065895106
i m the only person in the united states who has been president of the national league of cities and chairman of the national governors association.,106,0.0020170255919937253,83,0.10683037491143263,0.002454242450536148,0.9429841253920844
to his opponent s charges on his record on education voinovich is dismissive.,70,0.0020831182287824523,48,0.27868427804275264,0.002377961049793162,0.8984522572333101
i m probably the only republican in the united states who has been endorsed by the ohio education association and national education association he said adding that ms. boyle was a member of the state legislature during the period cited in the supreme court ruling.,248,0.0029370484021890905,141,0.3575767877969451,0.0025649437465878363,0.9606071968061911
mary boyle was vice chairman of the ways and means committee and a member of the democratic leadership during those years voinovich said.,160,0.002629907601638524,76,0.34693553790994835,0.0025675466711492763,0.9444014741622883
they did nothing to fix the buildings they did nothing for technology and the urban school districts.,17,0.001476798648652033,40,0.03937138267581461,0.0021601197607039905,0.902333127021048
ms. boyle who has not yet begun to run campaign commercials on television said her status as the underdog had allowed me to be more focused more intense.,113,0.00202771597838556,76,0.27698429060639523,0.002555075800405961,0.946183134830047
pausing after a campaign fund raising breakfast with former democratic sen. bill bradley of new jersey here on wednesday ms. boyle said this has been a marathon and it s been pretty much uphill.,168,0.0028784521646065177,97,0.2572113095340112,0.0026018169961321705,0.9546027110348171
but now we re down to the last three miles.,0,0.0024154589371980675,4,0.0001466896456951283,0.001105682988338175,0.6656159284328483
it s a tough race.,32,0.0015580130592250177,9,0.021489071375481398,0.0021690852951435835,0.7640457616183944
the last time george voinovich ran for office he won re election as ohio s governor with percent of the vote stunning even his most optimistic supporters and setting a th century record for victory margins in ohio politics.,201,0.0026167666512903597,125,0.25299203925770986,0.00260615445481318,0.9670115430413285
this year voinovich a republican who is barred from seeking a third term is running again this time for the senate seat held by john glenn a democrat who is retiring.,233,0.0038697935776716686,80,0.22460244079295796,0.00261208880917717,0.9541248550181668
and while there are few who expect voinovich to repeat his electoral benchmark of four years ago politicians of both parties generally acknowledge that he is well positioned to increase the republican majority in the senate.,183,0.002903806041019987,121,0.1674501770631023,0.0026626906122835625,0.9586092383803243
that has not prevented voinovich s democratic opponent mary boyle from undertaking a vigorous campaign.,172,0.0027326752813457253,68,0.3405348465658468,0.002441300918338627,0.924719050072859
ms. boyle a former commissioner in cuyahoga county which encompasses cleveland is crisscrossing the nation s seventh most populous state in what she describes as a grass roots campaign that while operating on a comparative shoestring has nonetheless attracted to her side nationally known democrats president clinton foremost among them on the campaign trail.,352,0.0020906199798157543,218,0.19385879488900534,0.002612231495504149,0.9745845459904112
glenn the former astronaut who is preparing to return to space this month at the age of has not made an endorsement in the senate race.,134,0.0019611486272952646,65,0.0017055629788115224,0.002547445354239565,0.9406538026370516
like many candidates this year ms. boyle is campaigning hard on the issue of education seeking to portray voinovich as a lackluster steward who allowed the state s schools to decline.,183,0.0039359638856181255,106,0.4444755232253658,0.002694395217306748,0.9546876389841856
he promised to be the education governor said ms. boyle.,50,0.0030455756465830887,31,0.49116354541353535,0.0022586470766917982,0.8819893534583483
but after seven and a half years he has failed the students of this state.,46,0.002237356028588635,24,0.13033743969644462,0.002511040733403234,0.8819040222075254
her role in the campaign she said is to remind the people of the state of ohio that george voinovich made a promise and that he didn t deliver on it.,198,0.0034638863144183444,70,0.2259945455083059,0.0026163523179234278,0.945711414089372
specifically she discusses a decision last year by the ohio supreme court that cited wide disparities in the quality of the state s schools and ruled unconstitutional the formula for funding them.,117,0.00284185736278911,113,0.1793788679147129,0.0025588379335906393,0.9602331061292116
she has also attacked her republican opponent for supporting a proposal to raise the state s sales tax by one percent.,138,0.002441691586390665,63,0.14680304232882907,0.002626962351426776,0.9332142775261375
under that plan half the additional funds would have been used for school improvement with the remainder earmarked for reducing property taxes.,30,0.0015647867028390113,74,0.08231228260034204,0.0023065985106859215,0.9422291481281324
that statewide ballot initiative last may proved to be wildly unpopular with about percent of the voters opposing it.,25,0.0015835796153071944,63,0.048438759441711034,0.0023390366819741036,0.9255778655979277
while the topics of taxes and education are hot ones this political season in ohio it is not clear that ms. boyle s emphasis on them has helped her campaign.,156,0.0021589948524679695,75,0.3357776428240395,0.002572377431282605,0.9485573193219493
despite some narrowing in the opinion polls she is still trailing voinovich by percentage points in some polls and as much as points in others.,39,0.0017466687244965184,55,0.08938240473182027,0.0022520618741876572,0.93021735843849
there is also a sharp fund raising disparity.,29,0.0023832876119026076,23,0.11543337378139641,0.0021163623571905064,0.8573348572573513
ms. boyle who is running her first statewide race and has widespread union support has raised nearly million so far far less than the nearly million voinovich has taken in.,161,0.004100087094888736,73,0.379324157039571,0.0025020380683522326,0.9379600060005491
