Sent,Tm,Lex,Luhn,Lsa,Tr,LDA
at the time clinton argued that the monetary fund should provide contingent finance to help countries ward off global financial contagion rather than wait for disaster to strike.,116,0.0027743398984797466,105,-0.08347639063979923,0.004062019029294211,0.9570829617773764
direct u.s. aid to brazil would clearly send a symbolic message that after a year of trying to manage the financial crisis through the monetary fund the united states is now ready to put a limited amount of its own capital at risk to prevent further havoc not only for brazil but to stop chaos spreading to argentina mexico and other countries that are major u.s. trading partners.,327,0.0036960802213523744,190,-0.09046217175640904,0.004131594282736673,0.9751121866611494
that would be a change of strategy.,5,0.0016289106497024473,14,-0.0036755897199804216,0.0035245687002067854,0.7364805265768103
so far the united states has operated almost entirely through international financial institutions chiefly the imf,110,0.005170177224189276,62,-0.07859125059689016,0.0037662475321205567,0.9076656630433472
but it would also be a risky move for president clinton economically and politically.,44,0.002255772512145578,48,-0.03812442654139277,0.0035441162885199193,0.871650232972102
even though congress objected to the billion in u.s. funds committed to the bailout of mexico it turned out that only billion was ultimately needed and it has since been paid back with interest.,117,0.004085532769562773,84,-0.13675932788638837,0.004034451801382447,0.9429410442535642
but rubin noted on friday that it s a very different environment now.,13,0.0017680418262312342,26,-0.013004874803449619,0.0035469270763773438,0.8554531714406894
other administration officials say they believe that there would be few objections in congress to direct u.s. participation in a brazil bailout.,100,0.0048214325696162175,71,-0.07179643551515061,0.0038417854752637896,0.9175320283497623
i think there are a lot more people in congress who are now scared to death by what s been happening in the markets and what could happen in their own districts a white house official said last week and they won t say much as long as they don t have to vote on it.,71,0.002458853004919114,89,-0.030940071086724648,0.003876286966712998,0.9593349572843866
by acting soon to stabilize latin america the administration is hoping to capitalize on two weeks of relative calm after the late summer panic that engulfed russia and at its height led to an outflow of a billion dollars a day from brazil for fear that it would be the next country forced to devalue its currency.,224,0.003607738389924504,165,-0.09914187523994487,0.004067549199829407,0.973444738186485
whether this calm marks the beginning of a turnaround or just another pause in the wildfires that have erupted since thailand s currency crisis in july is a matter of considerable debate.,43,0.0015816389470923037,91,-0.03258595077701123,0.003787710740085497,0.9532223213499054
but many experts cite the confluence of several events that have reassured jittery investors around the world two successive interest rate cuts in the united states japan s long delayed move to prop up its banking system with billion in taxpayer funds and a steady strengthening of currencies in thailand indonesia and south korea the first signs that investors may be preparing to return.,174,0.004899578655386378,220,-0.10372907050070537,0.004108684404128625,0.9763207501459568
always circumspect when it comes to commenting publicly on markets rubin acknowledged that in the last several weeks there have been a number of significant positive developments.,18,0.0029734252192994835,88,-0.027430315476415175,0.003822804623777633,0.93136404499051
but the former trader burned during a year career by many false market rallies warned that serious issues remain and that it will take some time for the world to work its way out of what he has repeatedly called the most serious international financial disruption of the last years.,145,0.004455120173093502,114,-0.05514577116595526,0.004072576343557269,0.9630936614955122
in fact rubin s aides are clearly nervous about the possibility of another outbreak that could set off a new round of panic which has made it virtually impossible for many emerging market countries to borrow money on world markets.,90,0.003343735901728567,116,-0.04792759079742638,0.003996394128524785,0.9632034990509595
brazil and japan are the two obvious tinderboxes said jeffrey garten dean of the yale school of management who served as undersecretary of commerce for international affairs during clinton s first term.,118,0.0017502209119833743,122,-0.043569575570804514,0.0035981263299672377,0.9609371003447764
in brazil the issue is whether the package that is coming together will really be big enough to deal with an exploding debt problem.,114,0.003863777194557556,47,-0.08162479537848749,0.003952683337028912,0.9241033660446096
and in japan the question is whether there is real reform that goes along with the money.,40,0.005205877092878414,28,-0.04863332511247627,0.0039612759619553455,0.8754847102093387
but after spending months in negotiations with the japanese rubin clearly senses that the united states has little leverage in tokyo its problems are chiefly rooted in political gridlock not lack of resources.,74,0.0017353711860706386,111,-0.03370030408536101,0.003959862486257831,0.9605977558287705
in brazil though the united states has a better chance of buying time and influencing an economic reform program as long as it does not appear to be dictating terms publicly to cardoso and his team.,198,0.004708008140271869,95,-0.0822491704672272,0.004104228217153063,0.9527933882187717
but demonstrating economic support will probably require tapping the exchange stabilization fund created during the roosevelt administration to help stabilize the dollar.,78,0.0021035777515439878,105,-0.03133997604061283,0.0038922117485944304,0.9498748802507029
the money is under rubin s control with presidential approval and he reached into it to circumvent congressional objections to aiding mexico in .,47,0.004541869302151731,83,-0.01461056448473736,0.003851506050967861,0.9378592383889134
but the reaction was so strong for a time congress restricted tapping the fund for international bailouts that rubin has been extraordinarily cautious ever since.,78,0.004559498929437149,89,-0.06700224845940667,0.003897034478253095,0.9422663744222551
he committed billion in a second line of defense in emergency aid programs for indonesia and south korea last year but no money was ultimately dispersed to either country.,127,0.002991449752680328,96,-0.0769616206947499,0.004010499635285108,0.9532633329680428
u.s. officials said that south korea did not need the extra help and that the collapse of the suharto government in indonesia so changed the political scene there that it would be too risky to offer direct u.s. aid.,85,0.00342868913464568,96,-0.02470863972461472,0.00398210128678709,0.9549778854299622
in the bailout of russia whose economy collapsed after president boris yeltsin abandoned an agreement to reform the economy and dismissed the leading reformers the united states offered no direct help.,156,0.0031281572506865387,120,-0.09088526607087481,0.003946852496760646,0.9559450993156405
those events set off a panicked exit by investors from all emerging markets and greatly worsened brazil s troubles.,66,0.0020507915675836265,63,-0.0494698535364094,0.003859413541526552,0.7237964414488528
so far brazilian officials have successfully calmed the market by constantly talking about a forthcoming aid program from the imf convincing speculators that it would be dangerous to bet against the country.,113,0.0035085718652087526,116,-0.03066370120021162,0.004005898464027674,0.9509980974101359
but at the same time the brazilian officials have maintained the pose that they do not really need the cash and are certainly in no hurry to get it.,39,0.002326146211518645,42,-0.02142928611518661,0.0039426135962527765,0.9093248474733222
u.s. officials and top officials of the imf are clearly nervous worried that the longer the negotiations drag on the greater will be the risk of brazil being caught in another round of market turmoil.,124,0.0033146928306964233,93,-0.04893397618319864,0.004018302943250768,0.9468702563584502
the brazilians want everyone to think that it s all under control said an investment banker involved in the talks.,9,0.002678364586625713,43,-0.0033049667073687655,0.003812005014791906,0.648874123141505
but the fact is that there s still a real risk that sometime in the next months the government is going to be forced to devalue its currency which is pegged to the dollar but adjusts about .,61,0.002228337381007258,62,-0.02833486727117067,0.0038743119704432844,0.9330393490401268
percent a year in a carefully controlled fall.,56,0.004760844357012998,31,0.33312921681830476,0.003927869392359027,0.8821627818398697
to prevent a sudden devaluation the brazilian government has had to raise interest rates to more than percent choking off credit for most companies.,104,0.004092290684106536,85,0.19141173474274567,0.0039319399071109,0.934817552062274
meanwhile the country is slipping into recession.,31,0.002801143893798724,20,-0.02727584897636546,0.0035054066597304647,0.8177297998258872
the aid would buy time for the brazilians but it is contingent on cardoso s success in persuading the legislature to end huge deficits chiefly through unpopular cuts in social spending.,101,0.004657011468970361,109,-0.03838820946627965,0.004099011982140617,0.9572743942374997
the first deputy managing director for the international monetary fund stanley fischer spent friday in brazil to review the country s austerity plan which is expected to be announced after sunday s elections but before the international package to avoid the appearance that the global lender is dictating conditions to brazil.,308,0.004920307025242642,200,-0.13151618730024406,0.00410779987079396,0.97507036397105
brazil has to do a lot fischer said last week before leaving on his trip.,85,0.0023759495410186487,29,-0.044602804751537495,0.0037166038215059516,0.8869707740123101
in return i expect the international community will make a large contribution.,77,0.0025081512913529337,55,-0.07576686372288723,0.003923358197624038,0.9072574877879704
