Sent,Tm,Lex,Luhn,Lsa,Tr,LDA
on wednesday newspapers published a joint statement from brazil and the imf although a final agreement hasn t been reached yet.,113,0.0038352590211917135,71,-0.03935472814259134,0.00377693389801597,0.9425946570683515
despite cardoso s efforts many brazilians were less than impressed by the palace penny pinching.,48,0.003036807426727881,45,-0.0370327188888935,0.0032222162542011983,0.90693982140099
the leftist workers party said the government was making a big deal of insignificant savings while it failed to cut other dubious projects such as a dlrs million reals moat being built around congress to keep protesters from easily entering the building.,117,0.002923037812424003,139,-0.06137761794664645,0.004022115930227882,0.9677076885229962
the globo tv network also suggested there still was plenty of fat to cut citing government expenses for running shoes persian carpets and gold cufflinks intended as presents for visiting dignitaries.,61,0.0023129048790850658,113,-0.009781933475389294,0.0037916098708276483,0.967639490295236
cardoso is counting on help from friendly state governors to control spending.,78,0.004170360893799003,48,-0.01674680257275777,0.003751515825491223,0.914184121846499
but the governors some facing runoff elections on sunday are promising pay raises and public works projects that could sink the austerity plan.,61,0.005368278945047192,81,-0.05811950543623021,0.00396178592137062,0.9515181577528607
in brasilia joaquim roriz has promised civil service raises bonuses and new jobs that his opponent estimates would cost some dlrs billion .,90,0.004220577466198417,83,-0.11418911192393665,0.0038659026661311243,0.9531193655655869
billion reals .,39,0.004802468485988789,11,-0.1778140938371765,0.003533323444083855,0.7644950226706307
roriz hasn t explained where the money would come from.,24,0.00244111614338538,21,-0.02340392928650372,0.002382495358773036,0.8622305307057194
in powerful minas gerais state the government will almost certainly have to lay off workers the state payroll consumes percent of the budget.,106,0.0045811750700842984,74,0.21842079238826945,0.0037337375063626744,0.9457967584992961
to rein in the free spending habits of provincial politicians cardoso reportedly wants to hold local governments to bimonthly limits on spending.,86,0.0027232300349641805,99,-0.020895256279495004,0.003871683054536388,0.9543126782035013
federal money would automatically be cut off if spending gets out of hand.,58,0.003905132910530264,40,-0.026829506300520937,0.0038359187405709065,0.8788822218684152
president fernando henrique cardoso s efforts to repair the largest economy in latin america may depend on the outcome of this weekend s gubernatorial elections.,161,0.004384764990382971,109,-0.10765076735040727,0.0038697115843021016,0.9541315835611137
cardoso wants to impose tough measures that would slash government spending and impose new taxes to try to halt the slide in brazil s economy and restore investor confidence.,208,0.004404974122330228,106,-0.06089316488411258,0.003894707844175491,0.9580668893213957
but his plan expected to be unveiled next week must be approved by congress and state governors have enormous sway over local delegations.,68,0.0038902920542342742,77,-0.0405444526921313,0.0038889483476886905,0.9437211224551918
the influence governors have on their congressional blocs is overwhelming said university of sao paulo political scientist eduardo kugelmas.,32,0.002046551299601055,98,-0.013329756526556706,0.003330412540887225,0.9434038665843598
brazil has been caught up in the financial turmoil that began more than a year ago in southeast asia.,135,0.004769176586912534,52,-0.07332920890295613,0.003934220552502402,0.9278723204428903
as wary investors have fled its financial markets brazil s foreign reserves have fallen below dlrs billion from dlrs billion at the end of july.,237,0.005706872213539837,84,-0.20750500584841872,0.00394585007039261,0.9538659060769971
on sunday voters return to the polls for runoff elections in states and in the federal district of brasilia.,52,0.003083054643335091,63,-0.02474166803428025,0.0034346943278244103,0.9351478232572727
the outcome will likely determine how successful cardoso is in getting congress to approve his economic program which is aimed at trimming the budget deficit.,127,0.0035055051543715268,83,-0.030933684528860188,0.0039067992841617305,0.944037993534745
new income fuel and bank transaction taxes are expected to be proposed.,24,0.002520618514079962,43,-0.015363108646931104,0.0036516632224379265,0.9037787966410717
kugelmas said opponents of the president stand a good chance of winning in four large states sao paulo minas gerais rio de janeiro and rio grande do sul.,87,0.003162226169484911,97,-0.013431194329330601,0.003091028549307611,0.961175499985658
if they win the president will face a tough uphill battle he said.,38,0.0029875782112012144,33,-0.02440104648399483,0.0033999352117408594,0.8971301049643284
cardoso needs the governors support not only in influencing the congressional delegations but also in holding down their own spending.,64,0.005324428344029725,66,-0.03601362126259805,0.003730217807314436,0.9239111904866418
the problem is that none of the candidates in sunday s elections ... wants to be identified with unpopular austerity measures said kugelmas.,39,0.0024106130425298905,70,-0.028696887624655845,0.0036636948082795664,0.9272315973800244
so they promise to spend more money on schools hospitals and public work projects.,40,0.003760152054088741,48,-0.02923563740366462,0.003699959104510831,0.922138506823954
sao paulo brazil s industrial and financial powerhouse is perhaps the state most critical to the success of cardoso s austerity plans.,170,0.005305461349224737,83,-0.06999311376280783,0.0037831124358643324,0.9419493356122302
with more than million inhabitants nearly equal to the entire population of neighboring argentina it alone accounts for more than one third of brazil s economic output and of the congressional seats.,106,0.00162036391134424,102,-0.018368260203655735,0.0038464584253012795,0.9456367803418868
while incumbent governor mario covas a cardoso ally who is seeking re election has committed himself to the austerity plan covas opponent paulo maluf is a question mark.,111,0.0027432611319388625,104,-0.04174125689692913,0.003230832378767036,0.9587604782155783
if maluf wins he will use his victory as a launching pad to the presidency in kugelmas predicted.,8,0.0018666480282949842,49,-0.004235960891898496,0.0031899938803296645,0.923322723523538
and that means he will try to stay as far away as possible from any austerity measure.,27,0.0020475516198377895,24,-0.012788500308969619,0.0035708261598574585,0.8622209046407325
the commerce department on tuesday provided a concrete measure of the effects of the global economic downturn on the american economy reporting that the nation s trade deficit widened by .,173,0.005393779198636589,119,-0.048914550618194254,0.004027064229493426,0.9595473137280499
billion in august to .,45,0.0033832243711947245,13,-0.1789132027149061,0.0033116496280213618,0.7460242570563699
billion.,39,0.0042678579990403365,7,-0.26268243580776457,0.0029624542040032962,0.6278979412511462
that is the widest gap since the government recalculated the way it measures trade flows in .,43,0.0024320435170755114,44,-0.005822922056784615,0.003786301209698515,0.49343882908614306
it resulted from a decline in american exports and a sharp increase in what this country buys from abroad.,58,0.0035876564626285074,56,-0.01595071684042914,0.0039627417103165865,0.9297130136265374
so far this year the trade deficit is running roughly percent above last year s levels and is up to a projected billion for the year a gap that is expected to widen even further.,177,0.006293269027705325,74,0.11606217484988204,0.00395418248527978,0.9483192890868645
one senior administration official who deals with economic issues speaking on condition of anonymity said tuesday that internal projections suggest that the trade deficit in could reach billion a figure that he said will certainly cut into growth and could well become a major political problem.,209,0.004569645382161036,160,-0.09755200255501038,0.004098945063792885,0.8681018965870531
trade deficits carry with them both good and troubling signals about the economy.,50,0.0027549391819722013,43,-0.030938190103337697,0.0038959714568306165,0.9113340105869421
the current flood of imports is helping contain inflation to some of the lowest levels in decades.,5,0.0022103909504476212,45,0.009644830765504165,0.0038195145682688066,0.9098709514288735
and while sales of american aircraft computer chips and other goods are suffering the weakening of the dollar on world markets in recent weeks may provide an end of the year boost for american exporters.,119,0.003399696150964261,110,-0.05180944548351307,0.004013312051214198,0.963061716151528
but at this moment of global upheaval the biggest problem facing american companies is the inability of many nations and some large companies in asia and latin america simply to borrow money to make ordinary purchases.,139,0.004314348135601869,129,-0.06415448347790685,0.004022559819155413,0.9622201952492898
the result is such a freeze of economic activity that empty shipping containers are stacking up on american piers.,53,0.0015671836296244884,67,-0.013339412987604455,0.0035347470650530888,0.9313325672109388
and the effects are hurting everyone from midwest farmers who can no longer send wheat to an impoverished russia to east coast fishermen who are discovering that japan s appetite for salmon and lobster has been ruined by the banking crisis.,46,0.0017215426996001228,123,-0.025110411609196758,0.0037270924044274997,0.9666440956798461
among the most surprising elements of tuesday s report is that more than a third of august s deficit was with one country that so far has managed to ward off the worst effects of the global troubles china.,86,0.002575282931763358,87,-0.05030738429155136,0.004080825036800189,0.9503704140679462
despite continued growth of the chinese economy exports to china have slowed dramatically and imports of chinese made goods have exploded as the country desperately seeks to sell here goods that would ordinarily be sold elsewhere in asia.,80,0.0020705784253898744,131,-0.03155040589902991,0.003956355279941826,0.9673279923831344
that increased the monthly deficit with beijing to .,27,0.002369187939622868,29,0.0020108098069270977,0.003631518405579508,0.7036518800604694
billion levels previously only seen in trade with japan.,60,0.004660954325792055,32,-0.09724884532385687,0.003864296242939501,0.8745448274048366
the chinese besieged by floods deeply troubled state owned industries and an incipient banking crisis have signaled to the united states in recent weeks that they have little interest in any swift moves to open their markets further in return for entry into the world trade organization.,148,0.0036997253372481526,160,-0.058552928481142553,0.004101966777610595,0.7803779595575004
that amounts to a major setback for president clinton who for three years has been using the negotiations over china s entry to the world body as the centerpiece of his effort to open china both economically and politically.,93,0.002533330373741841,117,-0.039133597585133975,0.0040123038251176826,0.9578778683070512
ostensible progress in this area has been cited by the administration until recently as one of the successes of the administration s china policy but now officials say privately that the progress is evaporating.,43,0.001871443293574739,115,-0.020390583576850176,0.0038166291071346785,0.9524586989280249
the decline in exports will trim the growth of the american economy and it was one factor in the federal reserve s decision to lower interest rates two times in recent weeks.,95,0.004434320024695242,96,-0.04102384287419814,0.004003397295054693,0.9484909605026226
so administration officials were going out of their way tuesday to portray the numbers as another warning sign but not a crisis.,48,0.0037542126567795993,56,-0.04840589560762764,0.003933167486574358,0.9129140795245004
while the united states remains strong and sound the troubled condition of the global marketplace continue to strongly influence the u.s. trade balance commerce secretary williams daley said in a statement tuesday.,119,0.003729133094985829,146,-0.04456645308995347,0.004001885269428051,0.9623774355776273
after china the biggest deterioration in the american trade balance in august came in mexico where the peso has weakened markedly as economic contagion has spread through latin america.,136,0.0038531425715258552,106,-0.06688315261212072,0.0038524761665077634,0.9562884876038921
exports to mexico have remained unchanged.,8,0.0024506942533930624,27,0.0018625540171851483,0.003527047464822238,0.8592755104890123
but imports from mexico have increased markedly chiefly automobiles and automotive parts and telecommunications equipment as american manufacturers have taken advantage of the weakening currency.,50,0.0030781410000218193,129,-0.028543415967715254,0.003730389635505284,0.9518107759792661
in contrast america s trade surplus with brazil the latest focus of concern by the administration and the international monetary fund barely budged from the same period a year ago.,203,0.004522692508450031,112,-0.09921054918477686,0.004155079775950547,0.9576041480600082
normally that would be cited as a sign of continued demand for american products in latin america s largest economy but there is fear it might be imperiled.,107,0.005288567074329934,72,-0.06607598961378999,0.003956695293973357,0.9353125492183121
the news comes as the united states and the imf complete a bailout package of billion or more for brazil intended to help it stave off the kind of economic troubles that have swept through asia russia and several other nations.,234,0.004493074770818016,105,-0.13386083894989576,0.004080556339694227,0.9589710776974084
tuesday the imf and brazil reached agreement on the country s fiscal targets for this year and next a sign that the aid will likely be announced after elections in brazil this weekend.,226,0.006240740836682768,89,-0.07116542434746982,0.00408815062635762,0.9526526097398867
but for all these potential problems the rising trade deficit has barely caused a ripple on capitol hill.,46,0.0026935448195452294,60,-0.014134093496495075,0.0037963300575793437,0.9370800266638906
because the rising level of imports does not appear to be triggering any unemployment here the subject has barely come up in races for the house and senate around the country.,38,0.0026155111173093016,69,-0.006886196738751274,0.003932257168846146,0.9417160892029446
the only exception has been in regions where the steel industry is strong.,10,0.0018096555481065734,34,-0.007800672978058839,0.0036885098437906693,0.8758926360841304
the major steel companies have charged in recent weeks that asian nations are dumping products on the american market at prices well below their costs.,63,0.003456083368682734,78,-0.031240203794755596,0.004019452447158137,0.9485006246160937
the commerce department has begun an inquiry.,13,0.003235562131137662,30,-0.0005690362034030682,0.0033336310989433896,0.8455563711451161
the commerce department s numbers showed that the deficit rose .,37,0.00533285932910252,39,0.00017324807154801575,0.0038276959015919993,0.8749184588433322
percent to .,26,0.0032806371113050553,7,0.8628851554002601,0.00307116133732795,0.6639162592310637
billion in august up from a revised figure of . billion in july.,92,0.004055968668387789,36,-0.1766105829139456,0.0035370961451922913,0.8978543399740747
the department said that the resumption of production at general motors corp. after last summer s strike may have increased the size of the deficit s rise in august as gm brought in parts from abroad.,59,0.0030507101802858517,105,-0.015848787601814594,0.003984025085802605,0.9335312322169056
the deficit was the highest since the commerce department began a new method of tracking trade information in .,52,0.0033260494034739107,61,0.0011915143778745071,0.0038762691529682556,0.9276396110467585
exports the department said fell three tenths of percent to about .,32,0.004253473450671951,32,0.34288464169980093,0.0036676911080521122,0.8804753124053001
billion.,39,0.0042678579990403365,7,-0.26268243580776457,0.0029624542040032967,0.6278979412511462
imports rose .,0,0.0036902355260956584,10,-0.0027157729779263436,0.003258231232425947,0.7669849460733246
percent to .,26,0.0032806371113050553,7,0.8628851554002601,0.00307116133732795,0.6639162592310637
billion.,39,0.0042678579990403365,7,-0.26268243580776457,0.0029624542040032967,0.6278979412511462
brazilian officials ended four days of meetings with representatives of the international monetary fund on tuesday without living up to their public pledge to announce concrete measures to reduce government deficits.,134,0.005031951457730903,139,-0.08028190729868125,0.004130998098571974,0.9628765755782158
in washington pedro parente executive secretary of the brazilian finance ministry offered only details on brazil s plans for raising a primary account surplus over the next three years.,122,0.003617387439715924,115,-0.056628303216948714,0.004044179685090013,0.9553401126719345
with only five days to go before gubernatorial runoffs on sunday neither he nor president fernando henrique cardoso in brasilia said how the government planned to achieve the savings.,126,0.0038869131590170947,95,-0.07550078414969572,0.0035867687067824366,0.9473051161737778
important allies of cardoso are lagging behind in three key states and despite the government promises market analysts did not expect an announcement until after the elections.,134,0.004305678958783352,87,-0.04942087089776605,0.00401164541269905,0.9446117078082097
instead the strategy in brasilia and washington appeared to focus on reassuring the markets that work on cutting the deficit was going forward without providing fodder for opponents in domestic elections.,61,0.003559168702291205,109,-0.02616276014740893,0.0040677733382016405,0.9589368362292661
the discussions continue with the objective of reaching agreement soon on the detailed program said a joint statement by the imf and the brazilian finance ministry.,95,0.002846614242635288,97,-0.034072572465328715,0.003853439623936536,0.9503202233635235
because of brazil s enormous deficits the collapse of emerging markets has hit the nation particularly hard draining foreign currency reserves and pushing the economy toward recession.,142,0.004496394032650253,101,-0.0826573852029889,0.003968083343677858,0.9564549248652187
finance officials in washington and around the world fear that a collapse of brazil because of its size and links to other economies would worsen financial instability throughout the hemisphere.,145,0.004511451241802993,99,-0.08448729429578813,0.003972924225481857,0.9500477825714791
with million people brazil represents the world s ninth largest economy and is the financial engine of latin america.,197,0.0055312624648445104,77,-0.12386719856788865,0.003964162076739021,0.940650209788292
throughout the day government officials met with cardoso in brasilia and were expected to fine tune a three year austerity package that cardoso was to discuss with congressional party leaders on wednesday morning.,190,0.003947056498611541,128,-0.06779652154612144,0.003943214393591284,0.9629302619415909
in brasilia officials said that among the measures being considered were a tax increase on financial transactions to three tenths of a percent from two tenths of a percent and extending the fiscal stabilization fund which sets aside percent of all taxes collected for presidential discretionary spending.,174,0.005069058590181944,170,0.3700649337057483,0.003986853509377508,0.9700673045111724
the fund was to have expired by .,20,0.002103618406122438,10,-0.044192919218302276,0.003005197204187889,0.7696488250620807
speaking in washington parente said that brazil would aim toward a surplus of .,79,0.0026340506179791463,38,-0.03801898003875638,0.003855973014467223,0.893212287981676
percent in .,26,0.0032806371113050553,7,0.8628851554002601,0.00307116133732795,0.6639162592310637
percent in and percent in .,52,0.0032806371113050553,14,0.8628851554002601,0.003071161274789574,0.776045691150281
it had already been announced at the end of the imf s annual meeting in washington two weeks ago that brazil would have to reach a primary account surplus of .,126,0.0050832706703017845,76,-0.0648067612093817,0.004098588221553365,0.9457655025476823
percent to percent to qualify for imf aid.,85,0.004963584325256827,27,0.599296125524333,0.003631331094261059,0.8815683683843479
the primary account covers government expenses without interest payments on debt.,50,0.0035597370677911576,55,-0.007487156397001524,0.003841797979137909,0.9126837497136794
ernest brown senior economist for latin america at morgan stanley dean witter said signs that the brazilian government and the imf were moving closer to an aid package were reassuring and that he did not expect much more than reassurance until next week.,196,0.0031324336418084545,137,-0.05759275798420988,0.0038829768322291196,0.9653432834358626
i call this the we have a pope scenario brown said.,11,0.0027515836336452523,21,-0.005079159105514721,0.0032584372543291882,0.5482239006563054
you re just going to hear that we have a pope maybe see the white smoke rising he said and not figure out who the pope is until after the elections.,15,0.0022364734249642943,40,-0.014279054085585982,0.00340862763427296,0.9225762072544741
the united states is preparing to commit u.s. taxpayer funds as part of a lending program of at least billion to try to insulate brazil and with it the rest of latin america from the worst effects of the financial turmoil circling the globe according to u.s. and foreign officials assembling the program.,266,0.00527055627377813,158,-0.14594696561692896,0.004117970273895959,0.9695293565561919
details of the u.s. contribution which is expected to total several billion dollars in direct aid or loan guarantees have yet to be negotiated.,65,0.0026398912373999327,73,-0.07884346929029129,0.003839725623230953,0.9259608914655663
but several congressional leaders have been alerted to the likelihood that the administration would have to act while congress is in recess.,33,0.0023343718829999006,65,-0.023567313467385675,0.003456042523409903,0.9240114440602097
this early warning from the administration reflects memories of how congress erupted with objections and hearings in when president clinton committed billion in u.s. funds to the bailout of mexico.,115,0.0037475081593081705,116,-0.1100681654191388,0.003960473104001127,0.9522629011044988
but administration officials said last week that their early soundings indicate that members of congress are deeply concerned about preventing an economic collapse in latin america that would resound in the united states and thus they expect few objections.,182,0.005938571635776328,137,-0.07483342836217406,0.0040119235845203355,0.9631914007923964
the timing of an aid package for brazil originally expected within the next few days is complicated by unexpected delays that have cropped up in dealing with the brazilian government.,145,0.003568640839689115,92,-0.0670857399702967,0.0040977749802093635,0.9485049904508867
the government of president fernando henrique cardoso faces politically risky gubernatorial elections on sunday which may well determine whether brazil can execute an austerity program that is the key condition for the loans it is concurrently negotiating with the international monetary fund.,275,0.005516397284248801,189,-0.12337584073440247,0.003960563603840408,0.9707840503384803
the biggest role in the rescue program for brazil will be taken by the international monetary fund which said last week that it would contribute at least billion and appears to be under pressure from the united states to do even more.,233,0.006138710305227616,97,-0.18573260491867172,0.004137035490500188,0.6032360510161607
another billion or so will come from the world bank and the inter american development bank and the remainder from the united states and other major industrial nations.,166,0.005463534770739204,86,-0.12151101687661506,0.003972209492366629,0.9475135758665091
germany and japan though have been reluctant to take part one u.s. official noted suggesting that latin america is chiefly washington s problem not their own.,100,0.004894820456320682,80,-0.0580369178795121,0.003920718972479598,0.9408495622838282
so far u.s. officials working behind the scenes to organize the aid package have said nothing in public about the details of plans for a direct contribution to brazil.,112,0.00422690814388082,75,-0.07064806743267737,0.003962395171766212,0.9370551811213205
brazil is very important to the economic well being of the region the united states and the international community and all of us are very much focused on seeing how we can be helpful treasury secretary robert rubin said on friday.,173,0.0048179433270513095,109,-0.07308909055825484,0.003930360951116025,0.9548088136796089
but in a wide ranging interview about the global economic turmoil rubin declined to say what strategy he would pursue in dealing with brazil s problems and insisted that no decisions had been made about how the united states might contribute.,161,0.004982728844979588,122,-0.07168045044772967,0.004091390407156292,0.9627909388584405
but he discussed brazil as an opportunity to engage in the kind of preventive financial diplomacy that president clinton advocated in speeches to the imf and the world bank here three weeks ago.,189,0.003932107480616266,111,-0.07742171074498216,0.004013698202788651,0.9602337552914234
