Sent,Tm,Lex,Luhn,Lsa,Tr,LDA
"The United Nations, which is brokering talks 
between Lisbon and Jakarta over the territory's political future, 
still regards Portugal as the administering power in East Timor.",30.360000000000003,0.007635226571923165,98,0.21576917215903893,0.005743337782242368,0.7632455807297781
"The 
half-island territory lies some 2,000 kilometers (1,200 miles) southeast 
of Jakarta. 
 
",23.0,0.006091058404002286,60,0.11020721018088511,0.005117900553572611,0.7507785058939295
"Representatives of exiled East Timorese pro-independence groups said 
Friday that Indonesian troops attacked unarmed civilians in a village 
in the disputed Southeast Asian territory, killing one East Timorese 
and wounding 22 others.",27.6,0.010048529761322884,154,-0.03307276242348246,0.005940979351767947,0.7760405696956192
"The report could not be independently confirmed, 
and Indonesian officials were not immediately available for comment. 
",19.32,0.00438261163661607,62,0.018166175703681574,0.005100081547814415,0.7270943189826727
"The attack took place Tuesday near Cailaco in East Timor, a former 
Portuguese colony, according to a statement issued by the pro-independence 
Christian Democratic Union of East Timor.",36.800000000000004,0.009845930761701108,113,-0.14125003661601832,0.005974538204972297,0.7686156958043777
"Placido dos Santos, a 28-year-old 
farmer, was tortured and killed by the Indonesian military during 
the attack, the statement, which cited resistance sources in East 
Timor's capital, Dili.",61.64,0.007488197363968599,116,-0.08276718230234247,0.0058844925430335294,0.7694998815546512
"The statement, released in the Portuguese capital 
of Lisbon, also said that 22 people were injured and 26 were missing. 
",46.0,0.005454756008240576,59,-0.029352768890514868,0.0055457957992065725,0.7486324013258403
"The names, ages and occupations of the villagers were listed.",0.0,0.004304534578007927,29,-0.006933627599898388,0.004863207254225521,0.6931920342269233
"Roque 
Rodrigues, a Lisbon spokesman for the National Council of Timorese 
Resistance, another pro-independence group, said he had corroborated 
the report with six sources inside East Timor and said he had ``no 
reasons to doubt the truth'' of the statement.",50.6,0.006243716039294294,145,-0.05705317284822625,0.005916926279075563,0.7743713144300741
"The United Nations, 
which is brokering talks between Lisbon and Jakarta over the territory's 
political future, still regards Portugal as the administering power 
in East Timor.",30.360000000000003,0.007635226571923165,98,0.21576917215903893,0.005743337782242368,0.7632455807297781
"The half-island territory lies some 2,000 kilometers 
(1,200 miles) southeast of Jakarta. 
 
",23.0,0.006091058404002286,60,0.11020721018088511,0.005117900553572611,0.7507785058939295
"In a decision welcomed as a landmark by Portugal, European Union leaders 
Saturday backed calls for a referendum to decide the fate of East 
Timor, the former Portuguese colony occupied by Indonesia since 1975. 
",22.080000000000002,0.005955048705123704,130,-0.06487057237015888,0.00588087412526553,0.40808363351230104
"``A definitive solution to the East Timor question will not be possible 
without free consultation to establish the real will of the East Timorese 
people,'' the 15 EU leaders said in statement after their year-end 
summit.",38.64,0.009035146142649558,115,-0.045311157694980606,0.005969975251479231,0.7718479611416192
"Portuguese Foreign Minister Jaime Gama said the statement 
marked the first time the EU had backed Lisbon's call for the East 
Timorese to vote on whether to opt for independence or remain under 
Indonesian rule.",50.6,0.008131158844227543,118,-0.013717679235456314,0.005839089500484184,0.7692425717749147
"Indonesia has resisted such calls for a referendum 
and maintains thousands of troops to keep order in the half-island 
territory.",17.48,0.004194462125003322,75,0.025003457330789135,0.005833585662023611,0.4395861842883381
"The EU statement also urged Indonesia to bring about a 
``real and substantial reduction'' in troop levels and called for 
the establishment of a permanent U.N. presence in East Timor.",36.800000000000004,0.004492999690319998,106,-0.029733899182656554,0.005748421392965126,0.7658415436508793
"The 
leaders repeated a demand that Indonesia release jailed Timorese rebel 
leader Xanana Gusmao, and all political prisoners.",26.68,0.004554269802520654,86,-0.003601854357641689,0.00520972673754007,0.7587059489807415
"Indonesia invaded 
East Timor in 1975 as Portugal prepared to grant independence, and 
annexed it the following year.",39.56,0.006757169607774074,72,-0.12390181260290623,0.005443026287457627,0.754629918113864
"The United Nations does not recognize 
Indonesian rule. 
 
",11.040000000000001,0.005291563540084662,36,0.2690871825699894,0.005579861158270453,0.7088351153322882
"JAKARTA, Indonesia (AP) -",40.480000000000004,0.007592388861384121,18,0.02684263537264285,0.004345040065767828,0.6562247578436389
"As a U.N. envoy trotted toward an Indonesian 
army helicopter, East Timorese protesters spilled onto the runway 
tarmac and shouted their anger at nervous soldiers.",8.280000000000001,0.004391249445725618,95,0.0036927418238867386,0.005191710580372253,0.6142175375127752
"Sent to make peace 
in Indonesian-controlled East Timor, Jamsheed Marker's recent hasty 
departure from the troubled territory signaled how easily tensions 
there can boil over.",29.44,0.005233119239831767,110,0.021180946683430856,0.005787581208545501,0.7687798581732036
"Yet Marker, who is visiting Indonesia to promote 
a U.N.-designed blueprint for autonomy in the former Portuguese colony, 
said Monday that both sides in the bitter conflict were displaying 
a newfound taste for compromise.",17.48,0.003379630595624793,122,-0.029903908179714098,0.005595537110863433,0.7659222531212757
"In an interview with The Associated 
Press, Marker admitted that a peaceful solution remains distant.",10.120000000000001,0.005248013764097252,54,0.0019690376232060726,0.005408498381587217,0.7363105999367472
"But 
in a big step forward, he said, many separatist activists were no 
longer pressing for an immediate vote on independence.",23.92,0.003545916215683041,57,-0.014586785575740084,0.005667074311576999,0.7448586419770238
"``They don't 
want independence tomorrow,'' said Marker, who was interviewed in 
a Jakarta hotel suite after his trip to East Timor.",25.76,0.007346136361282638,65,-0.0027950651372024827,0.005475672948878694,0.7462549393597449
"In other progress, 
Indonesia and Portugal will send diplomats to open ``interest'' sections 
in each other's capitals next month.",7.36,0.0034135475931576405,68,-0.013447097457833913,0.005824173783507029,0.6185856636009164
"Formal diplomatic relations, 
however, will not be resumed.",0.92,0.003373744126468275,30,0.0011789337243964138,0.004595324010340744,0.689536000586807
"Also in January, the two countries are 
scheduled to embark on a new round of U.N.-sponsored peace talks in 
New York.",7.36,0.0055026375946329404,55,0.017420397284223888,0.005481299111325381,0.742589878164972
"Turmoil has plagued East Timor ever since Indonesian troops 
invaded in 1975, unleashing a separatist rebel war and the resentment 
of a population pummeled by human rights abuses.",27.6,0.00525316569239039,113,-0.04094428480333485,0.005527871140029065,0.3981980986590591
"Talks were revived 
earlier this year after the ouster of authoritarian President Suharto, 
but differences remain over a definition of autonomy that would suit 
all parties.",22.080000000000002,0.003072773263387921,97,-0.006644219068866213,0.005491933561998274,0.7623170706262165
"Separatists want it to be transitional, while Indonesia 
is offering East Timorese partial control of their affairs in exchange 
for international recognition of its sovereignty.",18.400000000000002,0.0027972234337008558,112,0.0028338024424016347,0.005653678896939352,0.7609285915614272
"Jakarta wants to 
handle foreign, defense and financial affairs.",10.120000000000001,0.002549905147265853,42,0.025385657046523485,0.005253146161737162,0.7220709076659309
"Fears are widespread 
that more unrest in East Timor could derail the negotiations.",2.7600000000000002,0.0023421038562991816,46,-0.011610464062252171,0.005177092802055364,0.7324463234681465
"On Monday, 
Marker voiced his concern in a meeting with East Timor's jailed rebel 
chief, Xanana Gusmao.",9.200000000000001,0.003672520781884975,63,-0.010964611367013925,0.005525722231443304,0.7567327425244516
"``I said there was a lot of tension in East 
Timor and that he and his people ought to do everything they can to 
reduce it,'' said Marker, a former Pakistani ambassador to the United 
Nations.",18.400000000000002,0.006964381345608107,69,0.10372140474709722,0.005815813307263367,0.7536692705467026
"Tempers flared but there was no violence during protests 
timed for Marker's weekend trip to Dili, the seaside capital of the 
half-island territory of 800,000 people.",43.24,0.005412048946387412,97,0.03423689010821905,0.005744524231929013,0.7662102316610142
"On Sunday, separatist protesters 
tore down a fence at the commercial airport and pushed past soldiers 
with automatic rifles as they tried in vain to speak to Marker as 
he left.",15.64,0.004491392942622707,100,-2.4648777930497155e-05,0.005430188340218744,0.7660455885100124
"During a visit last year, Indonesian soldiers killed two 
pro-independence demonstrators outside a hotel where Marker was staying. 
",17.48,0.008766154312046278,76,-0.04166665924509403,0.005800336670730954,0.5744453606757115
"Activists have alleged that Indonesia secretly ferried troops into 
East Timor in spite of pledges to reduce the number.",7.36,0.007586338222728142,73,-0.016603960542488264,0.0057383944307030825,0.7537137437424981
"Marker said Jakarta 
had advised him of troop rotations and that U.N. staff were monitoring 
the situation.",14.72,0.0032254519496149915,53,0.022094205348718202,0.004977725413686585,0.7362689601695168
"Marker was scheduled to talk with Indonesian President 
B.J. Habibie on Tuesday and will leave Indonesia on Wednesday to prepare 
for another batch of meetings in the New Year.",17.48,0.006194567662327834,97,-0.010986434463920232,0.005673604917958378,0.7280213605640657
"``If you ask me... 
`Do you have a solution?'",2.7600000000000002,0.00291385069007754,8,-0.0038657361688469063,0.0037997003166395406,0.5250925203161515
"then the answer is, `I don't,''' he said. 
",0.92,0.00567741935483871,6,-0.00023424530074758496,0.0038929387189560022,0.531245875753964
"``But I think there are ways of getting there and the first thing 
is to have peace and quiet.'' 
",6.44,0.0036587835316679957,18,0.0015989687970752776,0.005070035313129367,0.6869339020642654
