Sent,Tm,Lex,Luhn,Lsa,Tr,LDA
"To document Netscape's errors, Microsoft issued a subpoena last month 
and obtained the unpublished manuscript of a new book, ``Competing 
on Internet Time:",40.480000000000004,0.001687679297590941,98,-0.02653027281254577,0.0013929332167780376,0.762220473616581
"Lessons From Netscape and Its Battle With Microsoft,'' 
which is based on hundreds of interviews with current and former Netscape 
executives.",8.280000000000001,0.0018932258594452679,74,-0.03375576393935783,0.0014036279613472097,0.7428090176138623
"The book does chronicle the mistakes made by Netscape. 
",13.8,0.0011898032728191968,32,-0.02602822880604846,0.0013025812470525897,0.6397238849407877
"But its authors, Michael Cusumano of the Massachusetts Institute of 
Technology's Sloan School of Management and David Yoffie of the Harvard 
Business School, think Microsoft is hardly blameless.",4.6000000000000005,0.0007691290198198169,125,-0.01097946738117898,0.0011497584799280884,0.7673279173981534
"``Microsoft's 
take-no-prisoners strategy backfired, all but inviting retaliation 
from competitors, the government and even customers,'' Yoffie said. 
",75.44,0.0007730928651003473,92,-0.00035078231275720984,0.0014310920893042414,0.7432774201576264
"Emphasizing that he was offering no legal judgment, Yoffie added, 
``I think Microsoft could have achieved 90 percent of what it did 
without crossing the line as much as it did.''",46.0,0.00130316365151459,70,0.01193149159482528,0.0014369480314829909,0.7485103606936038
"THE SPYGLASS LINK: 
REWARDS AND PERILS OF A PARTNERSHIP On April 6, 1994, Gates and 20 
Microsoft executives gathered for a daylong retreat not far from the 
company's headquarters in Redmond, Wash.",98.44,0.0008322047838220086,118,-0.010678049663578696,0.0013979885784457262,0.7678599380856281
"The subject was the Internet 
and how it might revolutionize the computer software business.",140.76000000000002,0.0015124812510948725,52,-0.04697715953569127,0.0013137626974784504,0.4422509756012266
"Few 
concrete plans were made that day, but Microsoft executives insist 
that a direction was set.",24.84,0.0013688501083111962,55,-0.008275722954763108,0.0014641386705269714,0.7446716296097501
"``Our vision from the outset was to unite 
the two worlds of the Windows desktop and the Internet,'' said Steven 
Sinofsky, a Microsoft executive who attended the meeting.",69.92,0.001462801663577463,88,-0.03861083698714318,0.0013962312084745295,0.7605665854497659
"Yet Microsoft 
badly trailed Netscape in the browser field.",79.12,0.0009914736657917222,39,-0.04251207517629658,0.0012332534359288788,0.7008890173831366
"To hasten its entry, 
Microsoft licensed its early browsing software from Spyglass Inc. 
of Naperville, Ill.",62.56,0.0011887023897723737,64,-0.024450023758746525,0.0012057079160646782,0.7405082033274941
"The first meeting between the two companies was 
initiated by Spyglass in April 1994.",24.84,0.001162561310498588,39,-0.011893469948402645,0.0012892258049710201,0.5745664900294126
"At the time, it was a tiny company 
and eager to do a deal with Microsoft.",122.36,0.0012425593983399633,33,-0.015588222476331171,0.0014524482927547988,0.7189724909263978
"Spyglass was selected as the 
commercial licensee for browser technology developed by the National 
Center for Supercomputing at the University of Illinois.",103.04,0.000717670363966323,102,-0.01785027588002897,0.001236656548808325,0.7570704709361166
"In the summer 
of 1994, Douglas Colbeth, president of Spyglass, met with Clark of 
Netscape at O'Hare International Airport in Chicago.",23.0,0.0012299995649453935,90,-0.01392478205612134,0.001291790150514459,0.7576341087292793
"The two men talked 
in the United Airlines Red Carpet Room, reserved for business-class 
passengers, and Colbeth recalled Clark telling him, ``We're going 
to take Microsoft head-on.''",11.040000000000001,0.001040488724490995,102,-0.00792541243959696,0.0014232859833006777,0.7633217738952511
"At the time, Colbeth recalled thinking 
to himself, ``Great, now Microsoft will really want to license from 
me.''",49.68,0.0016491492256090383,43,-0.012026507408424425,0.0014531191092907309,0.4024590036592202
"Today, he noted: ``Remember, we were a company with a couple 
dozen people and almost no money in the bank.",105.80000000000001,0.0007344560024926862,50,-0.002622367658167379,0.001370362975983785,0.7414076861080091
"Netscape had Jim Clark, 
with his money and reputation, and big-time venture capital backing 
from Silicon Valley.",21.16,0.0016196806590437372,70,-0.0172504972300591,0.0013907328075484096,0.7469743625741632
Netscape had a very different agenda.'',1.84,0.001057365585669968,14,-0.03202217152951036,0.0010765062804073508,0.5883023904494858
"By July 
1994, Microsoft had become quite interested in the Spyglass technology, 
Colbeth says, and the two companies signed their first licensing agreement 
the following December.",45.080000000000005,0.0013206670862119065,89,-0.015477538972330025,0.001386517424791997,0.753366142048618
"Microsoft, Colbeth recalls, always told him 
that it would eventually fold browser technology into its operating 
system, but its timing was accelerated by Netscape's rapid rise.",201.48000000000002,0.0016487159833248732,105,-0.06006166379640579,0.0014164672308652957,0.4692242294440241
"``Microsoft 
was initially hoping to charge for the browser,'' Colbeth said.",92.0,0.001237371779404699,42,-0.021719035946048508,0.0014030966681047206,0.7116963079798952
"But 
on Dec. 7, 1995, Gates declared that Microsoft would not only deeply 
integrate its browser into Windows but would give it away.",117.76,0.001482764696590064,60,-0.03984861885387813,0.0013956783443152398,0.42000836770321187
"The announcement 
caught the industry, even Colbeth, by surprise.",28.52,0.0006215796519565165,40,-0.009851447850914784,0.001297437566824442,0.6764784349368855
"At the time, Spyglass 
had licensed its technology to 82 other companies, including IBM and 
Digital Equipment, for use in their software products _",107.64,0.0014181189979479251,78,-0.013880971385898168,0.0013548902296594827,0.7537074282789271
"a licensing 
revenue stream of about $20 million a year.",60.720000000000006,0.0010375130082050826,33,0.0010898522549157767,0.0012484800704757636,0.7185901795084862
"As a result of Microsoft's 
move, Spyglass saw those revenues vanish within a year, as smaller 
Internet software companies went out of business and big customers 
shifted to Microsoft's free browser.",230.92000000000002,0.0022984174067886593,116,-0.036586315242251456,0.0014510950637107447,0.5908748006917827
"Spyglass slashed its payroll 
and scrambled into new niches of the software industry to replace 
its lost sales, which it succeeded in doing eventually.",80.96000000000001,0.0006574300897493088,81,-0.014161044329568469,0.0013475025028523893,0.7557401366226992
"``Whenever 
you license technology to Microsoft, you have to understand it can 
someday build it itself, drop it into the operating system and put 
you out of that business,'' Colbeth said.",191.36,0.002144399172294311,85,-0.04857479273720375,0.0014626836950503719,0.7445009213923983
THE NONOPTION COMPAQ:,0.0,0.0004953911902118675,15,-0.014859480230288635,0.0007070202966236723,0.6215039053220862
"SUDDENLY 
SEES THE LIGHT",0.0,0.0005494706897063611,16,-0.0010968414091293603,0.0011992757802039911,0.360572868845109
"Well into 1996, Netscape's share of the browser market 
continued to rise, while Microsoft made little headway, even though 
its browser was free.",210.68,0.002276069181872617,73,-0.06520746952729245,0.001397490645603041,0.599599926668488
"Industry analysts and trade magazines agreed 
that Netscape's browser was the clear technical leader.",104.88000000000001,0.001481559646509404,68,-0.01721878745686356,0.0014226584426360045,0.7475076891771666
"In April 1996, 
Netscape's Navigator was used by 87 percent of people browsing the 
Web, compared with 4 percent using Microsoft's Internet Explorer, 
according to Zona Research.",51.52,0.0014112728515329905,102,-0.04130398048121481,0.0013241072858478876,0.4399426354852458
"So the biggest personal computer maker, 
Compaq, thought it made sense to give customers Netscape's browser 
instead of Microsoft's.",173.88,0.0026492395146468016,80,-0.0697094502582985,0.0014023071196327056,0.57072909906835
"But Microsoft would not stand for that _ and 
",6.44,0.0007406602014952804,14,-0.009615179637790846,0.0013035732891177197,0.6118993115179597
Compaq had no choice but to give in.,22.080000000000002,0.000770283899541556,16,-0.022827313872037527,0.0013150942881663135,0.45196899845889993
"In June 1996, Compaq wanted not 
only to load the more popular Netscape browser on its machines but 
also to remove the icon for Microsoft's Internet Explorer, which was 
delivered to the computer maker with Windows 95.",169.28,0.0020221708883815105,114,-0.07343148813210569,0.0013619651606134495,0.6613917841875123
"Microsoft informed 
Compaq that if it removed Internet Explorer, the computer maker would 
lose its license for Windows, said Stephen Decker, Compaq's director 
of software procurement, in testimony to federal investigators.",142.6,0.0013802038593547566,148,-0.04430521574173078,0.0014104075040508582,0.5450962516981717
"The 
ultimatum from Microsoft was delivered bluntly in a letter headed, 
``Notice of Intent to Terminate License Agreement.''",11.040000000000001,0.0007980528981942625,79,-0.006984929589650962,0.0013019202735457982,0.751285694276754
"Faced with being 
denied the essential operating system, Compaq quickly reversed course 
and kept the Internet Explorer icon.",106.72,0.001718858937880633,72,-0.048662324145095935,0.0014438643184430911,0.396630841923696
"Microsoft asserts that Windows 
and Internet Explorer are a single product and that Microsoft alone 
defines what is in the product.",79.12,0.0024784665047981186,73,0.0026560501257151046,0.0013432580842551408,0.7491600536413213
"Nothing in its contracts, Microsoft 
adds, prohibits computer makers from including competing technologies. 
",48.760000000000005,0.0022674673344470777,65,-0.04053461300984561,0.00138296674832044,0.6119974334535234
"While the cutoff letter Microsoft sent to Compaq seems an unnecessarily 
hardball tactic when dealing with its largest corporate customer, 
Microsoft chief operating officer Bob Herbold insists that ``to take 
one letter here or one snippet of e-mail there to try to portray Microsoft 
as an arrogant company is unfair.''",193.20000000000002,0.0018871038130252845,182,-0.019323945603891203,0.001417997838013843,0.6491480019303795
"Noting that a Compaq executive 
is a witness for Microsoft, Herbold said, ``We are totally dependent 
on tremendous relationships with key companies like Compaq.''",53.36,0.0011671931842743579,96,-0.018369049380569526,0.0013819416809082016,0.49815697262325775
"At Netscape, 
however, the Compaq episode was a watershed.",2.7600000000000002,0.0007879941052490369,29,-0.033230630617298355,0.0009856206038705048,0.6795190016687803
"``That was the singular 
act that got me going to the Justice Department,'' Barksdale recalled. 
",21.16,0.001940871806984772,43,0.03761152564661875,0.0012242219994847876,0.5698599677094123
"Barksdale said he regarded Microsoft's tactic of forcing Compaq to 
buy its browser as a condition of obtaining an essential product, 
the Windows operating system, as ``an illegal act and absolute proof 
that Microsoft was a monopolist.''",263.12,0.0020300623812758434,145,-0.044320800055538616,0.001429117421959279,0.6253765304448136
"After investigating the incident, 
the Justice Department and the states agreed with Barksdale that Microsoft 
was illegally tying the sale of one product to another.",57.04,0.0015931715945653679,87,0.06089366893984923,0.0014266273405331117,0.7534960760625548
"Microsoft 
replies that it has a long history of adding new features to its operating 
system.",106.72,0.0021265189608953463,50,-0.031914903853969376,0.0014511636601016382,0.7261783742022301
"And from the outset, Microsoft says, it intended that Windows 
and its Internet Explorer browser would be seamlessly integrated, 
as they are now in Windows 98.",85.56,0.0022259397035580557,77,-0.058925686654363374,0.0012189239377955012,0.6920967546078414
"Thus, Microsoft insists, there is no 
product-tying violation of antitrust laws.",57.96,0.0024553970179290465,47,0.08147031652600963,0.0014084684845040048,0.41176617972130325
"In a separate case, a federal 
appeals court sided with Microsoft, upholding the principle that the 
company could put whatever it wanted to in its operating system and 
declare it a single product.",385.48,0.0021659799446517797,107,0.027000411018359906,0.0014802713149045616,0.42816723914853716
"But in June 1996, when Compaq wanted 
to offer the Netscape product instead of Microsoft's browser, most 
industry experts viewed the browser and operating system as two different 
software programs.",381.8,0.003277494614121433,109,-0.07903557662797202,0.0014259028495996432,0.7015937972856098
"``It took a long time for the integration strategy 
to play out,'' said a former senior Microsoft researcher.",73.60000000000001,0.001390623468863335,56,0.008998690893557641,0.0014311106243826077,0.7330677571249525
"``Back then, 
integration was basically bolting a browser onto Windows.''",77.28,0.000652662611499092,41,-0.03501407341805093,0.001267874804989164,0.5791886436035245
"THE `BALANCING 
ACT': AMERICA ONLINE TOSSES IN TOWEL America Online chairman Stephen 
Case refers to dealing with Microsoft as ``a delicate balancing act.'' 
",36.800000000000004,0.0018114685086102796,104,-0.018364399683250786,0.0014635613618385784,0.39819805974781414
"That balance swung sharply from the fall of 1995 to the spring of 
1996, when Microsoft used the lure of giving America Online a featured 
place on the Windows desktop as the ultimate bargaining chip.",69.0,0.001072860925689978,114,-0.03249247601734404,0.0014459186083515528,0.7641111871560571
"To gain 
access to computing's most coveted real estate, America Online agreed 
to make Microsoft's Internet Explorer the main browser for its online 
subscribers, who now number more than 13 million.",190.44,0.001732988977525673,123,-0.050179495179382555,0.0014122403884186713,0.7731723810912697
"Yet throughout 1995, 
as Microsoft prepared to introduce Windows 95, the most significant 
improvement ever in its operating system, Case was knocking on the 
door of the Justice Department.",129.72,0.001576612689473996,104,-0.001279872308586139,0.0014764962731570832,0.7620298794773273
"His complaint was that Microsoft was 
going to place its new online service, Microsoft Network, a direct 
competitor to America Online, prominently on the desktop screen of 
Windows 95, which was introduced in August.",113.16000000000001,0.0019135676464945288,128,-0.050903780548313585,0.001421298303457223,0.5668961893431014
"This bundling tactic of 
using the industry-dominant operating system to market Microsoft Network, 
or MSN, Case argued, gave Microsoft an unfair advantage in the young 
but fast-growing online business.",225.4,0.0025180384189435493,134,-0.0365192426000788,0.0014820999668972057,0.7711562746961604
"The Justice Department listened 
and investigated.",0.92,0.0012994162377523036,34,0.05133264703129457,0.0011908837075838194,0.641932314424751
"But ultimately, the government decided against taking 
any action.",71.76,0.0013082002324321803,36,0.02742636989907782,0.0013625406571953,0.6743188590070469
"At America Online's headquarters in Vienna, Va., Microsoft 
was both feared and loathed at the time.",37.72,0.0006645821173243033,57,-0.011882568742599919,0.001344392030725342,0.7447268615069397
"America Online had a designated 
``Microsoft watcher,'' a young M.B.A. who tracked its adversary's 
every move.",10.120000000000001,0.0009272046150829532,62,-0.027140883711562005,0.0014205768350921794,0.7399214456133565
"Above the desk in his small, windowless office was a picture 
of Gates.",15.64,0.0008375865938202762,36,7.014495047829341e-05,0.0011013142725669162,0.7196124899694769
"Beneath the picture, in large block letters, were the words 
``THE ENEMY.''",15.64,0.0010537529956733906,39,0.004359481234087251,0.0012679050505554762,0.7251679454984137
"Though America Online was the clear leader in the online 
services business, it had ample reason to worry about an all-out assault 
by a rival as rich and aggressive as Microsoft.",129.72,0.0016223027017274682,103,-0.02405948265696881,0.0014904820680834733,0.7643943557627666
"When he had visited 
the Microsoft headquarters a couple of years earlier, Case recalled, 
Gates had bluntly assessed Microsoft's options by saying he could 
buy 20 percent of America Online, all of it or enter the online business 
on his own and ``bury you.''",130.64000000000001,0.0022335400245878283,131,-0.02104835015338714,0.0014835263322446847,0.7748772250637276
"A threat or merely a statement of the 
facts?",13.8,0.0009029510381094128,19,0.013989447202516601,0.0012918342991386081,0.652753067790397
"``A bit of both,'' Case said recently.",3.68,0.0006713680297080192,15,0.03162200751529125,0.0013446970570371419,0.6527028790754802
"``But he was mainly 
articulating what everybody at that meeting kind of intuitively understood.'' 
",26.68,0.0008369972875329856,44,-0.007246993156518068,0.0010840722979608669,0.5826830552563378
"Yet by 1996, Microsoft and America Online found they had reason to 
cooperate.",16.560000000000002,0.0013844577455398314,45,-0.03889789230913548,0.0014567772793822804,0.7227284265569338
"With the exploding popularity of the Internet's World Wide 
Web, the conventional online companies, like America Online and Compuserve, 
had to provide their customers Internet access as well as their own 
services.",69.92,0.0017383884062781838,121,-0.04031447806798611,0.001372904039835069,0.7686548985714914
"America Online had its own browser, but to keep pace with 
the rapidly advancing technology it made sense to do a deal with Netscape 
or Microsoft.",128.8,0.002029646165458658,78,-0.06902534337895307,0.0014340403966934302,0.5761438535191756
"For both software companies, a deal with America Online, 
which had 5 million subscribers at the time, could mean a big surge 
in browser use and market share.",229.08,0.002446230539442514,80,-0.06793016295902764,0.001418326325908727,0.7591687973135061
"Netscape seemed the natural partner 
for America Online, since both companies were Microsoft rivals.",20.240000000000002,0.002872129365169137,56,-0.060438953387445926,0.0013626834874306286,0.7345854229335438
"On 
March 11, America Online did announce that it would buy Netscape technology, 
but it was a standard licensing deal based on a payment-for-use formula. 
",71.76,0.0011768424862701693,96,-0.038844258557519704,0.0014652441057860835,0.7648968861276335
"The next day, America Online announced a more significant deal with 
Microsoft making its browser the default technology _",127.88000000000001,0.0018791282052386072,76,-0.05927575114379986,0.0014723121562696582,0.7539448102885735
"the browser 
America Online subscribers would use unless they specifically asked 
for Netscape's Navigator.",78.2,0.0014868415173655337,62,-0.06850063091416696,0.0012321180143881046,0.7376575169309398
"To win the deal, Microsoft offered to give 
America Online a start-up icon on the Windows desktop _ precisely 
the kind of equal treatment on the main Windows screen that Case had 
asked the Justice Department to require of Microsoft.",94.76,0.0027767095721213057,146,-0.02296657890286523,0.0015129366841388791,0.6758177423580347
"``After we agreed 
to its Internet Explorer browser, Microsoft allowed us to be bundled 
on the Windows desktop,'' Case said.",92.92,0.0026253354795250303,66,-0.022248114035608644,0.001299447573602428,0.43026502913179315
"``It was an example of Microsoft's 
pragmatic side.''",15.64,0.0009552041599825752,22,-0.0012507989600054226,0.0012462865983715336,0.5274856832024903
"The pragmatic decision was that the paramount corporate 
goal was to increase browser market share to protect the mainstay 
software business.",230.0,0.0011539958636184182,96,-0.03349135661887827,0.001432538320963947,0.7575317411281873
"As a result, its new online service, MSN, would 
have to sacrifice an important marketing advantage over its main rival, 
America Online.",103.96000000000001,0.0014144395000289828,80,-0.03280819486088283,0.0014008669606439933,0.7551537320621209
"``It was Bill's decision,'' said former MSN general 
manager Russell Siegelman, referring to Gates.",16.560000000000002,0.0012570152166133503,54,-0.0010702090218677335,0.0013015313225202213,0.730512307437705
"``He sent me e-mail 
on it.",1.84,0.0005136594029953256,6,0.0003317376458567251,0.0010943410127710964,0.5010019320110334
He said he didn't think it would hurt MSN that much.,8.280000000000001,0.0005361213439044013,7,0.009513606638546472,0.00100692824253975,0.6030714150328191
"I disagreed 
with him.''",0.0,0.0014035087719298247,8,0.0001075458406076122,0.0006971557285107149,0.5326567077133427
"To other Microsoft executives, Gates expressed a different 
view of the likely impact on MSN.",17.48,0.0019884789049102567,42,-0.011754709736642267,0.0013529270916135083,0.7299453139104737
"He told senior vice president Brad 
Silverberg that putting America Online on the Windows desktop would 
amount to ``putting a bullet through MSN's head,'' according to a 
deposition taken by the Justice Department.",71.76,0.0011615719290705882,117,0.003896117694526306,0.0014457357900741607,0.761185928355494
"In the antitrust suit, 
the government asserts that the America Online deal shows how Microsoft 
used the power of its Windows monopoly to give it an edge in the browser 
war against Netscape.",286.12,0.0028560268049172915,105,-0.029599483279767542,0.0014715405528288377,0.6780714323373873
"David Colburn, a senior vice president of America 
Online who took part in the browser negotiations with Microsoft, is 
a witness for the government.",196.88,0.0017620767508363206,92,-0.03676273771735708,0.001434850880961826,0.7571131653252335
"Today, Microsoft has overhauled its 
Internet strategy to focus mainly on building popular special-interest 
Web sites in fields like travel, personal finance, automobile retailing 
and news.",55.2,0.0008377915422499941,127,-0.019948855654608393,0.0014563216942026804,0.7649692786425093
"And it is putting these sites, along with e-mail and search 
features, in an all-in-one site that uses the name MSN.com.",15.64,0.001144462132398831,47,-0.0004171955493129393,0.0013610167262695803,0.4654564555252124
"``I still 
regard Microsoft as a primary threat,'' Case observed.",13.8,0.0010288025941326997,39,0.021337453529243863,0.0014062060516540698,0.7145993252326884
"``Microsoft 
has a history of getting it right in the long run, and there's no 
reason to think it won't in this business as well.",87.4,0.0014025632541724668,37,-0.012294129049587104,0.0014744632545655124,0.6198834634330588
"We will always 
be in Microsoft's cross hairs.''",4.6000000000000005,0.0004925577900638686,18,-0.006046801710082844,0.0012385814395123556,0.6372304452531558
"THE LESSON: DON'T CONFRONT A STEAMROLLER 
At Netscape's headquarters in Silicon Valley, the strategy today is 
one of avoiding head-to-head competition with Microsoft whenever possible. 
",46.92,0.001607003846482108,108,-0.007349145172338704,0.001448789285101813,0.4474930881140103
``Don't do something that is in Microsoft's path _,3.68,0.0005088681789368674,13,-0.0071281549256384516,0.0012401463565630782,0.5991232179890099
"that's the lesson 
learned,'' observed Clark, the Netscape chairman.",14.72,0.0010294222926315437,39,-0.02005308555078756,0.001254077162708118,0.7107699654076529
"Silicon Valley's 
venture capitalists, the investors who finance so many of the nation's 
high-tech startups, generally follow the Netscape formula these days. 
",26.68,0.0014432790938236951,100,-0.008707575908566259,0.0013834602353219217,0.7616091643177388
Yet that still leaves ample room to prosper.,6.44,0.0004803044946772719,21,0.006133975197274436,0.0010652481815260852,0.5211113279459018
"For while competing directly 
with Microsoft is dangerous, the software industry as a whole is an 
engine of wealth creation, job generation and technical innovation. 
",92.92,0.0009638985301145623,101,-0.021587108679466397,0.0014101927642328439,0.7602856855515703
"And there is an ambivalent side to the venture community's relationship 
with Microsoft.",27.6,0.0009503222254054718,52,-0.0013855614181202639,0.0013074020833140326,0.7035699793599219
"For if a start-up cannot steer clear of Microsoft 
entirely, the favored option is to be bought out by Microsoft, which 
has scooped up many fledgling companies as a way of acquiring promising 
technology and people.",75.44,0.0011346781141976013,103,-0.007893464801878237,0.0014646507480595035,0.7642136891639156
"``Microsoft understands start-up innovation 
and how to co-opt start-up innovation better than any other high-tech 
company,'' said James Breyer, managing partner of Accel Partners, 
a venture capital firm.",125.12,0.0014638626400644938,131,-0.010636975017168638,0.001410343258691541,0.7698059325026605
"As Microsoft has grown, it has come to be 
seen not merely as a competitor but as a force of nature that shapes 
the business environment, like a weather front.",74.52000000000001,0.0008958886655098871,70,-0.00970484898159437,0.0014108126245313901,0.7409619185503237
"``Microsoft is incredibly 
pervasive,'' said Stewart Alsop, a partner with New Enterprise Associates, 
a venture capital firm in Menlo Park, Calif.",42.32,0.000799452807503727,98,-0.005383934008085087,0.001250935656018868,0.761802887018826
"At the board meetings 
of the companies in which his firm has invested, two issues always 
come up, he said: ``One is the price of the company's stock, and the 
other is what Microsoft is going to do.''",104.88000000000001,0.0016757243649711652,60,-0.009724270746608376,0.0013951836845268878,0.5798707025458264
