Sent,Tm,Lex,Luhn,Lsa,Tr,LDA
"The Treasury's 
relations with Camdessus are often more strained as he plays the role 
of world diplomat, traveling the globe and trying to coax along political 
leaders.",36.800000000000004,0.0011064041045794517,83,0.026406178800345268,0.002427147127908905,0.7598884207959076
"The tensions were obvious from the start of the Asia crisis. 
",23.0,0.003045501765795333,29,0.02574574099714204,0.0023568883094542597,0.6974406883446217
"The fund made little secret of its displeasure that the United States 
was not offering direct aid to Thailand, a major U.S. ally, as a sign 
of support and confidence.",65.32000000000001,0.0024592892994942605,89,0.022780803025977445,0.0025337359182904043,0.7642857929300815
"Mindful of the backlash in Congress when 
Mexico was bailed out with U.S. money, that was the last thing the 
Treasury planned to do.",26.68,0.001452792600586925,55,-0.0028962176184232098,0.0024019196117445905,0.7445040744410654
"Summers, in turn, thought the fund was not 
forcing the Thais to implement its reform commitments rigorously enough 
or disclose their true financial picture.",70.84,0.002642848582244132,92,0.010219401627240091,0.0025127434689268223,0.757965182207739
"Within the U.S. government 
there was other dissension: The State and Defense Departments felt 
the United States should do more for Thailand, but backed off when 
the Treasury asked if they would like to pony up some aid out of their 
own budgets.",53.36,0.0032007065811248286,94,0.025754357242306153,0.002514407840558265,0.756252331498271
There were other conflicts.,0.0,0.0024309392265193367,8,7.70624440178199e-05,0.0017968211270186305,0.5308890362634656
"When Japan used the last 
IMF meeting to propose setting up a $100 billion ``Asia Fund'' _",31.28,0.004808266111779565,40,0.06850323722474198,0.0024009731050607594,0.7358236781556713
"one 
that would exclude the United States and would probably offer aid 
under much more relaxed conditions than the IMF does.",17.48,0.0027358588798133622,46,0.055921086043864573,0.0024141146089795874,0.7384542590574865
"Rubin called 
up Camdessus at breakfast one morning and told him that the Japanese 
proposal would undercut the IMF's authority.",11.040000000000001,0.0024487597684648152,75,0.0018203618093491191,0.002378932727323742,0.7473901412416215
"``We've just had a dispute 
with Michel,''",2.7600000000000002,0.0017511336028601294,13,0.018797579665803903,0.0016855225189495305,0.3781004699011109
"Rubin reported to his aides as he returned to his orange 
juice and croissant.",2.7600000000000002,0.0013018516329784471,41,-0.0026739562534311622,0.002021978713599756,0.726927005903326
"One of them shot back: ``And it's only 8 a.m.'' 
",16.560000000000002,0.0019276804629320312,10,0.01583397947186702,0.0020683061109212394,0.5308890368267134
"Camdessus backed down at Rubin's insistence and walked away from money 
that Asia could have used.",22.080000000000002,0.0029694848005417203,41,0.02960236722851414,0.002342054287093517,0.7192594050772328
"Japan says it will be back with a similar 
proposal this weekend, this time for a $30 billion fund.",72.68,0.0022615742387496656,48,0.027626578991249092,0.002539898944221184,0.735948567466882
"Camdessus 
has also rankled U.S. officials with statements that amounted to cheerleading 
to reassure the markets _",3.68,0.0020655302258425633,64,0.031991391530986,0.0022727522765477615,0.7275838347980739
sometimes in the face of the facts.,2.7600000000000002,0.0013664999774733952,8,0.001475507179702195,0.0023044395488168476,0.6085622046322742
"In June, 
with Russia on its way to collapse, Camdessus declared that ``contrary 
to what markets and commentators are imagining'' about the slow collapse 
of Russia's economy, ``this is not a crisis.",52.440000000000005,0.003691780679322483,97,-0.03251837033839369,0.0024491571230450186,0.7611578843545538
"This is not a major development.'' 
",9.200000000000001,0.0017256122780882849,16,0.008959526939163204,0.002197311674879176,0.5991617685931742
"The bailouts of Russia and South Korea were prime examples of how 
Washington muscles into the IMF's turf as soon as major U.S. strategic 
interests are involved.",23.92,0.0019559208558215316,89,-0.03639117367794214,0.002511937232561112,0.7580472112873868
"Last Christmas, as South Korea slipped within 
days of running out of hard currency to pay its debts in December, 
it sent a secret envoy, Kim Kihwan, to work out a rescue package. 
",52.440000000000005,0.00266515043075822,93,0.0017164597540998059,0.0025514378028677104,0.7687608408007658
"``I didn't bother going to the IMF,'' Kim recalled recently.",7.36,0.0015896596542498355,26,0.11079502415104038,0.002209287824675957,0.7088149509384848
"``I called 
Summers' office at the Treasury from my home in Seoul, flew to Washington 
and went directly there.",16.560000000000002,0.002379173636491754,54,0.02782499297622742,0.002420882741901885,0.7374245745651785
"I knew that was how this would get done.'' 
",0.0,0.0014575196915886932,4,0.009465105454357726,0.001952230579209953,0.4970418509543576
"Within days the Treasury dispatched David Lipton, its most experienced 
veteran of emergency bailouts, who is leaving his post as undersecretary 
for international affairs this month, to shadow the IMF staff's negotiations 
with the government in Seoul.",85.56,0.0018096988185159028,151,0.04953805011380981,0.0024546021980825505,0.6567081988357129
Fischer was displeased.,0.0,0.0017470275896687433,16,0.007465101514000169,0.0005667636980929452,0.6178023581561884
"``To make a 
negotiation effective, it has to be clear who has the authority to 
do the negotiating,'' he said.",23.92,0.0020495383426341117,47,0.01061813984788866,0.002311583992214583,0.7174319605080468
WHO LOST RUSSIA?,0.0,0.004540499255281062,10,-0.06006403554929466,0.0021501638884834245,0.5869604039212678
"The pattern was repeated 
this summer, when the United States raced to put together a $17 billion 
package for Russia.",36.800000000000004,0.0036323429595026503,60,-0.0023185086344372596,0.002495996563472451,0.7455658188293395
"The IMF's staff in Moscow declared that Russia 
needed no money at all _ it just needed to enact policies that would 
restore confidence in investors.",35.88,0.0018662521488095603,77,-0.02628078853839258,0.0025264709338688844,0.7544662402095832
"The Americans and Germans came to 
a different conclusion.",0.92,0.0014606527891778882,26,-0.0014528577880924785,0.0019675384616891873,0.6611542088407965
"Soon after, U.S. officials gathered in the 
White House situation room to consider what might happen to Russia 
if the ruble was devalued and market reforms collapsed and to push 
the IMF to come up with emergency money.",69.0,0.003137423269405924,102,0.042510712046899275,0.002578074752463739,0.5216327435289672
"So the fund began assembling 
a last-ditch program to prop up a country that had resisted its reform 
plans for seven years.",69.92,0.0023165606889572,65,-0.0018331155163573407,0.002518426864909662,0.7449944025360621
"Camdessus, though, was still hesitant, questioning 
whether the IMF should risk its scarce resources in Russia.",4.6000000000000005,0.003282434575569449,52,0.018070752750333118,0.002191260859622023,0.7340669851186136
"``We had 
to pull Michel along,'' a senior Treasury official recalled.",30.360000000000003,0.002423615342459369,38,0.13152567904877752,0.0023257635008765306,0.6549849290587613
"As it 
turned out, Camdessus' instincts were right while the approach championed 
by Rubin and Summers proved disastrously wrong.",10.120000000000001,0.0024350230946231298,70,0.016111706735800275,0.0021886603884042994,0.7470553054631692
"The first installment 
of that payment _ $4.8 billion _ was wasted, propping up the currency 
long enough, in the words of one IMF official, ``to let the oligarchs 
get their money out of the country.''",134.32,0.003144421261206642,85,0.046442834844347594,0.0024479552849720203,0.7601595214222914
"Then Yeltsin reversed his commitments, 
let the ruble devalue anyway, began printing money with abandon and 
fired virtually every reformer in his government _ resulting in a 
collapse of the IMF agreements and the indefinite suspension of its 
aid program.",108.56,0.0034732906406651025,145,0.03628886217106006,0.002502047662177612,0.7732690048007161
"Now, inside the IMF and on Capitol Hill, there are recriminations 
over ``who lost Russia.''",0.92,0.001955751180269736,43,0.010167703495470394,0.002373894830288971,0.7298797438732462
"Publicly, Fischer argues that ``there are 
no apologies owed for what we attempted in Russia.''",0.0,0.0022780112758271197,43,-0.01944394880079754,0.002227382052724447,0.7278843647918586
"But some IMF 
officials complain privately that they let Rubin and Summers run roughshod 
over them, striking a deal that fell apart within weeks as the Russian 
parliament rebelled and Yeltsin backed away from his commitments. 
",18.400000000000002,0.0037674478258214227,112,0.07307734114231051,0.002530036299762859,0.6513758533295548
"Summers responds that the United States ``took a calculated risk'' 
because ``it was vastly better that Russia succeed than not succeed.'' 
",11.96,0.0025717845410484306,64,-0.0059213319938589285,0.002390124243343931,0.7465915667003271
"The Russian collapse touched off new rounds of economic contagion, 
with investors fleeing Latin America, and triggering huge losses in 
hedge funds like Long Term Capital, the Greenwich, Conn., investment 
firm that needed to be rescued by Wall Street powerhouses whose money 
it had invested.",79.12,0.0027272846548771095,173,-0.04453360477875244,0.002494810261770815,0.7797123431728863
"``Russia was a turning point,'' said Robert Hormats, 
the vice chairman of Goldman, Sachs &AMP; Co.",12.88,0.001144057975482086,55,-0.012983622731001936,0.0020760863971845066,0.7470550769394495
"``It made the world 
realize that some countries can fail, even if the IMF and the Treasury 
intercede.",31.28,0.003582548361779743,47,0.10004981051373026,0.002449599967014198,0.7359761938235035
And that changed the perception of risk.'',5.5200000000000005,0.0012099542750250933,20,0.01169537881370182,0.0021222967484993776,0.6532168636127991
"Now, as the 
countries meet to face a future that the IMF has warned could be very 
bleak, they need to reverse those perceptions, or watch countries 
slowly starve for lack of capital.",33.120000000000005,0.0032881617158718713,85,0.01999461451913255,0.0025058521014197587,0.7645764155393628
"The emerging markets are calling 
for controls on short term investments.",11.96,0.0031466996272058343,42,-0.07178764910670982,0.002545628227802466,0.40035929130262726
"The French want a stronger 
IMF.",0.92,0.001597684829538348,15,0.07652350159242037,0.002268104955716774,0.643419148816814
"The Americans say the answer is more disclosure, so that investors 
are better warned, and tougher regulation.",6.44,0.002488150589949177,52,-0.01609873462219559,0.002322694639878696,0.7262470249758963
"``These are usually nice, 
quiet meetings; everyone very polite,'' a top U.S. official said earlier 
this week.",46.92,0.0015743200640433183,42,0.03972099500662533,0.002364099811488932,0.7294592090863636
"``Not this year.'' 
 
",21.16,0.003325800611960026,4,0.08335325562367285,0.002215858332358242,0.5267476692837366
"In a season of crashing banks, plunging rubles, bouncing paychecks, 
failing cropsand rotating governments, maybe it is not the ultimate 
insult.",5.5200000000000005,0.0011655105753736981,82,0.024590631946382262,0.00229885548863175,0.7555899198171163
"But the nation that bore Tolstoy and Chekhov, and still regards 
a well-written letter as a labor of love, is buckling a little this 
week, because it can no longer wish good health to Baba Anya in Omsk. 
",38.64,0.002131690616017931,87,0.005950489782730323,0.0023891907117297656,0.767984822146337
The Post Office is broke.,0.0,0.0024345199922447412,15,0.034862954229164474,0.002307954043288575,0.6540189341620655
"In 60 of the country's 89 statelike regions, 
more than 1,000 mail cars have been sidetracked, many stuffed with 
up to 18 tons of letters, newspapers and parcels.",45.080000000000005,0.0023073229409016514,77,0.00926103229181508,0.002238973223053043,0.764268016215714
"The state Railway 
Ministry refuses to carry more mail until the Post Office makes good 
on some 210 million rubles in old bills _ about $13 million in today's 
dollars, or $35 million in dollars six weeks ago.",94.76,0.004831628875753734,114,0.02765717137631531,0.0024787333751966865,0.7743451746209394
"Air mail, which 
amounts to one of every four or five letters, was also suspended at 
one of Moscow's major airports until this week, when the Post Office 
coughed up 5 million rubles for old bills.",69.0,0.003765747677872205,80,0.04888350919920648,0.002457056462235568,0.7591867706410977
"A second airport is still 
demanding 3 million rubles for past-due debts.",27.6,0.0018545053315709443,38,0.02490142126799139,0.002428583459242207,0.7192926687170688
"So much mail is backed 
up that post offices in Moscow and elsewhere have simply stopped accepting 
out-of-town mail, except for areas that can be easily reached by truck. 
",46.0,0.0028072887858189657,75,0.03198018308025475,0.002455860016291978,0.7601785148196856
"Delivery schedules have fallen weeks, and perhaps months, behind. 
",0.0,0.0021064339742511303,29,0.024931245145041924,0.002277532871878514,0.5139153288673671
"``The situation is really extraordinary,'' said Vladimir Sherekhov, 
the deputy chief of mail service administration in the government's 
Communications Committee.",83.72,0.0036485480322304984,107,0.016348218123656062,0.0023620796051759146,0.7539093390209466
``We've never had anything like this before.'',0.92,0.0024309392265193367,0,0.0,0.0003497087802892971,0.26666666666666666
"
",0.0,0.0024309392265193367,0,0.0,0.0003497087802892971,0.26666666666666666
Maybe the Post Office has been lucky.,0.92,0.002101248807465611,15,0.03095249615474009,0.0021756222756306944,0.6627457251948623
"Extraordinary is the rule elsewhere 
in Russia.",0.92,0.0013021332804579585,23,-0.04074600647095345,0.002256070459296593,0.6527944152363708
"Until Friday, the lower house of Parliament was preparing 
to sue the government for failure to provide soap, heat, toilet paper 
and copy-machine paper in the legislature's monumental downtown offices. 
",60.720000000000006,0.0012135568517222131,129,0.006708027277352189,0.002435416772275428,0.7729163654588987
"It turned out that politicians had exhausted their funds by cutting 
short their recess and returning to address the nation's economic 
crisis.",55.2,0.002174948805251755,72,-0.018265532219832042,0.002570044107247609,0.7465543265333974
"Earlier in the week, officials said Russia's Arctic shipping 
routes may close next month because half the nation's icebreakers 
are in disrepair and there is no money to fix them.",69.0,0.0021142076341418648,89,0.01940150062678067,0.0025083804503340033,0.7610887984038177
"The oldest of 
the ships is so ancient that its nickname is Granny.",2.7600000000000002,0.001391521934157034,28,0.0014351615466154297,0.0015949961215731463,0.7080966589338997
"Such anecdotal 
evidence that Russia is losing its wheels, like one of its old, ill-maintained 
Volga sedans, is everywhere.",7.36,0.0011368557752333504,54,-0.027399854212703845,0.0022906761829620784,0.7450724302031324
"But oddly, real signs of public distress 
are not particularly common, perhaps because the system rarely seems 
to shed a part as big as a postal system.",35.88,0.001577900583936774,68,-0.005512910461380123,0.0024260240492056284,0.7480518547513011
"If the U.S. Postal Service 
is increasingly a pipeline for sweepstakes notices and bills, the 
Russian Post Office still holds a special place in the national conversation. 
",16.560000000000002,0.0021682657675756297,106,0.02452095564450638,0.002491059968632435,0.7625715001723667
"Russians still write letters to each other, frequently and fervently, 
and many in remote regions get their news through the mail.",23.0,0.0024132999224511596,58,0.005403940771677561,0.002265707212982874,0.7394290872018913
"Millions 
use the mails to ship canned goods and other provisions to needy relatives 
and friends in faraway areas, an especially vital service in winter. 
",11.040000000000001,0.001929860488433263,79,0.021567588973983774,0.002371236566308108,0.7584555762711156
"And in the last few years, the Post Office has become a vehicle for 
a growing mail-order trade in books, clothes and other catalog items 
not readily available outside big cities.",13.8,0.002759743191108536,75,0.04021822129564538,0.0024189049763988337,0.762230070068147
"Exactly why all this has 
rumbled to a halt is in some dispute.",5.5200000000000005,0.0013192664725964521,17,0.00344491534888682,0.0017558887864686772,0.6660010246262477
"What is clear is that the Post 
Office and the Railway Ministry both suffer from what ails every Russian 
venture, private and public alike: Nobody pays his bills.",17.48,0.0031550651275442927,78,0.013471547849773734,0.0025013363880369813,0.7573031025676857
"The state 
Railway Ministry complains that it is continually stiffed by customers 
who believe the railroads are honor-bound to carry freight whether 
they are paid or not.",25.76,0.0037731935966526155,86,5.996413066867712e-05,0.00232552158771478,0.7497459680726064
"The government has specified nearly 40 categories 
of freight which the railroads must carry for next to nothing.",48.760000000000005,0.0019748239836204526,40,-0.0032701122105262474,0.002174456257842562,0.719467862264145
"Among 
the biggest deadbeats are the ``power ministries'' _",4.6000000000000005,0.001955875130521832,24,0.014362304266534738,0.002311205884131736,0.690142800517044
"the military 
and interior departments _ which did not pay during Soviet times and 
feel little need to pay now.",21.16,0.0016185850046413774,46,-0.0012427408701389691,0.0024704900853752864,0.7362219398711396
"``It's a psychology formed during the 
socialist period,'' said Tatiana Pashkova, the deputy spokeswoman 
for the ministry, ``and the same situation exists with the Post Office. 
",26.68,0.001988572125618829,93,0.022637977194111845,0.0023145599789863767,0.7577561880475812
We've been in dispute for a very long time.,27.6,0.004699031644871408,15,-0.0042378995700985,0.0023853750205227965,0.6564821897461067
"Always we try to understand 
their differences.",4.6000000000000005,0.0015664659223372161,20,-0.003832672553818775,0.001906325065379388,0.6062635986616911
But we can't carry cargo for free.'',11.96,0.0015989017873797497,14,0.0003707690137654104,0.0019912660184861434,0.6634328465815691
"No kidding, 
says the Post Office: It, too, is owed 200 million rubles by government 
agencies, and is barred from raising rates even though freight costs 
are outstripping revenues.",56.120000000000005,0.002921153157708784,85,0.031244399949896532,0.002422946434065081,0.763518499995803
"Moreover, the Post Office is also required 
by the government to carry some forms of mail, such as pension checks, 
at reduced rates.",60.720000000000006,0.0034742523107188757,62,0.0233089975134161,0.002442909724778225,0.7471659404125094
"Officials at the state Communications Department 
say they also suspect an ulterior motive in the railroads' actions: 
a struggle to dominate the thriving mail-order business.",25.76,0.002777171286494022,112,0.02756434508950836,0.0024421769893397975,0.7633948406803878
"``Here's 
competition between us and the railroads for the delivery of parcels, 
and I think decisions made by the railroads are mainly explained by 
this competition,'' Sherekhov said.",8.280000000000001,0.001657538948657994,80,0.010284828437469754,0.002271884216596479,0.7487793695041458
"``They blame us for carrying some 
commercial cargoes instead of mail.''",20.240000000000002,0.00248120737182116,30,0.0153741583960909,0.0022142139946061735,0.5102542605964797
"The Railways Ministry's spokeswoman, 
Ms. Pashkova, said such ``commercial cargoes'' are indeed a problem, 
but only because the railroads know that the Post Office has already 
gotten cash to transport the packages.",14.72,0.0023277209148431957,98,0.02461069942587455,0.0022507120190565135,0.7627277812222255
"The railroads are still waiting 
for their share of that money, she said.",24.84,0.0020089662002825514,22,0.0107047799463924,0.002291079119830618,0.6660108599919916
"In the meantime, the situation 
has come to a boil.",11.040000000000001,0.0013419542243791865,21,0.006022144510796089,0.0018276833573595338,0.6654687171464944
"In late September the railroads cut mail service 
in and out of Moscow, effectively decapitating the postal system and 
forcing officials to draft a fleet of trucks to move letters in and 
out of the city.",53.36,0.003269355588968413,116,0.028125852485727888,0.0024312436698595637,0.7664563465732153
"Hundreds of empty and full rail cars have clogged 
some local yards to the point where moving cars into position for 
unloading has become difficult.",16.560000000000002,0.0018133498479197285,71,0.002597759373971438,0.0022776533949521206,0.74907215429322
"At last count, 39 loaded cars were 
awaiting service at one yard.",12.88,0.0013229242949654464,32,0.004436072271653615,0.001965140942111914,0.7290575453920705
And customers are getting angry.,0.92,0.0013765757038453573,13,-0.0006293409422482209,0.001767910455324271,0.6114973769602567
"``We've 
gotten all kinds of complaints,'' said Viktor Salikov, a deputy in 
the Communications Department's mail shipping center.",32.2,0.0019094606660452387,73,0.015966512858309887,0.002215928333439579,0.7411545673523269
"``People are 
even coming to us, searching for mail that was sent weeks ago.'' 
 
",19.32,0.002467474111607546,27,0.014705098955848943,0.0023932742453543995,0.7189209323741047
"The United States is disappointed by the economic confusion within 
the new Russian government of Prime Minister Yevgeny Primakov, said 
Secretary of State Madeleine Albright on Friday, and she warned Russia 
about the dangers of an anti-Western policy.",72.68,0.0034173242881978807,155,-0.10552390464617577,0.0024545458897422055,0.7749358019344338
"In her first comprehensive 
review of U.S.-Russian relations since Primakov was confirmed as prime 
minister last month, Albright said Washington was ``deeply concerned'' 
about Russia's direction and did not think the crisis there would 
soon abate.",76.36,0.00293043392624908,127,-0.08357190960389596,0.0024238050198882887,0.7687025452331729
"``We have heard a lot of talk in recent days about printing 
new money, indexing wages, imposing price and capital controls and 
restoring state management of parts of the economy,'' she told the 
U.S.-Russia Business Council in Chicago.",81.88000000000001,0.004123882437529141,133,-0.033856549496244275,0.002594086695344225,0.7740291313288576
"``We can only wonder if some 
members of Primakov's team understand the basic arithmetic of the 
global economy.''",32.2,0.001779498080644048,58,0.003879083058979564,0.002389914625845388,0.722703409090109
"While praising Primakov, once her counterpart when 
he was foreign minister, as a pragmatist able to cooperate on key 
issues with Washington, she had harsh words of warning for him.",43.24,0.0017019801613106869,90,-0.06450591944840761,0.002329762329378899,0.7565589663126935
"``Our 
initial reaction to some of the direction he's going in has not been 
particularly positive,'' she said, adding, ``The question now is whether 
that cooperation can continue.''",17.48,0.0010748107833204526,62,-0.001495676136136874,0.0024067078685138087,0.7388677819845011
"The United States must keep up its 
aid to Russia but is adjusting it to promote the building of democracy 
and student exchanges as well as arms control, Albright said.",29.44,0.002432979439395646,81,-0.024609076503395288,0.0025041817834991383,0.7551571880456958
"Washington 
does not favor more direct aid.",16.560000000000002,0.0029791986435537573,24,0.01268215499272179,0.002395791832567435,0.5172749394791819
"``More big bailouts are not by themselves 
going to restore investor confidence in Russia,'' she said.",24.84,0.0032966119170937795,41,-0.038416865943744515,0.002340010954167387,0.7120292333018734
"``In the 
long run, the gap between Russia's needs and its resources must be 
met not by foreign bailouts but by foreign investment.''",58.88,0.0032402247230228698,59,-0.07572065048927264,0.0025203133894472697,0.7465697341926247
"Albright 
sharply criticized as self-defeating the ``many voices in Russia who 
want to shift the emphasis in Russia's interaction with America and 
our allies from one of partnership to one of assertiveness, opposition 
and defiance for its own stake.''",18.400000000000002,0.0010808169357732446,136,-0.033229858035769964,0.0024243692497232794,0.7712243833451272
"Russia could not stand alone in 
the world, she said, and the United States' ability ``to help Russians 
help themselves will go from being merely very, very difficult to 
being absolutely impossible.''",34.96,0.002979133495060613,72,0.003681000762750944,0.002422266543927608,0.7428699841471884
"At the same time, she said, Washington 
would not ``assume the worst, for there are still plenty of people 
in Russia who will fight against turning back the clock.''",39.56,0.0031641610979569967,59,-0.007558141545835164,0.0025177941554010022,0.746269134061867
"And she 
urged the world _ and American critics _ to ``be patient with the 
workings of the democratic process in Russia'' and ``not start each 
day by taking a census of reformers in the Kremlin,'' a census that 
American officials themselves promoted before President Boris Yeltsin 
dismissed the previous government.",91.08,0.002060573754961626,168,0.023429564653585554,0.002541084023761723,0.7769985911669715
