Sent,Tm,Lex,Luhn,Lsa,Tr,LDA
"
In the summer of 1995, a whiff of revolution was in the air in Silicon 
Valley.",27.6,0.0008366659487472892,41,-0.0007616913110192007,0.0011770237084773383,0.7197916694970584
"The Internet offered a new deal in computing, a fresh opportunity 
for entrepreneurs to try to break Microsoft Corp.'s firm grip on the 
personal computer software business.",186.76000000000002,0.0013498470156900883,110,-0.04081279416816966,0.0014416859121758976,0.41163953829871497
"Leading the challenge was Netscape 
Communications Corp., whose software for browsing the World Wide Web 
had ignited the Internet boom.",52.440000000000005,0.0014531418800744957,83,-0.048169040132864965,0.0013489004101187641,0.4085105545598031
"Netscape chairman James Clark spoke 
boldly of attacking Microsoft head-on.",11.96,0.000938790474286767,59,-0.017974975026225398,0.0014006500197735212,0.7401043945642171
"He borrowed imagery from the 
movie ``Star Wars,'' referring to Microsoft as the Death Star and 
Netscape as the leader of a rebel alliance.",10.120000000000001,0.0004626928884372671,75,-0.013020481784438933,0.0013533646697732825,0.7610431730286746
"Microsoft answered with 
a vengeance.",0.92,0.0008006330077453375,24,0.00989408594655874,0.0012452890323826392,0.6561848985446392
"It dispatched hundreds of programmers to work on a competing 
browser and poured many millions of dollars into marketing it.",91.08,0.000682671365769609,69,-0.020609885554788817,0.0013505782966834398,0.7396359159254481
"It 
prodded computer makers and others to distribute its browser, folded 
the browser into its industry-dominant Windows operating system and 
gave the browser away free _ a campaign intended to ``cut off their 
air supply,'' as a senior Microsoft executive described it.",427.8,0.0021170741247853874,148,-0.08584038215335546,0.0014674511469365565,0.7747485199389347
"But not 
only competitors like Netscape have encountered Microsoft's force. 
",14.72,0.0015983021681582061,41,-0.02753790105726623,0.0012812932403975703,0.6917763318586138
"Microsoft's partners, its corporate customers and professional investors 
who finance new ventures have all collided with it.",13.8,0.0012401320345354753,74,-0.006057934605734902,0.0013172079530251607,0.7432889396509914
"A close look at 
Microsoft's no-holds-barred push into the Internet software business 
offers a window into the ways the company uses its market muscle to 
influence the behavior of virtually every player in the industry. 
",303.6,0.0014453195486688617,127,-0.033238875927949586,0.0014938574493492,0.7710615714825897
"Some of the cases recounted here figure prominently in the suit brought 
by the Justice Department and 20 states, scheduled to go to trial 
this month, charging that Microsoft at times went too far _ and violated 
antitrust laws.",139.84,0.002487769479827797,118,0.09216593796190996,0.001435888809823728,0.7189354256813855
"Regardless of the legal outcome, previously unreported 
details about incidents in the suit and the other examples provide 
a more complete picture of Microsoft in action.",80.04,0.0013423964736120992,94,0.029351412511790163,0.0014323128513003209,0.7518872039546346
_,0.0,0.0014035087719298247,0,0.0,0.00020232873639453486,0.26666666666666666
"When Compaq Computer 
Corp. considered loading Netscape's browser instead of Microsoft's 
on its personal computers, Microsoft threatened to stop selling its 
Windows operating system to Compaq.",194.12,0.0027471612775949346,125,-0.09642114050933333,0.0013446550516032342,0.5978701680589361
"The company quickly changed its 
mind.",79.12,0.0009836052476306478,24,-0.005148306253415028,0.0014097942780942813,0.6846516921261957
_,0.0,0.0014035087719298247,0,0.0,0.00020232873639453486,0.26666666666666666
"After Spyglass Inc. began supplying Microsoft with its early 
browser technology, Microsoft announced that it would give away its 
browser free.",210.68,0.0022047201937063733,82,-0.05366166057182866,0.0014010728183821346,0.6510004660886722
"The timing came as a rude surprise to its partner Spyglass. 
",20.240000000000002,0.0013278510600446536,31,-0.008329328189912104,0.0011999962919497008,0.4528544593986146
"The company lost most of its revenues almost overnight, as the technology, 
which it had also been licensing to companies besides Microsoft, suddenly 
became available free.",111.32000000000001,0.0016529158745846515,74,-0.0184318541499215,0.001426283122462319,0.7416880646205098
_,0.0,0.0014035087719298247,0,0.0,0.00020232873639453486,0.26666666666666666
"When America Online Inc., which competes 
fiercely with Microsoft's online service and electronic commerce divisions, 
went shopping for browser technology, Microsoft made an offer that 
was too good to pass up: If America Online used Microsoft's browser 
as the main one for its millions of subscribers, Microsoft would give 
America Online prime placement on the desktop screen of all personal 
computers using Windows.",355.12,0.002294483681819361,249,-0.08256164418953184,0.0014361057377711257,0.7830209560986559
_,0.0,0.0014035087719298247,0,0.0,0.00020232873639453486,0.26666666666666666
"When Intel Corp. began developing its own 
Internet software, Microsoft complained.",47.84,0.0018926894956844988,54,-0.03399637310666585,0.00132589168427209,0.7315391284991257
"Intel, the leading maker 
of the microprocessors that serve as the electronic brains on most 
personal computers running Windows, pulled back.",45.080000000000005,0.0014294870625732882,84,-0.05002388682223749,0.0013756927569894618,0.4409999724877878
"The chip maker decided 
that its lucrative hand-in-glove partnership with Microsoft took priority. 
_",19.32,0.0012894683932760643,65,-0.002994914722750774,0.001405229779262184,0.7384487472646494
"Microsoft's reach in computing has become so pervasive that nearly 
every year now, Silicon Valley's top venture capitalists meet privately 
with a team of top Microsoft executives to learn about the company's 
plans.",158.24,0.0016385111068185584,121,-0.010283317742628573,0.001453699788320432,0.7674288219545538
"The goal, one venture investor observed, was to ``stay out 
of the way of the steamroller.''",35.88,0.0012091996007028121,41,-0.0023355522202061774,0.0012496141316464635,0.7134296893673525
"Microsoft adamantly denies that it 
has broken any laws in these or similar situations.",7.36,0.0008011387608491879,47,0.016601745323546847,0.0013804697138831792,0.7289372930965345
"The company plays 
the game of business hard, and its executives acknowledge that without 
apology.",125.12,0.001186701672961843,54,-0.011779328305986799,0.0014385211175887973,0.6134349137037899
"Yes, Microsoft says, rivals may suffer and partners may be 
irritated occasionally.",3.68,0.000965237785817572,47,-0.00948851617228894,0.001261937669231367,0.7135319587801674
"But the company insists its actions are guided 
by its main corporate goal of bringing new technology inexpensively 
and conveniently to the millions of people who use its software.",188.6,0.0011300523861979509,102,-0.01092042323851202,0.0014608731832552156,0.7599350609982097
"Most 
people in the computer industry say that living in Microsoft's world 
means routinely making accommodations to it.",110.4,0.0012156257964488436,70,-0.02336929009465956,0.001444807806816571,0.7454722806073386
"Microsoft's power emanates 
from its near-monopoly on the market for personal computer operating 
systems, the master control programs that run computers.",179.4,0.00186509313461729,102,-0.07627119335939901,0.0014335150315884608,0.7622613372527227
"``Because 
it owns the operating system, Microsoft is the essential utility of 
the information age,'' said James Moore, president of Geopartners 
Research Inc., a technology consulting firm.",149.04000000000002,0.0009078209837260091,119,-0.03409677442699573,0.0014463759418583998,0.5118109862873513
"``It acts as a kind of 
gatekeeper to the pipeline of computing innovation, sitting there 
and deciding whether to help some innovation or slow it down.''",32.2,0.0008974787431965222,65,0.0009094676180501479,0.0013154532962406879,0.7482175992949939
"For 
months, Microsoft and Netscape had talked on and off, circling each 
other warily.",4.6000000000000005,0.0010966495397203326,38,-0.02061655948396428,0.0013085526475438269,0.7066955198574747
"But the event that would define them as unflinching 
rivals was a meeting on June 21, 1995, in a second-floor conference 
room at Netscape's headquarters in Mountain View, Calif.",57.04,0.001057946575694526,102,-0.010147530663980161,0.0013799060177444465,0.7689335077412554
"That meeting, 
according to the Justice Department and 20 states suing Microsoft, 
was the high-tech equivalent of the storied gatherings in smoke-filled 
railroad cars that inspired passage of the nation's antitrust laws 
a century ago.",106.72,0.001288169960736708,138,0.04967455214046537,0.0014499035033906807,0.5402217194920454
"On that day, they say, Microsoft made Netscape an illegal 
offer to divvy up the market for Internet browsing software, a collusion 
pact that Netscape rejected.",127.88000000000001,0.002084909353779592,96,-0.04985689258612509,0.0013716528391134394,0.7652695176756488
"Microsoft replies that the prosecutors 
are misinterpreting a routine meeting in the software business and 
that the company has never tried to divide the browser market.",295.32,0.0017591229330323757,92,-0.050620640186314285,0.001452419041579235,0.398236558282961
"Bill 
Gates, Microsoft's chairman and principal strategist, did not attend 
the Mountain View gathering, but he consulted by telephone with the 
Microsoft team.",34.04,0.0014355982895655729,97,-0.006964208646055527,0.0014018478190432231,0.7605963386081425
"Two people who did attend that June meeting have been 
named as witnesses in the trial scheduled to begin next week: Netscape 
president James Barksdale and Daniel Rosen, Microsoft's general manager 
of new technology.",142.6,0.002112813429982019,131,-0.012627475441979851,0.0014125378956211959,0.6455652181741343
"In the trial, the government will contend that 
Microsoft presented Netscape with an all-or-nothing offer, according 
to people who have been questioned in the federal investigation.",147.20000000000002,0.0018848297322823578,99,-0.0007943503157513696,0.0014866484161684705,0.7466534568105834
"Relying 
heavily on notes taken in the meeting by Netscape executive vice president 
Marc Andreessen and on the testimony of Barksdale, prosecutors are 
expected to assert that the Microsoft proposal had several elements, 
both incentives and requirements.",94.76,0.0015390338098939052,147,-0.016796251862028117,0.0014135378857622124,0.7725640127697158
"Microsoft, according to the people 
questioned by the government, would invest in Netscape, taking a 15 
to 20 percent stake, give Netscape technical information and fine-tune 
Microsoft's operating systems so that Netscape's software would run 
better on Windows.",250.24,0.003776474474571975,157,-0.07536876031239137,0.0014828678608665828,0.7714747861201755
"In return, the people say, Netscape would give 
Microsoft a seat on its board, license its technology to Microsoft, 
give Microsoft advance knowledge of its product-development efforts 
and not make a browser for the next generation of the Microsoft operating 
system, Windows 95, which was shipped two months after the June 1995 
meeting.",340.40000000000003,0.0026959381416671534,199,-0.06205433408995565,0.0015053132432681193,0.779784530927749
"And Microsoft, the people added, did what it has always denied 
it does _ used access to its technology as a powerful lever in business 
negotiations, by offering Netscape preferential access to the Windows 
``application program interfaces,'' or APIs, the links that enable 
other companies' programs to run smoothly on the Windows operating 
system.",256.68,0.0019453192168698914,194,-0.06244963711702616,0.0014367151293562459,0.7797649284485911
"By turning down the deal, Netscape, they say, would not have 
that preferred access to Microsoft technology _",55.2,0.0019527681498012813,47,-0.0359049706165094,0.0014088830898576594,0.7279510214365379
"a threat that Microsoft 
fiercely denies making.",12.88,0.0015691952493186096,31,-0.008551728004644212,0.0013544940029349385,0.7014946711861902
"Barksdale, Netscape's 55-year-old chief executive, 
told a colleague that the encounter with Microsoft in June 1995 was 
``the damnedest meeting I've ever attended in 35 years in business.'' 
",122.36,0.0015251689792407188,114,-0.01613130447586668,0.0014035228733256166,0.7710484496004506
"Had Netscape accepted Microsoft's offer, it would have had Microsoft's 
money and its endorsement.",22.080000000000002,0.0011896105283355784,53,-0.01918130142430726,0.0013325567583687553,0.7270018370349182
"Netscape would have also been free to sell 
its browser for use in earlier versions of Windows and for use on 
other operating systems like Apple's Macintosh and Unix, a powerful 
system used mainly in corporations and research labs.",211.60000000000002,0.0016479305804300718,110,-0.07505636107751051,0.0013627228459824928,0.3918784219833898
"``But if we 
had licensed our technology to Microsoft and stepped aside, the best 
we could have hoped for was becoming a company with sales of $100 
million or so and hoping to be bought out by Microsoft,'' said Clark, 
a former computer scientist at Stanford University who founded Silicon 
Graphics Inc., a computer graphics pioneer, before starting Netscape. 
",210.68,0.0012749005228137515,165,-0.02947992697434622,0.0014333676938595465,0.5200262518815147
``We didn't start Netscape for that.'',11.96,0.001681763125738144,13,-0.04025001881975518,0.0012005522505963411,0.5858098356640652
"For any company, a meeting 
with Microsoft is often a charged affair.",91.08,0.001650195540903362,32,0.0007495140305250902,0.0014276810239744464,0.378177262095222
"Every computing device from 
keyboards to disk drives, and every software program from games to 
browsers, must mesh smoothly with Microsoft's Windows operating system. 
",160.08,0.0015099096322759686,98,-0.06608985606600364,0.0012589698478575253,0.7631219406776766
"This is necessary to make computers reliable and easier to use, but 
it also gives Microsoft its role as the industry's gatekeeper.",65.32000000000001,0.0012545908031925605,55,-0.02003926597757657,0.0014279894568874983,0.682819470543931
"And 
since Microsoft itself makes all manner of software products beyond 
the operating system, other companies are put in the uneasy position 
of requiring Microsoft's cooperation to be able to compete against 
it.",180.32000000000002,0.0022953613834592874,107,-0.05012241874724518,0.0014788912485020165,0.759556264737499
"And in the software industry, where every program is rendered 
in the digital code of 1's and 0's, the lines that divide competition 
and cooperation are often blurred.",126.04,0.0005481205302026483,80,-0.01773390813162883,0.0013136007002956208,0.54935016514927
"The talk about that line at the 
Microsoft-Netscape meeting focused on the division between the operating 
system _",136.16,0.0026561913403741503,61,-0.059717236929028035,0.0014683691133071108,0.43301282317525935
"the ``platform,'' in computer terms _ and the application 
programs, sometimes called ``solutions,'' that run on top of the operating 
system.",185.84,0.0014906807933177247,71,-0.05858816450904385,0.0014452558771909734,0.7323767833087036
"The government suit states that in sworn testimony, Chris 
Jones, a Microsoft manager who attended the meeting, ``admitted that 
Microsoft `absolutely' intended to persuade Netscape not to compete.'' 
",148.12,0.0025783169402831436,125,-0.0199402138395762,0.0014312368743554103,0.7690737485690734
"Microsoft reads Jones' testimony very differently, as evidence mainly 
of the company's clarifying its position.",101.2,0.0009724456038690827,68,-0.0015369942747064885,0.0013819681110913069,0.731107705535397
"If Netscape stayed on the 
applications or solutions side of the operating system, the two companies 
could be partners, Microsoft said.",109.48,0.0028972334259271546,73,-0.06355280879711384,0.0014403973414816318,0.7351430175217729
"But if Netscape tried to become 
a player in the platform space, they would compete.",34.04,0.0012627055188069603,34,-0.04270081168416944,0.001269827047459226,0.7065967500921173
"Microsoft released 
portions of the Jones deposition in September as evidence that the 
government had quoted the Microsoft manager out of context.",94.76,0.0011346049713231194,94,-0.0007802613818384315,0.0014120798239055828,0.388748763518603
"Q. Do 
you recall any discussion about a desire of anybody on the part of 
Microsoft who was participating to be able to persuade or influence 
Netscape not to compete?",54.28,0.0009301544665183198,78,-0.02470258758271583,0.0013946181881960434,0.7452112726982256
A. Absolutely.,0.0,0.0007301980263429187,10,-0.0007872224813707861,0.0008840231916643591,0.5128190473600343
"But again, persuade in the 
sense of force or persuade in the sense of, hey, we think we can have 
a great business relationship together.",96.60000000000001,0.001010656206037334,59,-0.0050350279227408664,0.001325600821294251,0.7433064723798942
"Later in the deposition, a 
Justice Department lawyer asked Jones whether any of the Microsoft 
executives intended to suggest that ``there would be any consequences 
to Netscape or its business if Netscape chose to go in the platform 
direction you've described earlier as opposed to the solutions direction.'' 
",86.48,0.0020342527733577336,158,-0.01864594016103104,0.0014724197117040173,0.7728568279016482
"Jones replied: ``The conversation was something like the following: 
`We're in the platform business.",58.88,0.0009483883735505144,38,-0.02569820498879051,0.0013288326331816367,0.7006751298866404
"We're going to invest heavily in 
this part of the platform because we feel it's critical to our technologies. 
",40.480000000000004,0.0007706297914027143,47,-0.02102337753912348,0.0013754042661071116,0.718877408645548
That's a done deal.',14.72,0.0005802912434278539,4,-0.018413541473757598,0.0012216588744306193,0.525803195498957
"And we're asking them: `What is your business? 
",42.32,0.002057081383370689,8,-0.021044359201210745,0.0012661534062785268,0.5156740181513925
Is your business platforms or solutions?,43.24,0.001027539270894373,24,-0.035602430044147336,0.0013079305592869292,0.49985465341235563
"If it's platforms, we're 
in the platforms business.",44.160000000000004,0.0008911181162564798,24,-0.03993091614720331,0.0011845752408549588,0.6601139216529027
We're competing.''',0.0,0.0006991405847115547,7,-0.019871082642552104,0.0009391442409920809,0.5323647350555092
"Microsoft portrays 
such comments as innocuous statements of fact.",9.200000000000001,0.0008384287787942268,45,0.005206544871330592,0.0012940795387652707,0.7200825934204405
"But to Netscape, the 
same remarks could be taken as a warning, if not a threat.",12.88,0.000775307054003252,24,-0.01609366882291097,0.0011457804506924507,0.6294576409941234
"This is 
because Internet browsing software had the potential to become an 
alternative platform to the Windows operating system.",163.76000000000002,0.002027096634372178,71,-0.0932968376098551,0.0013370336566581418,0.4486406729575383
"The browser, 
sitting on top of the operating system, could supplant Windows as 
the main desktop screen on users' machines and the main layer of programming 
for starting other software applications.",272.32,0.0011365059888936806,114,-0.06795082233825102,0.001338666329365483,0.5077612999808799
"In addition, Netscape's 
browser could serve as a powerful platform for distributing and running 
Java, an Internet programming language developed by Sun Microsystems 
Inc., a Microsoft rival.",124.2,0.001910798958062996,123,-0.05230790868364403,0.0013344606072188808,0.6366650226376755
"In technical terms, Netscape's upstart platform 
could replace Microsoft's APIs as the essential utility of computing. 
",28.52,0.0012312640859203554,81,-0.021453682144778857,0.0012986946833302248,0.7529387828156012
"Indeed, Andreessen had boasted in public of Netscape's ambition to 
relegate Microsoft's Windows to so much software plumbing underneath 
the browser.",138.0,0.0008159283610656506,93,-0.04885818968589112,0.0011825292899367693,0.7571697076304865
"By the June meeting, Microsoft certainly viewed Netscape 
as a serious potential challenger to Windows, the corporate crown 
jewel.",33.120000000000005,0.0011771148096828999,76,-0.037868317380938855,0.0014126704570409212,0.44711706002426227
"On May 26, 1995, in an internal memo, ``The Internet Tidal 
Wave,'' Gates wrote: ``A new competitor `born' on the Internet is 
Netscape.",37.72,0.0010425687506781588,74,-0.028387393123710233,0.001398098115381173,0.7532946759149133
"Their browser is dominant with 70 percent usage share, allowing 
them to determine which network extensions will catch on.''",113.16000000000001,0.0007863077587028347,69,-0.019039337827447215,0.0013864498450039244,0.7480543197728607
"Netscape's 
strategy, Gates wrote, was to ``move the key API'' into the browser 
``to commoditize the underlying operating system.''",193.20000000000002,0.0014173194664286726,76,-0.0523668667896157,0.0013664694075946823,0.74817842545977
"THE BROADER INQUIRY: 
",0.0,0.0006557624666029362,12,0.0021029125388488086,0.0010787447766784817,0.43181802364084815
"GOVERNMENT SEES ARM-TWISTING The federal government and the states 
have recently broadened their allegations against Microsoft by adding 
evidence that it tried to bully Intel, Apple Computer Inc. and other 
companies to squelch competition.",130.64000000000001,0.0021755339262454656,137,0.004892837731939518,0.0014887546907628674,0.7715780330674566
"They say that like the Netscape 
meeting the new evidence fits a pattern of behavior by Microsoft, 
which has repeatedly tried to limit competition by strong-arming competitors 
and partners.",74.52000000000001,0.0013017830068708391,103,-0.011748712699362738,0.001472047011327437,0.6474906131595938
"One episode that fits the pattern, the prosecutors contend, 
was an effort by Microsoft to pressure Intel to shelve the development 
of multimedia and Internet software and to limit its cooperation with 
Netscape.",95.68,0.0014443322383337674,129,-0.03790368755090557,0.0014559097076098711,0.769115020578587
"Intel's main business is making the microprocessor chips 
that act as the electronic brains of most of the computers that run 
the Windows operating system.",190.44,0.0019297944820873595,89,-0.07657416497786465,0.001401514693591317,0.6213897051481934
"Indeed, the fortunes of Intel and Microsoft 
are so closely aligned that the two companies are sometimes referred 
to as a single, powerful entity, ``Wintel.''",22.080000000000002,0.0007905884817842002,71,-0.008181945641614822,0.0013395887079844706,0.7537702752162163
"But Intel also employs 
hundreds of software engineers, mainly at its Intel Architecture Labs 
in Hillsboro, Ore.",48.760000000000005,0.0009595272390276293,66,-0.017771260320063646,0.0011107287641881072,0.7450800153500884
"And while Intel and Microsoft are partners, they 
have also had their conflicts, typically over the direction and pace 
at which certain innovations should be introduced into the personal 
computer industry, which they dominate together.",98.44,0.0015389581871112423,102,-0.03318620990726457,0.0014404374067807856,0.7599690470452376
"Federal and state 
investigators have focused on Microsoft's strong reaction to work 
being done by Intel's software engineers _",77.28,0.0013479265041333873,77,-0.01285179803251402,0.0014490431091970012,0.7514005205152794
"a sentiment expressed in 
no uncertain terms during a meeting at Intel's Santa Clara, Calif., 
headquarters on Aug. 2, 1995.",57.96,0.0006873486952278363,73,0.004749028394767419,0.0013016331919933205,0.7570361882757449
"The contentious session was attended 
by several executives from Intel and Microsoft, including Gates and 
Intel chairman Andrew Grove.",14.72,0.001472413433229686,83,-0.01607596342980719,0.0012860443962710738,0.7575851597208934
"An internal Intel memo stated that Gates 
made ``vague threats'' about supporting Intel's competitors and that 
he was ``livid'' about Intel's ``investments in the Internet and wanted 
them stopped.''",17.48,0.0017422025084407808,99,-0.013518820738084232,0.0014674929550009944,0.7644362951766669
"Later, Intel did pull back from its multimedia and 
Internet software development.",71.76,0.0012928092768885863,50,-0.03671201828931423,0.001359368857965034,0.7213411758149545
"Steven McGeady, an Intel vice president 
who attended the August 1995 meeting, is scheduled to appear as a 
witness for the government.",128.8,0.001270072112892343,79,-0.006929344691437669,0.0013173255770956075,0.7510303762260602
"Microsoft replies that the government's 
accounts of meetings like those with Netscape and Intel are fanciful 
distortions, created by using a biased selection of documents and 
witnesses.",66.24000000000001,0.0016417019022020927,105,-0.021642404185573623,0.0013962213001985373,0.7635939685037899
"The government's case, Microsoft asserts, betrays an utter 
failure to accept the computer-industry reality that Microsoft routinely 
meets with companies to make sure their software and equipment will 
work well with Windows.",241.96,0.0020445286475314394,137,-0.02263935969174254,0.0014947739084989083,0.7732504591750063
"Sometimes the talks, Microsoft says, go on 
to include further levels of cooperation like licensing technology 
or a Microsoft investment, as the company discussed with Netscape. 
",122.36,0.001645124239899743,96,-0.031510475825806614,0.0014215746862842515,0.4645504340267764
"In the trial, Microsoft is expected to argue its advance in the browser 
market was the result of its own business acumen and Netscape's missteps. 
",196.88,0.0017626803501717477,80,-0.025533254889400635,0.0014267685058027963,0.6438629713340096
