Sent,Tm,Lex,Luhn,Lsa,Tr,LDA
"U.S. intelligence officials say they now believe that 
bin Laden was in the camp on the day of the attack, but he appears 
to have left unscathed before the missiles hit.",129.72,0.006412552688986875,71,0.08390901066559081,0.0045819593095396335,0.7409786959124824
"Officials said there 
were reports that at least one of his senior lieutenants may have 
died in the attack, and that total casualties in the complex were 
between 50 and 100.",36.800000000000004,0.003439668766048117,64,0.0686235994423347,0.00438590455189628,0.7520480533281405
"Administration spokesmen have drawn a distinction 
between attempting to kill a specific person like bin Laden and attacking 
a group of people who command a terrorist organization.",140.76000000000002,0.006656516701991864,116,0.02456019127571335,0.004718465796809578,0.7616303539216382
"Administration 
officials have denied since August that the raid was intended to kill 
bin Laden, a Saudi exile who has been charged by federal prosecutors 
with leading a global war against U.S. interests.",106.72,0.007327036187631467,108,-0.013232300310722565,0.004786472780173041,0.4699946212219665
"He has been linked 
to the Aug. 7 bombing of two U.S. embassies in East Africa.",23.0,0.006043407000518242,32,-0.05795898079803036,0.004027467223065491,0.7161793929927667
"But a 
less subtle explanation was offered on Oct. 13 by Defense Secretary 
William Cohen, who said during a visit to Saudi Arabia that the United 
States had been ``going after'' bin Laden and his colleagues.",79.12,0.005975496706150725,100,-0.003666304873621197,0.0045130875315254615,0.7681852618531884
"``We 
weren't quite successful,'' Cohen continued, ``but we sent a message.'' 
",1.84,0.0025831065312428942,30,-0.0007060383167745525,0.0042120942010582165,0.6927211871500027
"Kenneth Bacon, the Pentagon spokesman, said the secretary had not 
retracted his statements.",7.36,0.001988624964760645,54,-0.0007875949695558302,0.00352457309356243,0.7296380166113037
"The Los Angeles Times recently reported 
that the administration believed that it had a legal right to use 
deadly force against terrorist leaders.",46.92,0.005255188802454013,80,0.05931501682385746,0.004638074823679919,0.7541643553878207
"Bin Laden's organization was 
a significant concern for the Clinton administration even before the 
bombing of the U.S. embassies in East Africa.",40.480000000000004,0.006105894841721647,85,-0.04751637181508966,0.004604644142702907,0.7501616268071688
"Last spring, officials 
said, U.S. intelligence considered a daring raid into Afghanistan 
to capture the Saudi exile.",26.68,0.0030394959668534325,70,0.016578460323201216,0.004593214719139779,0.7459974835046367
"Officials said that at roughly the same 
time, the White House drafted the legal justification for military 
attacks against a terrorist leadership.",46.92,0.004035767534082789,85,0.1540804843018834,0.004659910138447722,0.7541311038383975
"That review, officials said, 
provided the legal basis in August to fire cruise missiles into the 
meeting at which it was believed bin Laden and his lieutenants would 
be gathered.",92.0,0.006976470976403167,92,0.07180046225238668,0.004701366795361655,0.7621101830089811
"The review, by the National Security Council, was the 
basis for saying this operation did not violate the presidential order 
banning assassinations.",18.400000000000002,0.0049836942746419146,83,0.018327059568624796,0.0043972463620765125,0.7491737982593517
"That ban was imposed by President Ford in 
1975, after congressional investigators uncovered evidence that the 
CIA had plotted to assassinate Fidel Castro, the Cuban leader, and 
others.",29.44,0.0019853718279951135,106,0.041334454048541,0.004299353149490321,0.7664022288357075
"The order said: ``No person employed by, or acting on behalf 
of the United States government shall engage in, or conspire to engage 
in, assassination.''",29.44,0.0026883296080664316,81,0.02628065668244013,0.0042992240276463626,0.7553863001051607
"While it is, on its face, a sweeping and unqualified 
ban, it has been subject to interpretation and intense debate over 
the years.",14.72,0.002187342059945827,64,0.0003727485982478777,0.003969902898595255,0.7445746409122207
"In 1986, the Reagan administration responded to a terrorist 
attack against U.S. soldiers in Germany with a bombing raid on Libya. 
",80.04,0.004246418981933718,76,0.04052089808605134,0.004429931178185781,0.745753416099803
"The targets included the residence of the Libyan leader, Moammar Gadhafi. 
",5.5200000000000005,0.0024189029572604837,48,0.015266007267898448,0.0037399183793368567,0.728979664031963
"And in the Gulf War, U.S. forces used powerful bombs in an attempt 
to kill Saddam Hussein, the president of Iraq.",19.32,0.0025518467547037305,61,0.02573454131496118,0.004418201004962204,0.7428988099715527
"The legal review conducted 
by the White House would appear to provide a precedent for future 
operations in similar circumstances. 
 
",21.16,0.00244720071390411,78,0.07268804549919994,0.0043054526921291756,0.7541588729337243
"Sometime in the summer of 1997, an operative for Osama bin Laden sat 
down at his personal computer in a hideaway in Kenya.",91.08,0.0032933015771862296,64,-0.05899174827885206,0.00430451300184804,0.7524636495040871
"He was worried, 
he wrote in an angry dispatch, about the security of the ``East Africa 
network'' of bin Laden, the Saudi exile accused of masterminding a 
worldwide terrorist conspiracy against Americans.",126.96000000000001,0.007075964640767525,121,-0.07733026331941197,0.0046069634187196696,0.5989821049800998
"The organization, 
the author complained, had declared war against the United States, 
yet he had learned of that only from the news media.",22.080000000000002,0.004723135427540336,63,0.018759207348705797,0.004427846909490685,0.7460005446526851
"The writer, who 
federal authorities believe was Haroun Fazil, who was to become one 
of the central suspects in the bombing of the U.S. Embassy in Nairobi 
a year later, noted with alarm British press reports about the arrest 
of an aide to bin Laden.",134.32,0.005898945685668049,117,-0.0927821647873373,0.004607777169243646,0.7696772539912967
"Striking almost bureaucratic tones, he said 
he was worried that ``an important man with close links'' to bin Laden, 
seemed to have ``fallen into the enemy's hands.''",92.92,0.0030311941259332418,70,-0.0410390929919599,0.004502861324841086,0.7573298292636341
"He said the Americans 
were breathing down the necks of his associates in Nairobi and that 
he had to take precautions.",4.6000000000000005,0.003592414612298057,47,-0.027410453523098847,0.0036542580523100067,0.7172873247845756
"``The cell is at 100 percent danger,'' 
the operative warned.",24.84,0.005125515457358472,33,-0.021796749935572228,0.004132634644405222,0.7122735137283907
"The letter, an extraordinary bit of digital 
evidence in a cloak-and-dagger case, was retrieved from a computer 
in a house where Fazil had been staying, according to papers filed 
in U.S. District Court in New York City.",38.64,0.0039942380950254725,120,0.007283799747656776,0.004364472826187759,0.7684035594266239
"The papers said the computer 
was seized in August 1997 in a raid by Kenyan authorities that was 
attended by an FBI agent.",19.32,0.0035263916766897353,61,-0.019039413041276706,0.0045003062198246055,0.7512490930540041
"The documents did not make clear whether 
the FBI had translated and read the document before or after the bombings 
of the U.S. Embassies in Nairobi and Dar es Salaam, Tanzania, on Aug. 
7 of this year.",35.88,0.00560919300930743,89,-0.05994868022722469,0.004227501562634505,0.7644502544228908
"The timing is potentially important because there 
have been mounting questions since the bombings about whether the 
United States adequately followed up warnings of a possible terrorist 
attack on American targets in Kenya.",53.36,0.00606002534572866,107,0.0646078092851456,0.004607744332095688,0.7634024635551677
"Officials of the FBI and the 
U.S. attorney's office in New York City refused to say Tuesday night 
at what point FBI agents learned of the computer file, nor would they 
make any other comment.",23.92,0.003939264654422347,93,0.01229239522969095,0.0043976254607771435,0.7676365645468461
"Fazil eluded American investigators after 
the bombing as he traveled from Kenya to his home in the Comoros Islands 
and then to the Middle East.",19.32,0.002792682580880404,73,-0.03110957549984351,0.004149860269829104,0.755238856973699
He remains a fugitive.,1.84,0.0028743612477677544,14,-0.0008909831147684055,0.0035422448861325718,0.621646990474356
"The dispatch provides 
a remarkable insight into the workings of a terrorist network in the 
twilight of the 20th century.",38.64,0.0018436558282075766,67,-0.0007485114849825583,0.004063857919775851,0.7452553516100071
"The author talks of how he and his fellow 
operatives follow events on CNN and use the Internet to communicate. 
",10.120000000000001,0.002294194456864463,58,-0.010757960048396503,0.0040716087558413175,0.744834833008501
"He refers to himself as the media information officer of the East 
Africa cell and complains that he is not being kept in the loop on 
big decisions.",14.72,0.0027477218106682307,65,-0.033346718448564856,0.004433024124341412,0.7536458195983164
"Along the way, in an almost casual fashion, the document 
seems to confirm two of the central charges of the federal case against 
bin Laden: That he had planted a terrorist cell in Nairobi and that 
his operatives carried out another of the crimes laid at bin Laden's 
door by federal authorities _",209.76000000000002,0.0063073149984498025,135,-0.06835537775068824,0.004698618908587922,0.7763683323126586
"the attacks on American soldiers in 
Somalia in 1993 and 1994.",3.68,0.002657832701299125,36,0.03869871010788925,0.004225286735548365,0.7203035687369393
"The writer of the document warned that the 
followers of bin Laden, whom he referred to as ``the sheik,'' had 
``become America's primary target.''",91.08,0.003067719611225392,66,-0.03920896387965397,0.004415132623209382,0.7539976407420397
"He said his comrades in East 
Africa ``should know that there is an American-Kenyan-Egyptian intelligence 
activity in Nairobi aiming to identify the names and residences of 
the members who are associated with the sheik since America knows 
well that the youth who lived in Somalia and were members of the sheik's 
cell are the ones who killed Americans in Somalia.''",44.160000000000004,0.004544303097519356,164,-0.03882730392508501,0.004586867357203599,0.7774743289959087
"``They know that 
since Kenya was the main gateway for those members, there must be 
a center in Kenya,'' he wrote, concluding: ``We are really in danger.'' 
",7.36,0.003043205808052105,52,-0.029642823236759135,0.004238697712452945,0.742705925162391
"The government has asserted that one of Fazil's duties was to prepare 
and transmit reports to bin Laden and his top lieutenants.",89.24000000000001,0.004399671095344996,67,-0.030264397380315663,0.0044979931029398516,0.7431657454680728
"Federal 
authorities said that Khalid al Fawwaz, a London-based associate of 
bin Laden, directed Fazil to ``report periodically to bin Laden about 
the ``security'' situation of the cell.",190.44,0.007209637618893368,116,-0.08732888714952634,0.004517161593898547,0.4321092744076442
"Fawwaz, who served as an informal 
press spokesman for bin Laden in London, was arrested by British authorities 
in September after the embassy bombings.",99.36,0.0040394534295231,92,-0.07534845340010564,0.004579703565574008,0.7595873683191272
"He has denied any connection 
to terrorist activities.",30.360000000000003,0.0034240507386395277,31,0.021390088050731677,0.004157309109862141,0.48268276068411775
"A translation of the report was part of a 
package of documents American prosecutors have sent to Britain to 
support the extradition of Fawwaz for trial in New York.",40.480000000000004,0.003458718341627247,94,-0.032910479732359964,0.004473071631686212,0.7532992738383864
"It is not 
clear from the materials whether the report in the computer was forwarded 
to bin Laden.",101.2,0.004326111578775168,42,-0.05929037767166188,0.004471239874118002,0.5608607695546505
"The documents, which were initially filed in secret, 
include a federal complaint that accuses Fawwaz of conspiring with 
bin Laden to kill Americans overseas.",103.96000000000001,0.004866825703198647,99,-0.062061461668860785,0.004533258371172496,0.7625959445091999
"A second count charges him with 
soliciting others to do so.",0.92,0.0016778774904244338,18,-0.0041085837766963295,0.0033005560564881905,0.6532836870272548
"The report made clear that the organization 
was being run on a shoestring.",35.88,0.0030271511829040587,40,-0.018804325668058515,0.004320770907421199,0.71774530570171
"Its author wrote that his mother has 
fallen ill, and that he would like to return to his homeland for a 
visit.",13.8,0.004445691723251266,40,-0.009093420113107127,0.0040366905122278035,0.7160554035137987
``What do you think?,0.92,0.004489795918367347,0,0.0,0.0006484841025681112,0.26666666666666666
Keep in mind we only have $500.'',1.84,0.004489795918367347,7,0.001178584668568046,0.0035013238695897667,0.6213289626169205
"He repeatedly 
expressed his fears of American intelligence, which he believed was 
in the midst of a worldwide search for bin Laden and his associates. 
",94.76,0.0028583151646578956,86,-0.023245818967286433,0.004567244958337709,0.7482108378479345
"``There is a war and the situation is dangerous,'' he said.",9.200000000000001,0.002174114575865857,21,-0.0029457028943594274,0.003922779343521985,0.6637370396381912
"He wrote 
that American forces kidnapped anyone who threatened the national 
security or American citizens.",15.64,0.004519451332382085,63,-0.005004828507418207,0.004374871509704012,0.48306292580401655
"The author noted with alarm a recent 
CIA operation in which a man accused of shooting agency employees 
had been lured across the border in Pakistan and returned to the United 
States for trial.",38.64,0.004071353081074974,102,0.0009619493045434584,0.0047159177447386996,0.7698468179940768
"According to federal authorities, Fazil went on 
to play a pivotal role in the bombing of the Nairobi embassy.",45.080000000000005,0.004163983048129615,57,-0.0651645012454512,0.00431955831690516,0.7431569456690615
"Prosecutors 
assert that he rented the villa where the bomb was assembled and surveyed 
the embassy's security precautions.",36.800000000000004,0.001986366605523933,69,-0.012703322835325262,0.004161652704894986,0.7500616075623334
"On Aug. 7, they charge, Fazil 
drove a pickup truck to the embassy, leading the way for a vehicle 
carrying the bomb that killed more than 200 people, including 12 Americans. 
",51.52,0.004708196921039806,89,-0.02081779106120959,0.004247349236371731,0.7674134505356311
"The author of the report said that he stood ready to ``fight the forces 
of atheism and dictators who wreaked havoc on earth.''",30.360000000000003,0.002263332081751976,62,0.0018890656406870617,0.004223381306577738,0.7539308725542335
"He said that 
the group did not have to inform its Nairobi-based operatives of all 
its global plans, but they needed enough warning to go ``underground 
for a while'' if authorities intensified the pressure in Nairobi. 
",18.400000000000002,0.003362324419934138,94,-0.02606984979058566,0.004485665722640214,0.7629782096340016
"``We, the East Africa cell members, do not want to know about the 
operations plans,'' he wrote, `` since we are just implementers.'' 
 
",7.36,0.005002569692429221,49,-0.05197209905757143,0.004306897633748248,0.7384039850256185
"If Osama bin Laden ever stands trial in New York for the bombings 
of the U.S. embassies in Africa and other acts of terror, it is already 
clear who prosecutors will call as a chief witness: One of his senior 
aides who has been talking to U.S. investigators for two years.",103.96000000000001,0.005945949994381582,117,-0.0699973349985385,0.004691128214209399,0.7664747123740939
"The 
government has identified the aide in court papers with the pseudonym 
CS-1, saying the person pleaded guilty to terrorism charges in a secret 
proceeding in U.S. district court in Manhattan.",55.2,0.0062074541117883115,112,0.009595810510288676,0.004334209688957719,0.7683602940288261
"According to the government, 
the informant worked closely with bin Laden from 1989 to 1996, a period 
when prosecutors assert that bin Laden was ordering deadly attacks 
on U.S. soldiers in Somalia and elsewhere.",170.20000000000002,0.0067971528805470275,107,-0.025489790615226368,0.004708021695146289,0.7666288024777042
"From the court papers filed 
in the investigation of the embassy bombings in East Africa in August, 
it is clear that the informant has provided crucial information to 
federal investigators.",51.52,0.007407847161315941,115,-0.07237504547840422,0.0046124311550349685,0.6284358836182762
"They have cited the source in the papers filed 
to support the extradition of two associates of bin Laden who are 
under arrest in Germany and Britain.",103.04,0.006976222886710157,75,-0.052209711994256364,0.004540821920023735,0.7504997767886497
"Bin Laden, a Saudi exile, is 
thought to be living in Afghanistan.",4.6000000000000005,0.005149104267590598,38,-0.0936275315408044,0.004282592712168199,0.4458205984150511
"The source is also the basis 
for many of the significant charges in the indictment against bin 
Laden himself, including the assertion that he directed the attacks 
on U.S. soldiers in Somalia and that he attempted to obtain nuclear 
weapons.",97.52000000000001,0.00448224856491137,114,0.013195595773831883,0.0046448874976391654,0.7680436236265087
"It is not known whether the source is in custody somewhere, 
or hiding under government protection.",29.44,0.003299209134011838,37,-0.0009618285801499384,0.004393537618274045,0.6917114999561785
"As recently as 11 days ago, 
records show, the source swore to a 5-page affidavit before a New 
York notary summarizing his allegations against bin Laden.",98.44,0.0024568485257673842,92,-0.018445613015687135,0.00448014466101706,0.7619582941276147
"Government 
officials adamantly declined to say anything about the identity of 
CS-1, which stands for ``confidential source.''",18.400000000000002,0.004664748226268415,69,0.030947855510464695,0.004261428061686013,0.7388490975517997
"But at least one operative 
of bin Laden's group in East Africa concluded more than a year ago 
that he knew the identity of a crucial turncoat: Sidi Tayyib, a businessman 
who was married to one of bin Laden's relatives.",179.4,0.0066035145237730635,116,-0.06964223684308822,0.004509685276357211,0.7724496849007157
"The operative's concerns 
were inflamed by a report in a British newspaper that Tayyib was cooperating 
with Saudi and U.S. authorities.",36.800000000000004,0.005005880121882738,74,-0.04108696782635943,0.004307295268417984,0.7477837323403871
"In an August, 1997 article, The Daily 
Telegraph said Tayyib had been in custody in Saudi Arabia since May 
and had given intelligence officials details of bin Laden's bank accounts 
and businesses.",95.68,0.006282615585632557,108,0.006735455136139438,0.004558658217825944,0.7601228508926978
"The news of Tayyib's possible defection, the East 
African operative wrote in a report apparently intended for the group's 
commanders, ``almost made me explode.",45.080000000000005,0.0037853978621390717,92,-0.016766223781377636,0.00461153217050174,0.7597816677984977
"``An important man with close 
links to'' bin Laden ``seems to have fallen into the enemy's hands, 
and we have to take all the appropriate security precautions against 
that,'' the operative, Haroun Fazil, wrote in his summary of security 
concerns.",121.44000000000001,0.0059495232342740316,108,-0.07794803948038288,0.00466778545286581,0.7694324879853757
"Fazil has since been charged in the embassy attacks and 
remains at large.",20.240000000000002,0.006232722585190844,35,0.003497444865481073,0.004427946759717057,0.7161144786745862
"The report was typed on a computer seized last year 
by Kenyan authorities, according to a government filing last week 
in U.S. district court in Manhattan.",70.84,0.004743493421987772,86,-0.010497863835607055,0.004437109718387664,0.7595340056403868
"Thus far, U.S. prosecutors have 
charged at least six members of bin Laden's organization with terrorist 
activities or conspiracy.",110.4,0.010622800586694991,69,-0.06263078991233902,0.004440204309992059,0.7372254584285628
"In one recent filing, they said their case 
will in part be ``based on the testimony'' of the confidential source, 
suggesting that the informant has agreed to testify at any trial of 
bin Laden or his associates.",118.68,0.005592858207382624,101,-0.050229413411880634,0.004495576377570809,0.7630005897517987
"The arrangement appears to have resulted 
from a plea bargain in which the source is cooperating in hopes of 
receiving a lesser sentence.",18.400000000000002,0.0024194184195833845,72,0.009261645035256076,0.004238337722297706,0.7490288173273187
"There is no indication that the source 
has yet been sentenced and it seems likely that sentencing would take 
place after the investigation and ensuing trials are complete.",23.0,0.0026512006278374333,70,-0.008071552886718581,0.004066330512931918,0.7457194348325181
"In 
the affidavit prepared last week, the source acknowledged pleading 
guilty to terrorism charges in the United States and said they stemmed 
from attacks on U.S. targets, which were not specifically identified. 
",29.44,0.005987669783853799,112,0.07544927333194992,0.004600327381735542,0.7616059278122899
"The source described taking ``an oath of allegiance'' to follow bin 
Laden's orders, and gave a detailed account of bin Laden's group, 
including its history and inner workings.",176.64000000000001,0.003928912770888156,96,-0.044268139959943074,0.004628059753295155,0.7630275442849501
"The source told of private 
statements by bin Laden to other al Qaeda members, encouraging them 
to attack U.S. troops and other citizens stationed in the Middle East 
and Africa.",117.76,0.005183239773053121,97,-0.038536715214075874,0.004679441394270177,0.7689342897062468
"``I either heard these statements myself,'' the source 
said, ``or I read them or learned of them from other al Qaeda members.'' 
",23.0,0.003448233165575982,41,-0.016569742356517772,0.004498860051632402,0.7348090793758666
"The government has also said in other court papers that the source 
helped identify bin Laden's signature on a 1996 document urging Muslims 
to kill Americans.",136.16,0.0071827121002258545,92,-0.036922470882316566,0.004733552915888013,0.5598778985917809
"Tayyib's whereabouts are unknown and he could not 
be reached for comment. 
",5.5200000000000005,0.002473569932267474,37,-0.0012169961484172845,0.0039392283889747555,0.7095698784416667
