Sent,Tm,Lex,Luhn,Lsa,Tr,LDA
"In the last few years, Microsoft 
has offered its guidance during almost yearly meetings between senior 
Microsoft executives and leading venture capitalists.",31.28,0.0018759114103347185,84,-0.004877840523549142,0.001429917731389499,0.755840239761593
"The meetings 
are part of Microsoft's effort to improve its sometimes prickly relations 
with Silicon Valley.",23.0,0.0014239851293798714,61,-0.007580407545877646,0.001393756317925515,0.47403018340216196
"``We work hard to provide clarity about where 
we're going and where we're not going,'' said Greg Maffei, Microsoft's 
chief financial officer.",38.64,0.0008523651231560736,62,0.006422120693587252,0.001383212016711411,0.7439957957378636
"Last year's conference took place in October 
at the Quadrus office building on Sand Hill Road in Menlo Park, the 
Wall Street of high-tech venture investing.",69.0,0.0006027309911215632,103,0.005356896022623908,0.0013209063368367787,0.7700295430835887
"Maffei led a team of five 
Microsoft executives who appeared before a group of 40 venture capitalists, 
one of whom stood and asked the question that seemed to be on the 
minds of many of his peers: ``How do I invest in a company that stays 
out of the way of the steamroller?''",123.28,0.0014152127839924607,114,-0.013260062976874584,0.001459670300512409,0.7715157152137371
"Maffei, recalled one person who 
attended the meeting, stood up and delivered a brief lecture on businesses 
that Microsoft was likely to avoid.",44.160000000000004,0.0014185935831796134,72,-0.013065116059217877,0.0014202335756253199,0.7529720484026775
"His list included specialized 
software for manufacturing, human resources management, computer-aided 
design and others.",63.480000000000004,0.0006670564914644492,82,-0.01639265391300275,0.001357263385169684,0.7491241853555876
"But, this person noted, broad swaths of the industry 
appeared to be designated as off limits _ including new software platforms 
that might compete with Microsoft's personal computer operating system. 
",263.12,0.0023862163658542497,118,-0.06587099987867823,0.001467755134262731,0.7669658781733081
"At one point, Ruthann Quindlen, a partner with Institutional Venture 
Partners, leaned over to Vinod Khosla, a co-founder of Sun Microsystems 
and a partner at the venture capital firm Kleiner Perkins Caufield 
&AMP; Byers, and said quietly, ``I guess that leaves us washing machines 
and toasters.'' 
 
",68.08,0.00104512364964707,184,-0.00481259613630436,0.0011636751381951858,0.7807879712419128
"A federal judge Friday pushed back the starting date of the antitrust 
trial against Microsoft Corp. by four days, to Oct. 19, while also 
ordering the company to comply with the Justice Department's request 
to examine Microsoft's financial records.",191.36,0.0022755174110914104,143,0.03941862732544628,0.001458833321646632,0.5397640836964022
"Microsoft argued that allowing 
``an army of government attorneys to come in and make demands will 
make it very difficult for us to remain in business.''",181.24,0.0016830524808186045,78,0.0034853131488114786,0.0014768233531326806,0.6935028422256013
"But after winning 
assurances from government lawyers that they would make only narrow, 
targeted searches of the records, Judge Thomas Penfield Jackson of 
the U.S. District Court for the District of Columbia ordered Microsoft 
to open the database for perusal.",102.12,0.001290191921854383,144,0.03408962619161673,0.0014144646112610722,0.7753382937042383
"Microsoft had asked that the trial 
be delayed several more months to prepare a defense against what it 
said was a last minute broadening of the case by the Justice Department, 
which had added new evidence.",131.56,0.0022205105801643595,89,0.05322038001285206,0.001413611098459419,0.7592813360908831
"Last month, the government said that 
in the process of preparing for the trial it had discovered that Microsoft 
tried to persuade Apple Computer not to market its Quicktime multimedia 
software to Windows customers.",188.6,0.001556264876297057,119,-0.03127750219438053,0.001432537784659601,0.7670515032034481
"On Thursday, the Justice Department 
and 20 states added two new people to their witness list to testify 
about Microsoft dealings with Apple and with Sun Microsystems.",56.120000000000005,0.001371863213404028,94,0.025105306135479594,0.0014485605044641501,0.7622260824417968
"Avi 
Tevanian, a former Apple executive, was added to the witness list 
in part to describe Microsoft's proposal, which Microsoft denies ever 
having made.",65.32000000000001,0.001202445364291019,85,-0.0133807203620966,0.0014290846850662454,0.757641543116414
"The other new witness was James Gosling, a Sun executive 
who led the development of Java, an Internet programming language 
that Microsoft sees as a potential threat to the company's dominance 
of the software market.",231.84,0.0021733338589406495,132,-0.03820952356957539,0.0014687634777984418,0.6577164312758041
"The government is charging that Microsoft 
took illegal steps to prevent Java from gaining wide acceptance.",84.64,0.0011396635285412446,65,-0.0025842157441737707,0.0014319897718757513,0.7473093057908168
"To 
counter that, Microsoft named two new witnesses Friday, Robert Muglia, 
a senior Microsoft executive who has worked with Sun, and Chris Engstrom, 
an executive who handled some of Microsoft's dealings with Apple. 
",80.04,0.0014184299012912989,125,-0.010697923350599015,0.001407699869890077,0.7701617088735889
"At the same time, John Warden, Microsoft's lawyer, argued that the 
new allegations had no place in the case.",126.96000000000001,0.0008972952245764631,54,0.030321081647090402,0.0013110646238039007,0.741749065813699
"The Justice Department, 
Warden told the judge, was ``trying to turn this into something approximating 
a plenary monopoly case like the IBM case.''",196.88,0.0021625211284033614,73,0.06054655501296447,0.0013669847616954289,0.4925197473523095
"``It becomes clearer 
and clearer and clearer with each new filing that they are trying 
to turn this into a broader case,'' he said.",92.0,0.0009433023602021198,34,0.04063982536050935,0.001369992335839862,0.7191960169446919
"``You can't have this 
bait-and-switch in which they file a complaint alleging A, B, C, and 
then talk about the whole alphabet three times over.''",33.120000000000005,0.000912506524018782,50,0.0023131606111794424,0.001381676857992746,0.7383745095211136
"As a result, 
Warden said, Microsoft wanted, at a minimum, another two-week delay, 
even though ``a more normal schedule'' would have the trial start 
next year.",87.4,0.0013066797395373563,73,0.012886026103452955,0.0014298035374909622,0.7556618768142285
The judge did not respond.,11.040000000000001,0.0006160244650158874,12,0.008443932266641672,0.0010875423809414517,0.45693976032580946
"Instead he entered an order 
setting the Oct. 19 trial date.",31.28,0.0006493534327927605,27,0.0121453115239818,0.0012504248943330926,0.693312793223236
"Late Friday, Microsoft entered a formal 
motion asking for another two-week delay.",6.44,0.0007652382107750467,49,-0.00022046809291879584,0.0014070959594997762,0.729993215242694
"A response is expected next 
week. 
 
",13.8,0.0010202609330793725,18,0.0017499278350478025,0.0013374324417111112,0.644397148723427
"Microsoft Corp. has said that material in an unpublished book by two 
business school professors will be a crucial part of its defense in 
the antitrust trial scheduled to begin next week.",192.28,0.0020472656497289203,108,0.021975078315605828,0.0014516957051675793,0.7607038808280072
"But judging from 
an advance copy of the manuscript, the Justice Department and 20 states 
that are suing the software giant will find support for their arguments 
in the book as well.",105.80000000000001,0.0014669381391427764,89,0.027304494452018786,0.00145478242021573,0.7505327542044831
"To cite one example, Microsoft contends that 
its industry-standard Windows operating system and its Internet Explorer 
browser are a single integrated product.",225.4,0.0031186292777466637,103,-0.06138416953262951,0.0014174931599863097,0.760534346814763
"In its suit, the government 
asserts that they are two separate products that Microsoft bundled 
together to get an unfair edge over its rival, Netscape Communications 
Corp., in the market for software used to browse the Internet's World 
Wide Web.",209.76000000000002,0.002112269050866493,131,-0.03482985226192684,0.0014380963763764344,0.7713440343911192
"In ``Competing on Internet Time: Lessons from Netscape and 
Its Battle with Microsoft,'' the authors, Michael A. Cusumano of the 
Massachusetts Institute of Technology's Sloan School of Management 
and David B. Yoffie of the Harvard business school, quote a Microsoft 
executive as saying that only with the third version of Microsoft's 
browser was it integrated with Windows.",170.20000000000002,0.0016225325404878688,216,-0.04761759204645808,0.0014001038330556808,0.5311406654518761
"Microsoft hurried its first 
browser offerings into the market, the book says, in its race to catch 
up with Netscape, then took a more ambitious approach with Internet 
Explorer 3.0, which was introduced in August 1996.",148.12,0.0016106549891259762,110,-0.047640549267581295,0.0014170924942422615,0.467307711150463
"In that version 
it changed its software design to use programming modules, or components, 
that could be put together and rearragned like building blocks.",73.60000000000001,0.0009843153165045514,75,-0.011853101740883958,0.0013410131260737223,0.74849787389053
"In 
the book, Ben Slivka, a Microsoft general manager, is quoted as saying, 
``IE 3.0 was the key thing because we did the componentized browser,'' 
",112.24000000000001,0.0010892048995362943,70,-0.016446151529361967,0.0013395588443235746,0.7446390172025192
"He added, ``We really made Internet Explorer part of the Windows platform.'' 
",27.6,0.002500710934818039,41,-0.051695721089038325,0.0013873008432730522,0.7175531231219953
"The timing could be legally significant because in its suit the government 
cites as evidence requests before August 1996 by personal computer 
makers that wanted to load Netscape's browser on their machines instead 
of Microsoft's browser.",342.24,0.0016404460780246018,132,-0.04804054699261132,0.0014789993716748282,0.7716868998048212
"Microsoft denied the requests, insisting its 
browers and Windows were a single, integrated product.",43.24,0.0014317333243375105,60,-0.0026528214556173027,0.0014084565988253099,0.7444087988229211
"Microsoft's 
legal team obtained an early manuscript of the new book last month, 
by issuing a subpoena to a Netscape executive who was given a confidential 
copy by the authors to review.",109.48,0.0016825432499990175,106,-0.007940061128363948,0.0013967997199501735,0.765816216866558
"Microsoft has also sought the transcripts 
of 44 current and former Netscape employees interviewed by the authors. 
",6.44,0.0006267288765063307,63,-0.01403751747943233,0.0013783062730896266,0.7415754200632132
"A federal judge in Boston last week denied Microsoft access to that 
research materials, but the company may appeal the ruling.",146.28,0.0020824473604496236,74,0.033424306051089044,0.001475507397478224,0.603969454478449
"The new 
book, published by the Free Press imprint of Simon &AMP; Schuster, 
is being hurried into print so it can be shipped within days of the 
start of the Microsoft trial on Oct. 19.",51.52,0.0008742412563396545,86,-0.002976502482593124,0.0013268996570837072,0.7677484556556384
"But already, a few quotes 
from Netscape executives have leaked out.",0.92,0.0013685014404414028,26,-0.03225746968035595,0.001137201927282147,0.6911483616615043
"The authors decided to send 
the complete manuscript to The New York Times and three other news 
organizations Monday, so that the material could be read in context. 
",31.28,0.0013456840119355391,84,0.015044340687725876,0.0013616837552098615,0.7522871972502333
"Microsoft intends to use material from the book as evidence that Netscape's 
troubles resulted largely from its own missteps rather than from any 
alleged predatory practices by Microsoft.",43.24,0.0013456866971837838,102,0.009378064899740036,0.0014035640627526908,0.7512588600925644
"The book does detail where 
Netscape stumbled, shifting its strategy too often and running into 
obstacles in its software development efforts.",81.88000000000001,0.0009340595208109318,74,-0.033840575331851634,0.0014225900994108457,0.40332755773121254
"In private antitrust 
suits, the argument that the competitor was his own worst enemy is 
an established defense.",83.72,0.0012204196274610932,62,0.03794742625740567,0.0014054600107775521,0.7431589237004979
"But legal experts say that defense may well 
be far less effective in a federal case in which the government is 
seeking court-mandated changes in Microsoft's business practices rather 
than the monetary damages that are the goal of plaintiffs in private 
cases.",244.72,0.0016569264055590225,128,0.0836423979666873,0.001448479364389865,0.7706003298072677
"``It seems to me that this debate over Netscape's mistakes 
is a total sideshow,'' said Robert Litan, a former senior official 
in the Justice Department's antitrust division, who is now at the 
Brookings Institution.",95.68,0.0011770657926459122,112,0.0413197165095228,0.001341273259472743,0.7648328787941316
"``But Microsoft has a big legal team, and it 
seems they are working on every defense they can find.''",46.92,0.002068752075740314,36,0.014861329022505464,0.0014722560687281314,0.7128759610405215
"The book 
quotes a former Netscape executive, Ram Shriram, as saying the company 
bungled a chance to win a sizable share of the browser business from 
America Online Inc.",251.16000000000003,0.001904470995116648,98,-0.05418675549172821,0.0014013076917391214,0.767004712800297
"But that was a second-chance to do a deal with 
America Online, the leading online service.",75.44,0.0011608654961240523,47,-0.04527348990779694,0.001440494051382994,0.7400323700476618
"The government's case 
focuses on an earlier deal in March 1996, when America Online chose 
Internet Explorer as its preferred browser; in that bargain Microsoft 
agreed to place a startup icon for the online service on the main 
Windows desktop screen _",350.52000000000004,0.0022482245815265865,158,-0.05240056922805283,0.0014731366710424786,0.7789746524899056
the prime real estate in computing.,13.8,0.0005150874712093801,24,-0.004228916610032398,0.00122445776911277,0.6929563669143723
"For a 
book entitled ``Competing on Internet Time,'' it is intriguing that 
one of its central themes is that Netcape got too wedded to the notion 
that the Internet revolution would change everything quickly.",37.72,0.0009257580484518933,97,-0.018728388946831043,0.0014163453400667207,0.7648446107596198
"Microsoft, 
by contrast, stuck to its three-year planning horizon that enabled 
the company, the authors write, to ``mesh its short-run tactical plans 
with a broader strategic view of how to win the war.''",111.32000000000001,0.0007855267011123775,120,-0.0060133196493286824,0.0014606943385284427,0.4715003859761674
"The book quotes 
Steve Ballmer, Microsoft's president, as saying, ``The fact of the 
matter is that customers can't take cataclysmic change every three 
months.",56.120000000000005,0.0014649680741822694,79,0.006333180165672697,0.0014203145540939125,0.5469736599281263
The organization also can't.,1.84,0.0008143244967081304,12,0.0006256971854368451,0.0010235842111326492,0.5324225387465499
"You can ship products quickly. 
",7.36,0.0009910942315238525,18,0.011511059201378758,0.0012620620354518255,0.6641738917910137
"But you can't say, `Oh, we have a radically new strategy' every three 
months.'' 
 
",12.88,0.000880998326947602,22,0.0032658259648514,0.001246931155417036,0.6565843492977628
"The case of United States vs. Microsoft Corp., the government's most 
aggressive move against a monopolist in almost 25 years, is playing 
out against a century of antitrust laws so broadly worded and court 
rulings so ambiguous that both sides are citing the same rulings to 
support their opposing arguments.",302.68,0.0018518552516194652,158,0.07681524754596175,0.001451772782471265,0.7768768184185612
"Whatever the outcome of the trial, 
scheduled to begin Monday in U.S. District Court in Washington, an 
almost certain appeal will leave to the Supreme Court the task of 
bringing legal order to 100 years of clashing antitrust doctrines. 
",135.24,0.0020847809750161586,125,0.11079271033073017,0.001381411697100609,0.7748800625831119
"The case focuses on Microsoft's Windows, the operating system that 
controls about 90 percent of all personal computers sold today.",217.12,0.002160872107314425,80,-0.06284799582447755,0.0014773810708921414,0.6615167573994941
"The 
government says its objective is to curb illegal monopolistic business 
practices that threaten to render large parts of the economy vulnerable 
to the vicissitudes of a single company.",225.4,0.0008972197257201613,122,0.01827982940206687,0.0013940262645754688,0.762457059175961
"Microsoft asserts that the 
case is intended to give the government control over which features 
can be added to Windows.",166.52,0.0022164582149183537,62,-0.011534692529772845,0.0014719256184743718,0.744108729212356
"However grand the economic stakes, the legal 
dispute is narrow.",32.2,0.0007017903430605263,36,0.02252579580330316,0.001317182767761651,0.7141506422024625
"The government says that Microsoft's contracts 
with computer manufacturers and with companies that provide access 
to the Internet illegally stifle competition.",164.68,0.0022235075288273023,101,-0.008804153831094444,0.0014266872058491479,0.7515398423921787
"The contracts prohibit 
manufacturers from substituting Netscape Communications Corp.'s Navigator 
browser for Microsoft's Internet Explorer.",80.04,0.0017360333432828443,105,-0.056004517876868394,0.0012045274975723622,0.750702300521389
"They also prohibit them 
from removing from the Windows main screen, or desktop, links to sites 
on the World Wide Web run by Microsoft or its partners.",58.88,0.001406150313021453,76,-0.052648117246728646,0.0014261558290113376,0.447489468925315
"Microsoft's 
contracts with companies that connect people to the Internet and with 
businesses that sell goods and services on the Web require favored 
treatment for Internet Explorer over Navigator in exchange for links 
on the Windows desktop.",67.16,0.001955411520649631,142,-0.04560787289892649,0.0014497500120801627,0.7742308883938873
"In the wake of the lawsuit, Microsoft has 
voluntarily dropped some of these requirements, though it could reinstate 
them at will.",7.36,0.0006011152500266993,55,-0.005228156946361189,0.0012711071906736377,0.7309372320105988
"Microsoft says that its contracts are legal because 
they produce tangible benefits for customers, including easier Internet 
access.",38.64,0.0016499355404771758,77,0.05599351526753834,0.0014277583879602957,0.7491778065039876
"The Justice Department says that the bundling of Explorer 
with Windows 95 and the inclusion of the browser as part of Windows 
98 amount to ``tying,'' an illegal practice that forces customers 
of one product to purchase another.",184.0,0.002291890083595083,119,0.028926588285871496,0.001446113743410766,0.5657021965628342
"The contracts with manufacturers 
and Internet services are illegal, the government says, because they 
are intended not only to create a monopoly in the browser market but 
to protect Microsoft's existing monopoly in operating systems.",275.08,0.002323780824167653,129,-0.05694420120551809,0.0014262691538788046,0.7661247063417491
"The 
latter threat is key, according to the Justice Department.",18.400000000000002,0.002473670497922637,26,0.060582502654348086,0.0012994905071592345,0.6813049790062871
"Browsers 
have the potential, like an operating system, to act as a software 
platform on which other programs run.",202.4,0.002451459191305226,60,-0.10645284159533137,0.0013954361326868208,0.572627209287683
"So contracts intended to drive 
browsers out of the market would also insulate the Windows monopoly. 
",60.720000000000006,0.0015662192299278007,54,-0.04648231418809391,0.0013371198456314222,0.7358248693905958
"Many antitrust experts say the problem facing the Justice Department 
is that the courts have provided no clear definition of tying and 
no clear guidelines for determining when contracts are illegally exclusionary. 
",106.72,0.0014958015077703893,125,0.11863433154906972,0.0014159879691514772,0.7690504766398683
"Professor Lawrence White of New York University, who was chief economist 
of the Justice Department's antitrust division in the early 1980s, 
says that the courts treat tying as an unusual practice when in fact 
it is ubiquitous.",133.4,0.0015663674470613562,136,0.09470738951962525,0.001362327966360888,0.7727205367310468
"No one, he said, ``would challenge the right of 
manufacturers to tie erasers to the tip of pencils, tires to an automobile 
or buttons to shirts.''",38.64,0.000573733317299674,64,0.007100390565724772,0.0009977521275794322,0.7508387532661955
"His point, shared widely among economists, 
is that some tying benefits consumers if, for example, it results 
in products that are easier to use or enables a company to recover 
development costs.",99.36,0.0013212546446485591,95,0.08136874954261254,0.0014359727660330254,0.6062287318645588
"But tying can be bad if it locks in monopoly power. 
",35.88,0.0012816623576792224,23,0.01677865765782722,0.0012276144850264603,0.7031248908833845
"The courts, White says, have not offered enough guidance for distinguishing 
good tying from bad, which is the nub of the legal dispute.",45.080000000000005,0.0014144573987665417,59,0.07136589937023338,0.0014113670405633092,0.7405034663734485
"Microsoft 
says it needs only to show that bundling Windows and Explorer passes 
what might be called a ``gross'' consumer benefits test _ that it 
offers an immediate benefit, whether or not it causes long-term damage 
to competition and, therefore, ultimately to consumers.",114.08,0.0018093931972171225,122,0.14378764311228437,0.0014795896829371056,0.39511378120095775
"The Justice 
Department says that Microsoft's practices must clear a higher hurdle: 
yielding ``net'' consumer benefits that are immediate and large enough 
to balance possible long-term harm to competition.",103.96000000000001,0.0018166283757761914,108,0.1501614477568633,0.0014706230329994832,0.7690355793480528
"So which test of 
consumer benefits satisfies antitrust laws?",104.88000000000001,0.0022141917695112623,38,0.1894620592738001,0.0013497685338816488,0.7203014102882432
"The simple answer is that 
no one knows for sure, which is why both sides can reasonably cite 
the same cases without fear of embarrassment.",30.360000000000003,0.0013286993978896763,41,0.04253129657520064,0.001311705337771353,0.6281572101748188
"Consider a 1985 case, 
Aspen Skiing Co. vs. Aspen Highlands Skiing Corp., and a 1951 case, 
Lorain Journal Co. vs. United States.",166.52,0.001270339784562304,75,0.055028550404272014,0.0011571652369840228,0.7635301830710901
"In the first, Aspen Skiing, 
the owner of three major ski runs in Aspen, Colo. _",9.200000000000001,0.0008599830871874836,36,0.01556173139052248,0.0009161985830495037,0.7399977750394426
"the monopolist 
_ had for years sold a ticket in cooperation with Aspen Highlands, 
a competitor, that gave skiers access to both companies' runs.",44.160000000000004,0.0011498906547459187,83,-0.006140404596791567,0.001381853480932271,0.7560115029292827
"When 
Aspen Skiing unilaterally canceled the agreement, its rival's revenues 
shriveled and the rival sued.",41.4,0.0010844356312545368,65,0.013402933102526432,0.0011941991112117654,0.7497349177089784
"The Supreme Court ruled that Aspen Skiing 
had violated antitrust laws because there was no evidence its action 
helped consumers.",81.88000000000001,0.0018988823622423405,72,0.17973386063951827,0.0013722814658757084,0.755824682140104
"In the Lorain Journal case, the only local newspaper 
in Lorain, Ohio, refused to sell advertising to companies that advertised 
on a new radio station.",112.24000000000001,0.0006414447524713871,90,0.01358453995836228,0.001262180542455616,0.7625072511506494
"Here, too, the Supreme Court ruled that the 
exclusionary practice did nothing to benefit consumers.",58.88,0.0021246786300559736,51,0.24650861481119818,0.0013112240916473106,0.7297517166286771
"Indeed, in 
Aspen Skiing, the court even forced the monopolist to do business 
with its rival, a precedent that augurs well for the Justice Department, 
which seeks to force Microsoft to install Netscape's browser alongside 
its own.",233.68,0.0021278989648506057,125,0.03667653334281938,0.0014385773935349574,0.765662907558285
"But Charles Rule, a legal consultant to Microsoft, says that 
in both cases the courts threw out exclusionary practices only because 
they offered no consumer benefit.",93.84,0.002352233730160872,89,0.21753040808781204,0.0014497918406386305,0.7574842150990788
"The courts, he argues, never pounced 
on practices that resulted in lower prices or better products or service. 
",26.68,0.001703878562476368,52,0.0911405584499629,0.0014418175419666415,0.7257628399867059
"Nor did the courts in either case call for balancing immediate benefits 
against hypothetical long-term harm.",110.4,0.001157939623731573,54,0.13198111924949796,0.0014076357231940183,0.7384541348967391
"Rule argues that Microsoft's 
practices produce demonstrable consumer benefits.",38.64,0.0016436207174548897,60,0.16216395958543542,0.001394459971628458,0.7370078983022287
"Besides, he says, 
unlike the actions taken by The Lorain Journal or Aspen Skiing, Microsoft's 
contracts do not prevent consumers from installing Netscape's browser 
or from using the Web sites of Microsoft's rivals.",83.72,0.002179725418320618,110,0.020190876700964793,0.001373091639625083,0.7678247890030313
