Sent,Tm,Lex,Luhn,Lsa,Tr,LDA
"Turkey's strongly secular military is opposed to 
any deal that would bring Virtue to power.",35.88,0.005762001370724978,55,0.19459011915578525,0.005717718002692771,0.7440054767256482
"It pressured Virtue's predecessor, 
the Welfare Party, out of power last year.",16.560000000000002,0.00467661494610776,46,0.12237104128108087,0.005690980182834951,0.7176332160082094
"Erez is supposed to talk 
Tuesday to center-right Tansu Ciller and to Deniz Baykal, who leads 
a center-left party.",52.440000000000005,0.005601377649297444,77,-0.08541619895596039,0.005549674829480502,0.7621257601997891
"``I am more and more optimistic after every meeting,'' 
",1.84,0.005641025641025641,17,6.103896895447524e-05,0.004575996833679703,0.6214786189742122
Erez told reporters after meeting with the party leaders.,49.68,0.008103332776337725,31,0.01703089759471866,0.005328109719176938,0.7073447178475207
"Turkey has 
been trying to form a new government since a coalition government 
led by Yilmaz collapsed last month over allegations that he rigged 
the sale of a bank.",148.12,0.011791029194132073,83,-0.06111681685912614,0.005802597633111445,0.7597621893211115
"Yilmaz is now acting premier. 
 
",13.8,0.00498500118036274,19,-0.07984958788331677,0.004400172262627936,0.655685160972284
"A week after the Turkish government fell in a corruption scandal, 
President Suleyman Demirel on Wednesday asked a veteran left-wing 
politician known for his personal honesty, Bulent Ecevit, to form 
a new government.",142.6,0.008492401879710261,145,-0.035786948181629516,0.005929254067506626,0.7730845190326087
"Ecevit, who served as prime minister three times 
in the 1970s, said he would immediately begin working to fashion a 
government that could command a majority in the faction-ridden Parliament. 
",89.24000000000001,0.003823215335417463,107,-0.03973871838785534,0.006012745434930321,0.7666877898462934
"He also suggested that although Parliament has set April 18 as the 
date for a new election, he might seek to remain in power for a longer 
period.",27.6,0.006707831110121281,64,0.04722976920007276,0.005678627460444514,0.7564821315924712
"``It is wrong to see this government as simply an election 
government,'' he said.",106.72,0.0049743388029246105,39,0.01672396768577504,0.005696713802357025,0.703235330574951
"``There are problems that will not wait until 
an election.''",11.040000000000001,0.0031612510157215017,19,0.017699452741739223,0.005248191150523624,0.6656674674184688
"Military commanders, who hold ultimate power in Turkey, 
have quietly told senior political figures, including Demirel, that 
they do not want a quick election.",38.64,0.00806393546866393,99,0.09496357026958263,0.005931808883653527,0.7614601150712056
"They fear it will produce a Parliament 
just as divided as the present one, perhaps with the Islamic-oriented 
Virtue Party as the largest bloc.",4.6000000000000005,0.0037826240345755365,68,0.14088960283534846,0.005795300482037817,0.7540518986933711
"The commanders are also hoping to 
exclude two of the country's leading politicians, outgoing Prime Minister 
Mesut Yilmaz and former Prime Minister Tansu Ciller, neither of whom 
they trust, from posts in the new government.",57.96,0.008100318266864191,113,-0.10708518314279017,0.0054319370327016205,0.5862730902263765
"Ecevit must now try 
to build a government that includes their center-right parties but 
not them as individuals.",48.760000000000005,0.005046142090027429,55,-0.03864847224490111,0.005891402761392474,0.7348757865526547
"In a meeting this week the country's senior 
policy-making body, the National Security Council, in which military 
officers have a strong say, set three priorities for the coming months. 
",29.44,0.0027297272379385993,100,0.005832619810263101,0.005820783228596955,0.7680829690500267
"It said that whatever government emerges from forthcoming negotiations 
should dedicate itself to fighting religious fundamentalism, Kurdish 
nationalism and criminal gangs that have infiltrated the state apparatus. 
",64.4,0.0035748130204641495,128,-0.01030994163770129,0.0053534476290179244,0.7650744912720429
"Among Ecevit's immediate challenges will be to resolve a political 
crisis with Italy that broke out last month when the Kurdish rebel 
leader Abdullah Ocalan was arrested in Rome and then asked for political 
asylum there.",47.84,0.005079532702002019,112,0.0022972733262807393,0.005743154416434908,0.7707556071019064
"Turkey wants Ocalan sent here for trial, but Italy says 
it cannot extradite him as long as Turkey retains the death penalty. 
",10.120000000000001,0.004314296194588098,59,0.045650539273425335,0.004986231635020388,0.7484680666885591
"Ecevit (pronounced EH-che-vit) is among the few senior Turkish politicians 
who favors the abolition of capital punishment.",5.5200000000000005,0.003068511638768061,79,-0.01220076180815153,0.005117348081885127,0.7580949375164132
"Together with Demirel, 
Ecevit is often cited by Turks who complain about the continued dominance 
of a geriatric political elite here.",14.72,0.002843282914612067,70,0.001330277793819615,0.005060333415458701,0.6437868094407341
"He is 73 and has been in politics 
for most of his adult life.",3.68,0.003141780303213091,18,0.0020318251814077292,0.003956857279484895,0.6891353615032632
"Early in his career Ecevit emerged as 
a spokesman for Turkey's downtrodden masses.",2.7600000000000002,0.003030053724415707,55,-0.01825503207528873,0.004995137094936822,0.738831127422366
"Perhaps more than any 
other figure, he legitimized social democratic ideology in a climate 
where leftist sympathies were often considered subversive.",18.400000000000002,0.004763039313238542,80,-0.0014993717906933743,0.005171394146001891,0.7482018205155838
"At the 
same time, however, he has shown himself to be a fierce nationalist. 
",3.68,0.0036152532888998157,25,-0.0007991311600232486,0.005320739192724657,0.6638643416081504
"He was prime minister when Turkey sent troops to occupy northern Cyprus 
in 1974 and is still considered a hard-liner on Cyprus.",34.96,0.005449057533931639,72,-0.010959137279245778,0.005540554245391411,0.5297915487155191
"He is also 
uncompromising in his opposition to Kurdish nationalism.",6.44,0.005026100745827291,40,-0.018765000847306514,0.00458345081440319,0.683892614231313
"During his 
terms as prime minister in the 1970s, Ecevit successfully undermined 
efforts to move Turkey toward membership in the European Union, then 
called the European Economic Community.",34.04,0.003931071094515049,117,-0.017725952582234854,0.005838163239624174,0.7654166897591383
"He considered it an instrument 
of capitalist exploitation.",2.7600000000000002,0.003984360132574999,40,-0.0005476510592097437,0.0040834587263424114,0.6922399540574216
"Ecevit has also disturbed the United States 
by flirting with anti-Western ideologies.",0.0,0.005442798410276146,50,-0.010421033005624048,0.00552575009311567,0.7380295251980669
"In the early 1990s, during 
an interval when he worked as a journalist, he traveled to Iraq and 
wrote a series of articles favorable to Saddam Hussein.",9.200000000000001,0.0037165281401231954,82,-0.004586254721756244,0.0052974053181140636,0.7601588886867099
"He recently 
called for better relations between Turkey and Iraq, and maintains 
some of the anti-imperialist positions and suspicion of capitalism 
that he developed in the 1960s.",6.44,0.004595853112018838,93,0.02027437732032347,0.005622424699205154,0.7568681716468767
"The Democratic Socialist Party, which 
Ecevit heads, is a closely held family fiefdom.",3.68,0.00580990821288111,58,0.0029617035085547955,0.005563328783900851,0.3929837953729544
"He and his wife carefully 
screen applicants for membership and veto those whose personal loyalty 
to Ecevit is suspect.",11.040000000000001,0.002882352904987675,70,-0.012686648475661966,0.005233425045278001,0.7508648547922891
"``During his terms as prime minister in the 
'70s, Ecevit did not appear to be a consensus builder,'' said Ilter 
Turan, a professor of political science at Bilgi University in Istanbul. 
",42.32,0.008053317327574494,100,-0.03765412629472956,0.0047519493412358895,0.7649734267688532
"``It seems that nowadays he is more accommodating, so from that perspective 
he may not be bad choice.''",3.68,0.005641025641025641,39,6.411152082221046e-05,0.004480604420827996,0.7104063459660156
"``On many issues that Turkish society 
is encountering now, he represents an orientation which does not seem 
to be totally in tune with the times,'' Turan said.",7.36,0.0027158109116829916,72,-0.005125481401583341,0.005262527809756416,0.7499033796105019
"``That would include 
his position on issues like privatization, integrating Turkey more 
fully into the international system, and the devolution of central 
authority.",20.240000000000002,0.003439410797583405,98,0.02843299066486839,0.00543951477086135,0.7543219526067126
He has failed to grasp where the world is heading.,2.7600000000000002,0.003344464849272598,18,0.0010673671032297785,0.004975551444833939,0.6873772569322134
"He looks 
at and analyzes the world in categories that are no longer useful 
or appropriate.''",8.280000000000001,0.0032713782413851555,24,-0.00505796585598697,0.004614986497031945,0.6923069993475897
"Almost alone among Turkish politicians, Ecevit lives 
modestly and has avoided any hint of personal or financial scandal. 
",11.96,0.007319843699933403,68,-0.02890601745148772,0.005579463641475564,0.43953816228099135
"He speaks fluent English, and his reading tastes run to poetry and 
intellectual journals such as The New York Review of Books.",9.200000000000001,0.0032764215070332343,73,-0.002124858791356776,0.004415763434966049,0.7587973129843429
"He has 
translated the works of T.S. Eliot into Turkish and published several 
volumes of his own poems. 
",0.0,0.003965102915519273,42,-0.004820822879584381,0.004197450435318986,0.5693718642075746
