Sent,Tm,Lex,Luhn,Lsa,Tr,LDA
"
Indonesia on Tuesday denied claims that its troops massacred more 
than 40 East Timorese recently, and criticized Portugal for suspending 
U.N.-sponsored talks over the future of the troubled territory.",26.68,0.007862741961824168,123,0.03746278047435824,0.005980266907098837,0.7705398352326978
"Foreign 
Minister Ali Alatas questioned whether Portugal truly wanted to settle 
the problem of East Timor, a former Portuguese colony, the official 
Antara news agency reported.",20.240000000000002,0.010575900409782513,111,-0.03529970878413134,0.005750385859520895,0.636272836108432
"Portugal suspended the talks with Indonesia 
in New York last week following reports of a massacre of dozens of 
East Timorese rebels in a series of clashes with Indonesian troops. 
",5.5200000000000005,0.00912992309424428,99,0.00791052633181988,0.005903965298335917,0.4666591819823591
"East Timor's spiritual leader, Roman Catholic Bishop Carlos Belo, 
has said that between 30 and 40 people were reportedly killed near 
the villages of Alas and Same, 40 kilometers (25 miles) southeast 
of Dili, East Timor capital.",54.28,0.007314931789743632,134,-0.004134052591756076,0.005558186632955186,0.5454253522791813
"The 1996 Nobel Peace Prize winner said 
that so far, only 11 bodies had been identified.",3.68,0.004236885710367632,39,0.004284263174748602,0.004975833668838886,0.739623872763608
"Alatas said the claims 
of a massacre were not true.",3.68,0.004008624781301731,22,0.03629590277077718,0.004214009864063558,0.6912227657411284
"``The Portuguese delegation, without 
checking the truth of the information, decided to temporarily suspend 
the ongoing dialogue,'' Antara quoted Alatas as saying.",12.88,0.0028564941512821515,96,-0.013302151068093801,0.005347045093612403,0.7605871084681146
"The New York-based 
group Human Rights Watch said some deaths had occurred in fights between 
rebels and Indonesian forces.",8.280000000000001,0.004560248757519578,64,0.0037128445498890257,0.00585454096835889,0.7540125906238653
"However, it could not confirm claims 
that dozens of people had been killed.",14.72,0.005630874310824363,27,0.02977507093904332,0.005315920097999215,0.6928905712420156
"Alatas said it was the third 
time that Portugal had unilaterally suspended talks over East Timor 
since 1986.",5.5200000000000005,0.006097411342112488,53,0.007143719957732475,0.005468009329162353,0.7453424597500488
"Based on this, Alatas said, Indonesia was skeptical about 
Portugal's sincerity, Antara reported.",1.84,0.00607613021859107,56,-0.013234509106137373,0.004945590637649459,0.4726927860722479
"In response, Portugal's Foreign 
Ministry accused Indonesia of breaking promises to reduce its military 
presence in East Timor and called for a permanent U.N. mission in 
the disputed territory.",35.88,0.009815248002217294,125,-0.00469487901064587,0.005952123066468446,0.5467039275456905
"``Unfortunately, Indonesia has increased its 
deployment and the brutality of its military actions in East Timor,'' 
said ministry spokesman Horacio Cesar.",27.6,0.0031758995170993167,88,-0.018637376177781478,0.005554669838671273,0.7562210260977489
"Meanwhile, about 500 students 
ended their noisy but peaceful rally outside the office of East Timor's 
governor in Dili Tuesday after receiving promises that the reported 
killings would be investigated.",13.8,0.006040680215574137,103,-0.018870763137726405,0.005930892368802032,0.7680748317500847
"In a dialogue with the students' representatives, 
Governor Abilio Osorio Soares and military chief Col. Suhartono Suratman 
agreed to set up a team to make a thorough investigation.",23.92,0.0033406219450810614,117,-0.004773324448337015,0.005114641714195528,0.7687301658892823
"The group 
earlier had spent one night occupying the provincial Parliament and 
vowed to stay at the governor's office.",20.240000000000002,0.003317518569889362,67,-0.005389112212280822,0.005567090525111302,0.752305989566125
"The students also demanded 
a total withdrawal of Indonesian soldiers from East Timor.",1.84,0.008404523898034961,54,0.0027290165625591203,0.005729030428442289,0.7366006608898111
"Meanwhile, 
an unidentified man, believed to be a rebel, was reported to have 
shot and wounded Izildo Pereira, a civilian, in Baucau, 100 kilometers 
(62 miles) east of Dili. Izildo, 30, who was shot Sunday, was being 
treated at a military hospital in Dili.",101.2,0.0034802279296066905,138,-0.0007494465654676592,0.005518880893756072,0.7731041587423488
"Indonesia invaded East Timor 
in 1975 and annexed it the following year.",23.0,0.007447175602752542,37,-0.14348221705134762,0.00530158099728283,0.7318462983075192
"The United Nations, however, 
does not recognize Indonesia's claim.",11.96,0.005148465773828002,36,0.26305847402362414,0.005418701948626131,0.7090996900065214
"Before being suspended, the 
talks centered on an Indonesian offer to give East Timor autonomy 
in return for international recognition of Indonesian sovereignty 
there. 
 
",13.8,0.0069937328577238805,104,0.04136452837911507,0.0057971861132808606,0.7603062755316711
"Taiwan's Foreign Ministry on Thursday blamed ``administrative negligence'' 
for an incident in which Nobel Peace Prize winner Josi Ramos-Horta 
was left stranded at the airport for hours after being refused entry. 
",17.48,0.006987947904059165,136,0.006609768298964202,0.005654090537697348,0.7747991720243711
"Opposition supporters alleged the incident Wednesday night was politically 
motivated.",9.200000000000001,0.004547191010495791,66,0.0005632922881862997,0.005311466840084215,0.7386040546948706
"Ramos-Horta is an advocate of independence for Indonesian-controlled 
East Timor, and newspapers reported Taiwan had formerly barred him 
to avoid antagonizing Indonesia.",16.560000000000002,0.009489137669098561,106,-0.020524233145988283,0.0058322390124348625,0.5019567182481216
"But Ramos-Horta's previous persona 
non grata status had been ordered lifted by the Foreign Ministry in 
August, leaving no reason why he should have been refused entry by 
airport immigration when he came to town Wednesday night, ministry 
spokesman Roy Wu told a news conference.",43.24,0.0086082831499418,165,0.003952988789781815,0.005832075013718815,0.5578314086059503
"``This incident accentuated 
the problem with administrative relations, it needs to be improved. 
...",9.200000000000001,0.00511404254284924,54,-0.0005104054494093494,0.0045977009449247016,0.42641488321120874
"It's a fact,'' Wu told a news conference.",8.280000000000001,0.0036379102385513842,24,0.0009351735014713461,0.005107919515055927,0.7107711903812812
"Ramos-Horta had a rough 
time Wednesday night.",8.280000000000001,0.006989975037869179,34,-0.002744762260366082,0.005337089818689065,0.7169846413413603
"Immigration officials would not let him in, 
then he tried to catch a flight out but missed the plane.",4.6000000000000005,0.004770251491369696,39,-0.0011164116835465144,0.005020859662317724,0.7235212242215174
"Eventually, 
the Foreign Ministry intervened and let Ramos-Horta enter Taiwan. 
",0.92,0.006556008361756496,56,-0.004111529766256706,0.005587204792270878,0.7353490928717116
He went only as far as the airport hotel.,7.36,0.0032617803164343073,12,-0.0063401316354749085,0.0037965488260449445,0.6107399431420405
"Conflicting reports indicate 
Ramos-Horta was stuck at the airport for between four and seven hours. 
",5.5200000000000005,0.005775388633630653,41,-0.0077347418564907245,0.0055850202129035026,0.7280941260510201
"Ramos-Horta was carrying a Portuguese passport, which should have 
permitted him visa-free entry to Taiwan for up to 14 days, newspapers 
said.",6.44,0.005282664566002804,74,-0.01394519579107758,0.005543908145123796,0.7608706360116931
"The opposition Democratic Progressive Party alleged Ramos-Horta 
had been refused entry because he planned to speak on behalf of Chen 
Shui-bian's campaign to be re-elected as mayor of Taipei.",11.96,0.0066843874002092876,119,0.0002889759218148878,0.005201524238756209,0.7720247660319939
"Chen is 
Taiwan's most prominent DPP politician.",1.84,0.0035390242058556598,32,-0.0014949512981392047,0.004184195800792629,0.7098173483117065
"``This sort of incident shows 
that Taiwan is just not qualified to be called a democratic nation,'' 
DPP Secretary-General Chiu Yi-jen told a news conference.",23.92,0.004970214506945103,99,0.00021904047120148974,0.005338658790555798,0.7654154851032651
"Ramos-Horta 
sought to play down the incident before leaving town Thursday.",7.36,0.0055686774228217205,44,-0.0025899388106318823,0.005770760689269636,0.7374189427152366
"``I 
don't want to make a big problem out of it.",11.96,0.005065159517315651,14,-0.0013717848934069047,0.004946200726572165,0.6624127335840285
"I have been to many countries. 
",0.92,0.003462277695278461,7,0.00401119822261081,0.00538914894114681,0.5198617539067952
"The only countries that don't allow me in would be countries like 
Iraq, Iran,'' he told reporters before catching an afternoon flight 
to attend a conference in Australia.",9.200000000000001,0.005152991010610091,81,0.015242929256150126,0.005713604931046926,0.7572649390362914
"Indonesia invaded East Timor 
in 1975 and annexed it the following year.",23.0,0.007447175602752542,37,-0.14348221705134762,0.00530158099728283,0.7318462983075192
"The United Nations does 
not recognize Indonesian claims to East Timor. 
 
",6.44,0.008389353934667375,46,0.2624902768578187,0.0057273547812197205,0.7315735360715179
"Bent on revenge for earlier attacks on churches, mobs set fire to 
four mosques in West Timor Monday after a protest and strike by thousands 
of Christians degenerated into a riot, the military and a Muslim leader 
said.",42.32,0.007971773149841143,125,-0.010428830568983903,0.005614973518439598,0.771796297731247
"A rampaging crowd also burned down a market and a Muslim school. 
",2.7600000000000002,0.003958400513176688,34,0.0009919303519510569,0.0049611108751994384,0.7208100020844113
Troops and riot police patrolled the streets.,5.5200000000000005,0.0027089977896073915,27,-0.00010393051209752155,0.004530790423950588,0.7088721159057378
"There were no immediate 
reports of serious injuries or arrests as fighting between Muslims 
and Christians continued after dark, said a military officer who spoke 
by telephone on condition of anonymity.",20.240000000000002,0.0028286374371454233,99,-0.004558036192125566,0.005647138169824414,0.7621542362771667
"The violence in the Christian-dominated 
city of Kupang was in retaliation for the burning and ransacking of 
22 churches by Muslim mobs in the capital, Jakarta, on Nov. 22, when 
14 people were killed.",45.080000000000005,0.007537330846574175,107,-0.0007567623348825128,0.005500151055044103,0.7685114137497956
"Islamic leaders urged Indonesia's Muslim majority 
not to retaliate with more violence.",5.5200000000000005,0.008918625299499766,57,-0.008379965335177127,0.00531059612325288,0.7374537326937096
"Adurrahman Wahid, head of Indonesia's 
largest Muslim grouping, the 30 million-member Nahdlatul Ulama, accused 
provocateurs of whipping up religious strife when the sprawling Southeast 
Asian nation is trying to head toward democracy.",22.080000000000002,0.007211042071824431,149,0.008746424203966279,0.005442039183663793,0.7711333112302552
"``I hope Muslims 
... are not deceived by such provocations,'' said Wahid, who has been 
pushing for religious unity.",6.44,0.0030293748601401675,52,0.00021205121108368161,0.004863580164346568,0.7355780935940874
"West Timor shares the same island as 
troubled East Timor, a former Portuguese territory dominated by Roman 
Catholicism and invaded by Indonesia in 1975.",30.360000000000003,0.007060767153299108,98,-0.049270096365376694,0.005472617637650817,0.5765922698923073
"Christians, mostly Protestants, 
dominate Kupang, about 1,875 kilometers (1,172 miles) southeast of 
the Indonesian capital.",23.92,0.003585613716297526,81,0.03684083733676896,0.00488291686812693,0.7525506258114666
"However, a sizable Muslim minority also lives 
there.",1.84,0.003668209139262843,25,0.0011873281533203875,0.004796495848380437,0.6901612316230644
"The Kupang riot broke out after thousands of Christians staged 
a peaceful strike and street protest against the Jakarta church attacks. 
",22.080000000000002,0.00722369807623516,84,0.017538521957075073,0.0054781322646524355,0.7580222196481632
"Most offices and shops were closed in the city of 120,000, the capital 
of East Nusa Tenggara province, whose governor called for calm.",18.400000000000002,0.00386039983844513,72,-0.0014048453004010734,0.00533767245499676,0.7576270784705356
"Organizers 
of Monday's strike had called for a non-violent ``day of mourning.'' 
",6.44,0.0029441168839042125,47,-0.0017331419605662074,0.00544505193899281,0.7317786948297145
"However, residents said fires broke out in three mosques after rival 
gangs pelted each other with rocks.",1.84,0.0031666029677779543,40,0.0011127132851955612,0.004879781463450075,0.7315907367731692
"Indonesia is the world's most 
populous Islamic nation.",9.200000000000001,0.005370629889987166,35,0.008459887055083711,0.005115803820117888,0.6986466024922047
"About 90 percent of Indonesia's 202 million 
people are Muslims, with the rest following Christian, Hindu, Buddhist 
or other faiths.",16.560000000000002,0.0027870872598906677,72,-0.015043741842280842,0.0050951692367456405,0.7575592831410218
"Religious diversity based on a belief in God is enshrined 
in the national philosophy, known as Pancasila, adopted when Indonesia 
declared independence from Dutch colonial rule in 1945.",27.6,0.002967826223698049,120,-0.01187541620459314,0.005166315626320551,0.7672920386575146
"The upsurge 
in religious violence follows months of riots and protests in many 
parts of Indonesia.",9.200000000000001,0.00908483638038221,53,-0.005431903689140808,0.00555500346906336,0.7304971721611284
"Social tensions in the sprawling Southeast Asian 
nation have intensified as it grapples with its worst economic crisis 
in decades.",7.36,0.002665422166081765,78,0.02071581280558779,0.005072842741520919,0.7568101760423294
"There is also political turmoil as students protesters 
demand greater democracy after 32 years of authoritarian rule by former 
President Suharto, who was forced to quit following deadly riots in 
May.",22.080000000000002,0.004070153135817335,110,0.001556788433753215,0.0056455624838072215,0.7682378018292161
"Ismalil Hasan Metareum, head of the Muslim-dominated opposition 
United Development Party, urged his followers not to hit back.",9.200000000000001,0.003213998905258947,90,0.04265218047184609,0.005565554141782922,0.7566941157939486
"More 
than 100,000 party supporters filled a sports stadium in Jakarta Sunday 
at the opening of a four-day convention.",6.44,0.004112141947517079,71,0.026509592454577072,0.005558381699533256,0.7531723938399668
"Religious strife erupted 
recently in the eastern part of the main island of Java, where more 
than 150 people, many of them Islamic clerics, have been murdered, 
apparently by rival Muslim groups.",28.52,0.0037380546549239412,107,0.007440408152840272,0.005679006302384094,0.7681799621907885
"Many of the dead were accused of 
practicing black magic. 
 
",2.7600000000000002,0.004356935617219782,28,0.001154252489384049,0.0048499483413559615,0.7069639793078127
"Protesters on Sunday urged Australian military leaders to identify 
Indonesian army officers trained here to allow closer monitoring of 
human rights abuses in East Timor.",26.68,0.01029460185347578,113,0.003421576501131432,0.005953067714656573,0.768820048823023
"The Australian military holds joint 
training exercises with Indonesian troops, including the elite commando 
units accused ot atrocities in East Timor.",26.68,0.00587630464939223,107,0.003594746588318743,0.005508724582521398,0.7691268053398705
"In Queensland, about 100 
activists gathered outside the Canungra Land Warfare Center, south 
of Brisbane, to mark the 23rd anniversary of the Indonesian invasion 
of East Timor.",13.8,0.0033542955696333507,111,0.010692810422874765,0.0055245374050756305,0.7700085023012685
"``It is a peaceful protest against Australia training 
Indonesian soldiers,'' spokesman Jason McLeod said.",18.400000000000002,0.006728254215417405,66,0.05064208209069383,0.005452091694232875,0.7411538243826886
"The protesters 
wanted Australia to cut all military ties with Indonesia despite Defence 
Minister John Moore's recent announcement that joint exercises would 
resume, he said.",26.68,0.00564139683717757,106,0.005957652663229002,0.0057836943095727475,0.7677437421819038
"``The Australian government has repeatedly refused 
to allow the Indonesians trained here to be identified,'' McLeod said. 
",3.68,0.004221087375954373,66,0.03735035477995162,0.005288300997489774,0.738558742477235
"``But we are demanding they be named along with their unit and battalion 
number because this will allow closer monitoring of human rights issues,'' 
he said.",13.8,0.007257784575302576,56,-0.019277337520452454,0.005638553160523728,0.7435148196968436
"McLeod said 40,000 East Timorese were killed by Japanese 
soldiers for protecting Australian commandos during World War II. 
",0.0,0.006407380048392909,77,0.0036130248913335632,0.005517614017998376,0.762579189265609
"``When they finally left the country the Australians distributed leaflets 
saying they would never forget the people of East Timor,'' he said. 
",19.32,0.006107164253096324,67,-0.003756940328687277,0.005838891270231464,0.7479282662592945
"The protesters wanted to remind Australia's current soldiers of that 
pledge.",6.44,0.004348164620405579,49,-0.004085991134974091,0.0050850014477381664,0.7305983026163944
"After Portugal abandoned its former colony in East Timor in 
1975, Indonesia invaded it and annexed it the following year.",30.360000000000003,0.00823178469598497,60,-0.14527021511936336,0.005168312373311177,0.7505840817365615
"The 
United Nations refuses to recognize the annexation as legitimate; 
Australia is one of the few nations that recognizes Indonesian sovereignty 
over East Timor. 
 
",22.080000000000002,0.005510390275900044,102,0.25289959113799604,0.005532277638188679,0.7599709600147154
"Protesters on Sunday urged Australian military leaders to identify 
Indonesian army officers trained here to allow closer monitoring of 
human rights abuses in East Timor.",26.68,0.01029460185347578,113,0.003421576501131432,0.005953067714656573,0.768820048823023
"The Australian military holds joint 
training exercises with Indonesian troops, including the elite commando 
units accused ot atrocities in East Timor.",26.68,0.00587630464939223,107,0.003594746588318743,0.005508724582521398,0.7691268053398705
"In Queensland, about 100 
activists gathered outside the Canungra Land Warfare Center, south 
of Brisbane, to mark the 23rd anniversary of the Indonesian invasion 
of East Timor.",13.8,0.0033542955696333507,111,0.010692810422874765,0.0055245374050756305,0.7700085023012685
"``It is a peaceful protest against Australia training 
Indonesian soldiers,'' spokesman Jason McLeod said.",18.400000000000002,0.006728254215417405,66,0.05064208209069383,0.005452091694232875,0.7411538243826886
"The protesters 
wanted Australia to cut all military ties with Indonesia despite Defence 
Minister John Moore's recent announcement that joint exercises would 
resume, he said.",26.68,0.00564139683717757,106,0.005957652663229002,0.0057836943095727475,0.7677437421819038
"``The Australian government has repeatedly refused 
to allow the Indonesians trained here to be identified,'' McLeod said. 
",3.68,0.004221087375954373,66,0.03735035477995162,0.005288300997489774,0.738558742477235
"``But we are demanding they be named along with their unit and battalion 
number because this will allow closer monitoring of human rights issues,'' 
he said.",13.8,0.007257784575302576,56,-0.019277337520452454,0.005638553160523728,0.7435148196968436
"McLeod said 40,000 East Timorese were killed by Japanese 
soldiers for protecting Australian commandos during World War II. 
",0.0,0.006407380048392909,77,0.0036130248913335632,0.005517614017998376,0.762579189265609
"``When they finally left the country the Australians distributed leaflets 
saying they would never forget the people of East Timor,'' he said. 
",19.32,0.006107164253096324,67,-0.003756940328687277,0.005838891270231464,0.7479282662592945
"The protesters wanted to remind Australia's current soldiers of that 
pledge.",6.44,0.004348164620405579,49,-0.004085991134974091,0.0050850014477381664,0.7305983026163944
"After Portugal abandoned its former colony in East Timor in 
1975, Indonesia invaded it and annexed it the following year.",30.360000000000003,0.00823178469598497,60,-0.14527021511936336,0.005168312373311177,0.7505840817365615
"The 
United Nations refuses to recognize the annexation as legitimate; 
Australia is one of the few nations that recognizes Indonesian sovereignty 
over East Timor. 
 
",22.080000000000002,0.005510390275900044,102,0.25289959113799604,0.005532277638188679,0.7599709600147154
"Representatives of exiled East Timorese pro-independence groups said 
Friday that Indonesian troops attacked unarmed civilians in a village 
in the disputed Southeast Asian territory, killing one East Timorese 
and wounding 22 others.",27.6,0.010048529761322884,154,-0.03307276242348246,0.005940979351767947,0.7760405696956192
"The attack took place Tuesday near Cailaco 
in East Timor, a former Portuguese colony, according to a statement 
issued by the pro-independence Christian Democratic Union of East 
Timor.",36.800000000000004,0.009845930761701108,113,-0.14125003661601832,0.005974538204972297,0.7686156958043777
"Placido dos Santos, a 28-year-old farmer, was tortured and 
killed by the Indonesian military during the attack, the statement 
claimed.",46.0,0.0048449205216334725,81,-0.04986406202609465,0.005693933851794344,0.7614462598003693
"Jose Pau Lelo, 38, Rosito Borges, 35, and Leao Soares, 50, 
were in a coma due to injuries they sustained in the attack, according 
to the statement which cited resistance sources in East Timor's capital 
Dili.",46.92,0.0030252114630592254,111,-0.03909288172148893,0.0054602458796830025,0.7743176912360457
"The statement, released in the Portuguese capital Lisbon, also 
said 19 men were wounded, eight seriously, and 26 others were missing. 
",29.44,0.004666794223372489,55,-0.02875621972704548,0.005548012639316405,0.7474623104642258
"The names, ages and occupations of the villagers were listed.",0.0,0.004304534578007927,29,-0.006933627599898388,0.004863207254225521,0.6931920342269233
"There 
was no independent confirmation of the attack, and Indonesian officials 
were was not immediately available for comment.",19.32,0.0036541059108849377,65,0.003895762470439605,0.005508061065700254,0.38590645266490897
"Indonesia invaded 
East Timor in Dec. 1975, following Portugal's colonial rule, and annexed 
it a month later.",20.240000000000002,0.007148903149227248,61,-0.0773010256068734,0.005365094873399563,0.7541683021021077
"Indonesian troops have since then been fighting 
a small band of pro-independence guerillas.",1.84,0.004475832738597549,53,-0.0177803122689636,0.0054608434483732335,0.42160192809107644
"Roque Rodrigues, a Lisbon 
spokesman for the National Council of Timorese Resistance, said he 
also had corroborated the report with six sources inside East Timor 
and said he had ``no reasons to doubt the truth'' of the statement. 
",42.32,0.004788311424712394,124,-0.04119409029313746,0.005729811047705167,0.7705150775992421
"The United Nations, which is brokering talks between Lisbon and Jakarta 
over the territory's political future, still regards Portugal as the 
administering power in East Timor.",30.360000000000003,0.007635226571923165,98,0.21576917215903893,0.005743337782242368,0.7632455807297781
"The half-island territory lies 
some 2,000 kilometers (1,200 miles) southeast of Jakarta. 
 
",23.0,0.006091058404002286,60,0.11020721018088511,0.005117900553572611,0.7507785058939295
"Representatives of exiled East Timorese pro-independence groups said 
Friday that Indonesian troops attacked unarmed civilians in a village 
in the disputed Southeast Asian territory, killing one East Timorese 
and wounding 22 others.",27.6,0.010048529761322884,154,-0.03307276242348246,0.005940979351767947,0.7760405696956192
"The report could not be independently confirmed, 
and Indonesian officials were not immediately available for comment. 
",19.32,0.00438261163661607,62,0.018166175703681574,0.005100081547814415,0.7270943189826727
"The attack took place Tuesday near Cailaco in East Timor, a former 
Portuguese colony, according to a statement issued by the pro-independence 
Christian Democratic Union of East Timor.",36.800000000000004,0.009845930761701108,113,-0.14125003661601832,0.005974538204972297,0.7686156958043777
"Placido dos Santos, a 28-year-old 
farmer, was tortured and killed by the Indonesian military during 
the attack, the statement, which cited resistance sources in East 
Timor's capital, Dili.",61.64,0.007488197363968599,116,-0.08276718230234247,0.0058844925430335294,0.7694998815546512
"The statement, released in the Portuguese capital 
of Lisbon, also said that 22 people were injured and 26 were missing. 
",46.0,0.005454756008240576,59,-0.029352768890514868,0.0055457957992065725,0.7486324013258403
"The names, ages and occupations of the villagers were listed.",0.0,0.004304534578007927,29,-0.006933627599898388,0.004863207254225521,0.6931920342269233
"Roque 
Rodrigues, a Lisbon spokesman for the Socialist Party of Timor, another 
pro-independence group, said he had corroborated the report with six 
sources inside East Timor and said he had ``no reasons to doubt the 
truth'' of the statement.",50.6,0.007896953970265188,131,-0.052599232088732864,0.005860789065007219,0.7726510785111689
