Sent,Tm,Lex,Luhn,Lsa,Tr,LDA
"
Hours before China was expected to sign a key U.N. human rights treaty 
and host British Prime Minister Tony Blair, police hauled a prominent 
human rights campaigner in for questioning Monday.",101.2,0.004529811884480413,124,-0.11421874322692793,0.004214144763945544,0.7393152334495807
"Qin Yongmin's latest 
run-in with the authorities came as he tried for the second time in 
a week to legally register a human rights monitoring group.",65.32000000000001,0.00487605223446087,77,-0.05132923563446407,0.00426997463587518,0.7551363619738055
"Qin said 
a civil affairs official in the Hubei provincial capital of Wuhan 
accused him of engaging in illegal activities.",28.52,0.0032433879618874338,76,-0.01349963389153909,0.0038699167974232083,0.7523940256558231
"The police came soon 
after he returned home.",24.84,0.003286328983557079,16,-0.024079564193470144,0.003875029378546376,0.6616540105826635
"``As I'm sending this statement, the Wuhan 
Public Security Bureau is again taking me away,'' Qin said in a hastily 
scrawled message on the bottom of the typed statement faxed to reporters. 
",11.96,0.0030809640235757146,97,0.0062149070506455845,0.003985688876681512,0.7626878723369925
"Qin, detained briefly two weeks ago, was questioned for about three 
hours before being released and threatened with prosecution if he 
persisted in trying to set up his China Human Rights Observer.",15.64,0.0050212891264297295,96,-0.06841086772241799,0.004298102451836599,0.7657438455746316
"Qin 
hoped the harassment would stop after China signs the International 
Covenant on Civil and Political Rights, but he said if local authorities 
don't observe the treaty ``we will unswervingly push ahead with protecting 
human rights to the last.''",50.6,0.006006183645104611,136,-0.11633072609743404,0.004178777994763186,0.7742981689675142
"China plans to sign the International 
Covenant on Civil and Political Rights on Monday at the United Nations. 
",11.96,0.004681240266134859,72,-0.14007542279155452,0.004149426498354449,0.7542310420631522
"By the time the ink is dry, Blair should be landing in Beijing on 
Tuesday morning for the first visit by a British prime minister in 
seven years.",29.44,0.00293736959989817,69,0.044835713817180045,0.003997641157170663,0.7514894676926208
"The treaty is supposed to guarantee freedoms of speech 
and assembly.",14.72,0.002165888876903282,43,-0.030725161319022882,0.0035828789465517205,0.7220347430739251
"But even after China signs, the treaty would not come 
into force until ratified by the legislature, which may attach reservations 
effectively nullifying some provisions.",19.32,0.00162687007253352,82,-0.018247831131319135,0.0034749856730628757,0.7542456796005589
"Blair has vowed to discuss 
differences over human rights with Chinese leaders.",23.92,0.0032544833594778545,48,-0.05315789214943871,0.00413021829225464,0.7375088731830843
"His visit has 
drawn appeals from dissidents and an international press freedom group 
urging him to persuade Chinese leaders to free political prisoners. 
",69.0,0.0043742071323031,100,-0.036652348867951434,0.00421895000993022,0.40984166470660005
"In an open letter, three dissident said that while Chinese leaders 
say they respect human rights principles, in law and practice the 
government allows rights abuses and persecution of dissidents.",113.16000000000001,0.005046944493903376,109,-0.06724877215911118,0.00421713986275952,0.7661761302864383
"Thousands 
of political prisoners are believed to remain in Chinese prisons, 
labor camps or detention centers, said the letter, a copy of which 
was released by the Hong Kong-based Information Center of Human Rights 
and Democratic Movement in China.",48.760000000000005,0.005785547099383095,155,-0.0916229491602003,0.004334926010002063,0.7771297242691355
"The letter called for the release 
of Shi Binhai, a journalist who compiled a popular book on political 
change; Fang Jue, a businessman who called openly for political reform; 
and other imprisoned activists.",86.48,0.0038501394408963392,128,-0.015480435854774512,0.0040686345602595625,0.7694425163476687
"Paris-based Reporters Without Borders 
urged Blair to call for the release of Gao Yu, Liu Xiaobo and Liu 
Jingsheng.",21.16,0.001977018334424253,70,-0.011386979506505497,0.003968638801768022,0.7600788216465719
"The three are among 13 journalists imprisoned ``simply 
for attempting to practice their profession,'' it said in a statement. 
 
",9.200000000000001,0.0021631643814252993,60,0.004065288525654043,0.004010328338525086,0.733794898995949
"Police detained and questioned the organizer of a group set up by 
dissidents to monitor official corruption and told him the group's 
activities must cease, a human rights group said Thursday.",105.80000000000001,0.007203447595647222,116,-0.10410067148096601,0.004255769844503801,0.7669909253755337
"Police 
in Xinyang, in central China's Henan province, took An Jun away Wednesday 
afternoon and held him until past midnight for questioning about the 
group's members, said the Information Center of Human Rights and Democratic 
Movement in China.",35.88,0.005930899936214782,145,-0.1143405998167358,0.004268548178208721,0.7749625477056301
"Police wanted a list of members with their work 
and home addresses, a demand An Jun refused for fear of getting them 
into trouble, the Hong Kong-based Information Center said.",14.72,0.0035820723563879447,91,-0.06134142481445047,0.004275467786181601,0.7695154272133637
"Corruption 
Watch, founded by nine dissidents in seven provinces, now has nearly 
100 members, the center said.",20.240000000000002,0.0037687081436412794,52,-0.03367618677521154,0.0040993874855588175,0.729689835576531
"It applied last month to the government 
to register officially, but received no response, the center added. 
",56.120000000000005,0.0029674912014307406,62,-0.029194015027239808,0.004087398544270451,0.4591783707226683
"The police officers who questioned An Jun said that without official 
permission, the group must cease its activities, the center said. 
",68.08,0.00383551059231418,66,-0.07140646865692797,0.0041525748218981424,0.7488323973132749
Rampant official corruption is a major public gripe in China.,25.76,0.002936586276516197,46,-0.023447577405390652,0.0038149987630987387,0.7208504810860089
"The 
Information Center said Corruption Watch had already received reports 
of graft in its first month of operation.",10.120000000000001,0.003116830601932675,64,-0.045322252948831465,0.004055683732869283,0.7455664425070333
"In a separate report, the 
center said that an official in the Sichuan provincial government 
refused Thursday to accept an application by three dissidents to form 
a branch of a would-be opposition group, the China Democracy Party. 
",104.88000000000001,0.005475404488662992,147,-0.0389154822187819,0.004335123653966759,0.7656873234008539
"Groups of dissidents in cities across China have attempted to register 
the group, as required by law, but authorities have rejected those 
applications.",38.64,0.004634851792397958,79,-0.03548703176416844,0.004179096525447039,0.7460816976155797
"Signaling that the Communist Party's 49-year-old ban 
on opposition groups remains intact, police have detained and questioned 
many dissidents associated with the group. 
 
",45.080000000000005,0.003488722014784394,96,-0.011894208613025188,0.0042107136540616655,0.7655875021638643
"China's central government ordered the arrest of a prominent democracy 
campaigner and may use his contacts with exiled Chinese dissidents 
to charge him with harming national security, a colleague said Wednesday. 
",136.16,0.006087553028803306,134,0.005109817170873754,0.004308037781588217,0.7684145030904479
"Two Beijing police officers spent 30 minutes telling Zha Jianguo to 
stop trying to set up a political opposition party.",123.28,0.004394432553355597,78,-0.004413522504742009,0.0042705366364725215,0.45621754070034337
"Underscoring the 
warning, they said his colleague, Xu Wenli, won't be released soon 
and may be charged for having links to ``reactionary groups,'' Zha 
said.",10.120000000000001,0.0026492007826715196,69,0.006547385687537598,0.0038341271215382045,0.7391248853206235
"Xu and another influential dissident, Qin Yongmin, were arrested 
Monday night in police raids in two cities that delivered the sternest 
blow so far to a five-month campaign to establish the China Democracy 
Party and challenge the ruling Communist Party's monopoly on power. 
",81.88000000000001,0.005579242151670399,169,0.021864067028123397,0.004315475804333412,0.7779051630277767
"Qin was arrested for plotting to overthrow the government, a crime 
that could land him in jail for life.",40.480000000000004,0.003745738000147916,49,0.037653869683988796,0.00399952719245263,0.398554443549845
"A third Democracy Party advocate, 
Wang Youcai, already in custody for a month, was also formally arrested 
Monday although his family has not been informed of the charges.",31.28,0.005979528889604933,82,0.03996617388768011,0.004264612833481507,0.6555858398780362
"Zha, 
who helped Xu organize would-be party members in Beijing and the nearby 
port of Tianjin, said police officers told him Xu's arrest was ordered 
by the central government, not Beijing police.",154.56,0.004988887503177636,119,-0.008460455044164967,0.004310336274413837,0.7645648542483601
"He took the police 
reference to ``reactionary groups'' to mean exiled dissidents in the 
United States.",23.0,0.004101891399786085,57,-0.05400345854963525,0.003998360996772989,0.7328883602320106
"Under China's vague State Security Law, such links 
may also be punishable by up to life in prison.",24.84,0.004520590365009417,51,0.06548644619808981,0.003828435800046915,0.7422405999597915
"Zha pledged to work 
with dissidents in China and exiles in the United States to campaign 
``to save Xu Wenli.''",11.040000000000001,0.004756300032878794,63,-0.018467030850845466,0.004048024616153774,0.3890267844371613
"On Wednesday, 190 dissidents from around the 
country demanded in an open letter that the government release Xu, 
Qin and Wang Youcai, saying the arrests run counter to U.N. human 
rights treaties China has signed over the past 14 months.",86.48,0.00813987328754779,126,-0.06571967154703581,0.004357702331536685,0.39474737693359596
"The authorities 
``are deceiving and cheating international public opinion while on 
the other hand they are suppressing and persecuting domestic political 
dissidents,'' said the letter faxed to foreign news agencies.",64.4,0.0017955842328052063,120,-0.02763445649641906,0.004053793471780366,0.7684471461410591
"In Washington, 
White House spokesman Joe Lockhart said the United States deplored 
the detention and arrests of Xu and Qin.",8.280000000000001,0.0030097809167576074,79,-0.022746492371287716,0.003970683065478924,0.7600638718533747
"``We believe the peaceful 
political activities of this kind and other forms of peaceful expression 
that they've been involved in are fundamental human rights that should 
be protected by all governments,'' Lockart said.",68.08,0.002639400702532535,103,-0.07675631016195171,0.003909761430942973,0.7609205240711461
"``We call on the 
Chinese government to assure the protection in these cases of Mr. 
Xu and Mr. Qin.''",32.2,0.003285172167981927,50,0.008833322625635418,0.004033068671319277,0.7439146469638211
"State Department spokesman James P. Rubin said U.S. 
officials conveyed their concerns to the Chinese Ministry of Foreign 
Affairs and urged that Xu be released immediately.",9.200000000000001,0.003210656133380851,107,0.00024680850292954014,0.004111272966171728,0.767407984703589
"U.S. officials 
received confirmation Wednesday that Xu is being detained on suspicion 
of ``having conducted activities damaging to China's national security,'' 
Rubin said.",17.48,0.004264034991500323,101,-0.014312336656412917,0.0041362546959326525,0.7625294155039736
"He said he had no information from Chinese authorities 
about Qin or Wang.",12.88,0.00836328002424173,34,0.012816767100707638,0.003681691495501073,0.6995421921732474
"Two other democracy party supporters taken into 
custody in central Wuhan city along with Qin _ Chen Zhonghe and Xiao 
Shichang _ were released Wednesday morning, said He Xintong, Xu Wenli's 
wife.",129.72,0.004109203546507409,114,0.019601486339449074,0.0038505773245565444,0.7711292463236159
"She added that police questioned the pair about the party as 
well as Qin's human rights monitoring organizations.",103.04,0.0054789872358403675,61,-0.07825366350021679,0.004224688446236761,0.7437223588804358
"Qin and Xu are 
towering figures in China's persecuted dissident community.",42.32,0.003345693816168751,48,0.016058422160846957,0.003682731562500248,0.7370493250298706
"Their 
activism dates to the seminal Democracy Wall movement of the 1970s. 
",13.8,0.0015752579710393538,44,0.01814690872417575,0.003488533769552655,0.732606624423676
"Wang was a student leader in 1989's influential Tiananmen Square democracy 
movement.",72.68,0.003433116173750534,65,0.10962507656407133,0.0038396325670280894,0.7451822413360568
"All have spent time in prison, Xu for 12 years, much of 
it in solitary confinement.",26.68,0.004142581030562282,42,0.16541648947355245,0.003727462086056778,0.6734863237293383
"Xu's wife said she does not know where 
he is being held and, in her 20-year experience with the authorities, 
believes they are unlikely to tell her.",18.400000000000002,0.0038066213049494754,44,0.040453555364262345,0.004175115581931027,0.7368881109590806
"Released in 1993, Xu picked 
up his campaigning for political change soon after his parole ended 
last year.",58.88,0.00404150429710569,53,0.04762634073287758,0.004146758730291352,0.7482399577723899
"He has tried to use China's nascent legal system and the 
international treaties it signed to push for reform.",18.400000000000002,0.002130953989897269,57,-0.06510118154632381,0.0037366938536993665,0.7394977322424547
"``My husband 
is innocent and there's nothing he can be criticized for,'' said his 
wife, He Xintong.",16.560000000000002,0.002141637563241224,35,-0.0006289944114954729,0.002833848050794414,0.7047311990414609
"``They're going to have to expend a lot of effort 
to make him a criminal.'' 
 
",13.8,0.0027628538730727825,27,0.005826553621981672,0.0036240214341878,0.7063009961166875
"China's government said Thursday that two prominent dissidents arrested 
this week are suspected of endangering national security _",56.120000000000005,0.00495383885644203,83,-0.008505555394691736,0.004164596963936367,0.7493677199891569
"the clearest 
sign yet Chinese leaders plan to quash a would-be opposition party. 
",80.96000000000001,0.0031754351037315506,54,-0.01769044102245027,0.004249594640165892,0.43382052657154413
"Foreign Ministry spokesman Zhu Bangzao refused to specify what laws 
were broken or how Xu Wenli and Qin Yongmin endangered the state. 
",18.400000000000002,0.004997409437323544,78,0.027969186750722658,0.003547529065869118,0.7615584923879786
"A third leading advocate of the China Democracy Party who has been 
in custody for a month, Wang Youcai, was accused of ``inciting the 
overthrow of the government,'' the Hong Kong-based Information Center 
of Human Rights and Democratic Movement in China reported.",43.24,0.008380575707557443,153,-0.0787876425709373,0.0043251803035550904,0.7764599123030831
"All three 
men could face up to life in prison if convicted of the harshest measures 
under China's vague state security law.",64.4,0.004339477349035812,62,0.09281370033020422,0.004137944327473708,0.7551700319633669
"The ruling Communist Party 
has resorted to the law to silence dissent since it went into effect 
last year.",42.32,0.002988640238913217,51,0.06589359453837265,0.004100789701460819,0.7401856994409286
"The arrests of Xu and Qin at their homes Monday night and 
the accusations against them and Wang were the sharpest action Chinese 
leaders have taken since dissidents began pushing to set up and legally 
register the China Democracy Party in June.",23.0,0.007152195807747623,123,0.017088374002389484,0.004393827042442576,0.7728246550574535
"Xu and Qin were ``suspected 
of involvement in activities endangering state security'' and their 
``behavior breached relevant provisions of the criminal laws of the 
People's Republic of China,'' Zhu said at a twice-weekly briefing. 
",37.72,0.0036583185509270586,136,0.010296957168748143,0.004291192868221232,0.7736754147733246
"Police in Hangzhou city notified Wang's wife Wednesday that charges 
have already been submitted to prosecutors, bringing him a step closer 
to trial, the Information Center said.",41.4,0.005514019185150683,99,0.001488094347177456,0.004231731358751977,0.7655068027597002
"Xu and Qin are influential 
figures in the dissident community, having started their campaign 
for change 20 years ago in the seminal Democracy Wall movement.",72.68,0.00440592724615206,96,0.07330120559365683,0.004176203149280168,0.7677277259003358
"Wang 
was a student leader in the 1989 Tiananmen Square democracy demonstrations. 
",57.96,0.002709309400522869,58,0.18274853473655164,0.003695321303404747,0.738692876595392
Both have served time in prison.,18.400000000000002,0.003956728060032517,15,0.11399904869853526,0.0038328881507236332,0.5191777590612289
"Xu spent 12 years in jail, much of 
it in solitary confinement.",11.040000000000001,0.0026362887184377907,36,0.1257510905162622,0.0035574018137713983,0.7021292690622234
"Since dissidents began organizing and 
trying to legally register the China Democracy Party, police have 
harassed and briefly detained more than two dozen members, but until 
now the government had not leveled such politically charged allegations. 
",57.96,0.005273555855524457,134,-0.005819033797964076,0.004275239476159714,0.7678740990275208
"The Communist Party has never allowed another political party to form 
since it took power in 1949.",99.36,0.006200974906184696,46,-0.0012113754400278824,0.003923081058490164,0.7344991241360193
"In Washington on Wednesday, White House 
spokesman Joe Lockhart said the United States deplored the arrests 
and said the dissidents' peaceful political activities were fundamental 
human rights that all governments should protect.",63.480000000000004,0.004382631777846981,146,-0.08744770361805347,0.004251697511267421,0.7693790289083773
"U.S. officials conveyed 
their concerns to the Chinese Ministry of Foreign Affairs and urged 
that Xu and Qin be released immediately.",4.6000000000000005,0.004998297746356851,76,0.006597767727510866,0.004007498052296937,0.7570745137874156
"Zhu criticized the United 
States for condemning the arrests, saying that ``no country, including 
the United States, should interfere in China's internal affairs.'' 
",6.44,0.0036542531876934117,91,-0.026140090608123768,0.004092163624830699,0.7611430101168595
"China in October signed a key U.N. treaty on civil and political rights 
that guarantees freedom of expression and freedom of association. 
",56.120000000000005,0.0037161681231731177,88,-0.09717738600487878,0.004111992703929549,0.7613584168538039
"It was the 17th international human rights treaty China has signed. 
",42.32,0.00611602630367069,42,-0.15084980699995923,0.0039500030981180325,0.7316316487262049
"Zhu told reporters there was ``absolutely no contradiction at all'' 
between China's support for these treaties and its arrests of the 
two dissidents. 
 
",5.5200000000000005,0.0028838108420397896,71,-0.02813772713047997,0.0041369270198764185,0.7445232494374905
"With attorneys locked up, harassed or plain scared, two prominent 
dissidents will defend themselves against charges of subversion Thursday 
in China's highest-profile dissident trials in two years.",64.4,0.004596662692363364,112,0.04195110581797342,0.004219107605753709,0.4677612430513586
"Qin Yongmin's 
and Wang Youcai's families were running out of options Wednesday to 
help the pair, leading organizers of a budding opposition political 
party.",95.68,0.0031794013698411344,90,0.0059303297604040486,0.004196824844214185,0.6794666612734453
"Qin's family pleaded for a postponement at Wuhan's Intermediate 
People's Court, but court officials denied the request.",27.6,0.003442584610918743,78,0.004458841182677792,0.003997975955705338,0.7562744134335795
"Police have 
detained one lawyer and threatened another, and subtler pressures 
have been used on others, family members said.",25.76,0.006044753087234126,53,-0.014848779631495513,0.003984223809456158,0.7376702060159589
"Given the interference, 
Wang Youcai's wife assumes he will be convicted.",13.8,0.00284687879439247,40,0.039784406332501666,0.0036747632128689835,0.7201391173443906
"``Whether he has 
a lawyer or not, whatever he says, the government has already decided,'' 
Hu Jiangxia said.",34.04,0.0040429556938403706,32,-0.01444518303209324,0.0038801038453004206,0.7065831658177452
"Qin and Wang will be tried separately, in cities 
500 kilometers (300 miles) apart and in proceedings attended only 
by family and a few observers selected by the courts.",22.080000000000002,0.0027762020916605357,82,0.026645941768630253,0.003839584290851075,0.7631701099617297
"Qin, 44, and 
Wang, 31, are accused of inciting the subversion of state power, apparently 
for helping to organize the China Democracy Party.",35.88,0.004299716344611977,87,0.047946104559687244,0.004170452221071853,0.7619275376325911
"They face from 
10 years to life imprisonment if convicted under the harshest aspects 
of the law.",30.360000000000003,0.00392624867413611,47,0.10227082439688272,0.003962116246903439,0.7449325448937788
"By moving against Qin, Wang and the China Democracy Party, 
the ruling Communist Party appears to be signaling its determination 
to crush challenges to its monopoly on power.",11.96,0.005547647701371648,100,0.045677755655447926,0.004127124867185724,0.7628705506788064
"Authorities have detained 
or questioned more than 30 people associated with the party in a 17-day-old 
crackdown.",71.76,0.004299327280499997,55,-0.019421913127014048,0.004171911874103394,0.7458278742971621
"Qin, a democracy campaigner for 20 years, and Wang, a student 
leader of the 1989 Tiananmen Square democracy movement, are among 
the most active and influential members of China's dissident community. 
",150.88,0.006584031649215235,127,0.15262908469091496,0.004043259560857523,0.7721297031441363
"A third prominent member of the dissident community, Xu Wenli, was 
also arrested in the crackdown, but not yet charged.",68.08,0.007088025306503946,61,0.033420245387292415,0.0038461384939716,0.7400615013362956
"To prevent displays 
of solidarity outside Wang's trial, police have detained at least 
ten dissidents in the eastern city of Hangzhou, a Hong Kong-based 
rights group reported.",70.84,0.004686413696440236,105,-0.05359526984077708,0.004245480007230266,0.4711206729947769
"The Information Center of Human Rights and 
Democratic Movement in China said many more are missing and believed 
to be in custody.",9.200000000000001,0.004886145837646511,68,-0.12035818814114058,0.004246670656041368,0.7485607963954188
"To prosecute Wang, authorities violated the minimal 
rights guaranteed suspects under Chinese law and ignored court orders, 
his wife said.",34.96,0.005447369901375991,81,-0.011606752398284726,0.004174366368936884,0.7567364016062589
"``Even the judge asked me to hire a lawyer, but while 
I was doing this, some people were doing things to stop me,''",23.92,0.0033182889209708278,33,-0.004515848457892512,0.0038220321654360546,0.7306626133846948
"Hu Jiangxia 
said.",0.0,0.001998035243905088,10,-0.014199866858677298,0.0015692718081720596,0.6186140021028259
"During one meeting with a potential defense attorney, a police 
official stormed in and said, ```Don't do anything for them.",44.160000000000004,0.0023623152618466995,47,-0.014546693943956307,0.004025690057476858,0.7308231950314218
"Don't 
take this case.",10.120000000000001,0.0025415187022799868,4,0.006058538692988996,0.003481044502647053,0.5181917285523959
"Whoever takes the case, you can't win,''' Hu recounted. 
",10.120000000000001,0.003984581686195347,20,-0.0021765857402224493,0.0038941785039998144,0.6311764277232238
"Four law firms refused to take Qin's case, his brother Qin Xiaoguang 
said.",28.52,0.004883280191792466,39,0.024592629714355753,0.00375619554619577,0.7301491648911891
"The Information Center said one lawyer who initially agreed 
to represent Qin on Monday went missing for four hours and then called 
Qin's family to withdraw.",28.52,0.006007113155796368,87,-0.018499254126053074,0.0042492665385059905,0.5607109447266078
"Dispirited by the harsh treatment, Qin's 
family argued over whether to attend the trial.",38.64,0.0038535567989238504,47,0.025719932720051263,0.003929999881509473,0.7378216573505211
"Qin Xiaoguang said 
he and his father have decided to stay away to protest the unfairness, 
but another brother will go.",23.0,0.0027222700694197756,52,0.006170840138082477,0.0038206016085066195,0.7364241054763795
"Three dissidents from northeastern China 
sent an open letter to China's legislature and the Supreme People's 
Court appealing for fair trials, the Information Center said.",15.64,0.003534562626620034,105,-0.03958778950556537,0.0042131870965440845,0.7599302139263225
"It added 
that authorities violated China's own laws by not ensuring Wang and 
Qin have adequate representation.",2.7600000000000002,0.003212054500534287,63,0.022566974090830347,0.0036760407862723053,0.7458557400757497
"The letter was the latest in a string 
of petitions demonstrating the appeal of both Wang and Qin and the 
idea of the China Democracy Party.",13.8,0.003842015447816453,73,0.02132333012624622,0.004202610169877159,0.7550668105147419
"Since Wang publicly announced in 
June that he and others in Hangzhou were setting up the party, dissidents 
in at least 14 provinces and cities have set up party branches.",130.64000000000001,0.00468487164523155,77,0.006197537281848454,0.004163580107822062,0.6307994025977762
