Sent,Tm,Lex,Luhn,Lsa,Tr,LDA
"
Wall Street extended a global stock selloff Thursday with the Dow 
industrials tumbling more than 200 points for a second straight day. 
",33.120000000000005,0.002443272528089417,80,0.017802054661353536,0.0022556407961196886,0.7582268642873387
"The Dow Jones industrial average, which plunged 237.90 points on Wednesday, 
fell an additional 210.09, or by 2.7 percent, to close at 7,632.53. 
",25.76,0.0017134673279619657,89,0.029981448461377378,0.0020733698188038123,0.768854961738422
Broader market indicators also sank sharply in heavy trading.,28.52,0.0014415151271637032,43,0.0032268380010857115,0.0021415863614186225,0.727886356628623
"Bank 
and technology stocks were particularly hard hit.",13.8,0.002850219654294691,26,0.026274017855526664,0.002370258595764894,0.6992137175704034
"The selling spree, 
amid worries about shrinking corporate profits and fears of new financial 
crises, left the Dow 18.3 percent, or more than 1,700 points, below 
the all-time high of 9,337.97 reached on July 17.",43.24,0.0022797733402839314,114,0.01982832040033542,0.0024526254945821837,0.7751315512071848
"It was getting closer 
to the low of 7,400 that was reached during trading Sept. 1, before 
Wall Street's best-known indicator began a comeback bid that brought 
it above 8,100 as recently as Monday.",28.52,0.0027148296937609417,96,0.03340236645522228,0.002468678106292696,0.7669531797736929
"The Dow's 12.4 percent slide 
in the third quarter, which ended Wednesday, was its worst quarterly 
performance in eight years.",22.080000000000002,0.0022730758868803602,64,0.043824389356021884,0.002277200490336727,0.7541340643379961
"It now is 3.5 percent below where it began 
this year.",36.800000000000004,0.004698128934408338,18,0.08667961937397624,0.002192699592782753,0.6513522628873827
"Stock prices earlier plunged in Asia, with Tokyo shares 
falling 1.6 percent to a new 12-year low, and shares were falling 
sharply in Europe, where Germany's central bank left interest rates 
unchanged.",65.32000000000001,0.0034804177511401076,125,0.06573361371208612,0.0024063327961067276,0.7703270376819551
"Blue chips in London sank 3.1 percent to close at new lows 
for the year, while the key index in Frankfurt, Germany, closed down 
5.5 percent and the main indicator in Paris was off 5 percent.",99.36,0.00325067644840197,103,0.052554304897168024,0.002251684229914032,0.7707169083655178
"The 
selloff in stocks has sent a flood of money into U.S. Treasury securities, 
a traditional haven in times of uncertainty.",31.28,0.001692610466521155,71,0.0266080893830259,0.002296932810668818,0.7424570979162418
"Yields on 30-year Treasury 
bonds fell further below 5 percent Thursday, reaching levels unseen 
for long-term government bonds since 1967.",67.16,0.0019929961167757357,87,0.031082835396225333,0.0024745910995172633,0.76566270655427
"Traders were alarmed to 
see prices on the New York Stock Exchange nosedive 2.9 percent on 
Wednesday, even though the Federal Reserve had lowered a key interest 
rate one-quarter percentage point on Tuesday.",43.24,0.002630247679238694,127,0.02296309928779135,0.00241073700271025,0.7697250050195228
"Some traders were disappointed 
that the cut was not deeper amid fears a go-slow approach would not 
do enough to counter the economic crises that have swept through Asia 
and Russia and are threatening Latin America.",40.480000000000004,0.002219086860950147,104,-0.02496132615613905,0.0025263852007932517,0.7688867676173782
"``The smaller-than-expected 
lowering of interest rates by the U.S. Federal Reserve has a chain 
reaction,'' said Lee Won-ho, an analyst at Samsung Securities Co. 
in Seoul, South Korea, where the main stock index fell by 1.5 percent. 
",45.080000000000005,0.0018444697053534285,136,0.029525156723377837,0.002422650399401168,0.7754650587895922
"``It is affecting Wall Street, the Japanese market, ours and others.'' 
",19.32,0.002369011490291507,30,-0.003371330752925717,0.0022302008890282697,0.7076788899683397
"The managing director of the International Monetary Fund, Michel Camdessus, 
on Thursday said the Fed made the right decision in cutting rates 
and that global powers now must push for stronger growth to offset 
steep recessions in Asia and Russia.",21.16,0.003501659690370404,141,0.015529089833218905,0.0025339908300373885,0.7745031725516689
"Asked why stock markets, particularly 
in the United States, have reacted so negatively to the Fed rate cut, 
Camdessus said he believed confidence will soon be restored, especially 
if financial leaders show resolve in their discussions over the next 
week.",66.24000000000001,0.002405156370997418,125,0.02430675301697478,0.002587444657350137,0.7700442517094959
"There also are worries about where the next financial market 
crisis may erupt after last week's dlrs 3.6 billion private bailout 
of Long-Term Capital Management LP of Greenwich, Connecticut.",104.88000000000001,0.0030736087489249314,110,-0.00794261515498353,0.0025011939704348528,0.7665932070350318
"In addition, 
investors worldwide worry that the downturn on Wall Street could signal 
a possible slowdown in economic growth _",44.160000000000004,0.002096885597999184,76,-0.022535357610675155,0.002251062031416616,0.7522339336943212
"a bad omen for the many foreign 
companies dependent on exports to the huge U.S. market.",50.6,0.002086159706569018,46,-0.031997677403728005,0.0023375381327480314,0.39606519416314623
"``There's 
a psychological impact overall, but there's also a direct impact on 
companies like Sony and TDK which derive a high percentage of their 
earnings from overseas markets,'' said Pelham Smithers, a stock strategist 
in Tokyo at",28.52,0.0010961880593574184,119,0.006112256031797647,0.0022389182910255096,0.7709376192214181
ING Baring Securities (Japan) Ltd.,0.0,0.0012226550407086847,20,0.015752829509426736,0.002193152588557799,0.6922640391950453
"A new survey in Japan 
said confidence among small- and medium-sized businesses about the 
economy plunged to its worst level since the Bank of Japan began the 
quarterly samplings in 1967. 
 
",29.44,0.0023185216727164624,103,0.03246961424220558,0.0024515191258366693,0.768388197677297
"President Boris Yeltsin would respond strongly to any effort to prohibit 
Russians from buying foreign currencies, believing the move would 
be like bringing another Iron Curtain down on the country, his spokesman 
said Friday.",51.52,0.0027209811264287415,125,-0.04666144509382312,0.002567558657570657,0.7707369324254604
"``The president clearly understands that such a ban would 
be a clear violation of our rights ... that would mean a return to 
the Iron Curtain in everyday life,'' said presidential spokesman Dmitry 
Yakushin.",34.96,0.00211074832176725,105,-0.013067992331410929,0.0024364787665651093,0.7649607283127217
"The remarks came after media reports of a government economic 
plan in the works that would prohibit Russians from buying U.S. dollars 
and other foreign currencies, and institute other strict economic 
controls, rolling back seven years of reforms.",148.12,0.004675278960028591,132,-0.07659097007036168,0.0026139865120739974,0.7722096513255301
"Though government officials 
say such a plan is only one of six possibilities, Prime Minister Yevgeny 
Primakov warned Thursday that he might be forced to take ``unpopular'' 
measures to rescue the Russian economy if it does not receive the 
next installment in a dlrs 22.6 billion loan from the International 
Monetary Fund.",129.72,0.004706946394529407,175,-0.0880913018449398,0.0025329351081949192,0.5012214919247299
"Central Bank Chairman Viktor Gerashchenko and Finance 
Minister Mikhail Zadornov flew to Washington on Friday for negotiations 
with the IMF over the dlrs 4.3 billion installment.",32.2,0.003153475732192794,124,0.035171507748584206,0.0023305912194384244,0.7660656838845769
"IMF officials 
have said they want the Russian government to come up with a sound 
economic program before the loan is given, and have made it clear 
that currency controls and boosting the money supply by printing rubles 
are not acceptable.",137.08,0.004319925259891694,112,0.01021834020980002,0.0025659741377262162,0.769937799715194
"But Primakov said that the country's plan would 
be dependent on the IMF loan, not the other way around.",56.120000000000005,0.0032715353988800595,36,-0.04636065170041723,0.002002496188045411,0.7185605722126404
"No short-term 
economic plan will be known for another three weeks, long after the 
IMF is set to make its decision, said First Deputy Prime Minister 
Vadim Gustov.",86.48,0.005075195702553857,78,-0.046975993926776864,0.0025282732502090862,0.6025567425403628
"A draft version of the government's fourth-quarter budget 
would rely heavily on the IMF loan, the Kommersant newspaper said. 
",62.56,0.002182017375086687,79,0.021951622377566773,0.002454073270795457,0.7530894977803236
"Without the loan, the government would have to engage in major deficit 
spending.",54.28,0.0014566919830378982,40,-0.014868246654085827,0.0024136819482827566,0.719375878608445
"Calls for Soviet-style controls _ part of the plan drafted 
by First Deputy Prime Minister Yuri Maslyukov and leaked to the press 
_ have apparently created a rift within the Cabinet.",30.360000000000003,0.002288944571416852,104,-0.07003568362772152,0.0024351315988912613,0.7662685654222606
"The plan drew 
heavy criticism from Zadornov, and Gerashchenko called the idea of 
banning foreign currency sales ``a mad idea.''",69.92,0.0018883313413750795,79,-0.0616585476176493,0.002506865379345628,0.7567201514534401
"Meanwhile, Russia's 
stock market dropped by 5 percent to 38.8 Friday, but trading was 
so light the downward move meant little.",68.08,0.0026013661051254235,66,-0.002923141260150763,0.0023778227494170297,0.743344765891464
"The stock market has continued 
to fall since the crisis hit Aug. 17.",64.4,0.003882080441590063,37,0.0073410795642579645,0.0023429034878291715,0.7283318896273054
"And tax collection was down 
in September, the result of the collapse in Russia's banking system, 
said Alexander Pochinok, head of the government's finance and credit 
department.",81.88000000000001,0.0028168019060952182,109,-0.020349932037005053,0.0024866318903968587,0.4591282762751092
"Revenues totaled 14.3 billion rubles (dlrs 875 million), 
700 million rubles (dlrs 43 million) less than expected.",81.88000000000001,0.0024689191955258073,75,0.0375289269604583,0.0019184697155102117,0.7640464454199885
"The government 
wants to reverse this trend by raising taxes for oil and gas companies, 
but the idea is expected to meet sharp resistance in the lower house 
of Russia's parliament, which wants to cut tax rates, Pochinok said. 
 
",81.88000000000001,0.002026307066736346,117,0.0036993197613922712,0.002516156286957149,0.7731851648377183
"President Leonid Kuchma called Friday for ``corrections'' to Ukraine's 
program of market reforms, but pledged that reforms would continue. 
",33.120000000000005,0.0028592126830125756,88,-0.021756940769851543,0.002466835816664683,0.7566369695239977
"Kuchma did not elaborate in his comments to a group of Ukrainian economists, 
saying only that the changes were necessary because of the country's 
economic problems.",54.28,0.0017325005076571282,67,0.007488742977526647,0.002454583383613203,0.7432083806418688
"Kuchma urged the economists to come up with recommendations 
before a national meeting of economists in November, the Interfax 
news agency reported.",23.92,0.00258157354285195,89,0.015380277751677787,0.0022594882934292952,0.7555501552575261
"Ukraine has suffered economic problems since 
the 1991 collapse of the Soviet Union and it has been especially hard 
hit by the financial crisis in neighboring Russia, its main trading 
partner.",91.08,0.0031048500696826886,105,-0.021045909064570278,0.002487470642587718,0.7619916378569392
"The Russian crisis has hurt bilateral trade, caused the Ukrainian 
currency to fall and led to a withdrawal of investors from Ukraine. 
",54.28,0.00175228844824842,86,-0.008531901230838548,0.0024388375552891924,0.4573016343316659
"In recent months, Kuchma has implemented some economic reforms by 
decree, prompting the International Monetary Fund to release the first 
installment of a long-awaited dlrs 2.2 billion loan.",82.8,0.0049587460734177285,122,-0.008918526136588223,0.002502212426665015,0.7680521014871898
"Many reforms, 
however, remain stalled.",1.84,0.0010270044401084618,19,-0.0018494105927926146,0.0021205190056979447,0.6643291137321102
"National Bank chairman Viktor Yushchenko 
was in Washington this week for consultations with IMF officials. 
",21.16,0.003912626406005546,73,0.10435462820006777,0.002363192533116727,0.7460573330845403
"Yushchenko has warned that the bank would not spend its dwindling 
reserves to support the hryvna currency, but has avoided comments 
on the currency in recent days.",85.56,0.002815815147557828,87,0.017059821680756756,0.002458811385369929,0.7562941834317233
"Kuchma met Friday with Yushchenko, 
Prime Minister Valery Pustovoitenko and other senior officials to 
discuss ways to stabilize the hryvna.",16.560000000000002,0.0022448300969962033,97,0.02848936544405569,0.0021943627285271106,0.7570552418115312
"The government's press service 
said they focused on possible ways to keep the hryvna under 3.5 to 
the U.S. dollar through the end of the year.",95.68,0.003457722918391922,51,0.012175633322323649,0.0025355198424055737,0.7350639609538923
"The hryvna has been trading 
at 3.4 to the dollar in recent days but trading has been limited. 
",39.56,0.0028238635016241045,40,0.004679523291003783,0.0023166380472791513,0.7179409785089071
"There are wide expectations in Ukraine that the hryvna will fall even 
further, and Ukrainians have been stocking up on food, clothing and 
household goods to save their fast-devaluing money. 
 
",47.84,0.0019473871560659604,92,0.02449837884257199,0.0024701114172481003,0.7645636231737183
"Ukraine's parliament on Friday refused to approve President Leonid 
Kuchma's decree establishing a state fund to compensate people for 
savings lost in banks.",70.84,0.0023339641201372426,113,0.004582876626631112,0.002480538606476557,0.7664792438711014
"Deputies voted 240-47 to prepare a revised 
version of the decree and debate it later in the month.",26.68,0.0018229072812867566,53,0.005315327820556679,0.0023828738488644546,0.7472232806644382
"They must 
consider the decree by Oct. 10, or else it automatically takes effect 
under the constitution.",11.040000000000001,0.0018075102063525089,46,0.007685181402268899,0.002149878722848585,0.7156342540342508
"Leftist factions, which voted against the 
proposed legislation, said it would not fully guarantee the return 
of savings lost during the financial instability that has recently 
hit Ukraine.",39.56,0.0017382076392815932,104,0.02305363290753091,0.002530523999019477,0.7652347661134495
"The fund Kuchma proposed to establish would have accumulated 
money in a special National Bank account and repay people in case 
the bank they kept their savings in went bankrupt or became insolvent. 
",99.36,0.002582159253972255,109,0.03589844201066879,0.0024210481640418125,0.7678562846406808
"Although the decree provided for compensation of deposits amounting 
only to 500 hryvna (dlrs 147 at the current exchange rate), its authors 
said it would cover more than 90 percent of Ukrainians who keep their 
money in banks.",82.8,0.0019235210070738646,111,0.040560485310822646,0.0023228307879411296,0.7697215229014382
"The measure was meant to prevent mass withdrawals 
of deposits that most Ukrainian banks have already experienced as 
people, scared by the fall of the national currency and the turmoil 
in neighboring Russia, started to stock up on food, clothing and household 
goods.",82.8,0.0030231456691585273,149,0.012540027930705126,0.0025772783028842343,0.775203002226574
"Government officials say that Ukrainians have recently withdrawn 
at least 10 percent of the 3 billion hryvna (dlrs 882 million) they 
deposited in banks. 
 
",85.56,0.004055745309882721,91,0.09620170995799328,0.002229690810694818,0.7601256336691276
"Prime Minister Yevgeny Primakov said Saturday that the economic crisis 
would not bring an end to the government's program of privatizing 
state property.",113.16000000000001,0.0026833223148585187,97,-0.1184695464372425,0.0024764413997692236,0.762170398472176
"``Privatization will be accomplished for growth of 
production, growth of investment and growth of production effectiveness 
through renewal of major funds,'' Primakov said during a meeting of 
Western businessmen.",48.760000000000005,0.0014163017337123882,133,-0.04193940832917816,0.0023900780134951767,0.7673325664916095
"``We shall conduct privatization so that it serves 
the interests of the people, the state, and business,'' he said, according 
to the ITAR-Tass news agency.",43.24,0.00254343885567829,71,-0.007918984379345193,0.002441373866421665,0.7495277568229133
"Primakov reassured the businessmen, 
members of the prime minister's consultive council on foreign investment 
in Russia, that the government had no plans to ban the circulation 
of U.S. dollars in Russia.",102.12,0.0055296550507792095,126,-0.16567969303364838,0.002454227827514921,0.7682000278769295
"But, he said, the government would take 
steps to staunch the flow of dollars from Russia.",46.0,0.002418148086018643,37,-0.06956379665299736,0.002431799756814303,0.7196939616406177
"Responding to media 
reports of a government economic plan that would prohibit Russians 
from buying U.S. dollars and other foreign currency, Primakov said 
the reports ``absolutely do not correspond to reality,'' ITAR-Tass 
quoted him as saying.",130.64000000000001,0.0031686471791354145,136,-0.1068095268530998,0.00251506478515014,0.7733255675558663
"He said there was no need to regulate the influx 
of dollars into Russia, but the government should take steps to prevent 
what he called ``the dollar drain.''",69.0,0.002364581094366908,62,-0.0721927016835846,0.002453498361651141,0.7425650286251521
"Russian companies stashed about 
dlrs 2.5 billion outside the country in September alone, the Interfax 
news agency reported Friday, quoting central bank figures.",92.0,0.002894567866761055,100,0.009018767339263746,0.0024415350447917037,0.7597031351852213
"Primakov 
said foreign investors are ``the force'' that will help Russia to 
minimize its losses from the current economic crisis.",69.0,0.005294506210564392,67,-0.11166717041867838,0.0024838526849349815,0.7432119619678786
"``We are very 
much interested in foreign investments, especially in ones that go 
into the real production sector,'' Primakov said, according to Interfax. 
",23.0,0.0025143249772244473,63,-0.0839522040001311,0.002352436924248614,0.7381125378763612
"``We need a continuous dialogue with foreign investors, without whom 
it will be difficult for us to overcome the current difficulties.'' 
",27.6,0.0013606282970396225,67,-0.03745089263599938,0.0024017493303142767,0.7335311232806387
He said Russia wanted long-term investments.,0.0,0.002763490962620059,29,-0.07859556639958072,0.002530120149580642,0.4896526815749347
"``Foreign capital has 
been coming to the country via short-term operations,'' Primakov said. 
",31.28,0.0028913193243535343,52,-0.0869362534041464,0.0025442828707035784,0.7150439324659049
"This, he said, ``is not to our liking or yours.''",0.0,0.0024309392265193367,4,0.00010277360178087182,0.0020209163107801345,0.5308890366062052
"Viktor Gerashchenko, 
the central bank chairman, said on Friday that the government must 
act to stem the flow of dollars from Russia.",86.48,0.0037695658984029353,76,-0.017805080263029398,0.002432519239497707,0.7489515815261384
"Gerashchenko and Finance 
Minister Mikhail Zadornov were in Washington Saturday for the annual 
meeting of the International Monetary Fund, where they plan to spell 
out the measures Russia is taking to bail out its finance system. 
",49.68,0.0032387922100617144,141,-0.0555346850138151,0.002499418585681155,0.7631890467793373
"Russia wants the IMF to release the second dlrs 4.3 billion installment 
of a loan that was approved in July, a month before the country's 
economy crashed and the government effectively defaulted on its foreign 
loans.",149.96,0.003464818363395566,119,-0.01112885314266507,0.0024129173432815005,0.7656524197693775
"IMF officials have said they want the Russian government to 
come up with a sound economic program before the installment is given, 
and have made it clear that currency controls and boosting the money 
supply by printing rubles are not acceptable. 
 
",134.32,0.0038162992754068015,119,0.013759315774772345,0.0025712619613338997,0.7699144101643093
"Russia's new prime minister picked an unusual way to reassure the 
nation Thursday.",43.24,0.0024710882712089418,53,-0.06037624693698887,0.0023565708800734136,0.7300592012570395
"After two weeks of deliberations he announced that 
he still had no plan to rescue the country from its economic crisis. 
",92.92,0.003721887185638346,55,-0.041848319316653275,0.0024906187429812256,0.5407887385176933
``I want to repeat once more _,2.7600000000000002,0.0013356479997472257,6,0.0003746374241853924,0.001624368938117679,0.532408404967538
"there is no program,'' Prime Minister 
Yevgeny Primakov said.",8.280000000000001,0.003181257819911326,35,-0.14567023913096408,0.0018360583102151101,0.7057218510942648
``It has yet to be worked out.'',0.92,0.0011213845659928045,4,-0.0006766548676566,0.002132179641660142,0.5150572135824604
"In most nations 
such a statement might provoke alarm.",6.44,0.001174507194508666,28,0.007272385329252818,0.002106930791043219,0.690698905942889
"But Primakov was seeking to 
calm an anxious public that was worried that the Kremlin's cure could 
be worse than the disease.",9.200000000000001,0.001136651164420204,55,-0.036908296096769516,0.002300838382231854,0.7437693514408655
"It is not as if Russians do not have something 
to be concerned about.",1.84,0.0016426272722001186,15,-0.014390106502747569,0.0020857952622629584,0.5855720203604975
"Thursday Primakov convened a meeting of top 
aides to try to hammer out a strategy for overcoming the economic 
woes.",46.92,0.0022483403549780697,67,-0.04858351300645095,0.0023328209856641473,0.7453509238372433
"A main item on the agenda was the plan drafted by Yuri Maslyukov, 
a Communist and the government's senior policy maker on economic issues. 
",106.72,0.002388520622424082,85,-0.01864974475028741,0.0024497118805691088,0.7587994544100451
It did not take long for Maslyukov's plan to hit the street.,55.2,0.0031903050161298098,27,-0.06593796352965771,0.0023667569096836698,0.7055612005766198
"A newspaper, 
Kommersant Daily, published it in full Thursday morning.",8.280000000000001,0.0023443398451726276,50,-0.010546645448156238,0.002030232418894176,0.7195308398247664
"Not surprisingly 
Maslyukov's plan calls for a greater state role in the economy, including 
controls on hard currency.",82.8,0.004641836543646672,77,-0.0788346931434422,0.0026071729610445482,0.7508271088150733
"A new State Bank for Reconstruction and 
Development would be established using the ``nationalized assets'' 
of failed commercial banks.",3.68,0.0023135946241830507,77,0.04064336628728919,0.00230450158911513,0.7481224194254485
"Wages and pensions would be paid in two 
months, and the minimum wage would be indexed to inflation.",6.44,0.001464040080305764,44,0.0010191930767313878,0.002049606604998058,0.7340897297958677
"There 
would be huge tax cuts, a combination that suggested that the government 
was committed to printing additional money.",71.76,0.0017393807151967922,64,-0.0062689814118779864,0.002432624442779044,0.7477366038506865
"The exchange rate of the 
ruble would be set by the central bank, based on changes in inflation 
and the balance of payments.",73.60000000000001,0.003002659781658081,58,0.03351480694100364,0.0023154508065933266,0.7401358647850821
"Maslyukov's plan also implies that Russians 
would be able to buy dollars at exchanges through the country.",47.84,0.003622796676745413,51,-0.08272417528483246,0.0024583217080261137,0.7296099823888788
"It 
stipulates that hard currency could enter the country only with special 
authorization.",55.2,0.0019683105161957763,53,-0.013295058694251249,0.0024107101223814565,0.7294851942096272
"Exporters would be required to sell most of their hard 
currency reserves.",30.360000000000003,0.001599634361323892,38,-0.011985284549079572,0.002320819246492043,0.7194827243282025
"That is an allusion to currency controls that sent 
shock waves through the Russian public.",26.68,0.0022055392913207165,45,-0.03477176482141417,0.0023996171280350077,0.7259875551684021
"Russians have come to treat 
the dollar as a second currency, and many people have squirreled away 
dollars as a hedge against inflation.",57.96,0.0028820086217362807,62,-0.04950721659416702,0.0022171591454778978,0.7405310324471572
"``It is an obvious stupidity,'' 
Otto Latsis, a commentator with the newspaper Noviye Izvestiya, said. 
",10.120000000000001,0.0013016322933216962,61,0.002224586600599142,0.0009355019442773314,0.738945905639203
``People won't give their dollars away.,0.92,0.0027211151287568564,16,-0.033440088074727856,0.002421994394414956,0.5896850248770188
"They will go to the black 
market if they need to.''",24.84,0.002468389453192965,11,-0.0033523566302237685,0.002154000089126427,0.5975630217132851
"Yegor Gaidar, the former prime minister 
who favors free markets, said the plan was a ``war against the dollar'' 
and predicted that it would lead to a shortage of imports.",85.56,0.0026648371759574667,77,-0.06934160602778067,0.0024642997231314355,0.5042816051234458
"As the 
criticism grew, Primakov rushed to distance himself from the talk 
of currency controls.",31.28,0.0023243631333221795,52,-0.06868391224970116,0.0024727369957264684,0.7357766435512116
