Sent,Tm,Lex,Luhn,Lsa,Tr,LDA
"``The rumors of the state's becoming a monopolist 
on the inflow of hard currency into the country is nonsense,'' he 
said, asserting that the document published by Kommersant Daily was 
just one of six possible plans.",72.68,0.0018292507922810838,93,-0.0404414041186402,0.002371104169639611,0.7628366228068427
"Primakov may be opposed to wildly 
unpopular currency controls.",23.92,0.002042848595841478,44,-0.08655707470827076,0.0021093087125306324,0.7203158869994621
"He may be worried that the plan would 
would set off the panic buying of dollars, further depressing the 
ruble.",43.24,0.002410954991078976,41,-0.0402235672209276,0.002225357594476652,0.7373143974056898
"Or he may simply be trying to keep his distance from Maslyukov's 
plan while Russia tries to wrangle its next disbursement, $4.3 billion, 
from the International Monetary Fund.",45.080000000000005,0.0023760996113743192,87,-0.059444293533448316,0.0024233318781649777,0.7440843222713381
"The particulars could be modified, 
but many people following the maneuvering say they believe that it 
represents the basic thrust of the government's thinking.",57.04,0.001539945997589958,65,-0.006583265272851055,0.0023833038673289684,0.7445630880608859
"Primakov 
has called for greater state regulation and an expansion of the money 
supply, two themes of Maslyukov's plan.",65.32000000000001,0.003198255682956996,71,-0.0926124487556834,0.002525629284588374,0.38921027522867385
"The plan also has many similarities 
with the plan presented to the government by Gorbachev-era advisers. 
",81.88000000000001,0.0026601091620811366,55,-0.06044408561847385,0.002451953977119786,0.7380360673353247
"``We think it is close to being a final document,'' said the United 
Financial Group, a Russian investment business.",23.0,0.002208536258849265,63,-0.0054651975535065945,0.0025255125379254166,0.7371431199123242
"It is unclear how 
long Primakov can carry on without spelling out a detailed strategy. 
",31.28,0.0025233332460999755,45,-0.04886489941206395,0.0023408692296235526,0.7300659016877644
"The ousted tax chief, Boris Fyodorov, has argued that the IMF should 
not provide further aid until Primakov has taken tough measures to 
build a free market.",51.52,0.002950980631494067,78,0.001742356046843049,0.0025054586408976443,0.7640036481406303
"Primakov has, however, sought to turn that logic 
on its head, arguing that his government's economic strategy will 
depend on the fund's willingness to provide aid.",136.16,0.0026745984129559006,89,-0.03496843182473441,0.0025208923631861026,0.7612022904095279
"His aim appears to 
be to pressure the fund by implying that it will be the fund's fault 
if Russia is forced to default on its loans or take draconian measures 
at home.",71.76,0.0026955928270031453,77,-0.03509073370035466,0.0025181798478435056,0.7611997607143794
"Or as Primakov put it Thursday, without the fund's money, 
Russia will have to impose ``unpopular measures.'' 
 
",57.96,0.003688839230934775,56,-0.08773347711095499,0.0025035442910546924,0.7255291258848193
"When the world's finance ministers and central bankers gathered last 
year in Hong Kong, they nervously congratulated each other for containing 
_ at least for the moment _",65.32000000000001,0.001436604923662713,78,0.03255889882024703,0.0023927247859097576,0.7577018707295021
"a nasty financial brush fire in Asia. 
",18.400000000000002,0.0015278179339027497,27,0.021650684582384894,0.0022129862290818465,0.6858077525431935
"In a year's time, many predicted in hallway chatter, the troubles 
in Thailand and Indonesia would look like a replay of Mexico in 1995 
_ a rough bump in the road for a world enjoying remarkable prosperity. 
",69.0,0.0013816551618989514,112,0.04864755335595934,0.0024007186975201393,0.7686091939449569
Talk about bad market calls.,28.52,0.0049385331965869925,17,-0.02483035276288335,0.002394592842088598,0.6489813730957422
"Twelve months later, as the same financial 
mandarins clog Washington with their limousines and glide through 
endless receptions at the annual meeting of the International Monetary 
Fund and the World Bank, just about everything that could have gone 
wrong in the world economy has: the worst downturn in Japan since 
World War II, economic meltdown in Russia, a depression in Indonesia 
that is plunging 100 million people below the poverty line, and deep 
fears over what happens next in Latin America.",143.52,0.004449734333775509,256,0.05221396350304656,0.0025608409310262413,0.784499314775104
"What makes this year's 
IMF meeting most remarkable, though, is that the harshest criticisms 
are directed at the monetary fund itself, and, by extension, at the 
U.S. Treasury, which is viewed as the power behind the IMF.",69.92,0.004202854804428952,86,0.09685409957129427,0.0025320518989797413,0.7613542657012395
"This year, 
in place of confident predictions, there are mutual recriminations. 
",27.6,0.001310136543491753,47,0.033571708198821534,0.002308842390552162,0.7093586766596087
"Arguments are breaking out over whether the true culprits were crony 
capitalists and weakened leaders like Russian President Boris Yeltsin, 
or huge investors who poured money into the world's emerging markets 
with reckless abandon in the mid-1990s and panicked in the past twelve 
months.",67.16,0.0021934135067829047,160,0.013797330708928635,0.0025333437943112643,0.7780661949390926
"Whatever the reason, one reality prevails: Hundreds of billions 
of dollars have fled from economies on four continents _ seeking the 
safest havens possible, often in the United States _ and the money 
is not returning anytime soon.",30.360000000000003,0.002183070809291301,103,-0.0030606060812048887,0.0024861061873312942,0.7664911123607497
"And the subtext of every seminar on 
capital flows and every conclave of nervous ministers will be some 
painfully blunt questions: Can this be stopped?",16.560000000000002,0.0010898226136506323,74,-0.02412327056131734,0.0023726888544031086,0.7520125812011282
"Or is the world headed 
for a global recession?",32.2,0.0025188235900837604,24,0.054724803476540254,0.0022441353578678573,0.6790896151703549
"Fifty-three years ago the IMF was created 
after the Bretton Woods conference which sought to stabilize the world 
economy and secure the peace after World War II.",53.36,0.0019380700413827697,94,0.08173189049783594,0.002509199474478287,0.765536364390443
"Now it is under attack 
from all sides, charged not only with worsening a bad situation by 
misjudging the economics, but with being politically tone-deaf in 
some of the most volatile capitals in the world, from Jakarta, Indonesia, 
to Moscow.",49.68,0.0027644885035999957,112,0.03130342935782487,0.0024676918882688605,0.7652200571763275
"For the first time, there are disturbing questions about 
whether the institution itself is still capable, financially or politically, 
of containing the kind of economic contagion that caught the world 
unaware.",79.12,0.001711163082902926,97,0.024303685252100873,0.0023860431156632013,0.7600333383135605
"Once, the IMF's critics were largely found in Africa and 
South Asia, were the fund was often viewed as arrogant; today they 
include Wall Street's biggest players and top officials in the most 
powerful economies of Asia and Europe.",42.32,0.00279683483130786,119,0.029950664180324937,0.0025229456292780086,0.7718362345956109
"Only a few _ including former 
Secretary of State George Schultz and members of Congress who are 
increasingly suspicious of all international institutions _ are talking 
about scrapping the IMF altogether.",17.48,0.0013549755788010028,116,0.02056069179827771,0.0024863814785746744,0.5110922098280776
"But almost everyone is talking 
about creating a ``new financial architecture'' that can do what the 
old one clearly cannot: smother financial wildfires before they leap 
around the globe.",40.480000000000004,0.0017175843808867482,65,0.012278307608819242,0.0022567197463781168,0.7446809824300735
"President Clinton, British Prime Minister Tony Blair 
and other leaders, after months of silence, have edged into the debate, 
in some cases wresting the issue for the first time from their finance 
ministers and central banks.",32.2,0.003230896585453692,117,-0.02197524490171598,0.0024571348537974816,0.7665686093198125
"Their fear, their advisers say, is that 
15 months of financial turmoil are now threatening political stability. 
",26.68,0.0019255204323404406,60,0.010048005339413723,0.002464440196859466,0.7390710127153468
"Such concerns have turned this year's meeting into a tumbled mass 
of worries and a groping for short and long-term solutions.",34.96,0.002458183056922027,64,-0.0038242306025256093,0.0025515515666341498,0.7558898667964945
"The Japanese, 
the French, the Southeast Asians are all arriving in Washington with 
different diagnoses of what went wrong, and different solutions about 
how to set it right.",13.8,0.0018905493592301602,69,0.012761338779727927,0.002421146172919114,0.7408360096358956
"The United States has its own set of plans, a 
mix of suggestions to force more disclosure of financial data in countries 
around the world and to impose more American-style financial standards 
and regulation.",80.04,0.00356533196538247,120,0.0042230564511574805,0.0025289488093497643,0.7685612551914907
"Meanwhile, an ideological argument is breaking out 
over whether the world should slow down a long march toward more free 
and open markets _",56.120000000000005,0.0021553654306414624,56,0.02258922068916307,0.002489250422873982,0.7474909056222689
"a strategy pressed by the Clinton administration 
for the past six years.",11.96,0.0024370424834538515,42,0.04414542275305221,0.0024835790782284715,0.7102656892765067
"Others argue that it is unwise to start rebuilding 
the hospital while the patients are still on the operating tables. 
",8.280000000000001,0.001197581246128498,50,0.002745220424504867,0.002305040857749781,0.739618278817704
"``Last year the standard answer that all of us were given came down 
to this: `We have the IMF and the World Bank, and they know best,''' 
Indonesian Foreign Minister Ali Alatas said over breakfast in Washington 
the other day, reflecting on how the crisis turned 30 years of astounding 
growth in his country into an overnight depression.",95.68,0.0038691618069753887,151,0.06487581506428833,0.002587053169043048,0.7765195916552394
"``Then they said 
everything that went wrong was our fault,'' he said.",5.5200000000000005,0.0011443312349274264,10,0.0013098566753932126,0.0015968607464959365,0.6022717837915943
"``But now, now 
I think people know that much of the problem came from the outside, 
and we need something better.''",27.6,0.002671790054250228,13,0.004075488441472253,0.0022494844282822256,0.6015356559714085
"And the IMF itself is beginning to 
fight back, an awkward role for an institution dominated by Ph.D. 
economists who are unaccustomed to being openly challenged.",24.84,0.0018594564037481033,85,0.05962944859903466,0.0024069503965847734,0.7570168355827852
"``Every 
place you turn you read the same story, that we came in, that we made 
things worse,'' said Stanley Fischer, the deputy managing director 
of the fund, who was born in Northern Rhodesia _ now Zambia _ and 
became chairman of the Massachusetts Institute of Technology's economics 
department before taking a job that has now put him in the center 
of the financial storm.",97.52000000000001,0.0019827284253435195,183,0.005034068253105011,0.002513881764482833,0.7791798694861196
"``We frequently get the blame, some of it 
well-deserved,'' he said.",5.5200000000000005,0.0015704696325820767,27,0.004507677658064914,0.0023360055668882954,0.6614185785969108
"``But it is politically convenient for governments 
around the world to cry, `The IMF made us do it,' and pin their mistakes 
on us.",31.28,0.001989350610582719,56,0.06832513975857775,0.00246801375186524,0.7370775529413083
That's fine.,0.92,0.0024309392265193367,4,2.5501164286763588e-05,0.0015907286392084945,0.5314229994941216
"We'd rather be loved, but more than that we'd 
like to be effective.''",3.68,0.0014616576818810094,13,0.0007251128899190412,0.0020553737367510682,0.6216426872015206
"MISCALCULATIONS, POLITICS AND SAFETY NETS 
On a steaming January day, Michel Camdessus, the IMF's top official, 
slipped into Jakarta to the private residence of President Suharto 
and sat down for a four-hour meeting to tick off, line by line, the 
huge reforms Indonesia would have to implement in return for tens 
of billions of dollars in emergency aid.",91.08,0.0025703687161000945,211,0.032727461920202566,0.002578763521842832,0.7821546404524446
"Two previous deals had collapsed 
when Suharto ignored the fund's conditions, so Camdessus insisted 
that he strike a deal directly with Suharto, then Asia's longest-serving 
leader.",43.24,0.002776643766806878,100,0.02766397880150351,0.002538784797734598,0.7630972816581244
"It was a meeting of men who knew different worlds of power 
politics: Suharto rose as a general in central Java, and Camdessus 
had detonated mines in Algeria for the French army before entering 
the French Treasury on his way to becoming head of France's central 
bank.",69.92,0.0032595283669314607,135,0.06614467861766075,0.0024950056126819245,0.7755045860251948
"``It was all there,'' a senior IMF official recalled.",31.28,0.0033884239179853884,23,0.18058473498818703,0.002257909340807387,0.69020855444343
"``He was 
told he had to dismantle the national airplane project, the clove 
monopoly, all the distribution monopolies.''",15.64,0.0012763135185002244,69,0.005322108979161798,0.002111878437702514,0.7442882018652992
"At one point, Camdessus 
looked at the impassive Suharto and said, ``You see what this means 
for your family,'' a reference to their vast investments in the country's 
key industries.",38.64,0.0019553684618195855,86,-0.005276775515413138,0.0024564649843252604,0.7579203994117485
"``He said, `I called in my children, and they all 
understand.'''",6.44,0.0027563567989806657,19,-0.024183453834999286,0.002174243212139503,0.6197745011959895
"But within months, that exchange in Jakarta came to 
symbolize the IMF's twin troubles: Its inability to understand and 
reckon with the national politics of countries in need of radical 
reform, and its focus on economic stabilization rather than the social 
costs of its actions.",73.60000000000001,0.0020749940791009204,147,0.005515122640206787,0.0025506533450358544,0.7734485148313652
"Suharto had no intention of fulfilling the agreement. 
",4.6000000000000005,0.0011703772700406023,35,0.008511473867145859,0.0019722235355658577,0.6877572811795668
"It was, one of his former Cabinet members said, ``a delaying move 
that was obvious to everyone except Camdessus.''",11.040000000000001,0.001851264280751361,38,0.0005400621085214606,0.002342243710480849,0.6964806670781183
"Perhaps one reason 
why the IMF sometimes appears tone-deaf is that its senior staff is 
almost entirely composed of Ph.D. economists.",13.8,0.0019810760906987823,53,0.07852945210827132,0.0023494231479398997,0.7503749764060448
"There are few officials 
with deep experience in international politics, much less the complexities 
of Javanese culture that were at work in Indonesia.",23.0,0.002409317730134076,80,0.04176443712100943,0.0022755383453567056,0.7449250612077329
"Historically, 
experts in politics and security have gravitated to the United Nations, 
development experts to the World Bank, and economists to the IMF _ 
creating dangerous gaps in a crisis like this one.",25.76,0.002981974640533501,117,0.0717416677922802,0.0024603101756841246,0.766973882035611
"As a result, the 
fund had only a rudimentary understanding of what would happen if 
its demands were met and all Indonesia's state monopolies were quickly 
dissolved.",55.2,0.002820588526786781,87,0.0034733021631500765,0.002527751268563371,0.7530421562221274
"While that system lined the pockets of the Suhartos and 
their friends, it also distributed food, gasoline and other staples 
to a country that stretches for 3,000 miles over thousands of islands. 
",34.96,0.0020060584278038533,94,0.0011095596405081808,0.002227571569825817,0.7629561599307249
"To help balance the budget, the fund demanded a quick end to expensive 
subsidies that keep the price of food and gasoline artificially low. 
",56.120000000000005,0.0017807840090319443,79,0.006816580067195518,0.0023260624685065997,0.7590515053569536
"But that, combined with the huge currency devaluation that sparked 
the crisis, resulted in high prices and shortages that fueled riots 
that continue to this day, as millions of Indonesians lose their jobs. 
",70.84,0.0025075948656102954,107,0.008913197597426743,0.0024825558646330292,0.7670024070822429
"The IMF _ unintentionally, its officials insist _ also sped Suharto's 
resignation, insisting on the elimination of ``crony capitalism,'' 
code words for removing the Suharto family from the center of the 
economy.",35.88,0.0016661453952326983,128,0.05940046174408982,0.0024455573412050444,0.769927050179271
"Ultimately, that may prove to be Indonesia's salvation, if 
the new government can contain the rioting against the ethnic Chinese 
minority _ whose money is desperately needed to save the country's 
fast-shrinking economy.",104.88000000000001,0.0013149964712277295,121,-0.008290211872299728,0.0025050175537480383,0.7676076715086756
"``It is worth noting,'' Fischer said this 
week, ``that our programs in Asia _ in Indonesia, Korea and Thailand 
_ only took hold after there was a change in government.''",60.720000000000006,0.0025524625337772344,74,0.02734920933784405,0.002520559481252773,0.6097772027164061
"Nonetheless, 
the Indonesia experience has revived the argument that the IMF is 
so focused on stabilizing banks and currencies, on preventing capital 
flight and freeing up markets, that it is blind to the social costs 
of its actions.",23.0,0.0017926906914941768,127,0.045548376242028885,0.0025478797157042813,0.7705248789779391
"Among the toughest critics has been its sister institution, 
the World Bank, whose main charge is alleviating poverty.",16.560000000000002,0.0016345625236740444,63,0.05802230093594376,0.0024651542578288553,0.7443555759422478
"``You've 
seen the tension almost every day,'' one senior World Bank official 
said recently.",51.52,0.00412791648427504,41,0.16751465746245636,0.0024930113896692334,0.7175551713632683
"The bank has gone to extraordinary lengths in recent 
months to differentiate its role from that of the fund, and to announce 
a tripling of aid to the poorest in the countries hit by the economic 
chaos.",117.76,0.0026726166805816107,99,0.005743692492657755,0.0025771731478412864,0.7658342486869012
"Even U.N. Secretary General Kofi Annan has joined the argument, 
warning in a speech at Harvard recently that ``if globalization is 
to succeed, it must succeed for poor and rich alike.",26.68,0.0018034561829311233,105,0.02122466683674006,0.0023693052934586098,0.7656214499352402
"It must deliver 
rights no less than riches.",1.84,0.0016720380387351967,16,-0.0005120312242789705,0.0022077909979970386,0.6590826782212416
"It must be harnessed to the cause not 
of capital alone, but of development and prosperity for the poorest 
of the world.''",44.160000000000004,0.002582130186257435,44,0.037952881359091806,0.002250085185028646,0.716180847401092
"IMF officials say they are changing strategies when 
they see they are exacting too great a social cost.",12.88,0.003606444525388952,45,0.07428772074658548,0.002509505512927265,0.40620703416761395
"``It's a very 
difficult formula to get exactly right,'' Fischer said in August, 
as Russia was teetering and the IMF was sending in $4.8 billion in 
aid that was rapidly wasted.",36.800000000000004,0.002475158321808475,72,0.026741789195425223,0.0024469492091288287,0.7570047487870529
"``You need enough discipline to send 
the right message to the markets and keep investors from fleeing. 
",11.040000000000001,0.0021066302586691854,39,-0.008118695927332642,0.002389943614531373,0.721346481840227
"But you need enough leeway to keep people from suffering more than 
they otherwise would.''",18.400000000000002,0.0017720672161743037,18,-0.0026504767639115414,0.0020104357503217102,0.6481438550693532
"In recent months, he noted, the IMF has allowed 
more spending to sustain subsidies for basic goods for longer periods 
in Indonesia, Korea and elsewhere.",11.040000000000001,0.0019590536125820156,75,0.03557684111120757,0.0025664704404182856,0.6767223967874099
"``There is a new flexibility at 
the IMF'' a senior Indonesian official concluded recently.",36.800000000000004,0.0021757528328961366,54,0.14043240899903603,0.002354300067598891,0.7301495623018504
"``It is 
a lot better.''",1.84,0.0013240360714908894,3,-0.0036939092444438627,0.0019173803138464191,0.5322166125293656
"A U.S. PAWN, OR A RUNAWAY AGENCY?",0.0,0.0011033134025913653,17,0.0011417617282499946,0.0018029801902042153,0.6650579994933211
"The Clinton administration 
admits that the IMF has many failings, many of them on display this 
year.",25.76,0.001305564706516764,47,0.07792792165461368,0.0024738517546204044,0.7301851182543082
"But it insists that the world has gone through global financial 
crises without an IMF once before in this century _",46.92,0.003953064313617348,42,0.09866229792661323,0.0024026581603773757,0.7210272452275875
"and the result 
was the 1930s.",6.44,0.0013754524286402115,11,0.000714785359335924,0.0020317721955269725,0.6033229232944723
"``I have no doubt the situation over the past year 
would have been much worse _ with greater devaluations, more defaults, 
more contagion, and greater trade dislocations _",39.56,0.00288626564053031,78,0.021100193051312718,0.0023711405035045986,0.7525377358288549
"without the program 
agreed with the IMF and the finance it has provided,'' Deputy Treasury 
Secretary Lawrence Summers told Congress last week.",32.2,0.003014135529096393,82,0.05237407963121367,0.0024305954997240627,0.5609635371007242
"Many Republicans 
and some Democrats are unconvinced.",0.0,0.0024309392265193367,30,-0.00010608972363550549,0.0016796150082318874,0.6655705548981978
"Even though the Senate has overwhelmingly 
approved an $18 billion contribution to the fund to help it fight 
new crises, the House defeated that measure two weeks ago.",68.08,0.001882653408075389,88,0.014444645453552282,0.0024530149530940797,0.7617895845212705
"The fund's 
last hope of getting the money, which will free up nearly $100 billion 
in contributions from other nations waiting for the United States 
to act, will come when the House and Senate try to resolve their budget 
differences in a conference committee in the next 10 days.",99.36,0.0028220362285138224,122,0.02885780801251451,0.0025569723048249533,0.7704315559360086
"A rejection, 
Treasury Secretary Robert Rubin insists, would send a message around 
the world that the United States is turning its back on the one institution 
charged with restoring economic stability.",78.2,0.004868088077866643,120,0.05391761897596682,0.00255145802697509,0.7671744853813511
"Everywhere else in the 
world, though, politicians and businessmen insist that one of the 
biggest problems with the IMF is that, contrary to the view of Congress, 
it acts as the U.S. Treasury's lap dog.",41.4,0.00242762848734308,82,0.08001093676053998,0.0025072100416265886,0.7600545665619122
"Ask in Jakarta or Moscow, 
and the response is the same: The IMF never ventures far without looking 
back for the approving nod of its master.",15.64,0.001384740665819759,52,0.048941378606923755,0.0024279095021216123,0.7354883759048034
"When the United States weighs 
in, however, is when the IMF is called on to rescue a country in deep 
trouble.",34.04,0.004192620830468971,49,0.03116058536904559,0.002514879133247241,0.735797586573684
"Only then does the IMF _ and the U.S. Treasury _ have the 
leverage to extract commitments in return for billions in aid.",20.240000000000002,0.003111071558740929,52,0.07762844782636452,0.0022609031071608933,0.7385667662169234
"In 
theory, the U.S. influence is limited: It has an 18.5 percent vote 
in the fund.",49.68,0.002146816171312484,38,0.022220194230733795,0.0023788924708184186,0.7280607552788745
"Germany, Japan, France and Britain have about 5 percent 
each.",26.68,0.0018523473462036322,33,0.036672432056062215,0.002163666056031643,0.7099741498905677
"But in practice the United States usually gets its way, exercising 
its influence behind the scenes, often in interactions between Fischer 
and Summers.",5.5200000000000005,0.002966587371243492,66,0.0203920905824711,0.0023783385276396024,0.7413538198395392
"The two met when Fischer was on the MIT faculty and Summers 
was a graduate student taking one of his classes, later becoming a 
colleague at MIT.",8.280000000000001,0.0013277362318804948,65,0.00998632093219841,0.0019148152270024525,0.7536456713996347
"Each served as chief economist of the World Bank. 
",11.96,0.0036497089072617455,28,0.0855146272226634,0.0022085966814634978,0.6968380176732827
"It was Summers who was instrumental in placing Fischer in the fund's 
no. 2 job, and these days they talk constantly.",45.080000000000005,0.003439825152458829,55,0.01909653389815585,0.002447945933211093,0.7438893667208615
"``It's usually a warm 
relationship,'' Fischer said this summer.",11.96,0.002514315907794731,29,0.014555623475718234,0.0019732212132336983,0.6903402761812005
"``Remember, this is a job 
where you cannot turn to outsiders for advice _",16.560000000000002,0.0012192337200802917,29,0.003084408433476821,0.002169018420178096,0.6923466273731027
"you can't call the 
chief economist at a Wall Street firm, or even many of your academic 
friends, because so many of the issues are confidential.''",29.44,0.002020902649826244,63,-0.0007617467558511293,0.002305532510576616,0.7436107604069875
