Sent,Tm,Lex,Luhn,Lsa,Tr,LDA
"But Cook 
said Britain will not budge on the demand by Washington and London 
that the suspects serve any sentence in a Scottish jail.",20.240000000000002,0.004579288494196869,70,-0.04847692239419704,0.0050421145048477715,0.7532224117750753
"Annan said 
he was tired after arriving back in Jerba.",3.68,0.003962420387313482,25,0.02431527876122164,0.00422169493900725,0.6782260283062466
"He left Sunday for a summit 
of the Gulf Cooperation Council, a federation of six Gulf states, 
which begins Monday in the United Arab Emirates.",11.96,0.003293336745261727,87,-0.009334417018756053,0.005195401869608713,0.7628414247788343
"In Washington, James 
Foley, a State Department spokesman, said the United States is awaiting 
a briefing from Annan but is ``disappointed'' that Libya has not complied 
with U.N. Security Council resolutions.",7.36,0.004970975648919324,122,-0.043065856492400585,0.005125716967894598,0.7685976169823348
"``Compliance means turnover 
of the two suspects for trial,'' Foley said.",23.0,0.00466987910768932,39,-0.03828964562417088,0.004567547570132807,0.716614278683892
"``It's been almost 10 
years since the Pan Am 103 tragedy, this has gone on for far too long.'' 
",11.040000000000001,0.0034244008953660077,23,-0.015057224451238192,0.004852751902663143,0.7207572405039384
"State-run Libyan Radio quoted an unnamed official in the Foreign Liaison 
Secretariat, which is the equivalent of a foreign ministry, as saying 
Sunday that ``a solution to this crisis is within reach.''",39.56,0.005089650494502264,115,0.06829472443259407,0.005302266197688666,0.7684349467301698
"Annan's 
meeting with Gadhafi took place after Libya's official news agency, 
JANA, initially reported that Annan might not be able to meet with 
the Libyan leader because Gadhafi was ``in the desert.''",75.44,0.00948427352710652,99,0.18907884748342246,0.005263793921766754,0.7673054495074076
"U.N. spokesman 
Fred Eckhard said Annan was taken on an hour's trip into the Libyan 
desert in a four-wheel drive vehicle to meet with Gadhadi in a tent 
with a roaring fire outside.",59.800000000000004,0.0035658089328216595,90,0.10296163504919412,0.0050554694937580864,0.5367783049991941
"Earlier, Libyan media suggested that 
Gadhafi had no authority to hand over the suspects _ an indication 
he was giving himself room in case he decides against giving up the 
two men wanted by the United States and Britain.",30.360000000000003,0.006196069962518273,109,0.020413958668154306,0.005554767906457036,0.768628645090726
"JANA indicated a 
decision on handing over the two suspects would have to be approved 
by some 500 grassroots national committees before being considered 
by the Parliament.",20.240000000000002,0.004016981243164534,81,0.020415518633534083,0.0050957642596151645,0.7539535093748961
"Libyan radio reported that the Parliament had been 
called to meet Tuesday in Sirte, 250 miles (400 kilometers) east of 
Tripoli, but did not say whether the Lockerbie issue would be discussed. 
",48.760000000000005,0.005459464075290439,98,0.12471739699726993,0.0052562792741933356,0.7652318516470914
"Annan flew into Libya aboard a special plane from Jerba after receiving 
clearance from the U.N. Sanctions Committee.",14.72,0.004538268479425877,69,-0.07859458439162426,0.004891042665884894,0.7521873198967312
"Libya has been under 
U.N. sanctions since 1992 for its refusal to hand over the two suspects. 
",24.84,0.007058301671700539,35,-0.1734509627780623,0.0050320542390996075,0.7202173459577647
"The U.N. sanctions ban air travel in and out of the country but do 
not cover oil exports, Libya's economic lifeblood.",49.68,0.004197062682766989,64,-0.17202562169231542,0.004846115927675135,0.7546149533301612
"The Netherlands 
was chosen as a venue after Libya proposed a trial in a neutral country. 
",35.88,0.004064888324045755,53,-0.10292956639567143,0.005101501415022162,0.7358475447261503
"But a disagreement has arisen because Libya wants the suspects jailed 
in the Netherlands or Libya if convicted, but the United States and 
Britain insist they be imprisoned in Scotland. 
 
",3.68,0.0075859343249635855,98,-0.10043821700926918,0.004940026645733425,0.762620857326801
"Libya's justice minister on Wednesday said the two suspects in the 
1988 bombing of a Pan Am jetliner should not become victims of Western 
politics when they go on trial.",69.0,0.009107035482436899,84,-0.03132937320230878,0.005109165100758377,0.5697664230789227
"``We want to be sure that the only 
aim of the trial is to show the truth ... and that it is held without 
a political or security background,'' Justice Minister Mohammed Belgasim 
al-Zuwiy said.",46.92,0.0054722357256002385,86,-0.02328607236023299,0.005350820422352045,0.7553180270863187
"He was addressing the General People's Congress, or 
Parliament, which opened a debate that will decide the fate of the 
two men who are wanted in connection with the Dec. 21, 1988 bombing. 
",42.32,0.004878093158173146,91,-0.018122783267137167,0.005404193664094561,0.764813684084777
"A total of 270 people on board and on ground were killed when the 
jetliner blew up over the Scottish town of Lockerbie.",33.120000000000005,0.00403774832449356,62,-0.04131627263660918,0.004751624062075334,0.7541888819526249
"Libya has accepted 
in principle to a trial before a panel of Scottish judges in the Netherlands. 
",24.84,0.004480978906205233,53,-0.06982353044028769,0.004807891388066019,0.7274109684277174
"But the hand over of the suspects has been held up over Libya's demand 
for a guarantee that the two men, if convicted, will be jailed in 
Libya.",19.32,0.00799517805549344,55,-0.07585109401617779,0.005189119618969327,0.7474777664821575
"The United States and Britain insist that the two suspects 
serve their prison term in Britain.",12.88,0.0046191205053071225,54,-0.05021022129731139,0.005207564908152132,0.7454757994226925
"The Parliament meeting, expected 
to last five days, is being held in the northern coastal town of Sirte 
and was broadcast live on national television.",28.52,0.00660964551411652,85,0.035519589204496514,0.005165795450101735,0.7508385654703075
"Libyan media have suggested 
that Libyan leader Moammar Gadhafi does not have the authority to 
hand over the suspects and that any decision would have to be approved 
by the Congress.",43.24,0.009066250639979886,88,0.09489076516940222,0.005175933872104227,0.7564890754655835
"``Our argument is that since this is an exceptional 
trial, therefore this exception should include serving the jail term 
in Libya, maybe under U.N. supervision,'' al-Zuwiy said.",37.72,0.0041154123742963445,77,-0.0639887886578889,0.0052693663700125815,0.7562603136829082
"He said Libya 
is seeking the guarantees from the West to ensure that the trial will 
be ``honest, just .. and without loopholes that (would) leave our 
citizens in illegal, unjust and inappropriate circumstances.''",31.28,0.001980931572237938,97,-0.034237365762343965,0.004921591305437146,0.7636894827728594
"Opening 
the debate, Foreign Minister Omar al-Muntasser gave the background 
to the controversy since the Security Council imposed sanctions on 
Libya in 1992 to force it to hand over the Lockerbie suspects for 
trial.",52.440000000000005,0.007459362446629475,134,-0.10252345818975811,0.005532769998823955,0.7687292765930056
"The sanctions include a ban on air travel from and to Libya, 
restricting diplomatic personnel and banning the purchase of oil equipment. 
",38.64,0.00489436192131173,82,-0.13870619634089074,0.004918348742004898,0.7613374099703099
"Al-Zuwiy, the justice minister, said the two suspects will have the 
right to an appeal in the same court if it finds them guilty.",21.16,0.005855505666479615,51,-0.018839649883480674,0.005115274993283492,0.7352025266600305
"On Saturday, 
U.N. Secretary-General Kofi Annan met with Gadhafi to iron out the 
details.",0.92,0.0048648094072543625,55,0.09945980677878734,0.005088126220105821,0.7389303153461706
"No agreement was reached but Annan said Libya is expected 
to reach a decision soon. 
 
",11.96,0.005598100337273215,43,0.0022039296714221833,0.005152674130689606,0.5374533242342432
"Qatar's foreign minister, Sheik Hamad bin Jassem bin Jaber Al Thani, 
met Libyan leader Moammar Gadhafi in the desert on Saturday, Libya's 
official television reported.",67.16,0.005489056085920474,129,0.10645802498694928,0.004466157487688971,0.7748214916544031
"The television, monitored in Cairo, 
did not say where the meeting took place, but it showed Gadhafi, dressed 
in a muddy brown gown and matching cap, receiving the Qatari minister 
in a tent.",33.120000000000005,0.004506430843429197,94,0.06385034055699079,0.005076727308475402,0.7674988108768618
"Al Thani handed Gadhafi a letter that reaffirmed Qatar's 
support for Libya ``in its just position toward the so-called Lockerbie 
case,'' the television said, referring to Libya's objections to the 
U.N. sanctions imposed in 1992 to press it to hand over two Libyans 
wanted for the 1988 bombing of a Pan Am airliner over the Scottish 
town of Lockerbie that left 270 people dead.",97.52000000000001,0.006802207856090575,207,-0.07214575894942316,0.005539235231137171,0.7820037042608388
"The television gave no 
other details about the visit. 
 
",16.560000000000002,0.007251611512718086,25,0.038071615187020486,0.005054455588591987,0.41163976764611815
"With the mournful lament of bagpipes and prayers of healing, the people 
of Lockerbie paid tribute to the 270 people killed when a bomb brought 
Pan Am Flight 103 crashing down on this tiny town 10 years ago Monday. 
",59.800000000000004,0.0074942911649213476,118,-0.03840057543436536,0.005099783161201541,0.7767276645004723
"The hundreds who packed Dryfesdale Parish Church heard messages from 
British Prime Minister Tony Blair and U.S. President Bill Clinton, 
who renewed their vows to punish the culprits who hid the bomb in 
a suitcase on Dec. 21, 1988.",25.76,0.0067509865726139515,139,-0.0036117892914025915,0.005318335887877261,0.7764456883480696
"But they also heard quiet sobs that echoed 
throughout the century-old church as a few moments of silence were 
observed before the bagpiper blew her lament.",7.36,0.0028962526231722323,71,-0.0062762416865068575,0.004467485893015689,0.7608720875877822
"``In the lives that 
were lost, some very young, there was meaning and achievement,'' the 
Rev. David Almond told the gathering of about 600 people, which included 
60 family members of those who perished.",23.92,0.0028570730943894493,91,-0.013219187975058045,0.004883307192756209,0.7677908390139061
"``Our task in commemoration 
is to continue that meaning and to build on that achievement.''",6.44,0.002625113272791593,45,-0.004374124731224205,0.004662424007563902,0.7204386040471981
"The 
congregation heard the children of the local elementary school sing 
a tribute, ``Let There be Love,'' as well as a message from the queen. 
",13.8,0.00343602306196981,69,-0.0003095707491282722,0.004337421124598906,0.7549163695003138
"``We pray on this anniversary that the families will find solace together 
in quiet remembrance across the world,'' the queen's message said. 
",21.16,0.004082200954548185,64,-0.007612624807294746,0.004581144060453559,0.7346118716532188
"In a separate service in London's Westminster Abbey, attended by Blair, 
Foreign Secretary Robin Cook and Prince Andrew, the second son of 
Queen Elizabeth II, hundreds listened as one-by-one the names of the 
259 passengers and 11 of Lockerbie's own residents were read out as 
a candle was lit for each.",12.88,0.0032665497105438452,177,0.007630443383577567,0.005138897399399952,0.7791139451824631
"Simultaneous services were also held at 
Arlington National Cemetery in Virginia and in Syracuse, New York, 
which lost 35 college students in the crash.",5.5200000000000005,0.0036638103581449035,93,-0.0008902787681844888,0.004576763736649266,0.763593612643795
"Each service began at 
7:03 p.m. (1903 GMT), the moment when the plane disappeared from the 
radar screen above Scotland.",14.72,0.002491963810921499,61,-0.00791168693590306,0.004465783365335316,0.7544397372897098
"``This was a very positive, emotional 
day,'' Bert Ammerman of River Vale, New Jersey, whose brother Thomas 
died in the crash, said after the service.",18.400000000000002,0.0030750977548513,75,0.010508015728589478,0.004542415621303376,0.7614814015869691
"He said the people of Lockerbie 
have ``proven over the past 10 years that good intentions can overcome 
evil.''",23.92,0.004552709891636329,55,-0.021315296042890335,0.00522085693488828,0.7405287643830712
"Earlier in the day, Prince Philip, the queen's husband, laid 
a wreath in Lockerbie's cemetery, where the town's Roman Catholic 
parish priest at the time of the crash spoke to about 200 victims' 
relatives and townspeople about the ``ticking bomb'' of justice.",42.32,0.007526056378285625,145,0.006015785862694168,0.004883970338791876,0.7782051538738748
"``Ten 
years ago, for you and for us, a bomb was ticking,'' the Rev. Pat 
Keegans told the crowd, many of them visibly moved.",11.96,0.004371085990606383,54,-0.004055239643694694,0.004812685733637349,0.7497588440144526
"``Be assured of 
this _",0.0,0.005176470588235294,6,-3.0953243046373825e-05,0.0031193024684946415,0.530574304852709
there is another bomb ticking _,7.36,0.0035221313611865056,11,-0.0013726306508160728,0.0029416030182887426,0.6183980039728397
"the irresistible bomb of justice 
and truth.",14.72,0.0049638090338227,28,-0.0042191158610260905,0.004218363650802607,0.6868007069634757
"``Be certain that our wreath-laying today is not a symbolic 
gesture.",2.7600000000000002,0.003073395874478543,30,0.00026430991878743584,0.004534919837428461,0.7106858951847292
"It is a declaration that we will not rest until we have justice 
and truth, until all who are responsible for your deaths are held 
accountable,'' he said.",12.88,0.002644680574880159,58,-0.005858016042449899,0.005010573669453285,0.7365583322840034
"Two Libyan suspects have been indicted in 
connection with the bombing, but have not yet been turned over for 
trial.",38.64,0.004560100274335534,45,-0.0033566027310387016,0.004694033431954836,0.7215913614395295
"Last week, Libya's Parliament gave its conditional approval 
for a trial in the Netherlands by a Scottish court, but said some 
obstacles remained.",28.52,0.0045995503299001515,86,-0.018974185616749104,0.005167872729170981,0.7519572638045688
"The plane had just reached its cruising altitude 
of 31,000 feet (9,400 kms), 42 minutes after taking off from London's 
Heathrow Airport for New York, when it exploded in the night sky. 
",11.96,0.0028270574805416664,92,0.006038515035924705,0.004557498361489952,0.7703294292965057
"The aircraft was felled by a small amount of high explosives smuggled 
on in a portable radio hidden inside a suitcase, which made its way 
as checked baggage from Malta to Frankfurt, Germany, and then to London. 
",15.64,0.003359243926936752,117,0.0014073390052150526,0.004690267235154197,0.7707278379628246
