Sent,Tm,Lex,Luhn,Lsa,Tr,LDA
"
MUNICH, Germany (AP) _",0.0,0.0022782577539883614,15,-0.007558709617807268,0.002985432718558657,0.6572541723400627
"U.S. prosecutors have asked for a 20-day extension 
to provide Germany with paperwork necessary to extradite a top lieutenant 
of Saudi terrorist suspect Osama bin Laden, officials said Saturday. 
",117.76,0.005614155264440974,123,0.011617997568029826,0.004702023116229494,0.7672135810030197
"Mamdouh Mahmud Salim, 40, of Sudan, has been jailed since his arrest 
near Munich on Sept. 16 by Bavarian authorities acting on a U.S. warrant. 
",14.72,0.0029607310760554686,74,-0.0017031434967962095,0.0041232950560910015,0.7611307637353292
"Under German law, U.S. officials have 40 days after the arrest to 
turn over supporting evidence so a German court can rule on their 
extradition request.",58.88,0.004990964932609477,80,0.04784829572135617,0.004521863427812829,0.7601175108269583
"A Bavarian Justice Ministry spokesman, Gerhard 
Zierl, said U.S. authorities a few days ago asked the court hearing 
the case for an extra 20 days to provide the necessary material.",41.4,0.0032591425474355245,103,0.005715084499666623,0.004485604731466637,0.7698649078267041
"Quoting 
unidentified Bavarian law enforcement sources, Focus newsmagazine 
reported Saturday that the evidence turned over so far was not very 
strong.",27.6,0.002479237111198728,94,0.029092040760556395,0.004435009841617391,0.7594446946346541
"The magazine said much of it was based on the testimony of 
an FBI informant, a former bin Laden associate, who made only vague 
connections between Salim and terrorist activities.",110.4,0.004778517724914663,91,-0.036588147054477264,0.004486090459952727,0.7606091272181424
"Zierl declined 
to comment on the report, but said U.S. authorities probably asked 
for more time just a precautionary measure.",32.2,0.0037761724187105805,61,0.020785469163445782,0.004180840138319768,0.7424140323698559
"U.S. authorities charge 
Salim helped finance, train and arm members of a terrorist organization, 
including the alleged bombers of the U.S. embassies in Kenya and Tanzania. 
",59.800000000000004,0.00493870557143097,105,-0.036324783070366816,0.004482754519274501,0.76559810636821
"A criminal complaint unsealed Sept. 25 in U.S. District Court in New 
York charges him with murder conspiracy and use of weapons of mass 
destruction. 
 
",14.72,0.0033402858610381736,89,-0.0014843554819165478,0.004142923987869107,0.7628444252638761
"The Taliban's chief justice accused the United States on Wednesday 
of looking for an ``excuse'' to launch another missile attack on his 
war-shattered homeland.",47.84,0.005424155876872105,91,0.06048429739910359,0.004572866718991535,0.7616587848499803
"And that excuse is Osama bin Laden, the man 
Washington calls Enemy No. 1 and blames for the Aug. 7 bombings of 
U.S. embassies in East Africa, Justice Noor Mohammed Saqib said an 
interview with The Associated Press.",98.44,0.0075887955792428964,113,-0.08851586968742511,0.004596929652707796,0.7708282330100195
"On Aug. 20 the United States 
retaliated by firing Tomahawk missiles at suspected terrorist camps 
in eastern Afghanistan, killing 26 people.",37.72,0.004612178158124719,95,0.0540734171078444,0.00441106098131415,0.7586892267911818
"According to U.S. intelligence 
sources, the camps were being used to train members of bin Laden's 
al Qaeda terrorist group.",132.48000000000002,0.007360199196893655,62,-0.0021396058823853104,0.004394090637734236,0.751037553303032
"``America is looking for an excuse to fire 
more rockets on our dear Afghanistan and that excuse is bin Laden,'' 
Saqib said.",82.8,0.0037800611020807795,57,-0.04830128144625568,0.004266433139236491,0.7448870161365981
"Washington, which has posted a dlrs 5 million reward for 
bin Laden's arrest, hasn't ruled out further attacks on Afghanistan. 
",85.56,0.0033895243726934166,67,-0.029704863270991328,0.004592043429675584,0.751229665592952
"Saqib, who heads a judicial inquiry established by the Taliban to 
investigate the terrorism charges against bin Laden, says the United 
States has become insecure.",80.96000000000001,0.004969318436121213,94,-0.006616523366427778,0.0046134137899143165,0.7622708660366944
"``America fears its shadow ... in every 
part of the world it is afraid and sees every danger connected to 
bin Laden,'' he said in an interview in the Afghan capital of Kabul. 
",92.92,0.0028653570036345785,84,-0.030718900494758106,0.004595250595113984,0.7579571403547591
"In Afghanistan, bin Laden is considered an honored guest by his Taliban 
hosts.",73.60000000000001,0.0055472942974091905,50,-0.06895702882811915,0.00425817249932523,0.7354073889004935
"They cite Afghan tradition, which demands the host guarantee 
his guest protection.",9.200000000000001,0.0021910352524240604,53,-0.005757828956955165,0.004221884948994961,0.7376071571545294
"So far Saqib says he has no evidence of bin 
Laden's involvement in terrorist activities.",115.92,0.006406399053286846,49,-0.010626467658768108,0.004105521254697289,0.7282166719593378
"The Taliban have refused 
to turn over bin Laden to the United States, but they say if there 
is evidence they will try him under Islamic law.",98.44,0.01006077201675058,55,0.03024616158023816,0.004610481526426162,0.4498871939687935
"In the 90 percent 
of Afghanistan ruled by the Taliban a harsh brand of Islamic justice 
has been imposed, including the death penalty.",14.72,0.005246708584370808,80,-0.01678045873624149,0.004429274744566847,0.7593119773099405
"``We want good relations 
with the United States and all Muslim and non-Muslim countries, but 
they have to respect our ways,'' he said.",4.6000000000000005,0.002658909285575591,57,0.020979852908371212,0.004383287195295261,0.7495419156380665
"Saqib said his inquiry will 
wind up on Nov. 20 and if there is no evidence against bin Laden the 
case will be closed _ at least for the Taliban.",103.04,0.005545856529981257,53,-0.02324633452923011,0.004434956556108147,0.7527606338102415
"``Bin Laden is not 
a sinful man ...",11.96,0.006328875745839507,17,-0.09735851568491215,0.0036569707560102577,0.6882508189699633
"America has been silent ... they have given no evidence,'' 
he said.",18.400000000000002,0.003498303436535713,21,0.03901385807200765,0.00400976406628904,0.6515100847741966
"``It is too shameful for America who is now seen by all that 
world to have no reason to go after bin Laden.'' 
 
",76.36,0.00318421526454179,34,-0.04642220368211341,0.0042458617188169505,0.7189858726079233
"NAIROBI, Kenya (AP) _",0.0,0.004877523916323821,14,-0.038062126879156076,0.002826639628355673,0.6451473949814113
"FBI agents this week began questioning relatives 
of the victims of the Aug. 7 U.S. Embassy bombing as well as the seriously 
injured on request of the U.S. Attorney's office for the Southern 
District of New York, a U.S. official said Thursday.",59.800000000000004,0.004679870644192898,117,0.024567166403809838,0.004515629346029848,0.7705807605737973
"The blast at 
the embassy building in downtown Nairobi killed 213 people, 12 of 
them Americans, and injured 5,400.",28.52,0.0037562300514562465,66,-0.02435860765163246,0.00396912347590709,0.7526673316739654
"In an nearly simultaneous bombing 
of the U.S. Embassy in Dar es Salaam in neighboring Tanzania, 11 people 
were killed and 85 were injured, none of them Americans.",28.52,0.0031814647751247827,85,-0.032861984702008774,0.0038210565525059028,0.7626020768891073
"The official, 
who could not be further identified, said the questioning was aimed 
at gathering recorded testimony to be used by the prosecution in the 
pre-sentencing phase of the trials of the six men indicted in connection 
with the attack.",61.64,0.0038743845331483486,108,0.04025394606820878,0.004525879112901381,0.7671900371850027
"Wadih El Hage, Mohamed Sadeek Odeh and Mohamed Rashed 
Daoud Al-'Owhali are being held by the U.S. District Court in the 
Southern District of New York.",0.92,0.0025603209892598243,89,0.0012696733393157329,0.003376496346878415,0.7697363220968652
All three have pleaded innocent.,1.84,0.0020105530268085168,13,0.006592176284384768,0.0027171925078446684,0.6214259900968951
"Fazul 
Abdullah Mohammed is a fugitive.",1.84,0.003173302879195003,29,-0.00489946397230184,0.00267394528286789,0.68873296367491
"Saudi exile Osama bin Laden, the 
alleged mastermind of a conspiracy to attack U.S. targets around the 
world, and Muhammad Atef, the alleged military commander of bin Laden's 
terrorist organization, Al-Qaeda, were charged in a separate 238-page 
indictment with murder and conspiracy in the bombings.",235.52,0.00607795038732758,193,-0.035369047521550324,0.004440014252437719,0.6696598315166828
"Bin Laden is 
believed to be living in Afghanistan.",0.0,0.009820105178046086,30,-0.09580157871338212,0.004273331205109045,0.7064391107625204
"U.S. law provides for the trial 
in the United States of those charged in terror attacks against American 
citizens, even if carried out on foreign soil. 
 
",23.92,0.007280314817903497,69,0.05114082800952299,0.004636947519904505,0.7528933269041089
"Police arrested two journalists and charged them with writing articles 
to encourage Muslim youths to stage an Islamic revolution in Bangladesh 
after the Taliban model in Afghanistan, a police officer said Thursday. 
",12.88,0.003904349841043015,138,-0.023834080199235563,0.004570209245598296,0.7701111487474577
"Mufti Abdul Hye and Manzoor Ahmed, editors at ``Jago Mujahid'' or 
``Wake Up Mujahid,'' a monthy magazine published from Dhaka, the Bangladeshi 
capital, were jailed for a month shortly after their arrest on Wednesday. 
",23.0,0.002084026123905002,129,-0.0004111330412082191,0.0037494520128556518,0.7752818906255087
"They were arrested under a 1974 law that allows police to detain any 
one for offenses related to national security, the officer said on 
condition of anonymity.",32.2,0.002947309587251989,79,-0.00710564689550507,0.004353043206778793,0.7566795580046082
"Those arrested need not be taken to court 
for trial for up to three months.",22.080000000000002,0.009407902807374477,21,-0.008241241164471506,0.0040559288646905625,0.669302416778735
"Police seized copies of the newspaper 
for reproducing a foreign newspaper interview of Afghanistan-based 
Saudi billionaire Osama Bin Laden, who has been accused by the United 
States of masterminding bombing attacks on the U.S. embassies in Kenya 
and Tanzania in August.",40.480000000000004,0.010335448936522077,170,-0.04244902207774316,0.004674518889858242,0.7764216483110713
"Under Taliban rules women may not study or 
work outside their houses, and all kinds of light entertainment including 
music are banned.",7.36,0.002179493468258053,67,0.004902895191735043,0.004344133482061888,0.7564307148471702
"Men must grow beards of a certain length and criminals 
are subjected to amputations and public executions Even though Bangladesh 
is a predominantly Muslim country, it is governed by secular laws. 
",8.280000000000001,0.002762002767424752,110,-0.0068036244796446845,0.004191394280840618,0.7677318029115692
"Prime Minister Sheikh Hasina's liberal government hasn't recognized 
the Taliban government in Afghanistan. 
 
",24.84,0.0040108779823226715,80,-0.023706026481012374,0.004166566737940202,0.7467252892140377
"The man accused of orchestrating the U.S. embassy bombings in Tanzania 
and Kenya was declared a free man Friday in Afghanistan, where he 
has lived for years with the permission of the hard-line Islamic Taliban 
militia.",44.160000000000004,0.005400449134425196,126,-0.08751019036755786,0.004655860302965647,0.7721846960033764
"The Taliban, who control about 90 percent of Afghanistan, 
on Friday closed their three-week inquiry into allegations that Osama 
bin Laden is waging a war of terror against the United States.",92.0,0.007009715438968495,110,-0.025245572283309963,0.004714022647557264,0.7702365958864975
"``It's 
over, and America has not presented any evidence,'' Afghanistan's 
chief justice, Noor Mohammed Saqib, told The Associated Press in an 
interview at the Supreme Court building in the Afghan capital, Kabul. 
",34.96,0.004117083585639447,119,-0.000547338752217312,0.004448182795126692,0.767911372063352
"``Without any evidence, bin Laden is a man without sin.",100.28,0.006564545103894935,22,-0.04627712924160759,0.004022039567173644,0.7065495126054215
...,0.0,0.004489795918367347,0,0.0,0.0006484841025681112,0.26666666666666666
"He is 
a free man.''",12.88,0.0037388167719891448,7,-0.05025149566377211,0.003937272250173433,0.6163068459406817
"The Taliban have told bin Laden, however, that political 
activity is banned and he has agreed to respect that, the Taliban 
information minister said in a statement Friday.",91.08,0.0054737900953822655,92,-0.06127465106946967,0.004667722927807514,0.7616803083223043
"The minister, Amir 
Khan Muttaqi, also disputed U.S. assertions that bin Laden is a rich 
man, saying the Saudi dissident has had his foreign assets frozen, 
a claim not immediately corroborated. 
 
",92.92,0.002164809670895559,113,-0.04526217438620563,0.004369773883437142,0.7683672665160356
"Albania says it has uncovered a terrorist network operated by Osama 
Bin Laden, the Islamic fundamentalist accused of masterminding the 
August embassy bombings in Africa, and that it's members have infiltrated 
other parts of Europe, The Sunday Times reported.",51.52,0.006515069246240417,156,-0.05797523997035651,0.004640249456067421,0.7707507370306041
"The newspaper quoted 
Fatos Klosi, the head of Shik, the Albanian intelligence service, 
as saying that Bin Laden's network had sent units to fight in Kosovo, 
the neighboring Serbian province.",35.88,0.002498860559767583,112,-0.0251492468040801,0.004343497039860114,0.7696226634015496
"``Egyptians, Saudi Arabians, Algerians, 
Tunisians, Sudanese and Kuwaitis _",0.92,0.002073425587702979,56,0.0032151970591459233,0.002247534216619745,0.73140306656713
"they come from several different 
organizations,'' Klosi was quoted as telling The Sunday Times.",0.0,0.0030707224205532976,37,-0.018764288328293684,0.004186205994965401,0.7149319362197017
"He 
said he believed terrorists had already infiltrated other parts of 
Europe from bases in Albania through a traffic in illegal immigrants, 
who have been smuggled across the Mediterranean to Italy in huge numbers. 
",2.7600000000000002,0.0019175572864323705,105,-0.0076712304990033415,0.004276116225644552,0.7622607513234682
"Interpol believes more than 100,000 blank Albanian passports were 
stolen in riots last year, providing ample opportunity for terrorists 
to acquire false papers, the newspaper said.",19.32,0.0019244858933179583,113,-0.006781318047971219,0.0043661455272753944,0.7696497558149297
"Apparent confirmation 
of the Bin Laden's activities came earlier this month during the murder 
trial of Claude Kader, 27, a French national and self-confessed member 
of Bin Laden's Albanian network, the newspaper said.",51.52,0.005494218992017975,134,-0.060181632760152225,0.004660084637195539,0.7749384803860377
"Kader claimed 
during the trial that he had visited Albania to recruit and arm fighters 
for Kosovo, and that four of his associates were still at large.",18.400000000000002,0.0023501777992937325,64,-0.01876103162797384,0.00442315650298055,0.7528449481352836
"Bin 
Laden is believed to have established an Albanian operation in 1994 
after telling the government that he was head of a wealthy Saudi humanitarian 
agency wishing to help in Albania, the newspaper reported. 
 
",35.88,0.006393811082593357,119,-0.03246498160274749,0.0047078553695036884,0.7680555370085895
"The United States has obtained new evidence to link the owner of a 
Sudanese factory destroyed in a U.S. cruise missile strike last month 
to a terrorist group backed by Osama bin Laden, the suspected mastermind 
of the bombings of two U.S. embassies in East Africa, according to 
U.S. intelligence officials.",184.0,0.008519926783190038,175,0.10067773939355212,0.004727837638883899,0.7785223224751219
"The evidence, the officials said last 
week, shows that Salih Idris, the owner of Al Shifa pharmaceutical 
plant in Khartoum, has had financial dealings with members of Islamic 
Jihad, an Egypt-based group responsible for the assassination there 
of President Anwar Sadat in 1981.",56.120000000000005,0.006870047462071799,169,0.12097182172961696,0.00458116195435741,0.7783171783707061
"Islamic Jihad, in turn, receives 
money and sponsorship from bin Laden and has been absorbed into his 
terror network, the officials added.",89.24000000000001,0.003723801076654224,77,0.02109541472646933,0.004462553864210004,0.7578610404550812
"This evidence was uncovered after 
the United States destroyed Idris' factory in a missile attack following 
the bombing of the U.S. embassies, the officials said.",71.76,0.00938580512386966,81,0.17201690651880722,0.004524284336056085,0.7548019466949172
"A spokesman 
for Idris denied the accusations, saying Idris had no ties either 
to bin Laden or to any Islamic terrorist groups.",103.04,0.00760924894768339,66,0.05550791820645141,0.004189277109971889,0.5710001195312846
"In a statement provided 
by Tim Pendry, his London-based adviser, Idris said: ``I have absolutely 
no relationship with any Islamic terrorist organization anywhere in 
the world.",47.84,0.004005362053192311,103,0.029699177716417773,0.004600445631103547,0.7584286519589628
"I have never met Mr. bin Laden, I have never spoken with 
him, I have never had any financial or business relationship with 
him, nor knowingly with anyone acting as his agent.''",83.72,0.0026611011063180515,65,-0.015884495495705225,0.004421891976323053,0.7509438583390495
"U.S. officials 
say they have also received new reports of an increase in the Iraqi 
presence in Sudan since the missile attack.",35.88,0.00460994820601553,60,0.11891008837935511,0.004539581811676041,0.7362347570127352
"Officials said they were 
not certain what the Iraqis were now doing in Khartoum.",0.0,0.0018111043025712602,22,0.06992734737796119,0.003867853091288932,0.6511135691236069
"But intelligence 
agents previously obtained evidence that the manager of the Shifa 
plant made frequent trips to Iraq, where he visited the head of the 
chemical weapons program.",57.04,0.004886956795148437,108,0.09832375566565868,0.00451575834942864,0.7679299626034664
"In addition, a soil sample that the CIA 
clandestinely took at the Shifa plant showed the presence of a chemical 
used in the production of VX nerve gas, a process used only by Iraq. 
",27.6,0.0035309194173334464,95,0.07475518871589212,0.0038280543028793215,0.764986951840965
"The new evidence comes as President Clinton faces attack over his 
decision to strike the Shifa plant.",58.88,0.007757119114584995,58,0.14949205925676023,0.004436749707256794,0.744322015646788
"Some State Department and CIA 
officials have objected to the decision, arguing that it was based 
on tenuous evidence of a connection between the plant and bin Laden. 
",107.64,0.004704148851754751,87,0.05794039172964693,0.004661923224130494,0.763120569541408
"The criticism is also based on the suspicion that the United States 
has poor data on Sudan, as the CIA station there has been closed since 
1995 and the entire U.S. Embassy since 1996.",12.88,0.0028785144610074882,83,0.028229282508586674,0.00459924957422474,0.7627158919202085
"In addition, more than 
100 intelligence reports from a CIA informer in Sudan were withdrawn 
in January 1996 because they proved to be fabrications.",25.76,0.0034394686002881076,80,0.03427915423029252,0.004524367567823963,0.7555483058989156
"That year 
a second informer warned of several terrorist threats, including one 
against Anthony Lake, then the national security adviser, but his 
reports proved impossible to confirm.",57.04,0.004053275688758469,100,-0.003619955179333498,0.004603621892489236,0.7635990663070277
"Senior administration officials 
say that at the time of the cruise missile strike they had evidence 
of Sudan's involvement with bin Laden in a chemical weapons program, 
but no direct evidence linking the Shifa plant directly to that effort. 
",166.52,0.007515016202994598,147,0.1524748571663959,0.004645440682718881,0.7757830039595456
"Now they say that the new evidence against Idris has confirmed their 
initial suspicions about Al Shifa.",18.400000000000002,0.004226898156509218,43,0.09803250371650801,0.0038942244184656627,0.7306042769026684
"At the time of the Aug. 20 cruise 
missile attack, Clinton administration officials acknowledge, they 
did not know that Idris owned the Shifa factory.",67.16,0.006888166373264201,88,0.20389092990261753,0.004523011864681815,0.7587205910196678
"The CIA, which had 
begun to scrutinize the plant 18 months earlier, believed the plant's 
ownership was irrelevant.",23.0,0.0032403701138191974,66,0.050273619685483176,0.0042925161488827236,0.7539967556591399
"``What we knew about the ownership was that 
a lot of it couldn't be reliably established,'' said one senior U.S. 
intelligence official.",53.36,0.003320894296793371,59,0.05940523835125923,0.004407319205953059,0.7305417013953684
"Still, after the missile strike, when Idris 
was publicly identified as the owner, U.S. intelligence began to investigate 
his possible connections to chemical weapons and terrorism.",46.92,0.004093587829833015,100,0.12512836832249558,0.004473530737226657,0.7594306959654706
"A Sudanese 
expatriate who now lives in Jidda, Saudi Arabia, Idris, 46, was previously 
a senior manager of the National Commercial Bank of Saudi Arabia. 
",11.040000000000001,0.0035966122826016573,101,0.022109926300809053,0.004220885133879992,0.7622054543070778
He bought the Shifa plant in March.,9.200000000000001,0.0026838029565019153,18,0.07408898336031113,0.003430498565083604,0.692668572528218
"Officials say U.S. intelligence 
has received reports that Idris launders money for international Islamic 
groups, and that he also has a stake in a company in Sudan that is 
40 percent owned by the Military Industrial Corporation, a government 
entity that the United States says controls Sudanese chemical weapons 
development.",47.84,0.005339083379177245,202,0.12922853181384028,0.004526616361947872,0.7782905003614355
"Bin Laden has helped finance the Military Industrial 
Corp. in his effort to use Sudan as a base for chemical weapons production, 
and talked to Sudanese leaders about testing poisonous gases against 
U.S. troops in Saudi Arabia, according to U.S. intelligence.",38.64,0.005431287856832921,142,0.041503378359343056,0.004530063234398884,0.772864758603185
"But Pendry 
denied that Idris owned any businesses with the Military Industrial 
Corp.",0.0,0.002930362361825206,48,0.07716869437874223,0.004050142129300015,0.731347890614684
"U.S. intelligence officials declined to provide details about 
the reports of Idris' financial dealings with members of Islamic Jihad. 
",24.84,0.005648772234813985,85,0.0877137160443263,0.004553086765891944,0.5845770386750175
"But they said that Islamic Jihad had now been consolidated into bin 
Laden's terrorist campaign. 
 
",98.44,0.004004127099667186,49,-0.017758186618595354,0.00408958982236039,0.4086421143721161
"One of the clear but unstated objectives of last August's raid on 
Afghanistan was to kill Osama bin Laden and as many of his lieutenants 
as possible, administration officials now acknowledge.",105.80000000000001,0.007291100770066305,102,0.002815265967046212,0.004584903996267122,0.7605488762166129
"According to 
the officials, White House lawyers conducted a secret review in the 
months before the attack and concluded that such operations are legal 
under U.S. and international law.",45.080000000000005,0.0035083774330953933,92,0.11884128249412272,0.0045668917352167816,0.7619455497068088
"The officials said the raid was 
timed so that more than 70 cruise missiles would hit bin Laden's camps 
at the moment when the Central Intelligence Agency believed he would 
be meeting there with his chief operatives.",89.24000000000001,0.005064131808235588,102,0.06279714507158701,0.0047099312517668,0.7699119796532012
"A 1976 executive order 
bars anyone working for the U.S. government from plotting or carrying 
out assassinations.",20.240000000000002,0.00266114234914263,57,0.009259186864393377,0.0044990765111109785,0.7438143403431656
"But officials said the White House legal opinion 
drafted before the Afghan strike asserts that the president has authority 
to target the ``infrastructure'' of terrorist groups that are attacking 
Americans.",66.24000000000001,0.005164276526920599,120,0.14397727508408925,0.0047212702745499085,0.7680587712688436
"A top U.S. counterterrorism official said this week that 
the infrastructure of bin Laden's group is mostly ``human.''",126.04,0.004182180464091682,63,0.03528443798742634,0.004597132033084263,0.7377214692913809
"``As 
we said from the time of the Aug. 20 strike, the objective was to 
disrupt the training, organization and infrastructure of the bin Laden 
terrorist network at the Khost camps,'' said David C. Leavy, a spokesman 
for the National Security Council at the White House.",145.36,0.006896411911941626,150,0.04856089304276037,0.0046356063097241045,0.7731622031830103
"Targeting infrastructure, 
officials acknowledged, can also mean destroying the leadership of 
a terrorist group.",43.24,0.004768516990149583,70,0.12694116447467485,0.004490827436646329,0.7372797615743939
"``Command and control of an enemy is a justifiable 
target,'' Leavy said.",13.8,0.0024689536179824294,41,0.019355549859259212,0.0035694001864636496,0.720169853791246
"Senior administration officials said they never 
discussed killing bin Laden in their planning sessions.",80.04,0.0037802106216699074,62,0.02196477363677263,0.004596248099921558,0.7440233557242572
"His death, 
they said in interviews after the attack, would simply have been a 
side benefit.",27.6,0.0018178242032577609,37,0.031016824089829836,0.004449182369163837,0.7052223315972806
